# name: test/sql/cascade_simple_projection_join.test
# description: Compile-only SIMPLE_PROJECTION joins emit real cascade view deltas
# group: [sql]

require openivm

statement ok
SET openivm_files_path='__TEST_DIR__';

# 2-source equi join
statement ok
CREATE TABLE cspj_eq_watch (watch_id INT, security_id INT, action_ts INT);

statement ok
CREATE TABLE cspj_eq_security (security_id INT, symbol VARCHAR);

statement ok
INSERT INTO cspj_eq_watch VALUES (1, 10, 100), (2, 20, 200);

statement ok
INSERT INTO cspj_eq_security VALUES (10, 'alpha'), (20, 'beta');

statement ok
CREATE MATERIALIZED VIEW cspj_eq_mv AS
    SELECT w.watch_id, w.security_id, s.symbol, w.action_ts
    FROM cspj_eq_watch w
    JOIN cspj_eq_security s ON w.security_id = s.security_id;

statement ok
SELECT COUNT(*) FROM openivm_compile_with_facts(
    'cspj_eq_mv',
    '{"target_dialect":"duckdb","compile_only":true}'
);

query I
SELECT CASE
           WHEN contains(content, 'INSERT INTO openivm_delta_cspj_eq_mv') AND
                contains(content, 'openivm_delta_cspj_eq_watch') AND
                contains(content, 'openivm_delta_cspj_eq_security') AND
                contains(content, 'UNION ALL') AND
                NOT contains(content, 'SELECT NULL::')
           THEN 1 ELSE 0
       END
FROM read_text('__TEST_DIR__/openivm_upsert_queries_cspj_eq_mv.sql');
----
1

statement ok
INSERT INTO cspj_eq_watch VALUES (3, 30, 300), (4, 20, 250);

statement ok
INSERT INTO cspj_eq_security VALUES (30, 'gamma');

statement ok
DELETE FROM cspj_eq_watch WHERE watch_id = 1;

statement ok
UPDATE cspj_eq_security SET symbol = 'beta_x' WHERE security_id = 20;

statement ok
PRAGMA refresh('cspj_eq_mv');

query I
SELECT COUNT(*) FROM (
    SELECT * FROM cspj_eq_mv
    EXCEPT ALL
    SELECT w.watch_id, w.security_id, s.symbol, w.action_ts
    FROM cspj_eq_watch w
    JOIN cspj_eq_security s ON w.security_id = s.security_id
);
----
0

query I
SELECT COUNT(*) FROM (
    SELECT w.watch_id, w.security_id, s.symbol, w.action_ts
    FROM cspj_eq_watch w
    JOIN cspj_eq_security s ON w.security_id = s.security_id
    EXCEPT ALL
    SELECT * FROM cspj_eq_mv
);
----
0

# A source-independent VALUES leaf is unchanged and must not emit its own N-term.
statement ok
CREATE TABLE cspj_values_customer (customer_id INT, credit VARCHAR, last_name VARCHAR);

statement ok
INSERT INTO cspj_values_customer VALUES (1, 'GC', 'Able'), (2, 'XX', 'Cross');

statement ok
CREATE MATERIALIZED VIEW cspj_values_mv AS
    SELECT c.customer_id, c.last_name, v.priority
    FROM cspj_values_customer c
    JOIN (VALUES ('GC', 1), ('BC', 2)) AS v(credit, priority)
      ON c.credit = v.credit;

query I
SELECT CASE WHEN COUNT(*) = 1 AND
                 bool_and(contains(sql, 'openivm_delta_cspj_values_customer')) AND
                 bool_and(NOT contains(sql, 'UNION ALL'))
            THEN 1 ELSE 0 END
FROM openivm_compile_with_facts(
    'cspj_values_mv',
    '{"target_dialect":"duckdb","compile_only":true,"delta_shape":{"cspj_values_customer":"MIXED"}}'
)
WHERE stmt_kind = 'data'
  AND contains(sql, 'INSERT INTO openivm_delta_cspj_values_mv');
----
1

query I
SELECT CASE WHEN COUNT(*) = 1 AND
                 bool_and(contains(sql, 'openivm_delta_cspj_values_customer')) AND
                 bool_and(NOT contains(sql, 'UNION ALL'))
            THEN 1 ELSE 0 END
FROM openivm_compile_with_facts(
    'cspj_values_mv',
    '{"target_dialect":"duckdb","compile_only":true,"delta_shape":{"cspj_values_customer":"UNCHANGED"}}'
)
WHERE stmt_kind = 'data'
  AND contains(sql, 'INSERT INTO openivm_delta_cspj_values_mv');
----
1

statement ok
UPDATE cspj_values_customer SET credit = 'GC' WHERE customer_id = 2;

statement ok
PRAGMA refresh('cspj_values_mv');

query I
SELECT COUNT(*) FROM (
    SELECT * FROM cspj_values_mv
    EXCEPT ALL
    SELECT c.customer_id, c.last_name, v.priority
    FROM cspj_values_customer c
    JOIN (VALUES ('GC', 1), ('BC', 2)) AS v(credit, priority)
      ON c.credit = v.credit
);
----
0

query I
SELECT COUNT(*) FROM (
    SELECT c.customer_id, c.last_name, v.priority
    FROM cspj_values_customer c
    JOIN (VALUES ('GC', 1), ('BC', 2)) AS v(credit, priority)
      ON c.credit = v.credit
    EXCEPT ALL
    SELECT * FROM cspj_values_mv
);
----
0

# 2-source temporal range join
statement ok
CREATE TABLE cspj_rng_txn (txn_id INT, account_id INT, txn_ts INT, amount INT);

statement ok
CREATE TABLE cspj_rng_window (account_id INT, start_ts INT, end_ts INT, bucket VARCHAR);

statement ok
INSERT INTO cspj_rng_txn VALUES (10, 1, 50, 100), (20, 2, 50, 200);

statement ok
INSERT INTO cspj_rng_window VALUES (1, 0, 100, 'a'), (2, 0, 100, 'b');

statement ok
CREATE MATERIALIZED VIEW cspj_rng_mv AS
    SELECT t.txn_id, t.account_id, w.bucket, t.txn_ts, t.amount
    FROM cspj_rng_txn t
    JOIN cspj_rng_window w
      ON t.account_id = w.account_id
     AND t.txn_ts BETWEEN w.start_ts AND w.end_ts;

statement ok
SELECT COUNT(*) FROM openivm_compile_with_facts(
    'cspj_rng_mv',
    '{"target_dialect":"duckdb","compile_only":true}'
);

query I
SELECT CASE
           WHEN contains(content, 'INSERT INTO openivm_delta_cspj_rng_mv') AND
                contains(content, 'openivm_delta_cspj_rng_txn') AND
                contains(content, 'openivm_delta_cspj_rng_window') AND
                contains(content, 'UNION ALL') AND
                NOT contains(content, 'SELECT NULL::')
           THEN 1 ELSE 0
       END
FROM read_text('__TEST_DIR__/openivm_upsert_queries_cspj_rng_mv.sql');
----
1

statement ok
INSERT INTO cspj_rng_txn VALUES (30, 2, 60, 250), (40, 3, 70, 300);

statement ok
INSERT INTO cspj_rng_window VALUES (3, 0, 100, 'c');

statement ok
DELETE FROM cspj_rng_txn WHERE txn_id = 20;

statement ok
UPDATE cspj_rng_window SET bucket = 'a2' WHERE account_id = 1 AND start_ts = 0 AND end_ts = 100;

statement ok
PRAGMA refresh('cspj_rng_mv');

query I
SELECT COUNT(*) FROM (
    SELECT * FROM cspj_rng_mv
    EXCEPT ALL
    SELECT t.txn_id, t.account_id, w.bucket, t.txn_ts, t.amount
    FROM cspj_rng_txn t
    JOIN cspj_rng_window w
      ON t.account_id = w.account_id
     AND t.txn_ts BETWEEN w.start_ts AND w.end_ts
);
----
0

query I
SELECT COUNT(*) FROM (
    SELECT t.txn_id, t.account_id, w.bucket, t.txn_ts, t.amount
    FROM cspj_rng_txn t
    JOIN cspj_rng_window w
      ON t.account_id = w.account_id
     AND t.txn_ts BETWEEN w.start_ts AND w.end_ts
    EXCEPT ALL
    SELECT * FROM cspj_rng_mv
);
----
0

# 3-source join
statement ok
CREATE TABLE cspj_tri_account (account_id INT, customer_id INT, broker_id INT, balance INT);

statement ok
CREATE TABLE cspj_tri_customer (customer_id INT, customer_name VARCHAR);

statement ok
CREATE TABLE cspj_tri_broker (broker_id INT, broker_name VARCHAR);

statement ok
INSERT INTO cspj_tri_account VALUES (1, 10, 100, 500);

statement ok
INSERT INTO cspj_tri_customer VALUES (10, 'Alice');

statement ok
INSERT INTO cspj_tri_broker VALUES (100, 'North');

statement ok
CREATE MATERIALIZED VIEW cspj_tri_mv AS
    SELECT a.account_id, c.customer_name, b.broker_name, a.balance
    FROM cspj_tri_account a
    JOIN cspj_tri_customer c ON a.customer_id = c.customer_id
    JOIN cspj_tri_broker b ON a.broker_id = b.broker_id;

statement ok
SELECT COUNT(*) FROM openivm_compile_with_facts(
    'cspj_tri_mv',
    '{"target_dialect":"duckdb","compile_only":true}'
);

query I
SELECT CASE
           WHEN contains(content, 'INSERT INTO openivm_delta_cspj_tri_mv') AND
                contains(content, 'openivm_delta_cspj_tri_account') AND
                contains(content, 'openivm_delta_cspj_tri_customer') AND
                contains(content, 'openivm_delta_cspj_tri_broker') AND
                ((length(content) - length(replace(content, 'UNION ALL', ''))) / length('UNION ALL')) >= 2 AND
                NOT contains(content, 'SELECT NULL::')
           THEN 1 ELSE 0
       END
FROM read_text('__TEST_DIR__/openivm_upsert_queries_cspj_tri_mv.sql');
----
1

query I
SELECT ((length(content) - length(replace(content, 'UNION ALL', ''))) / length('UNION ALL'))
FROM read_text('__TEST_DIR__/openivm_upsert_queries_cspj_tri_mv.sql');
----
4

statement ok
SET openivm_regular_nterm = false;

statement ok
SELECT COUNT(*) FROM openivm_compile_with_facts(
    'cspj_tri_mv',
    '{"target_dialect":"duckdb","compile_only":true}'
);

query I
SELECT ((length(content) - length(replace(content, 'UNION ALL', ''))) / length('UNION ALL'))
FROM read_text('__TEST_DIR__/openivm_upsert_queries_cspj_tri_mv.sql');
----
6

statement ok
SET openivm_regular_nterm = true;

statement ok
SELECT COUNT(*) FROM openivm_compile_with_facts(
    'cspj_tri_mv',
    '{"target_dialect":"duckdb","compile_only":true}'
);

# Compile facts marked UNCHANGED remove both their delta terms and their old-state reconstruction.
query I
SELECT CASE WHEN COUNT(*) = 1 AND
                 bool_and(contains(sql, 'openivm_delta_cspj_tri_broker')) AND
                 bool_and(NOT contains(sql, 'openivm_delta_cspj_tri_account')) AND
                 bool_and(NOT contains(sql, 'openivm_delta_cspj_tri_customer')) AND
                 bool_and(NOT contains(sql, 'UNION ALL'))
            THEN 1 ELSE 0 END
FROM openivm_compile_with_facts(
    'cspj_tri_mv',
    '{"target_dialect":"duckdb","compile_only":true,"delta_shape":{"cspj_tri_account":"UNCHANGED","cspj_tri_customer":"UNCHANGED","cspj_tri_broker":"MIXED"}}'
)
WHERE stmt_kind = 'data'
  AND contains(sql, 'INSERT INTO openivm_delta_cspj_tri_mv');
----
1

# An entirely unchanged join keeps one empty delta arm so the compiled program remains valid without expanding terms.
query I
SELECT CASE WHEN COUNT(*) = 1 AND
                 bool_and(CAST(contains(sql, 'openivm_delta_cspj_tri_account') AS INTEGER) +
                          CAST(contains(sql, 'openivm_delta_cspj_tri_customer') AS INTEGER) +
                          CAST(contains(sql, 'openivm_delta_cspj_tri_broker') AS INTEGER) = 1) AND
                 bool_and(NOT contains(sql, 'UNION ALL'))
            THEN 1 ELSE 0 END
FROM openivm_compile_with_facts(
    'cspj_tri_mv',
    '{"target_dialect":"duckdb","compile_only":true,"delta_shape":{"cspj_tri_account":"UNCHANGED","cspj_tri_customer":"UNCHANGED","cspj_tri_broker":"UNCHANGED"}}'
)
WHERE stmt_kind = 'data'
  AND contains(sql, 'INSERT INTO openivm_delta_cspj_tri_mv');
----
1

statement ok
UPDATE cspj_tri_broker SET broker_name = 'NorthX' WHERE broker_id = 100;

statement ok
INSERT INTO cspj_tri_account VALUES (2, 20, 200, 700);

statement ok
INSERT INTO cspj_tri_customer VALUES (20, 'Bob');

statement ok
INSERT INTO cspj_tri_broker VALUES (200, 'South');

statement ok
PRAGMA refresh('cspj_tri_mv');

query I
SELECT COUNT(*) FROM (
    SELECT * FROM cspj_tri_mv
    EXCEPT ALL
    SELECT a.account_id, c.customer_name, b.broker_name, a.balance
    FROM cspj_tri_account a
    JOIN cspj_tri_customer c ON a.customer_id = c.customer_id
    JOIN cspj_tri_broker b ON a.broker_id = b.broker_id
);
----
0

query I
SELECT COUNT(*) FROM (
    SELECT a.account_id, c.customer_name, b.broker_name, a.balance
    FROM cspj_tri_account a
    JOIN cspj_tri_customer c ON a.customer_id = c.customer_id
    JOIN cspj_tri_broker b ON a.broker_id = b.broker_id
    EXCEPT ALL
    SELECT * FROM cspj_tri_mv
);
----
0

# CTE-fed join
statement ok
CREATE TABLE cspj_cte_holdings (account_id INT, security_id INT, qty INT);

statement ok
CREATE TABLE cspj_cte_security (security_id INT, symbol VARCHAR);

statement ok
INSERT INTO cspj_cte_holdings VALUES (1, 10, 5), (2, 20, 8);

statement ok
INSERT INTO cspj_cte_security VALUES (10, 'AAA'), (20, 'BBB');

statement ok
CREATE MATERIALIZED VIEW cspj_cte_mv AS
    WITH active_holdings AS (
        SELECT account_id, security_id, qty
        FROM cspj_cte_holdings
        WHERE qty > 0
    )
    SELECT h.account_id, h.security_id, s.symbol, h.qty
    FROM active_holdings h
    JOIN cspj_cte_security s ON h.security_id = s.security_id;

statement ok
SELECT COUNT(*) FROM openivm_compile_with_facts(
    'cspj_cte_mv',
    '{"target_dialect":"duckdb","compile_only":true}'
);

query I
SELECT CASE
           WHEN contains(content, 'INSERT INTO openivm_delta_cspj_cte_mv') AND
                contains(content, 'openivm_delta_cspj_cte_holdings') AND
                contains(content, 'openivm_delta_cspj_cte_security') AND
                contains(content, 'UNION ALL') AND
                NOT contains(content, 'SELECT NULL::')
           THEN 1 ELSE 0
       END
FROM read_text('__TEST_DIR__/openivm_upsert_queries_cspj_cte_mv.sql');
----
1

statement ok
INSERT INTO cspj_cte_holdings VALUES (3, 30, 7);

statement ok
INSERT INTO cspj_cte_security VALUES (30, 'CCC');

statement ok
DELETE FROM cspj_cte_holdings WHERE account_id = 1;

statement ok
UPDATE cspj_cte_security SET symbol = 'BBBX' WHERE security_id = 20;

statement ok
PRAGMA refresh('cspj_cte_mv');

query I
WITH active_holdings AS (
    SELECT account_id, security_id, qty
    FROM cspj_cte_holdings
    WHERE qty > 0
)
SELECT COUNT(*) FROM (
    SELECT * FROM cspj_cte_mv
    EXCEPT ALL
    SELECT h.account_id, h.security_id, s.symbol, h.qty
    FROM active_holdings h
    JOIN cspj_cte_security s ON h.security_id = s.security_id
);
----
0

query I
WITH active_holdings AS (
    SELECT account_id, security_id, qty
    FROM cspj_cte_holdings
    WHERE qty > 0
)
SELECT COUNT(*) FROM (
    SELECT h.account_id, h.security_id, s.symbol, h.qty
    FROM active_holdings h
    JOIN cspj_cte_security s ON h.security_id = s.security_id
    EXCEPT ALL
    SELECT * FROM cspj_cte_mv
);
----
0

# Projection-wrapped self join uses the regular N-term path
statement ok
CREATE TABLE cspj_self_event (event_id INT, account_id INT, event_ts INT, label VARCHAR);

statement ok
CREATE TABLE cspj_self_account (account_id INT, account_name VARCHAR);

statement ok
INSERT INTO cspj_self_event VALUES
    (1, 1, 10, 'a'),
    (2, 1, 20, 'b'),
    (3, 2, 10, 'c');

statement ok
INSERT INTO cspj_self_account VALUES (1, 'one'), (2, 'two');

statement ok
CREATE MATERIALIZED VIEW cspj_self_mv AS
    SELECT cur.event_id AS current_id,
           prev.event_id AS previous_id,
           a.account_name,
           cur.label
    FROM cspj_self_event cur
    JOIN cspj_self_event prev
      ON cur.account_id = prev.account_id
     AND prev.event_ts < cur.event_ts
    JOIN cspj_self_account a ON cur.account_id = a.account_id;

statement ok
SELECT COUNT(*) FROM openivm_compile_with_facts(
    'cspj_self_mv',
    '{"target_dialect":"duckdb","compile_only":true}'
);

query I
SELECT ((length(content) - length(replace(content, 'UNION ALL', ''))) / length('UNION ALL'))
FROM read_text('__TEST_DIR__/openivm_upsert_queries_cspj_self_mv.sql');
----
4

statement ok
INSERT INTO cspj_self_event VALUES (4, 1, 30, 'd'), (5, 2, 20, 'e'), (6, 2, 30, 'temporary');

statement ok
UPDATE cspj_self_event SET label = 'bx', event_ts = 25 WHERE event_id = 2;

statement ok
UPDATE cspj_self_event SET label = 'temporary_x' WHERE event_id = 6;

statement ok
DELETE FROM cspj_self_event WHERE event_id IN (1, 6);

statement ok
UPDATE cspj_self_account SET account_name = 'ONE' WHERE account_id = 1;

statement ok
PRAGMA refresh('cspj_self_mv');

query I
SELECT COUNT(*) FROM (
    SELECT * FROM cspj_self_mv
    EXCEPT ALL
    SELECT cur.event_id,
           prev.event_id,
           a.account_name,
           cur.label
    FROM cspj_self_event cur
    JOIN cspj_self_event prev
      ON cur.account_id = prev.account_id
     AND prev.event_ts < cur.event_ts
    JOIN cspj_self_account a ON cur.account_id = a.account_id
);
----
0

query I
SELECT COUNT(*) FROM (
    SELECT cur.event_id,
           prev.event_id,
           a.account_name,
           cur.label
    FROM cspj_self_event cur
    JOIN cspj_self_event prev
      ON cur.account_id = prev.account_id
     AND prev.event_ts < cur.event_ts
    JOIN cspj_self_account a ON cur.account_id = a.account_id
    EXCEPT ALL
    SELECT * FROM cspj_self_mv
);
----
0

# Reduced "arc_machine_status_transaction" shape: a CTE (INNER JOIN + LEFT
# JOIN) feeding an outer query with two further chained LEFT JOINs. Before
# src/delta/operators/join.cpp's AppendMultiplicityToAncestorProjectionMaps
# fix, a deeper join's own left_projection_map growing (to append a new
# per-leaf multiplicity column) silently shifted where its right-side
# contribution begins in its own combined column numbering. A grandparent
# join's pre-existing projection-map entry, fixed before that growth
# happened, could then alias onto the just-added multiplicity column
# instead of the real business column (`cust_key`) it used to select,
# permanently dropping it and surfacing as an internal arity mismatch.
statement ok
CREATE TABLE cspj_arcm_msf(id INT, coll_key INT);

statement ok
CREATE TABLE cspj_arcm_acd(coll_key INT, sub_id INT, arm_id VARCHAR);

statement ok
CREATE TABLE cspj_arcm_hw(arm_id VARCHAR, provider VARCHAR);

statement ok
CREATE TABLE cspj_arcm_tpid(sub_id INT, tp_id INT);

statement ok
CREATE TABLE cspj_arcm_cust(tp_id INT, cust_key INT);

statement ok
INSERT INTO cspj_arcm_msf VALUES (1, 100), (2, 100);

statement ok
INSERT INTO cspj_arcm_acd VALUES (100, 10, 'arm-1');

statement ok
INSERT INTO cspj_arcm_hw VALUES ('arm-1', 'azure');

statement ok
INSERT INTO cspj_arcm_tpid VALUES (10, 200);

statement ok
INSERT INTO cspj_arcm_cust VALUES (200, 21);

statement ok
CREATE MATERIALIZED VIEW cspj_arcm_mv AS
    WITH bff AS (
        SELECT msf.id, acd.sub_id,
               coalesce(hw.provider, 'N/A') AS provider
        FROM cspj_arcm_msf msf
        INNER JOIN cspj_arcm_acd acd ON msf.coll_key = acd.coll_key
        LEFT JOIN cspj_arcm_hw hw ON acd.arm_id = hw.arm_id
    )
    SELECT bff.id,
           coalesce(cust.cust_key, 1) AS cust_key
    FROM bff
    LEFT JOIN cspj_arcm_tpid tpid ON bff.sub_id = tpid.sub_id
    LEFT JOIN cspj_arcm_cust cust ON coalesce(tpid.tp_id, -1) = cust.tp_id;

statement ok
SELECT COUNT(*) FROM openivm_compile_with_facts(
    'cspj_arcm_mv',
    '{"target_dialect":"duckdb","compile_only":true}'
);

query I
SELECT CASE
           WHEN contains(content, 'INSERT INTO openivm_delta_cspj_arcm_mv') AND
                contains(content, 'openivm_delta_cspj_arcm_msf') AND
                contains(content, 'openivm_delta_cspj_arcm_acd') AND
                contains(content, 'openivm_delta_cspj_arcm_hw') AND
                contains(content, 'openivm_delta_cspj_arcm_tpid') AND
                contains(content, 'openivm_delta_cspj_arcm_cust') AND
                NOT contains(content, 'SELECT NULL::')
           THEN 1 ELSE 0
       END
FROM read_text('__TEST_DIR__/openivm_upsert_queries_cspj_arcm_mv.sql');
----
1

statement ok
INSERT INTO cspj_arcm_msf VALUES (3, 300);

statement ok
INSERT INTO cspj_arcm_acd VALUES (300, 30, 'arm-2');

statement ok
INSERT INTO cspj_arcm_hw VALUES ('arm-2', 'gcp');

statement ok
INSERT INTO cspj_arcm_tpid VALUES (30, 400);

statement ok
DELETE FROM cspj_arcm_msf WHERE id = 2;

statement ok
UPDATE cspj_arcm_cust SET cust_key = 99 WHERE tp_id = 200;

statement ok
PRAGMA refresh('cspj_arcm_mv');

query I
SELECT COUNT(*) FROM (
    SELECT * FROM cspj_arcm_mv
    EXCEPT ALL
    SELECT bff.id, coalesce(cust.cust_key, 1) AS cust_key
    FROM (
        SELECT msf.id, acd.sub_id, coalesce(hw.provider, 'N/A') AS provider
        FROM cspj_arcm_msf msf
        INNER JOIN cspj_arcm_acd acd ON msf.coll_key = acd.coll_key
        LEFT JOIN cspj_arcm_hw hw ON acd.arm_id = hw.arm_id
    ) bff
    LEFT JOIN cspj_arcm_tpid tpid ON bff.sub_id = tpid.sub_id
    LEFT JOIN cspj_arcm_cust cust ON coalesce(tpid.tp_id, -1) = cust.tp_id
);
----
0

query I
SELECT COUNT(*) FROM (
    SELECT bff.id, coalesce(cust.cust_key, 1) AS cust_key
    FROM (
        SELECT msf.id, acd.sub_id, coalesce(hw.provider, 'N/A') AS provider
        FROM cspj_arcm_msf msf
        INNER JOIN cspj_arcm_acd acd ON msf.coll_key = acd.coll_key
        LEFT JOIN cspj_arcm_hw hw ON acd.arm_id = hw.arm_id
    ) bff
    LEFT JOIN cspj_arcm_tpid tpid ON bff.sub_id = tpid.sub_id
    LEFT JOIN cspj_arcm_cust cust ON coalesce(tpid.tp_id, -1) = cust.tp_id
    EXCEPT ALL
    SELECT * FROM cspj_arcm_mv
);
----
0

# Reduced "int_instance_status_transaction" shape: a UNION ALL of two LEFT
# JOIN branches partitioned by an IS NOT NULL / IS NULL predicate on the
# joined side. Before the `third_party/lpts` pin was advanced to commit
# 77ed5e5 (fork PR #18, "Fix set-op column binding remaps"), remapping
# duplicated UNION ALL key-projection output aliases could leave a stale
# reference to a child alias that no longer existed in the rewritten plan,
# surfacing as a runtime Binder Error ("Referenced column ... not found in
# FROM clause").
statement ok
CREATE TABLE cspj_inti_isf(id INT, k INT);

statement ok
CREATE TABLE cspj_inti_ml(k INT, res VARCHAR);

statement ok
INSERT INTO cspj_inti_isf VALUES (1, 100), (2, 200);

statement ok
INSERT INTO cspj_inti_ml VALUES (100, 'machine-1');

statement ok
CREATE MATERIALIZED VIEW cspj_inti_mv AS
    SELECT isf.id, isf.k FROM cspj_inti_isf isf LEFT JOIN cspj_inti_ml ml ON isf.k = ml.k WHERE ml.res IS NOT NULL
    UNION ALL
    SELECT isf.id, isf.k FROM cspj_inti_isf isf LEFT JOIN cspj_inti_ml ml ON isf.k = ml.k WHERE ml.res IS NULL;

statement ok
SELECT COUNT(*) FROM openivm_compile_with_facts(
    'cspj_inti_mv',
    '{"target_dialect":"duckdb","compile_only":true}'
);

query I
SELECT CASE
           WHEN contains(content, 'INSERT INTO openivm_delta_cspj_inti_mv') AND
                contains(content, 'openivm_delta_cspj_inti_isf') AND
                contains(content, 'openivm_delta_cspj_inti_ml') AND
                contains(content, 'UNION ALL') AND
                NOT contains(content, 'SELECT NULL::')
           THEN 1 ELSE 0
       END
FROM read_text('__TEST_DIR__/openivm_upsert_queries_cspj_inti_mv.sql');
----
1

statement ok
INSERT INTO cspj_inti_isf VALUES (3, 300), (4, 400);

statement ok
INSERT INTO cspj_inti_ml VALUES (300, 'machine-2'), (400, NULL);

statement ok
DELETE FROM cspj_inti_isf WHERE id = 2;

statement ok
UPDATE cspj_inti_ml SET res = NULL WHERE k = 100;

statement ok
PRAGMA refresh('cspj_inti_mv');

query I
SELECT COUNT(*) FROM (
    SELECT * FROM cspj_inti_mv
    EXCEPT ALL
    (
        SELECT isf.id, isf.k FROM cspj_inti_isf isf LEFT JOIN cspj_inti_ml ml ON isf.k = ml.k WHERE ml.res IS NOT NULL
        UNION ALL
        SELECT isf.id, isf.k FROM cspj_inti_isf isf LEFT JOIN cspj_inti_ml ml ON isf.k = ml.k WHERE ml.res IS NULL
    )
);
----
0

query I
SELECT COUNT(*) FROM (
    (
        SELECT isf.id, isf.k FROM cspj_inti_isf isf LEFT JOIN cspj_inti_ml ml ON isf.k = ml.k WHERE ml.res IS NOT NULL
        UNION ALL
        SELECT isf.id, isf.k FROM cspj_inti_isf isf LEFT JOIN cspj_inti_ml ml ON isf.k = ml.k WHERE ml.res IS NULL
    )
    EXCEPT ALL
    SELECT * FROM cspj_inti_mv
);
----
0
