# name: test/sql/compile_refresh.test
# description: openivm_compile_with_facts — compile-only refresh path (openivm-spark integration).
# group: [sql]

require openivm

statement ok
SET openivm_files_path='__TEST_DIR__';

# ==========================================
# Setup: a simple SUM/GROUP BY materialized view
# ==========================================

statement ok
CREATE TABLE sales (region VARCHAR, amount INT);

statement ok
INSERT INTO sales VALUES ('east', 100), ('west', 200);

statement ok
CREATE MATERIALIZED VIEW mv_region AS
    SELECT region, SUM(amount) AS total, COUNT(*) AS cnt FROM sales GROUP BY region;

# Snapshot the MV state before the compile call so we can prove it is
# untouched by `openivm_compile_with_facts` afterwards.
statement ok
CREATE TABLE mv_region_before AS SELECT * FROM mv_region;

# Mutate the base table — the deltas are now non-empty.
statement ok
INSERT INTO sales VALUES ('east', 50), ('north', 75);

statement ok
DELETE FROM sales WHERE region = 'west';

# ==========================================
# Test 1: openivm_compile_with_facts succeeds and emits at least one
# data-bucket row carrying the upsert SQL for the AGGREGATE_GROUP view.
# ==========================================

query ITT
SELECT refresh_type, refresh_type_name, sql
FROM openivm_compile_with_facts(
    'mv_region',
    '{"target_dialect":"duckdb","compile_only":true}'
)
WHERE stmt_kind = 'data' AND sql LIKE '%openivm_delta_mv_region%'
ORDER BY stmt_order
LIMIT 1;
----
0	AGGREGATE_GROUP	<REGEX>:.*INSERT INTO.*openivm_delta_mv_region.*

# ==========================================
# Test 2: openivm_compile_with_facts did NOT mutate the materialized view
# ==========================================

query I
SELECT (SELECT count(*) FROM ((SELECT * FROM mv_region) EXCEPT ALL (SELECT * FROM mv_region_before))) = 0 AND
       (SELECT count(*) FROM ((SELECT * FROM mv_region_before) EXCEPT ALL (SELECT * FROM mv_region))) = 0 AS unchanged;
----
true

# Sanity: the deltas are still pending — a real refresh would commit them.
query I
SELECT total FROM mv_region WHERE region = 'east';
----
100

# ==========================================
# Test 3: PRAGMA refresh still works after the table-function compile call
# (i.e. the per-call CompileFacts slot did not leak state into PRAGMA refresh)
# ==========================================

statement ok
PRAGMA refresh('mv_region');

query III
SELECT region, total, cnt FROM mv_region ORDER BY region;
----
east	150	2
north	75	1

# ==========================================
# Test 4: target_dialect='spark' — the facts.target_dialect override
# is accepted and the compile path runs cleanly. Specific identifier-quoting /
# function remap correctness is verified end-to-end in spark-ext integration tests
# (the AGGREGATE_GROUP refresh assembly happens outside lpts for this view shape;
# lpts is exercised on SIMPLE_PROJECTION / SEMI_ANTI / WINDOW shapes).
# ==========================================

statement ok
INSERT INTO sales VALUES ('mid', 11);

statement ok
SELECT count(*) FROM openivm_compile_with_facts(
    'mv_region',
    '{"target_dialect":"spark","compile_only":true}'
);

statement ok
SELECT count(*) FROM openivm_compile_with_facts(
    'mv_region',
    '{"target_dialect":"duckdb","compile_only":true}'
);

# ==========================================
# Test 5: compile-only does not specialize to local insert-only deltas
# ==========================================

statement ok
CREATE TABLE compile_only_proj_src(id INT, val VARCHAR);

statement ok
INSERT INTO compile_only_proj_src VALUES (1, 'one'), (2, 'two');

statement ok
CREATE MATERIALIZED VIEW mv_compile_only_proj AS
    SELECT id, val FROM compile_only_proj_src;

statement ok
INSERT INTO compile_only_proj_src VALUES (3, 'three');

query I
SELECT CASE WHEN string_agg(lower(sql), ' ' ORDER BY stmt_order)
                 LIKE '%delete from %openivm_data_mv_compile_only_proj%'
            THEN 1 ELSE 0 END
FROM openivm_compile_with_facts(
    'mv_compile_only_proj',
    '{"target_dialect":"duckdb","compile_only":true}'
)
WHERE stmt_kind = 'data';
----
1

statement ok
CREATE TABLE compile_only_agg_src(k INT, amount INT);

statement ok
INSERT INTO compile_only_agg_src VALUES (1, 10), (2, 20);

statement ok
CREATE MATERIALIZED VIEW mv_compile_only_agg AS
    SELECT k, SUM(amount) AS total, COUNT(*) AS cnt
    FROM compile_only_agg_src
    GROUP BY k;

statement ok
INSERT INTO compile_only_agg_src VALUES (1, 5);

query I
SELECT CASE WHEN string_agg(lower(sql), ' ' ORDER BY stmt_order)
                 LIKE '%delete from %openivm_data_mv_compile_only_agg%'
            THEN 1 ELSE 0 END
FROM openivm_compile_with_facts(
    'mv_compile_only_agg',
    '{"target_dialect":"duckdb","compile_only":true}'
)
WHERE stmt_kind = 'data';
----
1

# ==========================================
# Test 6: forced full refresh still dispatches through the full-recompute
# compiler when compile-for-cascade asks for view deltas.
# ==========================================

statement ok
SET openivm_refresh_mode = 'full';

query I
SELECT CASE WHEN string_agg(lower(sql), ' ' ORDER BY stmt_order)
                 LIKE '%delete from openivm_data_mv_compile_only_proj;%insert into openivm_data_mv_compile_only_proj select%'
            AND string_agg(lower(sql), ' ' ORDER BY stmt_order)
                 LIKE '%from %compile_only_proj_src%'
            AND string_agg(lower(sql), ' ' ORDER BY stmt_order)
                 LIKE '%insert into openivm_delta_mv_compile_only_proj%'
            AND string_agg(lower(sql), ' ' ORDER BY stmt_order)
                 NOT LIKE '%openivm_net%'
            THEN 1 ELSE 0 END
FROM openivm_compile_with_facts(
    'mv_compile_only_proj',
    '{"target_dialect":"duckdb","compile_only":true,"force_view_delta_cascade":true}'
)
WHERE stmt_kind = 'data';
----
1

statement ok
SET openivm_refresh_mode = 'incremental';

statement ok
CREATE TABLE compile_only_left(id INT, k INT);

statement ok
CREATE TABLE compile_only_right(k INT, item INT);

statement ok
INSERT INTO compile_only_left VALUES (1, 10);

statement ok
INSERT INTO compile_only_right VALUES (10, 100), (10, 200);

statement ok
CREATE MATERIALIZED VIEW mv_compile_only_join_gr AS
    SELECT l.k, COUNT(DISTINCT r.item) AS item_count
    FROM compile_only_left l
    JOIN compile_only_right r ON l.k = r.k
    GROUP BY l.k;

statement ok
INSERT INTO compile_only_left VALUES (2, 20);

query I
SELECT CASE WHEN string_agg(lower(sql), ' ' ORDER BY stmt_order)
                 LIKE '%openivm_delta_compile_only_left%'
            AND string_agg(lower(sql), ' ' ORDER BY stmt_order)
                 LIKE '%openivm_delta_compile_only_right%'
            THEN 1 ELSE 0 END
FROM openivm_compile_with_facts(
    'mv_compile_only_join_gr',
    '{"target_dialect":"duckdb","compile_only":true,"force_view_delta_cascade":true}'
)
WHERE stmt_kind = 'data';
----
1

# CURRENT_DIFF_RECOMPUTE coverage for ASOF views lives in compile_refresh_asof.test.

# ==========================================
# Test 6: a caller-proven insert-only batch enables the MIN/MAX MERGE
# template, including a scalar output derived from the final aggregate state.
# Without assume_insert_only, compile-only remains conservative (Test 5).
# ==========================================

statement ok
CREATE TABLE compile_only_watch_events(
    customer_id INT,
    symbol VARCHAR,
    action VARCHAR,
    event_ts TIMESTAMP
);

statement ok
CREATE MATERIALIZED VIEW mv_compile_only_watches AS
    WITH grouped AS (
        SELECT customer_id,
               symbol,
               MIN(CASE WHEN action = 'Activate' THEN event_ts END) AS placed_at,
               MAX(CASE WHEN action = 'Cancelled' THEN event_ts END) AS removed_at
        FROM compile_only_watch_events
        GROUP BY customer_id, symbol
    )
    SELECT *,
           CASE WHEN removed_at IS NULL THEN 'Active' ELSE 'Inactive' END AS status
    FROM grouped;

query I
SELECT CASE WHEN string_agg(lower(sql), ' ' ORDER BY stmt_order)
                 LIKE '%merge into %openivm_data_mv_compile_only_watches%'
            AND string_agg(lower(sql), ' ' ORDER BY stmt_order)
                 NOT LIKE '%delete from %openivm_data_mv_compile_only_watches%'
            AND string_agg(lower(sql), ' ' ORDER BY stmt_order)
                 LIKE '%status = case when%removed_at%'
            THEN 1 ELSE 0 END
FROM openivm_compile_with_facts(
    'mv_compile_only_watches',
    '{"target_dialect":"duckdb","compile_only":true,"force_view_delta_cascade":false,"assume_insert_only":true}'
)
WHERE stmt_kind = 'data';
----
1

query I
SELECT CASE WHEN derived_aggregate_outputs_json LIKE '%"complete":true%' THEN 1 ELSE 0 END
FROM openivm_views WHERE view_name = 'mv_compile_only_watches';
----
1

# Unsupported scalar functions are recorded as incomplete, so even a caller-
# proven insert-only MIN/MAX batch must use exact affected-group recompute.
statement ok
CREATE TABLE compile_only_round_events(grp INTEGER, value DOUBLE);

statement ok
CREATE MATERIALIZED VIEW mv_compile_only_round AS
WITH grouped AS (
    SELECT grp, MIN(value) AS min_value
    FROM compile_only_round_events GROUP BY grp
)
SELECT grp, min_value, ROUND(min_value / 3.0, 2) AS rounded_value FROM grouped;

query I
SELECT CASE WHEN derived_aggregate_outputs_json LIKE '%"complete":false%' THEN 1 ELSE 0 END
FROM openivm_views WHERE view_name = 'mv_compile_only_round';
----
1

# An escaped `"complete":true` inside an earlier derived expression must not
# override the top-level incomplete marker and enable the MIN/MAX MERGE path.
statement ok
CREATE TABLE compile_only_escaped_metadata_events(grp INTEGER, value DOUBLE);

statement ok
CREATE MATERIALIZED VIEW mv_compile_only_escaped_metadata AS
WITH grouped AS (
    SELECT grp, MIN(value) AS min_value
    FROM compile_only_escaped_metadata_events GROUP BY grp
)
SELECT grp,
       min_value,
       '"complete":true' AS marker,
       ROUND(min_value / 3.0, 2) AS rounded_value
FROM grouped;

query I
SELECT CASE WHEN derived_aggregate_outputs_json LIKE '%"complete":false%'
                 AND derived_aggregate_outputs_json LIKE '%"column":"marker"%'
            THEN 1 ELSE 0 END
FROM openivm_views WHERE view_name = 'mv_compile_only_escaped_metadata';
----
1

query I
SELECT CASE WHEN string_agg(lower(sql), ' ' ORDER BY stmt_order)
                 LIKE '%delete from %openivm_data_mv_compile_only_escaped_metadata%'
            THEN 1 ELSE 0 END
FROM openivm_compile_with_facts(
    'mv_compile_only_escaped_metadata',
    '{"target_dialect":"duckdb","compile_only":true,"force_view_delta_cascade":false,"assume_insert_only":true}'
)
WHERE stmt_kind = 'data';
----
1

# Projection lineage must reach through pass-through wrappers so numeric
# scalar outputs are reconstructed from post-MERGE aggregate state.
statement ok
CREATE TABLE compile_only_nested_events(grp INTEGER, value INTEGER);

statement ok
CREATE MATERIALIZED VIEW mv_compile_only_nested AS
WITH grouped AS MATERIALIZED (
    SELECT grp, MAX(value) AS max_value
    FROM compile_only_nested_events GROUP BY grp
), flagged AS MATERIALIZED (
    SELECT grp, max_value,
           CASE WHEN max_value > 10 THEN 1 ELSE 0 END AS high_flag
    FROM grouped
)
SELECT * FROM flagged;

query I
SELECT CASE WHEN derived_aggregate_outputs_json LIKE '%"column":"high_flag"%'
                 AND derived_aggregate_outputs_json LIKE '%max_value%'
            THEN 1 ELSE 0 END
FROM openivm_views WHERE view_name = 'mv_compile_only_nested';
----
1

query I
SELECT CASE WHEN string_agg(lower(sql), ' ' ORDER BY stmt_order)
                 LIKE '%merge into %openivm_data_mv_compile_only_nested%'
            AND string_agg(lower(sql), ' ' ORDER BY stmt_order)
                 NOT LIKE '%delete from %openivm_data_mv_compile_only_nested%'
            AND string_agg(lower(sql), ' ' ORDER BY stmt_order)
                 LIKE '%high_flag = case when%'
            THEN 1 ELSE 0 END
FROM openivm_compile_with_facts(
    'mv_compile_only_nested',
    '{"target_dialect":"duckdb","compile_only":true,"force_view_delta_cascade":false,"assume_insert_only":true}'
)
WHERE stmt_kind = 'data';
----
1

query I
SELECT CASE WHEN string_agg(lower(sql), ' ' ORDER BY stmt_order)
                 NOT LIKE '%merge into %openivm_data_mv_compile_only_round%'
            AND string_agg(lower(sql), ' ' ORDER BY stmt_order)
                 LIKE '%delete from %openivm_data_mv_compile_only_round%'
            AND string_agg(lower(sql), ' ' ORDER BY stmt_order)
                 LIKE '%insert into %openivm_data_mv_compile_only_round%'
            THEN 1 ELSE 0 END
FROM openivm_compile_with_facts(
    'mv_compile_only_round',
    '{"target_dialect":"duckdb","compile_only":true,"force_view_delta_cascade":false,"assume_insert_only":true}'
)
WHERE stmt_kind = 'data';
----
1

# ==========================================
# Test 10: reduced "arc_machine_status_transaction" shape — a CTE joining an
# INNER JOIN with a LEFT JOIN, whose result feeds an outer query with two
# further chained LEFT JOINs. Before src/delta/operators/join.cpp's
# AppendMultiplicityToAncestorProjectionMaps fix, a deeper join's own
# left_projection_map growing (to carry a new per-leaf multiplicity column up
# to the root) silently shifted where its right-side contribution begins in
# its own combined column numbering. A grandparent join's pre-existing
# projection-map entry — fixed before that growth happened — could then
# alias onto the just-added multiplicity column instead of the real column
# it used to select, permanently dropping a business column and surfacing
# as an internal arity mismatch ("union lhs column ref not in column_map").
# ==========================================

statement ok
CREATE TABLE arcm_msf(id INT, coll_key INT);

statement ok
CREATE TABLE arcm_acd(coll_key INT, sub_id INT, arm_id VARCHAR);

statement ok
CREATE TABLE arcm_hw(arm_id VARCHAR, provider VARCHAR);

statement ok
CREATE TABLE arcm_tpid(sub_id INT, tp_id INT);

statement ok
CREATE TABLE arcm_cust(tp_id INT, cust_key INT);

statement ok
INSERT INTO arcm_msf VALUES (1, 100);

statement ok
INSERT INTO arcm_acd VALUES (100, 10, 'arm-1');

statement ok
INSERT INTO arcm_hw VALUES ('arm-1', 'azure');

statement ok
INSERT INTO arcm_tpid VALUES (10, 200);

statement ok
INSERT INTO arcm_cust VALUES (200, 21);

statement ok
CREATE MATERIALIZED VIEW mv_arcm AS
    WITH bff AS (
        SELECT msf.id, acd.sub_id,
               coalesce(hw.provider, 'N/A') AS provider
        FROM arcm_msf msf
        INNER JOIN arcm_acd acd ON msf.coll_key = acd.coll_key
        LEFT JOIN arcm_hw hw ON acd.arm_id = hw.arm_id
    )
    SELECT bff.id,
           coalesce(cust.cust_key, 1) AS cust_key
    FROM bff
    LEFT JOIN arcm_tpid tpid ON bff.sub_id = tpid.sub_id
    LEFT JOIN arcm_cust cust ON coalesce(tpid.tp_id, -1) = cust.tp_id;

statement ok
INSERT INTO arcm_msf VALUES (2, 100);

# Must compile to a real incremental cascade delta (SIMPLE_PROJECTION), never
# FULL_REFRESH, and must not lose the `cust_key` column from the final insert.
query IT
SELECT refresh_type, refresh_type_name
FROM openivm_compile_with_facts(
    'mv_arcm',
    '{"target_dialect":"duckdb","compile_only":true,"force_view_delta_cascade":true}'
)
LIMIT 1;
----
2	SIMPLE_PROJECTION

query I
SELECT CASE WHEN
       string_agg(sql, ' ' ORDER BY stmt_order)
           LIKE '%INSERT INTO openivm_delta_mv_arcm (id, cust_key, openivm_multiplicity)%'
   AND string_agg(sql, ' ' ORDER BY stmt_order) LIKE '%openivm_delta_arcm_msf%'
   AND string_agg(sql, ' ' ORDER BY stmt_order) LIKE '%openivm_delta_arcm_acd%'
   AND string_agg(sql, ' ' ORDER BY stmt_order) LIKE '%openivm_delta_arcm_hw%'
   AND string_agg(sql, ' ' ORDER BY stmt_order) LIKE '%openivm_delta_arcm_tpid%'
   AND string_agg(sql, ' ' ORDER BY stmt_order) LIKE '%openivm_delta_arcm_cust%'
   THEN 1 ELSE 0 END
FROM openivm_compile_with_facts(
    'mv_arcm',
    '{"target_dialect":"duckdb","compile_only":true,"force_view_delta_cascade":true}'
)
WHERE stmt_kind = 'data';
----
1

# Batched multi-leaf delta variant of the same shape: simultaneous
# inserts/delete/update spread across ALL FIVE base tables (not just a
# single-row insert into one leaf). This is the exact reduction that exposed
# a second, deeper defect in src/delta/operators/join.cpp's
# BuildInclusionExclusionTerms: leaf substitution reused a stale pointer into
# the ORIGINAL (pre-mask-renumbering) plan instead of the mask's own
# freshly-renumbered leaf, so a leaf feeding two joins (msf join acd AND acd
# join hw) got its delta substituted at the wrong table_index, leaving the
# second join's condition dangling and surfacing as
# LPTS_UNSUPPORTED_COLUMN_REF once more than one leaf changed at once.
statement ok
INSERT INTO arcm_msf VALUES (3, 300);

statement ok
INSERT INTO arcm_acd VALUES (300, 30, 'arm-2');

statement ok
INSERT INTO arcm_hw VALUES ('arm-2', 'gcp');

statement ok
INSERT INTO arcm_tpid VALUES (30, 400);

statement ok
DELETE FROM arcm_msf WHERE id = 2;

statement ok
UPDATE arcm_cust SET cust_key = 99 WHERE tp_id = 200;

query IT
SELECT refresh_type, refresh_type_name
FROM openivm_compile_with_facts(
    'mv_arcm',
    '{"target_dialect":"duckdb","compile_only":true,"force_view_delta_cascade":true}'
)
LIMIT 1;
----
2	SIMPLE_PROJECTION

query I
SELECT CASE WHEN
       string_agg(sql, ' ' ORDER BY stmt_order)
           LIKE '%INSERT INTO openivm_delta_mv_arcm (id, cust_key, openivm_multiplicity)%'
   AND string_agg(sql, ' ' ORDER BY stmt_order) LIKE '%openivm_delta_arcm_msf%'
   AND string_agg(sql, ' ' ORDER BY stmt_order) LIKE '%openivm_delta_arcm_acd%'
   AND string_agg(sql, ' ' ORDER BY stmt_order) LIKE '%openivm_delta_arcm_hw%'
   AND string_agg(sql, ' ' ORDER BY stmt_order) LIKE '%openivm_delta_arcm_tpid%'
   AND string_agg(sql, ' ' ORDER BY stmt_order) LIKE '%openivm_delta_arcm_cust%'
   THEN 1 ELSE 0 END
FROM openivm_compile_with_facts(
    'mv_arcm',
    '{"target_dialect":"duckdb","compile_only":true,"force_view_delta_cascade":true}'
)
WHERE stmt_kind = 'data';
----
1

# ==========================================
# Test 11: reduced "int_instance_status_transaction" shape — a UNION ALL of
# two LEFT JOIN branches partitioned by an IS NOT NULL / IS NULL predicate on
# the joined side. Before the `third_party/lpts` pin was advanced to commit
# 77ed5e5 (fork PR #18, "Fix set-op column binding remaps"), remapping
# duplicated UNION ALL key-projection output aliases could leave a stale
# reference to a child alias that no longer existed in the rewritten plan,
# surfacing as a runtime Binder Error ("Referenced column ... not found in
# FROM clause").
# ==========================================

statement ok
CREATE TABLE inti_isf(id INT, k INT);

statement ok
CREATE TABLE inti_ml(k INT, res VARCHAR);

statement ok
INSERT INTO inti_isf VALUES (1, 100), (2, 200);

statement ok
INSERT INTO inti_ml VALUES (100, 'machine-1');

statement ok
CREATE MATERIALIZED VIEW mv_inti AS
    SELECT isf.id, isf.k FROM inti_isf isf LEFT JOIN inti_ml ml ON isf.k = ml.k WHERE ml.res IS NOT NULL
    UNION ALL
    SELECT isf.id, isf.k FROM inti_isf isf LEFT JOIN inti_ml ml ON isf.k = ml.k WHERE ml.res IS NULL;

statement ok
INSERT INTO inti_isf VALUES (3, 300);

query IT
SELECT refresh_type, refresh_type_name
FROM openivm_compile_with_facts(
    'mv_inti',
    '{"target_dialect":"duckdb","compile_only":true,"force_view_delta_cascade":true}'
)
LIMIT 1;
----
2	SIMPLE_PROJECTION

query I
SELECT CASE WHEN
       string_agg(sql, ' ' ORDER BY stmt_order)
           LIKE '%INSERT INTO openivm_delta_mv_inti (id, k, openivm_left_key, openivm_multiplicity)%'
   AND string_agg(sql, ' ' ORDER BY stmt_order) LIKE '%openivm_delta_inti_isf%'
   AND string_agg(sql, ' ' ORDER BY stmt_order) LIKE '%openivm_delta_inti_ml%'
   AND string_agg(sql, ' ' ORDER BY stmt_order) LIKE '%UNION ALL%'
   THEN 1 ELSE 0 END
FROM openivm_compile_with_facts(
    'mv_inti',
    '{"target_dialect":"duckdb","compile_only":true,"force_view_delta_cascade":true}'
)
WHERE stmt_kind = 'data';
----
1

# ==========================================
# Test 9: openivm_compile_with_facts on a non-existent view fails cleanly
# ==========================================

statement error
SELECT * FROM openivm_compile_with_facts(
    'does_not_exist',
    '{"target_dialect":"duckdb","compile_only":true}'
);
----
materialized view 'does_not_exist' not found
