# name: test/sql/data_dependent_template.test
# description: data-dependent optimizers must stay off while planning the delta template, so the
# group: [sql]

#   view query is not specialized to current table contents. Regression for statistics_propagation
#   folding the template (count/min/max -> constant, predicate -> EMPTY_RESULT, COALESCE -> column).
#   The unittest harness runs with query verification on, which forces the exact-cardinality stats
#   that trigger these folds — so these refreshes exercise the disable directly.

require openivm

# Finished-plan optimization is on by default for native refresh.
query I
SELECT current_setting('openivm_enable_data_dependent_optimizers');
----
true

# --- Family 1: ungrouped COUNT(*) folded to a constant via TryExecuteAggregates ---
statement ok
CREATE TABLE ddt(i INT);

statement ok
INSERT INTO ddt VALUES (1);

statement ok
CREATE MATERIALIZED VIEW dd_count AS SELECT COUNT(*) AS c FROM ddt;

statement ok
INSERT INTO ddt VALUES (2), (3);

statement ok
PRAGMA refresh('dd_count');

query I
SELECT count(*) FROM ((SELECT c FROM dd_count) EXCEPT ALL (SELECT COUNT(*) FROM ddt));
----
0

query I
SELECT count(*) FROM ((SELECT COUNT(*) FROM ddt) EXCEPT ALL (SELECT c FROM dd_count));
----
0

# --- Family 1b: ungrouped MIN/MAX folded from partition stats ---
statement ok
CREATE TABLE ddm(v INT);

statement ok
INSERT INTO ddm VALUES (5), (3), (8);

statement ok
CREATE MATERIALIZED VIEW dd_minmax AS SELECT MIN(v) AS mn, MAX(v) AS mx FROM ddm;

statement ok
INSERT INTO ddm VALUES (1), (10);

statement ok
PRAGMA refresh('dd_minmax');

query I
SELECT count(*) FROM ((SELECT mn, mx FROM dd_minmax) EXCEPT ALL (SELECT MIN(v), MAX(v) FROM ddm));
----
0

query I
SELECT count(*) FROM ((SELECT MIN(v), MAX(v) FROM ddm) EXCEPT ALL (SELECT mn, mx FROM dd_minmax));
----
0

# --- Family 2: filter proven empty on current stats -> EMPTY_RESULT (future rows must still flow) ---
statement ok
CREATE TABLE ddf(x INT);

statement ok
INSERT INTO ddf VALUES (1), (2);

statement ok
CREATE MATERIALIZED VIEW dd_filter AS SELECT x FROM ddf WHERE x > 100;

statement ok
INSERT INTO ddf VALUES (200), (5);

statement ok
PRAGMA refresh('dd_filter');

query I
SELECT count(*) FROM ((SELECT x FROM dd_filter) EXCEPT ALL (SELECT x FROM ddf WHERE x > 100));
----
0

query I
SELECT count(*) FROM ((SELECT x FROM ddf WHERE x > 100) EXCEPT ALL (SELECT x FROM dd_filter));
----
0

# --- Family 3: COALESCE simplified away because the column currently has no NULLs ---
statement ok
CREATE TABLE ddc(a INT, b INT);

statement ok
INSERT INTO ddc VALUES (1, 1), (2, 2);

statement ok
CREATE MATERIALIZED VIEW dd_coal AS SELECT COALESCE(a, -1) AS sa, b FROM ddc;

statement ok
INSERT INTO ddc VALUES (NULL, 3);

statement ok
PRAGMA refresh('dd_coal');

query I
SELECT count(*) FROM ((SELECT sa, b FROM dd_coal) EXCEPT ALL (SELECT COALESCE(a, -1), b FROM ddc));
----
0

query I
SELECT count(*) FROM ((SELECT COALESCE(a, -1), b FROM ddc) EXCEPT ALL (SELECT sa, b FROM dd_coal));
----
0

# Enabling data-dependent optimization applies only after the base-view plan has been rewritten to
# the incremental plan. The finished native plan is executed immediately, so current delta facts may
# be folded without baking the old base-table contents into the reusable template.
statement ok
CREATE TABLE ddo(i INT);

statement ok
INSERT INTO ddo VALUES (1);

statement ok
CREATE MATERIALIZED VIEW dd_opt_count AS SELECT COUNT(*) AS c FROM ddo;

statement ok
INSERT INTO ddo VALUES (2), (3);

statement ok
PRAGMA refresh('dd_opt_count');

query I
SELECT count(*) FROM ((SELECT c FROM dd_opt_count) EXCEPT ALL (SELECT COUNT(*) FROM ddo));
----
0

query I
SELECT count(*) FROM ((SELECT COUNT(*) FROM ddo) EXCEPT ALL (SELECT c FROM dd_opt_count));
----
0

# Delta capture uses UTC timestamps internally. Watermarks must use the same clock even when the
# session time zone is non-UTC, otherwise the first refresh treats fresh deltas as hours old.
statement ok
LOAD icu;

statement ok
SET TimeZone = 'Europe/Amsterdam';

statement ok
CREATE TABLE ddtz_parent(id INTEGER PRIMARY KEY, label VARCHAR);

statement ok
CREATE TABLE ddtz_child(id INTEGER PRIMARY KEY, parent_id INTEGER, amount INTEGER);

statement ok
INSERT INTO ddtz_parent VALUES (1, 'one');

statement ok
INSERT INTO ddtz_child VALUES (10, 1, 20);

statement ok
CREATE MATERIALIZED VIEW ddtz_mv AS
SELECT p.id, p.label, c.id AS child_id, c.amount
FROM ddtz_parent p JOIN ddtz_child c ON p.id = c.parent_id;

statement ok
UPDATE ddtz_child SET amount = 30 WHERE id = 10;

statement ok
PRAGMA refresh('ddtz_mv');

query I
SELECT count(*) FROM (
    SELECT id, label, child_id, amount FROM ddtz_mv
    EXCEPT ALL
    SELECT p.id, p.label, c.id, c.amount
    FROM ddtz_parent p JOIN ddtz_child c ON p.id = c.parent_id
);
----
0

query I
SELECT count(*) FROM (
    SELECT p.id, p.label, c.id, c.amount
    FROM ddtz_parent p JOIN ddtz_child c ON p.id = c.parent_id
    EXCEPT ALL
    SELECT id, label, child_id, amount FROM ddtz_mv
);
----
0

statement ok
SET TimeZone = 'UTC';
