# name: test/sql/ducklake_chained.test
# description: Test chained MVs (table → mv1 → mv2) with DuckLake base tables
# group: [sql]

require openivm

require parquet

statement ok
INSTALL ducklake;

statement ok
LOAD ducklake;

statement ok
ATTACH '__TEST_DIR__/ducklake_chained.db' AS dl (TYPE ducklake);

# Disable auto cascade — refresh each MV explicitly in order
statement ok
SET openivm_cascade_refresh = 'off';

# ==========================================
# 2-level chain: dl.sales → dl.mv_region → dl.mv_top
# ==========================================

statement ok
CREATE TABLE dl.sales (id INT, region VARCHAR, amount INT);

statement ok
INSERT INTO dl.sales VALUES (1, 'east', 100), (2, 'west', 200), (3, 'east', 150), (4, 'south', 50);

# Level 1: aggregate per region
statement ok
CREATE MATERIALIZED VIEW dl.mv_region AS
  SELECT region, SUM(amount) as total, COUNT(*) as cnt
  FROM dl.sales GROUP BY region;

# Level 2: filter top regions
statement ok
CREATE MATERIALIZED VIEW dl.mv_top AS
  SELECT region, total, cnt FROM dl.mv_region WHERE total > 100;

# Initial state
query III rowsort
SELECT * FROM dl.mv_region ORDER BY region;
----
east	250	2
south	50	1
west	200	1

query III rowsort
SELECT * FROM dl.mv_top ORDER BY region;
----
east	250	2
west	200	1

# --- Insert: boost south above threshold ---
statement ok
INSERT INTO dl.sales VALUES (5, 'south', 200);

statement ok
PRAGMA refresh('mv_region');

statement ok
PRAGMA refresh('mv_top');

# EXCEPT ALL for level 1
query I
SELECT count(*) FROM (
  SELECT region, total, cnt FROM dl.mv_region
  EXCEPT ALL
  SELECT region, SUM(amount), COUNT(*) FROM dl.sales GROUP BY region
);
----
0

query I
SELECT count(*) FROM (
  SELECT region, SUM(amount), COUNT(*) FROM dl.sales GROUP BY region
  EXCEPT ALL
  SELECT region, total, cnt FROM dl.mv_region
);
----
0

# EXCEPT ALL for level 2
query I
SELECT count(*) FROM (
  SELECT region, total, cnt FROM dl.mv_top
  EXCEPT ALL
  SELECT region, SUM(amount), COUNT(*) FROM dl.sales GROUP BY region HAVING SUM(amount) > 100
);
----
0

query I
SELECT count(*) FROM (
SELECT region, SUM(amount), COUNT(*) FROM dl.sales GROUP BY region HAVING SUM(amount) > 100
  EXCEPT ALL
  SELECT region, total, cnt FROM dl.mv_top
);
----
0

# ==========================================
# Empty upstream cascade should skip unchanged ancestors and advance DuckLake
# snapshots for sources proven unchanged. A later real source update must still
# be detected.
# ==========================================

statement ok
SET openivm_cascade_refresh = 'upstream';

statement ok
SET openivm_skip_empty_deltas = true;

statement ok
CREATE TABLE dl.chain_skip_base (id INTEGER, v INTEGER);

statement ok
CREATE TABLE dl.chain_skip_unrelated (id INTEGER);

statement ok
INSERT INTO dl.chain_skip_base VALUES (1, 10);

statement ok
CREATE MATERIALIZED VIEW dl.chain_skip_l1 AS
SELECT id, v FROM dl.chain_skip_base;

statement ok
CREATE MATERIALIZED VIEW dl.chain_skip_l2 AS
SELECT id, v * 2 AS doubled FROM dl.chain_skip_l1;

statement ok
CREATE TEMP TABLE chain_skip_snapshots AS
SELECT view_name, table_name, last_snapshot_id AS snap
FROM openivm_delta_tables
WHERE view_name IN ('chain_skip_l1', 'chain_skip_l2');

statement ok
INSERT INTO dl.chain_skip_unrelated VALUES (1);

statement ok
PRAGMA refresh('chain_skip_l2');

query I
SELECT count(*) FROM openivm_delta_tables d
JOIN chain_skip_snapshots s
  ON d.view_name = s.view_name AND d.table_name = s.table_name
WHERE d.last_snapshot_id <= s.snap;
----
0

query I
SELECT count(*) FROM (
  SELECT id, v FROM dl.chain_skip_l1
  EXCEPT ALL
  SELECT id, v FROM dl.chain_skip_base
);
----
0

query I
SELECT count(*) FROM (
  SELECT id, v FROM dl.chain_skip_base
  EXCEPT ALL
  SELECT id, v FROM dl.chain_skip_l1
);
----
0

query I
SELECT count(*) FROM (
  SELECT id, doubled FROM dl.chain_skip_l2
  EXCEPT ALL
  SELECT id, v * 2 AS doubled FROM dl.chain_skip_base
);
----
0

query I
SELECT count(*) FROM (
  SELECT id, v * 2 AS doubled FROM dl.chain_skip_base
  EXCEPT ALL
  SELECT id, doubled FROM dl.chain_skip_l2
);
----
0

statement ok
INSERT INTO dl.chain_skip_base VALUES (2, 20);

statement ok
PRAGMA refresh('chain_skip_l2');

query I
SELECT count(*) FROM (
  SELECT id, v FROM dl.chain_skip_l1
  EXCEPT ALL
  SELECT id, v FROM dl.chain_skip_base
);
----
0

query I
SELECT count(*) FROM (
  SELECT id, v FROM dl.chain_skip_base
  EXCEPT ALL
  SELECT id, v FROM dl.chain_skip_l1
);
----
0

query I
SELECT count(*) FROM (
  SELECT id, doubled FROM dl.chain_skip_l2
  EXCEPT ALL
  SELECT id, v * 2 AS doubled FROM dl.chain_skip_base
);
----
0

query I
SELECT count(*) FROM (
  SELECT id, v * 2 AS doubled FROM dl.chain_skip_base
  EXCEPT ALL
  SELECT id, doubled FROM dl.chain_skip_l2
);
----
0

# ==========================================
# Cross-catalog DuckLake pipeline with non-dl catalog names
# ==========================================

statement ok
SET openivm_cascade_refresh = 'off';

statement ok
ATTACH '__TEST_DIR__/ducklake_chain_a.db' AS chain_a (TYPE ducklake);

statement ok
ATTACH '__TEST_DIR__/ducklake_chain_b.db' AS chain_b (TYPE ducklake);

statement ok
CREATE TABLE chain_a.pipeline_src (id INT, amount INT);

statement ok
INSERT INTO chain_a.pipeline_src VALUES (1, 10), (2, 20);

statement ok
CREATE MATERIALIZED VIEW chain_b.pipeline_l1 AS
SELECT id, amount FROM chain_a.pipeline_src;

statement ok
CREATE MATERIALIZED VIEW chain_a.pipeline_l2 AS
SELECT id, amount, amount * 2 AS doubled FROM chain_b.pipeline_l1;

query II rowsort
SELECT table_catalog, table_name
FROM information_schema.tables
WHERE table_name IN ('openivm_data_pipeline_l1', 'openivm_delta_pipeline_l1',
                     'openivm_data_pipeline_l2', 'openivm_delta_pipeline_l2')
ORDER BY table_catalog, table_name;
----
chain_a	openivm_data_pipeline_l2
chain_a	openivm_delta_pipeline_l2
chain_b	openivm_data_pipeline_l1
chain_b	openivm_delta_pipeline_l1

statement ok
INSERT INTO chain_a.pipeline_src VALUES (3, 30);

statement ok
PRAGMA refresh_options('chain_b', 'main', 'pipeline_l1');

statement ok
PRAGMA refresh_options('chain_a', 'main', 'pipeline_l2');

query I
SELECT count(*) FROM (
  SELECT id, amount FROM chain_a.pipeline_src
  EXCEPT ALL
  SELECT id, amount FROM chain_b.pipeline_l1
);
----
0

query I
SELECT count(*) FROM (
  SELECT id, amount FROM chain_b.pipeline_l1
  EXCEPT ALL
  SELECT id, amount FROM chain_a.pipeline_src
);
----
0

query I
SELECT count(*) FROM (
  SELECT id, amount, amount * 2 AS doubled FROM chain_b.pipeline_l1
  EXCEPT ALL
  SELECT id, amount, doubled FROM chain_a.pipeline_l2
);
----
0

query I
SELECT count(*) FROM (
  SELECT id, amount, doubled FROM chain_a.pipeline_l2
  EXCEPT ALL
  SELECT id, amount, amount * 2 AS doubled FROM chain_b.pipeline_l1
);
----
0

# --- Delete: drop east below threshold ---
statement ok
DELETE FROM dl.sales WHERE id = 1;

statement ok
PRAGMA refresh('mv_region');

statement ok
PRAGMA refresh('mv_top');

# EXCEPT ALL for level 1
query I
SELECT count(*) FROM (
  SELECT region, total, cnt FROM dl.mv_region
  EXCEPT ALL
  SELECT region, SUM(amount), COUNT(*) FROM dl.sales GROUP BY region
);
----
0

query I
SELECT count(*) FROM (
  SELECT region, SUM(amount), COUNT(*) FROM dl.sales GROUP BY region
  EXCEPT ALL
  SELECT region, total, cnt FROM dl.mv_region
);
----
0

# EXCEPT ALL for level 2
query I
SELECT count(*) FROM (
  SELECT region, total, cnt FROM dl.mv_top
  EXCEPT ALL
  SELECT region, SUM(amount), COUNT(*) FROM dl.sales GROUP BY region HAVING SUM(amount) > 100
);
----
0

query I
SELECT count(*) FROM (
  SELECT region, SUM(amount), COUNT(*) FROM dl.sales GROUP BY region HAVING SUM(amount) > 100
  EXCEPT ALL
  SELECT region, total, cnt FROM dl.mv_top
);
----
0

# ==========================================
# Stress: batch ops, then refresh chain
# ==========================================

statement ok
INSERT INTO dl.sales VALUES (6, 'north', 500);

statement ok
DELETE FROM dl.sales WHERE id = 4;

statement ok
INSERT INTO dl.sales VALUES (7, 'west', 100);

statement ok
PRAGMA refresh('mv_region');

statement ok
PRAGMA refresh('mv_top');

# EXCEPT ALL for both levels
query I
SELECT count(*) FROM (
  SELECT region, total, cnt FROM dl.mv_region
  EXCEPT ALL
  SELECT region, SUM(amount), COUNT(*) FROM dl.sales GROUP BY region
);
----
0

query I
SELECT count(*) FROM (
  SELECT region, SUM(amount), COUNT(*) FROM dl.sales GROUP BY region
  EXCEPT ALL
  SELECT region, total, cnt FROM dl.mv_region
);
----
0

query I
SELECT count(*) FROM (
  SELECT region, total, cnt FROM dl.mv_top
  EXCEPT ALL
  SELECT region, SUM(amount), COUNT(*) FROM dl.sales GROUP BY region HAVING SUM(amount) > 100
);
----
0

query I
SELECT count(*) FROM (
  SELECT region, SUM(amount), COUNT(*) FROM dl.sales GROUP BY region HAVING SUM(amount) > 100
  EXCEPT ALL
  SELECT region, total, cnt FROM dl.mv_top
);
----
0

# ==========================================
# Cascade mode across DuckLake schemas
# ==========================================

statement ok
SET openivm_cascade_refresh = 'downstream';

statement ok
CREATE SCHEMA dl.bronze;

statement ok
CREATE SCHEMA dl.silver;

statement ok
CREATE SCHEMA dl.gold;

statement ok
CREATE TABLE dl.bronze.cross_schema_base (id INT, amount INT);

statement ok
INSERT INTO dl.bronze.cross_schema_base VALUES (1, 10);

statement ok
CREATE MATERIALIZED VIEW dl.silver.cross_schema_l1 AS
  SELECT id, amount FROM dl.bronze.cross_schema_base;

statement ok
CREATE MATERIALIZED VIEW dl.gold.cross_schema_l2 AS
  SELECT id, amount FROM dl.silver.openivm_data_cross_schema_l1;

statement ok
INSERT INTO dl.bronze.cross_schema_base VALUES (2, 20);

# Only refresh level 1 — level 2 should cascade in its own gold schema
statement ok
PRAGMA refresh_options('dl', 'silver', 'cross_schema_l1');

query II rowsort
SELECT id, amount FROM dl.silver.cross_schema_l1 ORDER BY id;
----
1	10
2	20

query II rowsort
SELECT id, amount FROM dl.gold.cross_schema_l2 ORDER BY id;
----
1	10
2	20

statement ok
SET openivm_cascade_refresh = 'upstream';

statement ok
INSERT INTO dl.bronze.cross_schema_base VALUES (3, 30);

# Only refresh level 2 — level 1 should cascade in its own silver schema first
statement ok
PRAGMA refresh_options('dl', 'gold', 'cross_schema_l2');

query II rowsort
SELECT id, amount FROM dl.silver.cross_schema_l1 ORDER BY id;
----
1	10
2	20
3	30

query II rowsort
SELECT id, amount FROM dl.gold.cross_schema_l2 ORDER BY id;
----
1	10
2	20
3	30

# Explicit refresh after an upstream delete/rewrite must not duplicate rows in the downstream schema.
# This covers gold views that read silver.openivm_data_* tables, as in the benchmark.
statement ok
SET openivm_cascade_refresh = 'off';

statement ok
DELETE FROM dl.bronze.cross_schema_base WHERE id = 2;

statement ok
PRAGMA refresh_options('dl', 'silver', 'cross_schema_l1');

statement ok
PRAGMA refresh_options('dl', 'gold', 'cross_schema_l2');

query I
SELECT count(*) FROM dl.gold.cross_schema_l2;
----
2

query I
SELECT count(*) FROM (
  SELECT id, amount FROM dl.gold.cross_schema_l2
  EXCEPT ALL
  SELECT id, amount FROM dl.silver.cross_schema_l1
);
----
0

query I
SELECT count(*) FROM (
  SELECT id, amount FROM dl.silver.cross_schema_l1
  EXCEPT ALL
  SELECT id, amount FROM dl.gold.cross_schema_l2
);
----
0

statement ok
CREATE MATERIALIZED VIEW dl.gold.cross_schema_join_l2 AS
  WITH l1 AS (
    SELECT id, amount FROM dl.silver.cross_schema_l1
  )
  SELECT l1.id, l1.amount, b.amount AS base_amount
  FROM l1
  JOIN dl.bronze.cross_schema_base b USING (id);

statement ok
INSERT INTO dl.bronze.cross_schema_base VALUES (4, 40);

statement ok
PRAGMA refresh_options('dl', 'silver', 'cross_schema_l1');

statement ok
PRAGMA refresh_options('dl', 'gold', 'cross_schema_join_l2');

query I
SELECT count(*) FROM (
  SELECT id, amount, base_amount FROM dl.gold.cross_schema_join_l2
  EXCEPT ALL
  SELECT id, amount, amount AS base_amount FROM dl.silver.cross_schema_l1
);
----
0

query I
SELECT count(*) FROM (
  SELECT id, amount, amount AS base_amount FROM dl.silver.cross_schema_l1
  EXCEPT ALL
  SELECT id, amount, base_amount FROM dl.gold.cross_schema_join_l2
);
----
0

# Projection chains use the upstream MV's materialized data table directly.
statement ok
CREATE TABLE dl.bronze.catalog_chain_base (id INT, amount INT);

statement ok
INSERT INTO dl.bronze.catalog_chain_base VALUES (1, 10), (2, 20);

statement ok
CREATE MATERIALIZED VIEW dl.bronze.catalog_chain_l1 AS
  SELECT id, amount FROM dl.bronze.catalog_chain_base;

statement ok
CREATE MATERIALIZED VIEW dl.silver.catalog_chain_l2 AS
  SELECT id, amount FROM dl.bronze.catalog_chain_l1;

query II
SELECT table_name, source_catalog
FROM openivm_delta_tables
WHERE view_name = 'catalog_chain_l2'
ORDER BY table_name;
----
openivm_data_catalog_chain_l1	dl

statement ok
INSERT INTO dl.bronze.catalog_chain_base VALUES (3, 30);

statement ok
PRAGMA refresh_options('dl', 'bronze', 'catalog_chain_l1');

statement ok
PRAGMA refresh_options('dl', 'silver', 'catalog_chain_l2');

query I
SELECT count(*) FROM (
  SELECT id, amount FROM dl.silver.catalog_chain_l2
  EXCEPT ALL
  SELECT id, amount FROM dl.bronze.catalog_chain_l1
);
----
0

query I
SELECT count(*) FROM (
  SELECT id, amount FROM dl.bronze.catalog_chain_l1
  EXCEPT ALL
  SELECT id, amount FROM dl.silver.catalog_chain_l2
);
----
0

# Benchmark-shaped persisted metadata can track an upstream MV through its
# companion delta_<upstream_mv> table. The downstream MV lives in DuckLake, but
# that companion delta table is a physical OpenIVM table, so refresh metadata
# updates and empty-delta probes must qualify it via source_catalog/source_schema
# instead of the target DuckLake schema.
statement ok
CREATE TABLE dl.bronze.catalog_window_base (
  sym VARCHAR,
  trade_date DATE,
  low_price INT,
  high_price INT
);

statement ok
INSERT INTO dl.bronze.catalog_window_base VALUES
  ('A', DATE '2026-01-01', 10, 20),
  ('A', DATE '2026-01-02', 8, 22),
  ('B', DATE '2026-01-01', 30, 40);

statement ok
CREATE MATERIALIZED VIEW dl.bronze.catalog_window_l1 AS
  SELECT sym, trade_date, low_price, high_price FROM dl.bronze.catalog_window_base;

statement ok
CREATE MATERIALIZED VIEW dl.silver.catalog_window_l2 AS
  SELECT
    sym,
    trade_date,
    low_price,
    high_price,
    MIN(low_price) OVER (PARTITION BY sym ORDER BY trade_date) AS running_low,
    MAX(high_price) OVER (PARTITION BY sym ORDER BY trade_date) AS running_high
  FROM dl.bronze.catalog_window_l1;

statement ok
UPDATE openivm_delta_tables
SET table_name = 'openivm_delta_catalog_window_l1',
    catalog_type = 'duckdb',
    source_catalog = 'dl',
    source_schema = 'bronze'
WHERE view_name = 'catalog_window_l2'
  AND table_name = 'openivm_data_catalog_window_l1';

query II
SELECT table_name, source_schema
FROM openivm_delta_tables
WHERE view_name = 'catalog_window_l2'
ORDER BY table_name;
----
openivm_delta_catalog_window_l1	bronze

statement ok
INSERT INTO dl.bronze.catalog_window_base VALUES
  ('A', DATE '2026-01-03', 7, 25),
  ('B', DATE '2026-01-02', 28, 41);

statement ok
PRAGMA refresh_options('dl', 'bronze', 'catalog_window_l1');

# The in-memory DuckLake test normally tracks the upstream MV through DuckLake
# snapshots. Seed the companion delta table to emulate the benchmark's persisted
# delta_<upstream_mv> dependency and force the downstream refresh to read it.
statement ok
INSERT INTO dl.bronze.openivm_delta_catalog_window_l1
SELECT sym, trade_date, low_price, high_price, 1, now()
FROM dl.bronze.catalog_window_l1
WHERE trade_date IN (DATE '2026-01-02', DATE '2026-01-03');

statement ok
PRAGMA refresh_options('dl', 'silver', 'catalog_window_l2');

query I
SELECT count(*) FROM (
  SELECT * FROM dl.silver.catalog_window_l2
  EXCEPT ALL
  SELECT
    sym,
    trade_date,
    low_price,
    high_price,
    MIN(low_price) OVER (PARTITION BY sym ORDER BY trade_date) AS running_low,
    MAX(high_price) OVER (PARTITION BY sym ORDER BY trade_date) AS running_high
  FROM dl.bronze.catalog_window_l1
);
----
0

query I
SELECT count(*) FROM (
  SELECT
    sym,
    trade_date,
    low_price,
    high_price,
    MIN(low_price) OVER (PARTITION BY sym ORDER BY trade_date) AS running_low,
    MAX(high_price) OVER (PARTITION BY sym ORDER BY trade_date) AS running_high
  FROM dl.bronze.catalog_window_l1
  EXCEPT ALL
  SELECT * FROM dl.silver.catalog_window_l2
);
----
0

# A second downstream refresh with no upstream changes must probe the same
# physical companion delta table and then skip cleanly.
statement ok
PRAGMA refresh_options('dl', 'silver', 'catalog_window_l2');

query I
SELECT count(*) FROM (
  SELECT * FROM dl.silver.catalog_window_l2
  EXCEPT ALL
  SELECT
    sym,
    trade_date,
    low_price,
    high_price,
    MIN(low_price) OVER (PARTITION BY sym ORDER BY trade_date) AS running_low,
    MAX(high_price) OVER (PARTITION BY sym ORDER BY trade_date) AS running_high
  FROM dl.bronze.catalog_window_l1
);
----
0

# ==========================================
# Cascade mode: downstream
# Refreshing mv_region should auto-refresh mv_top
# ==========================================

statement ok
SET openivm_cascade_refresh = 'downstream';

statement ok
INSERT INTO dl.sales VALUES (8, 'east', 1000);

# Only refresh level 1 — level 2 should cascade automatically
statement ok
PRAGMA refresh('mv_region');

# Both levels should be correct
query I
SELECT count(*) FROM (
  SELECT region, total, cnt FROM dl.mv_region
  EXCEPT ALL
  SELECT region, SUM(amount), COUNT(*) FROM dl.sales GROUP BY region
);
----
0

query I
SELECT count(*) FROM (
  SELECT region, total, cnt FROM dl.mv_top
  EXCEPT ALL
  SELECT region, SUM(amount), COUNT(*) FROM dl.sales GROUP BY region HAVING SUM(amount) > 100
);
----
0

query I
SELECT count(*) FROM (
  SELECT region, SUM(amount), COUNT(*) FROM dl.sales GROUP BY region HAVING SUM(amount) > 100
  EXCEPT ALL
  SELECT region, total, cnt FROM dl.mv_top
);
----
0

# ==========================================
# Cascade mode: upstream
# Refreshing mv_top should auto-refresh mv_region first
# ==========================================

statement ok
SET openivm_cascade_refresh = 'upstream';

statement ok
INSERT INTO dl.sales VALUES (9, 'west', 300);

# Only refresh level 2 — level 1 should be refreshed first
statement ok
PRAGMA refresh('mv_top');

query I
SELECT count(*) FROM (
  SELECT region, total, cnt FROM dl.mv_region
  EXCEPT ALL
  SELECT region, SUM(amount), COUNT(*) FROM dl.sales GROUP BY region
);
----
0

query I
SELECT count(*) FROM (
  SELECT region, total, cnt FROM dl.mv_top
  EXCEPT ALL
  SELECT region, SUM(amount), COUNT(*) FROM dl.sales GROUP BY region HAVING SUM(amount) > 100
);
----
0

query I
SELECT count(*) FROM (
  SELECT region, SUM(amount), COUNT(*) FROM dl.sales GROUP BY region HAVING SUM(amount) > 100
  EXCEPT ALL
  SELECT region, total, cnt FROM dl.mv_top
);
----
0

# Pipeline refresh: selection, topological order, shared ancestors and repeated targets.

statement ok
USE dl;

statement ok
SET openivm_disable_daemon=true;

statement ok
CREATE SEQUENCE memory.main.pipe_seq;

statement ok
CREATE TABLE memory.main.pipe_log(seq BIGINT DEFAULT nextval('memory.main.pipe_seq'), name VARCHAR);

statement ok
CREATE TABLE pipe_src_a(id INT,v INT);

statement ok
CREATE TABLE pipe_src_b(id INT,w INT);

statement ok
INSERT INTO pipe_src_a VALUES (1,10),(2,20);

statement ok
INSERT INTO pipe_src_b VALUES (1,100),(2,200);

statement ok
CREATE MATERIALIZED VIEW pipe_a AS SELECT id,SUM(v) AS v FROM pipe_src_a GROUP BY id;

statement ok
CREATE VIEW pipe_bridge AS SELECT * FROM pipe_a;

statement ok
INSERT INTO memory.main.openivm_refresh_hooks VALUES ('pipe_a', 'INSERT INTO memory.main.pipe_log(name) VALUES (''pipe_a'')', 'after');

statement ok
CREATE MATERIALIZED VIEW pipe_b AS SELECT id,SUM(w) AS w FROM pipe_src_b GROUP BY id;

statement ok
INSERT INTO memory.main.openivm_refresh_hooks VALUES ('pipe_b', 'INSERT INTO memory.main.pipe_log(name) VALUES (''pipe_b'')', 'after');

statement ok
CREATE MATERIALIZED VIEW pipe_c AS SELECT id,v*2 AS v FROM pipe_bridge;

statement ok
INSERT INTO memory.main.openivm_refresh_hooks VALUES ('pipe_c', 'INSERT INTO memory.main.pipe_log(name) VALUES (''pipe_c'')', 'after');

statement ok
CREATE MATERIALIZED VIEW pipe_z AS SELECT a.id,a.v,b.w FROM pipe_c a JOIN pipe_b b USING(id);

statement ok
INSERT INTO memory.main.openivm_refresh_hooks VALUES ('pipe_z', 'INSERT INTO memory.main.pipe_log(name) VALUES (''pipe_z'')', 'after');

statement ok
CREATE MATERIALIZED VIEW pipe_tail AS SELECT id,v+w AS total FROM pipe_z;

statement ok
INSERT INTO memory.main.openivm_refresh_hooks VALUES ('pipe_tail', 'INSERT INTO memory.main.pipe_log(name) VALUES (''pipe_tail'')', 'after');

statement ok
CREATE MATERIALIZED VIEW pipe_side AS SELECT id,v+1 AS v FROM pipe_a;

statement ok
INSERT INTO memory.main.openivm_refresh_hooks VALUES ('pipe_side', 'INSERT INTO memory.main.pipe_log(name) VALUES (''pipe_side'')', 'after');

statement ok
DELETE FROM memory.main.pipe_log;

statement ok
INSERT INTO pipe_src_a VALUES (1,5),(99,9);

statement ok
UPDATE pipe_src_a SET v=v+1 WHERE id=1;

statement ok
DELETE FROM pipe_src_a WHERE id=99;

statement ok
INSERT INTO pipe_src_b VALUES (1,7),(99,9);

statement ok
UPDATE pipe_src_b SET w=w+1 WHERE id=1;

statement ok
DELETE FROM pipe_src_b WHERE id=99;

statement ok
SET openivm_cascade_refresh='off';

statement ok
PRAGMA refresh_pipeline('pipe_tail','pipe_z','pipe_c','pipe_b','pipe_a','pipe_a');

query T
SELECT COALESCE(string_agg(name, ',' ORDER BY seq), '') FROM memory.main.pipe_log;
----
pipe_a,pipe_b,pipe_c,pipe_z,pipe_tail

query II
SELECT (SELECT COUNT(*) FROM (SELECT * FROM pipe_a EXCEPT ALL SELECT id,SUM(v) AS v FROM pipe_src_a GROUP BY id)),
       (SELECT COUNT(*) FROM (SELECT id,SUM(v) AS v FROM pipe_src_a GROUP BY id EXCEPT ALL SELECT * FROM pipe_a));
----
0	0

query II
SELECT (SELECT COUNT(*) FROM (SELECT * FROM pipe_b EXCEPT ALL SELECT id,SUM(w) AS w FROM pipe_src_b GROUP BY id)),
       (SELECT COUNT(*) FROM (SELECT id,SUM(w) AS w FROM pipe_src_b GROUP BY id EXCEPT ALL SELECT * FROM pipe_b));
----
0	0

query II
SELECT (SELECT COUNT(*) FROM (SELECT * FROM pipe_c EXCEPT ALL SELECT id,v*2 AS v FROM pipe_a)),
       (SELECT COUNT(*) FROM (SELECT id,v*2 AS v FROM pipe_a EXCEPT ALL SELECT * FROM pipe_c));
----
0	0

query II
SELECT (SELECT COUNT(*) FROM (SELECT * FROM pipe_z EXCEPT ALL SELECT a.id,a.v,b.w FROM pipe_c a JOIN pipe_b b USING(id))),
       (SELECT COUNT(*) FROM (SELECT a.id,a.v,b.w FROM pipe_c a JOIN pipe_b b USING(id) EXCEPT ALL SELECT * FROM pipe_z));
----
0	0

query II
SELECT (SELECT COUNT(*) FROM (SELECT * FROM pipe_tail EXCEPT ALL SELECT id,v+w AS total FROM pipe_z)),
       (SELECT COUNT(*) FROM (SELECT id,v+w AS total FROM pipe_z EXCEPT ALL SELECT * FROM pipe_tail));
----
0	0

statement ok
DELETE FROM memory.main.pipe_log;

statement ok
INSERT INTO pipe_src_a VALUES (1,5),(99,9);

statement ok
UPDATE pipe_src_a SET v=v+1 WHERE id=1;

statement ok
DELETE FROM pipe_src_a WHERE id=99;

statement ok
INSERT INTO pipe_src_b VALUES (1,7),(99,9);

statement ok
UPDATE pipe_src_b SET w=w+1 WHERE id=1;

statement ok
DELETE FROM pipe_src_b WHERE id=99;

statement ok
SET openivm_cascade_refresh='upstream';

statement ok
PRAGMA refresh_pipeline('pipe_tail','pipe_z','pipe_tail');

query T
SELECT COALESCE(string_agg(name, ',' ORDER BY seq), '') FROM memory.main.pipe_log;
----
pipe_a,pipe_b,pipe_c,pipe_z,pipe_tail

query II
SELECT (SELECT COUNT(*) FROM (SELECT * FROM pipe_a EXCEPT ALL SELECT id,SUM(v) AS v FROM pipe_src_a GROUP BY id)),
       (SELECT COUNT(*) FROM (SELECT id,SUM(v) AS v FROM pipe_src_a GROUP BY id EXCEPT ALL SELECT * FROM pipe_a));
----
0	0

query II
SELECT (SELECT COUNT(*) FROM (SELECT * FROM pipe_b EXCEPT ALL SELECT id,SUM(w) AS w FROM pipe_src_b GROUP BY id)),
       (SELECT COUNT(*) FROM (SELECT id,SUM(w) AS w FROM pipe_src_b GROUP BY id EXCEPT ALL SELECT * FROM pipe_b));
----
0	0

query II
SELECT (SELECT COUNT(*) FROM (SELECT * FROM pipe_c EXCEPT ALL SELECT id,v*2 AS v FROM pipe_a)),
       (SELECT COUNT(*) FROM (SELECT id,v*2 AS v FROM pipe_a EXCEPT ALL SELECT * FROM pipe_c));
----
0	0

query II
SELECT (SELECT COUNT(*) FROM (SELECT * FROM pipe_z EXCEPT ALL SELECT a.id,a.v,b.w FROM pipe_c a JOIN pipe_b b USING(id))),
       (SELECT COUNT(*) FROM (SELECT a.id,a.v,b.w FROM pipe_c a JOIN pipe_b b USING(id) EXCEPT ALL SELECT * FROM pipe_z));
----
0	0

query II
SELECT (SELECT COUNT(*) FROM (SELECT * FROM pipe_tail EXCEPT ALL SELECT id,v+w AS total FROM pipe_z)),
       (SELECT COUNT(*) FROM (SELECT id,v+w AS total FROM pipe_z EXCEPT ALL SELECT * FROM pipe_tail));
----
0	0

statement ok
DELETE FROM memory.main.pipe_log;

statement ok
INSERT INTO pipe_src_a VALUES (1,5),(99,9);

statement ok
UPDATE pipe_src_a SET v=v+1 WHERE id=1;

statement ok
DELETE FROM pipe_src_a WHERE id=99;

statement ok
INSERT INTO pipe_src_b VALUES (1,7),(99,9);

statement ok
UPDATE pipe_src_b SET w=w+1 WHERE id=1;

statement ok
DELETE FROM pipe_src_b WHERE id=99;

statement ok
SET openivm_cascade_refresh='downstream';

statement ok
PRAGMA refresh_pipeline('pipe_b','pipe_c','pipe_a','pipe_b');

query T
SELECT COALESCE(string_agg(name, ',' ORDER BY seq), '') FROM memory.main.pipe_log;
----
pipe_a,pipe_b,pipe_c,pipe_side,pipe_z,pipe_tail

query II
SELECT (SELECT COUNT(*) FROM (SELECT * FROM pipe_a EXCEPT ALL SELECT id,SUM(v) AS v FROM pipe_src_a GROUP BY id)),
       (SELECT COUNT(*) FROM (SELECT id,SUM(v) AS v FROM pipe_src_a GROUP BY id EXCEPT ALL SELECT * FROM pipe_a));
----
0	0

query II
SELECT (SELECT COUNT(*) FROM (SELECT * FROM pipe_b EXCEPT ALL SELECT id,SUM(w) AS w FROM pipe_src_b GROUP BY id)),
       (SELECT COUNT(*) FROM (SELECT id,SUM(w) AS w FROM pipe_src_b GROUP BY id EXCEPT ALL SELECT * FROM pipe_b));
----
0	0

query II
SELECT (SELECT COUNT(*) FROM (SELECT * FROM pipe_c EXCEPT ALL SELECT id,v*2 AS v FROM pipe_a)),
       (SELECT COUNT(*) FROM (SELECT id,v*2 AS v FROM pipe_a EXCEPT ALL SELECT * FROM pipe_c));
----
0	0

query II
SELECT (SELECT COUNT(*) FROM (SELECT * FROM pipe_side EXCEPT ALL SELECT id,v+1 AS v FROM pipe_a)),
       (SELECT COUNT(*) FROM (SELECT id,v+1 AS v FROM pipe_a EXCEPT ALL SELECT * FROM pipe_side));
----
0	0

query II
SELECT (SELECT COUNT(*) FROM (SELECT * FROM pipe_z EXCEPT ALL SELECT a.id,a.v,b.w FROM pipe_c a JOIN pipe_b b USING(id))),
       (SELECT COUNT(*) FROM (SELECT a.id,a.v,b.w FROM pipe_c a JOIN pipe_b b USING(id) EXCEPT ALL SELECT * FROM pipe_z));
----
0	0

query II
SELECT (SELECT COUNT(*) FROM (SELECT * FROM pipe_tail EXCEPT ALL SELECT id,v+w AS total FROM pipe_z)),
       (SELECT COUNT(*) FROM (SELECT id,v+w AS total FROM pipe_z EXCEPT ALL SELECT * FROM pipe_tail));
----
0	0

statement ok
DELETE FROM memory.main.pipe_log;

statement ok
INSERT INTO pipe_src_a VALUES (1,5),(99,9);

statement ok
UPDATE pipe_src_a SET v=v+1 WHERE id=1;

statement ok
DELETE FROM pipe_src_a WHERE id=99;

statement ok
INSERT INTO pipe_src_b VALUES (1,7),(99,9);

statement ok
UPDATE pipe_src_b SET w=w+1 WHERE id=1;

statement ok
DELETE FROM pipe_src_b WHERE id=99;

statement ok
SET openivm_cascade_refresh='both';

statement ok
PRAGMA refresh_pipeline('pipe_c');

query T
SELECT COALESCE(string_agg(name, ',' ORDER BY seq), '') FROM memory.main.pipe_log;
----
pipe_a,pipe_b,pipe_c,pipe_z,pipe_tail

query II
SELECT (SELECT COUNT(*) FROM (SELECT * FROM pipe_a EXCEPT ALL SELECT id,SUM(v) AS v FROM pipe_src_a GROUP BY id)),
       (SELECT COUNT(*) FROM (SELECT id,SUM(v) AS v FROM pipe_src_a GROUP BY id EXCEPT ALL SELECT * FROM pipe_a));
----
0	0

query II
SELECT (SELECT COUNT(*) FROM (SELECT * FROM pipe_b EXCEPT ALL SELECT id,SUM(w) AS w FROM pipe_src_b GROUP BY id)),
       (SELECT COUNT(*) FROM (SELECT id,SUM(w) AS w FROM pipe_src_b GROUP BY id EXCEPT ALL SELECT * FROM pipe_b));
----
0	0

query II
SELECT (SELECT COUNT(*) FROM (SELECT * FROM pipe_c EXCEPT ALL SELECT id,v*2 AS v FROM pipe_a)),
       (SELECT COUNT(*) FROM (SELECT id,v*2 AS v FROM pipe_a EXCEPT ALL SELECT * FROM pipe_c));
----
0	0

query II
SELECT (SELECT COUNT(*) FROM (SELECT * FROM pipe_z EXCEPT ALL SELECT a.id,a.v,b.w FROM pipe_c a JOIN pipe_b b USING(id))),
       (SELECT COUNT(*) FROM (SELECT a.id,a.v,b.w FROM pipe_c a JOIN pipe_b b USING(id) EXCEPT ALL SELECT * FROM pipe_z));
----
0	0

query II
SELECT (SELECT COUNT(*) FROM (SELECT * FROM pipe_tail EXCEPT ALL SELECT id,v+w AS total FROM pipe_z)),
       (SELECT COUNT(*) FROM (SELECT id,v+w AS total FROM pipe_z EXCEPT ALL SELECT * FROM pipe_tail));
----
0	0

statement ok
DELETE FROM memory.main.pipe_log;

statement ok
INSERT INTO pipe_src_a VALUES (1,5),(99,9);

statement ok
UPDATE pipe_src_a SET v=v+1 WHERE id=1;

statement ok
DELETE FROM pipe_src_a WHERE id=99;

statement ok
INSERT INTO pipe_src_b VALUES (1,7),(99,9);

statement ok
UPDATE pipe_src_b SET w=w+1 WHERE id=1;

statement ok
DELETE FROM pipe_src_b WHERE id=99;

statement ok
SET openivm_cascade_refresh='off';

statement ok
PRAGMA refresh_pipeline('pipe_a','pipe_a');

query T
SELECT COALESCE(string_agg(name, ',' ORDER BY seq), '') FROM memory.main.pipe_log;
----
pipe_a

query II
SELECT (SELECT COUNT(*) FROM (SELECT * FROM pipe_a EXCEPT ALL SELECT id,SUM(v) AS v FROM pipe_src_a GROUP BY id)),
       (SELECT COUNT(*) FROM (SELECT id,SUM(v) AS v FROM pipe_src_a GROUP BY id EXCEPT ALL SELECT * FROM pipe_a));
----
0	0

statement ok
DELETE FROM memory.main.pipe_log;

statement ok
SET openivm_cascade_refresh='downstream';

statement ok
PRAGMA refresh_pipeline('pipe_c');

query T
SELECT COALESCE(string_agg(name, ',' ORDER BY seq), '') FROM memory.main.pipe_log;
----
pipe_c,pipe_z,pipe_tail

query II
SELECT (SELECT COUNT(*) FROM (SELECT * FROM pipe_c EXCEPT ALL SELECT id,v*2 AS v FROM pipe_a)),
       (SELECT COUNT(*) FROM (SELECT id,v*2 AS v FROM pipe_a EXCEPT ALL SELECT * FROM pipe_c));
----
0	0

query II
SELECT (SELECT COUNT(*) FROM (SELECT * FROM pipe_z EXCEPT ALL SELECT a.id,a.v,b.w FROM pipe_c a JOIN pipe_b b USING(id))),
       (SELECT COUNT(*) FROM (SELECT a.id,a.v,b.w FROM pipe_c a JOIN pipe_b b USING(id) EXCEPT ALL SELECT * FROM pipe_z));
----
0	0

query II
SELECT (SELECT COUNT(*) FROM (SELECT * FROM pipe_tail EXCEPT ALL SELECT id,v+w AS total FROM pipe_z)),
       (SELECT COUNT(*) FROM (SELECT id,v+w AS total FROM pipe_z EXCEPT ALL SELECT * FROM pipe_tail));
----
0	0

statement ok
DELETE FROM memory.main.pipe_log;

statement ok
INSERT INTO pipe_src_a VALUES (1,5),(99,9);

statement ok
UPDATE pipe_src_a SET v=v+1 WHERE id=1;

statement ok
DELETE FROM pipe_src_a WHERE id=99;

statement ok
INSERT INTO pipe_src_b VALUES (1,7),(99,9);

statement ok
UPDATE pipe_src_b SET w=w+1 WHERE id=1;

statement ok
DELETE FROM pipe_src_b WHERE id=99;

statement ok
SET openivm_cascade_refresh='upstream';

statement error
PRAGMA refresh_pipeline('pipe_a','pipe_missing');
----
does not exist

query T
SELECT COALESCE(string_agg(name, ',' ORDER BY seq), '') FROM memory.main.pipe_log;
----
(empty)

statement error
PRAGMA refresh_pipeline(NULL);
----
No function matches

statement error
PRAGMA refresh_pipeline(NULL::VARCHAR);
----
non-empty

statement error
PRAGMA refresh_pipeline('');
----
non-empty

statement ok
SET openivm_cascade_refresh='invalid';

statement error
PRAGMA refresh_pipeline('pipe_a');
----
unknown cascade mode

statement ok
SET openivm_cascade_refresh='upstream';

statement ok
CREATE TEMP TABLE pipe_saved_edges AS SELECT * FROM memory.main.openivm_delta_tables WHERE view_name='pipe_a';

statement ok
UPDATE memory.main.openivm_delta_tables SET table_name='openivm_data_pipe_tail' WHERE view_name='pipe_a';

statement error
PRAGMA refresh_pipeline('pipe_tail');
----
cycle

query T
SELECT COALESCE(string_agg(name, ',' ORDER BY seq), '') FROM memory.main.pipe_log;
----
(empty)

statement ok
DELETE FROM memory.main.openivm_delta_tables WHERE view_name='pipe_a';

statement ok
INSERT INTO memory.main.openivm_delta_tables SELECT * FROM pipe_saved_edges;

statement ok
PRAGMA refresh_pipeline('pipe_tail');

query T
SELECT COALESCE(string_agg(name, ',' ORDER BY seq), '') FROM memory.main.pipe_log;
----
pipe_a,pipe_b,pipe_c,pipe_z,pipe_tail

query II
SELECT (SELECT COUNT(*) FROM (SELECT * FROM pipe_a EXCEPT ALL SELECT id,SUM(v) AS v FROM pipe_src_a GROUP BY id)),
       (SELECT COUNT(*) FROM (SELECT id,SUM(v) AS v FROM pipe_src_a GROUP BY id EXCEPT ALL SELECT * FROM pipe_a));
----
0	0

query II
SELECT (SELECT COUNT(*) FROM (SELECT * FROM pipe_b EXCEPT ALL SELECT id,SUM(w) AS w FROM pipe_src_b GROUP BY id)),
       (SELECT COUNT(*) FROM (SELECT id,SUM(w) AS w FROM pipe_src_b GROUP BY id EXCEPT ALL SELECT * FROM pipe_b));
----
0	0

query II
SELECT (SELECT COUNT(*) FROM (SELECT * FROM pipe_c EXCEPT ALL SELECT id,v*2 AS v FROM pipe_a)),
       (SELECT COUNT(*) FROM (SELECT id,v*2 AS v FROM pipe_a EXCEPT ALL SELECT * FROM pipe_c));
----
0	0

query II
SELECT (SELECT COUNT(*) FROM (SELECT * FROM pipe_z EXCEPT ALL SELECT a.id,a.v,b.w FROM pipe_c a JOIN pipe_b b USING(id))),
       (SELECT COUNT(*) FROM (SELECT a.id,a.v,b.w FROM pipe_c a JOIN pipe_b b USING(id) EXCEPT ALL SELECT * FROM pipe_z));
----
0	0

query II
SELECT (SELECT COUNT(*) FROM (SELECT * FROM pipe_tail EXCEPT ALL SELECT id,v+w AS total FROM pipe_z)),
       (SELECT COUNT(*) FROM (SELECT id,v+w AS total FROM pipe_z EXCEPT ALL SELECT * FROM pipe_tail));
----
0	0

statement ok
ALTER TABLE pipe_src_a ADD COLUMN unused INT;

statement ok
ALTER TABLE pipe_src_a DROP COLUMN unused;

statement ok
DELETE FROM memory.main.pipe_log;

statement ok
INSERT INTO pipe_src_a VALUES (1,5),(99,9);

statement ok
UPDATE pipe_src_a SET v=v+1 WHERE id=1;

statement ok
DELETE FROM pipe_src_a WHERE id=99;

statement ok
INSERT INTO pipe_src_b VALUES (1,7),(99,9);

statement ok
UPDATE pipe_src_b SET w=w+1 WHERE id=1;

statement ok
DELETE FROM pipe_src_b WHERE id=99;

statement ok
PRAGMA refresh_pipeline('pipe_tail');

query T
SELECT COALESCE(string_agg(name, ',' ORDER BY seq), '') FROM memory.main.pipe_log;
----
pipe_a,pipe_b,pipe_c,pipe_z,pipe_tail

query II
SELECT (SELECT COUNT(*) FROM (SELECT * FROM pipe_a EXCEPT ALL SELECT id,SUM(v) AS v FROM pipe_src_a GROUP BY id)),
       (SELECT COUNT(*) FROM (SELECT id,SUM(v) AS v FROM pipe_src_a GROUP BY id EXCEPT ALL SELECT * FROM pipe_a));
----
0	0

query II
SELECT (SELECT COUNT(*) FROM (SELECT * FROM pipe_b EXCEPT ALL SELECT id,SUM(w) AS w FROM pipe_src_b GROUP BY id)),
       (SELECT COUNT(*) FROM (SELECT id,SUM(w) AS w FROM pipe_src_b GROUP BY id EXCEPT ALL SELECT * FROM pipe_b));
----
0	0

query II
SELECT (SELECT COUNT(*) FROM (SELECT * FROM pipe_c EXCEPT ALL SELECT id,v*2 AS v FROM pipe_a)),
       (SELECT COUNT(*) FROM (SELECT id,v*2 AS v FROM pipe_a EXCEPT ALL SELECT * FROM pipe_c));
----
0	0

query II
SELECT (SELECT COUNT(*) FROM (SELECT * FROM pipe_z EXCEPT ALL SELECT a.id,a.v,b.w FROM pipe_c a JOIN pipe_b b USING(id))),
       (SELECT COUNT(*) FROM (SELECT a.id,a.v,b.w FROM pipe_c a JOIN pipe_b b USING(id) EXCEPT ALL SELECT * FROM pipe_z));
----
0	0

query II
SELECT (SELECT COUNT(*) FROM (SELECT * FROM pipe_tail EXCEPT ALL SELECT id,v+w AS total FROM pipe_z)),
       (SELECT COUNT(*) FROM (SELECT id,v+w AS total FROM pipe_z EXCEPT ALL SELECT * FROM pipe_tail));
----
0	0

statement ok
DELETE FROM memory.main.pipe_log;

statement ok
CREATE TABLE pipe_drop_src(id INT);

statement ok
INSERT INTO pipe_drop_src VALUES (1);

statement ok
CREATE MATERIALIZED VIEW pipe_drop_mv AS SELECT id FROM pipe_drop_src;

statement ok
DROP TABLE pipe_drop_src;

statement error
PRAGMA refresh_pipeline('pipe_a','pipe_drop_mv');
----
cannot bind materialized view

query T
SELECT COALESCE(string_agg(name, ',' ORDER BY seq), '') FROM memory.main.pipe_log;
----
(empty)

statement ok
DROP VIEW pipe_side;

query II
SELECT (SELECT COUNT(*) FROM memory.main.openivm_views WHERE view_name='pipe_side'),
       (SELECT COUNT(*) FROM memory.main.openivm_delta_tables WHERE view_name='pipe_side');
----
0	0

statement error
PRAGMA refresh_pipeline('pipe_a','pipe_side');
----
does not exist

query T
SELECT COALESCE(string_agg(name, ',' ORDER BY seq), '') FROM memory.main.pipe_log;
----
(empty)


statement ok
INSERT INTO pipe_src_a VALUES (1,21);

statement ok
SET openivm_cascade_refresh='both';

statement ok
PRAGMA refresh_pipeline('pipe_a');

query T
SELECT string_agg(name, ',' ORDER BY seq) FROM memory.main.pipe_log;
----
pipe_a,pipe_c,pipe_z,pipe_tail

query II
SELECT (SELECT COUNT(*) FROM (SELECT * FROM pipe_a EXCEPT ALL SELECT id,SUM(v) AS v FROM pipe_src_a GROUP BY id)),
       (SELECT COUNT(*) FROM (SELECT id,SUM(v) AS v FROM pipe_src_a GROUP BY id EXCEPT ALL SELECT * FROM pipe_a));
----
0	0

query II
SELECT (SELECT COUNT(*) FROM (SELECT * FROM pipe_b EXCEPT ALL SELECT id,SUM(w) AS w FROM pipe_src_b GROUP BY id)),
       (SELECT COUNT(*) FROM (SELECT id,SUM(w) AS w FROM pipe_src_b GROUP BY id EXCEPT ALL SELECT * FROM pipe_b));
----
0	0

query II
SELECT (SELECT COUNT(*) FROM (SELECT * FROM pipe_c EXCEPT ALL SELECT id,v*2 AS v FROM pipe_a)),
       (SELECT COUNT(*) FROM (SELECT id,v*2 AS v FROM pipe_a EXCEPT ALL SELECT * FROM pipe_c));
----
0	0

query II
SELECT (SELECT COUNT(*) FROM (SELECT * FROM pipe_z EXCEPT ALL SELECT a.id,a.v,b.w FROM pipe_c a JOIN pipe_b b USING(id))),
       (SELECT COUNT(*) FROM (SELECT a.id,a.v,b.w FROM pipe_c a JOIN pipe_b b USING(id) EXCEPT ALL SELECT * FROM pipe_z));
----
0	0

query II
SELECT (SELECT COUNT(*) FROM (SELECT * FROM pipe_tail EXCEPT ALL SELECT id,v+w AS total FROM pipe_z)),
       (SELECT COUNT(*) FROM (SELECT id,v+w AS total FROM pipe_z EXCEPT ALL SELECT * FROM pipe_tail));
----
0	0

# A failed parent hook stops the run; retry consumes the still-pending descendants.

statement ok
DELETE FROM memory.main.pipe_log;

statement ok
UPDATE memory.main.openivm_refresh_hooks SET mode='before',hook_sql='SELECT error(''pipeline test hook failure'')' WHERE view_name='pipe_b';

statement ok
INSERT INTO pipe_src_a VALUES (1,31);

statement ok
INSERT INTO pipe_src_b VALUES (1,41);

statement error
PRAGMA refresh_pipeline('pipe_tail');
----
pipeline test hook failure

query T
SELECT string_agg(name, ',' ORDER BY seq) FROM memory.main.pipe_log;
----
pipe_a

query II
SELECT (SELECT COUNT(*) FROM (SELECT * FROM pipe_a EXCEPT ALL SELECT id,SUM(v) AS v FROM pipe_src_a GROUP BY id)),
       (SELECT COUNT(*) FROM (SELECT id,SUM(v) AS v FROM pipe_src_a GROUP BY id EXCEPT ALL SELECT * FROM pipe_a));
----
0	0

statement ok
UPDATE memory.main.openivm_refresh_hooks SET mode='after',hook_sql='INSERT INTO memory.main.pipe_log(name) VALUES (''pipe_b'')' WHERE view_name='pipe_b';

statement ok
DELETE FROM memory.main.pipe_log;

statement ok
PRAGMA refresh_pipeline('pipe_tail');

query T
SELECT string_agg(name, ',' ORDER BY seq) FROM memory.main.pipe_log;
----
pipe_b,pipe_c,pipe_z,pipe_tail

query II
SELECT (SELECT COUNT(*) FROM (SELECT * FROM pipe_a EXCEPT ALL SELECT id,SUM(v) AS v FROM pipe_src_a GROUP BY id)),
       (SELECT COUNT(*) FROM (SELECT id,SUM(v) AS v FROM pipe_src_a GROUP BY id EXCEPT ALL SELECT * FROM pipe_a));
----
0	0

query II
SELECT (SELECT COUNT(*) FROM (SELECT * FROM pipe_b EXCEPT ALL SELECT id,SUM(w) AS w FROM pipe_src_b GROUP BY id)),
       (SELECT COUNT(*) FROM (SELECT id,SUM(w) AS w FROM pipe_src_b GROUP BY id EXCEPT ALL SELECT * FROM pipe_b));
----
0	0

query II
SELECT (SELECT COUNT(*) FROM (SELECT * FROM pipe_c EXCEPT ALL SELECT id,v*2 AS v FROM pipe_a)),
       (SELECT COUNT(*) FROM (SELECT id,v*2 AS v FROM pipe_a EXCEPT ALL SELECT * FROM pipe_c));
----
0	0

query II
SELECT (SELECT COUNT(*) FROM (SELECT * FROM pipe_z EXCEPT ALL SELECT a.id,a.v,b.w FROM pipe_c a JOIN pipe_b b USING(id))),
       (SELECT COUNT(*) FROM (SELECT a.id,a.v,b.w FROM pipe_c a JOIN pipe_b b USING(id) EXCEPT ALL SELECT * FROM pipe_z));
----
0	0

query II
SELECT (SELECT COUNT(*) FROM (SELECT * FROM pipe_tail EXCEPT ALL SELECT id,v+w AS total FROM pipe_z)),
       (SELECT COUNT(*) FROM (SELECT id,v+w AS total FROM pipe_z EXCEPT ALL SELECT * FROM pipe_tail));
----
0	0

# New descendants are discovered on the next call without pipeline registration.

statement ok
CREATE MATERIALIZED VIEW pipe_new AS SELECT id,v+99 AS v FROM pipe_a;

statement ok
INSERT INTO memory.main.openivm_refresh_hooks VALUES ('pipe_new','INSERT INTO memory.main.pipe_log(name) VALUES (''pipe_new'')','after');

statement ok
DELETE FROM memory.main.pipe_log;

statement ok
INSERT INTO pipe_src_a VALUES (1,51);

statement ok
PRAGMA refresh_pipeline('pipe_a');

query T
SELECT string_agg(name, ',' ORDER BY seq) FROM memory.main.pipe_log;
----
pipe_a,pipe_c,pipe_new,pipe_z,pipe_tail

query II
SELECT (SELECT COUNT(*) FROM (SELECT * FROM pipe_a EXCEPT ALL SELECT id,SUM(v) AS v FROM pipe_src_a GROUP BY id)),
       (SELECT COUNT(*) FROM (SELECT id,SUM(v) AS v FROM pipe_src_a GROUP BY id EXCEPT ALL SELECT * FROM pipe_a));
----
0	0

query II
SELECT (SELECT COUNT(*) FROM (SELECT * FROM pipe_b EXCEPT ALL SELECT id,SUM(w) AS w FROM pipe_src_b GROUP BY id)),
       (SELECT COUNT(*) FROM (SELECT id,SUM(w) AS w FROM pipe_src_b GROUP BY id EXCEPT ALL SELECT * FROM pipe_b));
----
0	0

query II
SELECT (SELECT COUNT(*) FROM (SELECT * FROM pipe_c EXCEPT ALL SELECT id,v*2 AS v FROM pipe_a)),
       (SELECT COUNT(*) FROM (SELECT id,v*2 AS v FROM pipe_a EXCEPT ALL SELECT * FROM pipe_c));
----
0	0

query II
SELECT (SELECT COUNT(*) FROM (SELECT * FROM pipe_z EXCEPT ALL SELECT a.id,a.v,b.w FROM pipe_c a JOIN pipe_b b USING(id))),
       (SELECT COUNT(*) FROM (SELECT a.id,a.v,b.w FROM pipe_c a JOIN pipe_b b USING(id) EXCEPT ALL SELECT * FROM pipe_z));
----
0	0

query II
SELECT (SELECT COUNT(*) FROM (SELECT * FROM pipe_tail EXCEPT ALL SELECT id,v+w AS total FROM pipe_z)),
       (SELECT COUNT(*) FROM (SELECT id,v+w AS total FROM pipe_z EXCEPT ALL SELECT * FROM pipe_tail));
----
0	0

query II
SELECT (SELECT COUNT(*) FROM (SELECT * FROM pipe_new EXCEPT ALL SELECT id,v+99 AS v FROM pipe_a)),
       (SELECT COUNT(*) FROM (SELECT id,v+99 AS v FROM pipe_a EXCEPT ALL SELECT * FROM pipe_new));
----
0	0

statement ok
USE memory;
