# name: test/sql/group_recompute_persistent_unique_index.test
# description: AGGREGATE_GROUP views carry a UNIQUE index on the data table. On a PERSISTENT database
#              DuckDB's on-disk unique index keeps deleted keys for constraint checking within a
#              transaction, so the group-recompute path's DELETE-then-INSERT of a surviving group
#              raised a spurious "Duplicate key ... violates unique constraint" and the refresh
#              failed outright. Must use `load` + `restart`: on an in-memory database the index is
#              built in-session and the bug does not fire, which is why the rest of the suite (all
#              in-memory) never caught it.
# group: [sql]

load __TEST_DIR__/openivm_group_recompute_unique_index.db

require openivm

statement ok
SET openivm_cascade_refresh = 'off';

statement ok
CREATE TABLE cust (cid INT, nation VARCHAR);

statement ok
CREATE TABLE ord (oid INT, cid INT, amt INT);

statement ok
INSERT INTO cust VALUES (1,'A'),(2,'A'),(3,'B'),(4,'C');

statement ok
INSERT INTO ord VALUES (10,1,5),(11,1,7),(12,2,9),(13,3,4);

# AGGREGATE_GROUP over a LEFT JOIN -> data table gets the UNIQUE index on the group key.
statement ok
CREATE MATERIALIZED VIEW mv AS
    SELECT c.nation, COUNT(o.oid) AS n_ord, SUM(o.amt) AS total
    FROM cust c LEFT JOIN ord o ON o.cid = c.cid
    GROUP BY c.nation;

query I
SELECT COUNT(*) FROM (
    SELECT c.nation, COUNT(o.oid), SUM(o.amt) FROM cust c LEFT JOIN ord o ON o.cid=c.cid GROUP BY c.nation
    EXCEPT ALL SELECT nation, n_ord, total FROM mv
);
----
0

# Reopen the database so the unique index is loaded from disk rather than built in this session.
# Without this restart the bug does not reproduce.
restart

statement ok
SET openivm_cascade_refresh = 'off';

# openivm_left_join_merge=false routes CompileAggregateGroups to its group-recompute branch, which
# recomputes affected groups: nation 'A' survives the recompute, so it is deleted and re-inserted.
statement ok
SET openivm_left_join_merge = false;

statement ok
INSERT INTO ord VALUES (14,1,3);

statement ok
DELETE FROM ord WHERE oid = 12;

statement ok
PRAGMA refresh('mv');

query I
SELECT COUNT(*) FROM (
    SELECT c.nation, COUNT(o.oid), SUM(o.amt) FROM cust c LEFT JOIN ord o ON o.cid=c.cid GROUP BY c.nation
    EXCEPT ALL SELECT nation, n_ord, total FROM mv
);
----
0

query I
SELECT COUNT(*) FROM (
    SELECT nation, n_ord, total FROM mv
    EXCEPT ALL
    SELECT c.nation, COUNT(o.oid), SUM(o.amt) FROM cust c LEFT JOIN ord o ON o.cid=c.cid GROUP BY c.nation
);
----
0

# A group that disappears entirely must still be removed (the recompute yields no row for it, so the
# upsert form has to delete it rather than leave the stale row behind).
statement ok
DELETE FROM cust WHERE nation = 'C';

statement ok
PRAGMA refresh('mv');

query I
SELECT COUNT(*) FROM (
    SELECT c.nation, COUNT(o.oid), SUM(o.amt) FROM cust c LEFT JOIN ord o ON o.cid=c.cid GROUP BY c.nation
    EXCEPT ALL SELECT nation, n_ord, total FROM mv
);
----
0

query I
SELECT COUNT(*) FROM (
    SELECT nation, n_ord, total FROM mv
    EXCEPT ALL
    SELECT c.nation, COUNT(o.oid), SUM(o.amt) FROM cust c LEFT JOIN ord o ON o.cid=c.cid GROUP BY c.nation
);
----
0

query I
SELECT COUNT(*) FROM mv WHERE nation = 'C';
----
0

# refresh_mode='full' reaches the same recompute branch on a persistent DB.
statement ok
SET openivm_left_join_merge = true;

statement ok
SET openivm_refresh_mode = 'full';

statement ok
INSERT INTO ord VALUES (15,3,11);

statement ok
PRAGMA refresh('mv');

query I
SELECT COUNT(*) FROM (
    SELECT c.nation, COUNT(o.oid), SUM(o.amt) FROM cust c LEFT JOIN ord o ON o.cid=c.cid GROUP BY c.nation
    EXCEPT ALL SELECT nation, n_ord, total FROM mv
);
----
0

query I
SELECT COUNT(*) FROM (
    SELECT nation, n_ord, total FROM mv
    EXCEPT ALL
    SELECT c.nation, COUNT(o.oid), SUM(o.amt) FROM cust c LEFT JOIN ord o ON o.cid=c.cid GROUP BY c.nation
);
----
0
