# name: test/sql/group_recompute_persistent_unique_index.test
# description: AGGREGATE_GROUP views carry a UNIQUE index on the data table. On a PERSISTENT database
# group: [sql]

#              DuckDB's on-disk unique index keeps deleted keys for constraint checking within a
#              transaction, so the group-recompute path's DELETE-then-INSERT of a surviving group
#              raised a spurious "Duplicate key ... violates unique constraint" and the refresh
#              failed outright. Must use `load` + `restart`: on an in-memory database the index is
#              built in-session and the bug does not fire, which is why the rest of the suite (all
#              in-memory) never caught it.

load __TEST_DIR__/openivm_group_recompute_unique_index.db

require openivm

statement ok
SET openivm_cascade_refresh = 'off';

statement ok
CREATE TABLE cust (cid INT, nation VARCHAR);

statement ok
CREATE TABLE ord (oid INT, cid INT, amt INT);

statement ok
INSERT INTO cust VALUES (1,'A'),(2,'A'),(3,'B'),(4,'C');

statement ok
INSERT INTO ord VALUES (10,1,5),(11,1,7),(12,2,9),(13,3,4);

# AGGREGATE_GROUP over a LEFT JOIN -> data table gets the UNIQUE index on the group key.
statement ok
CREATE MATERIALIZED VIEW mv AS
    SELECT c.nation, COUNT(o.oid) AS n_ord, SUM(o.amt) AS total
    FROM cust c LEFT JOIN ord o ON o.cid = c.cid
    GROUP BY c.nation;

query I
SELECT COUNT(*) FROM (
    SELECT c.nation, COUNT(o.oid), SUM(o.amt) FROM cust c LEFT JOIN ord o ON o.cid=c.cid GROUP BY c.nation
    EXCEPT ALL SELECT nation, n_ord, total FROM mv
);
----
0

# NULL group keys do not conflict in DuckDB UNIQUE indexes. Both the forced-full
# and affected-group upsert forms must explicitly remove the old NULL-key row
# before inserting its replacement.
statement ok
CREATE TABLE nullable_full_src (k INT, val INT);

statement ok
INSERT INTO nullable_full_src VALUES (NULL, 10), (1, 20);

statement ok
CREATE MATERIALIZED VIEW nullable_full_mv AS
    SELECT k, SUM(val) AS total FROM nullable_full_src GROUP BY k;

statement ok
SET openivm_refresh_mode = 'full';

statement ok
INSERT INTO nullable_full_src VALUES (NULL, 5), (1, 2);

statement ok
PRAGMA refresh('nullable_full_mv');

query I
SELECT COUNT(*) FROM (
    SELECT * FROM nullable_full_mv
    EXCEPT ALL
    SELECT k, SUM(val) FROM nullable_full_src GROUP BY k
);
----
0

query I
SELECT COUNT(*) FROM (
    SELECT k, SUM(val) FROM nullable_full_src GROUP BY k
    EXCEPT ALL
    SELECT * FROM nullable_full_mv
);
----
0

statement ok
SET openivm_refresh_mode = 'incremental';

statement ok
CREATE TABLE nullable_gr_left (id INT, k INT);

statement ok
CREATE TABLE nullable_gr_right (id INT, val INT);

statement ok
INSERT INTO nullable_gr_left VALUES (1, NULL), (2, 1);

statement ok
INSERT INTO nullable_gr_right VALUES (1, 10), (2, 20);

statement ok
CREATE MATERIALIZED VIEW nullable_gr_mv AS
    SELECT l.k, COUNT(r.id) AS matches, SUM(r.val) AS total
    FROM nullable_gr_left l LEFT JOIN nullable_gr_right r ON l.id = r.id
    GROUP BY l.k;

statement ok
SET openivm_left_join_merge = false;

statement ok
INSERT INTO nullable_gr_right VALUES (1, 11), (2, 21);

statement ok
UPDATE nullable_gr_right SET val = 12 WHERE id = 1 AND val = 11;

statement ok
DELETE FROM nullable_gr_right WHERE id = 2 AND val = 20;

statement ok
PRAGMA refresh('nullable_gr_mv');

query I
SELECT COUNT(*) FROM (
    SELECT * FROM nullable_gr_mv
    EXCEPT ALL
    SELECT l.k, COUNT(r.id), SUM(r.val)
    FROM nullable_gr_left l LEFT JOIN nullable_gr_right r ON l.id = r.id
    GROUP BY l.k
);
----
0

query I
SELECT COUNT(*) FROM (
    SELECT l.k, COUNT(r.id), SUM(r.val)
    FROM nullable_gr_left l LEFT JOIN nullable_gr_right r ON l.id = r.id
    GROUP BY l.k
    EXCEPT ALL
    SELECT * FROM nullable_gr_mv
);
----
0

statement ok
SET openivm_left_join_merge = true;

# Reopen the database so the unique index is loaded from disk rather than built in this session.
# Without this restart the bug does not reproduce.
restart

statement ok
SET openivm_cascade_refresh = 'off';

# openivm_left_join_merge=false routes CompileAggregateGroups to its group-recompute branch, which
# recomputes affected groups: nation 'A' survives the recompute, so it is deleted and re-inserted.
statement ok
SET openivm_left_join_merge = false;

statement ok
INSERT INTO ord VALUES (14,1,3);

statement ok
DELETE FROM ord WHERE oid = 12;

statement ok
PRAGMA refresh('mv');

query I
SELECT COUNT(*) FROM (
    SELECT c.nation, COUNT(o.oid), SUM(o.amt) FROM cust c LEFT JOIN ord o ON o.cid=c.cid GROUP BY c.nation
    EXCEPT ALL SELECT nation, n_ord, total FROM mv
);
----
0

query I
SELECT COUNT(*) FROM (
    SELECT nation, n_ord, total FROM mv
    EXCEPT ALL
    SELECT c.nation, COUNT(o.oid), SUM(o.amt) FROM cust c LEFT JOIN ord o ON o.cid=c.cid GROUP BY c.nation
);
----
0

# A group that disappears entirely must still be removed (the recompute yields no row for it, so the
# upsert form has to delete it rather than leave the stale row behind).
statement ok
DELETE FROM cust WHERE nation = 'C';

statement ok
PRAGMA refresh('mv');

query I
SELECT COUNT(*) FROM (
    SELECT c.nation, COUNT(o.oid), SUM(o.amt) FROM cust c LEFT JOIN ord o ON o.cid=c.cid GROUP BY c.nation
    EXCEPT ALL SELECT nation, n_ord, total FROM mv
);
----
0

query I
SELECT COUNT(*) FROM (
    SELECT nation, n_ord, total FROM mv
    EXCEPT ALL
    SELECT c.nation, COUNT(o.oid), SUM(o.amt) FROM cust c LEFT JOIN ord o ON o.cid=c.cid GROUP BY c.nation
);
----
0

query I
SELECT COUNT(*) FROM mv WHERE nation = 'C';
----
0

# refresh_mode='full' reaches the same recompute branch on a persistent DB.
statement ok
SET openivm_left_join_merge = true;

statement ok
SET openivm_refresh_mode = 'full';

statement ok
INSERT INTO ord VALUES (15,3,11);

statement ok
PRAGMA refresh('mv');

query I
SELECT COUNT(*) FROM (
    SELECT c.nation, COUNT(o.oid), SUM(o.amt) FROM cust c LEFT JOIN ord o ON o.cid=c.cid GROUP BY c.nation
    EXCEPT ALL SELECT nation, n_ord, total FROM mv
);
----
0

query I
SELECT COUNT(*) FROM (
    SELECT nation, n_ord, total FROM mv
    EXCEPT ALL
    SELECT c.nation, COUNT(o.oid), SUM(o.amt) FROM cust c LEFT JOIN ord o ON o.cid=c.cid GROUP BY c.nation
);
----
0

# The interrupted-refresh recovery route goes through BuildFullRecomputeSQL
# (DELETE FROM data; INSERT INTO data <query>), which re-inserts every key deleted in the same
# transaction and so hits the same on-disk unique-index behaviour. Distinct code path from the
# group-recompute branch above -- it needs its own coverage.

# Reopen again: the on-disk index must be freshly loaded for this to reproduce. Once earlier
# statements in a session have modified the index, the bug stops firing.
restart

statement ok
SET openivm_cascade_refresh = 'off';

statement ok
SET openivm_refresh_mode = 'incremental';

statement ok
INSERT INTO ord VALUES (16,1,6);

# Simulate a crash mid-refresh: set the flag without refreshing.
statement ok
UPDATE openivm_views SET refresh_in_progress = true WHERE view_name = 'mv';

statement ok
PRAGMA refresh('mv');

query I
SELECT refresh_in_progress FROM openivm_views WHERE view_name = 'mv';
----
false

query I
SELECT COUNT(*) FROM (
    SELECT c.nation, COUNT(o.oid), SUM(o.amt) FROM cust c LEFT JOIN ord o ON o.cid=c.cid GROUP BY c.nation
    EXCEPT ALL SELECT nation, n_ord, total FROM mv
);
----
0

query I
SELECT COUNT(*) FROM (
    SELECT nation, n_ord, total FROM mv
    EXCEPT ALL
    SELECT c.nation, COUNT(o.oid), SUM(o.amt) FROM cust c LEFT JOIN ord o ON o.cid=c.cid GROUP BY c.nation
);
----
0

# A group that vanishes must also be dropped by the recovery recompute.
restart

statement ok
SET openivm_cascade_refresh = 'off';

statement ok
DELETE FROM cust WHERE nation = 'B';

statement ok
UPDATE openivm_views SET refresh_in_progress = true WHERE view_name = 'mv';

statement ok
PRAGMA refresh('mv');

query I
SELECT COUNT(*) FROM mv WHERE nation = 'B';
----
0

query I
SELECT COUNT(*) FROM (
    SELECT c.nation, COUNT(o.oid), SUM(o.amt) FROM cust c LEFT JOIN ord o ON o.cid=c.cid GROUP BY c.nation
    EXCEPT ALL SELECT nation, n_ord, total FROM mv
);
----
0
