# name: test/sql/insert_rule.test
# description: Test IVM insert rule (delta table population for INSERT/DELETE/UPDATE)
# group: [sql]

require openivm

# ==========================================
# Setup: base table, MV (auto-creates system tables + delta tables)
# ==========================================

statement ok
CREATE TABLE staff (id INT, name VARCHAR, dept VARCHAR, salary INT);

statement ok
INSERT INTO staff VALUES (1, 'Alice', 'eng', 100), (2, 'Bob', 'sales', 200);

# CREATE MATERIALIZED VIEW auto-populates openivm_views, openivm_delta_tables,
# creates openivm_delta_staff, openivm_data_mv_staff, openivm_delta_mv_staff, and the mv_staff view.
statement ok
CREATE MATERIALIZED VIEW mv_staff AS SELECT id, name, dept, salary FROM staff;

# Initial refresh so MV reflects the pre-seeded rows.
statement ok
PRAGMA refresh_options('memory', 'main', 'mv_staff');

# Source table for INSERT...SELECT tests
statement ok
CREATE TABLE temp_hires (id INT, name VARCHAR, dept VARCHAR, salary INT);

statement ok
INSERT INTO temp_hires VALUES (6, 'Frank', 'eng', 175), (7, 'Grace', 'sales', 225);

# ==========================================
# Test 1: INSERT VALUES — single row
# ==========================================

statement ok
INSERT INTO staff VALUES (3, 'Carol', 'eng', 150);

statement ok
PRAGMA refresh_options('memory', 'main', 'mv_staff');

# MV must match base table after every PRAGMA
query I
SELECT count(*) FROM (SELECT * FROM mv_staff EXCEPT ALL SELECT id, name, dept, salary FROM staff);
----
0

query I
SELECT count(*) FROM (SELECT id, name, dept, salary FROM staff EXCEPT ALL SELECT * FROM mv_staff);
----
0

# ==========================================
# Test 2: INSERT VALUES — multi-row batch
# ==========================================

statement ok
INSERT INTO staff VALUES (4, 'Dave', 'sales', 250), (5, 'Eve', 'eng', 300);

statement ok
PRAGMA refresh_options('memory', 'main', 'mv_staff');

query I
SELECT count(*) FROM (SELECT * FROM mv_staff EXCEPT ALL SELECT id, name, dept, salary FROM staff);
----
0

query I
SELECT count(*) FROM (SELECT id, name, dept, salary FROM staff EXCEPT ALL SELECT * FROM mv_staff);
----
0

# ==========================================
# Test 3: INSERT VALUES with bound scalar expressions
# ==========================================

statement ok
INSERT INTO staff VALUES (8, 'Heidi' || '', upper('eng'), 300 + 25);

statement ok
PRAGMA refresh_options('memory', 'main', 'mv_staff');

query I
SELECT count(*) FROM (SELECT * FROM mv_staff EXCEPT ALL SELECT id, name, dept, salary FROM staff);
----
0

query I
SELECT count(*) FROM (SELECT id, name, dept, salary FROM staff EXCEPT ALL SELECT * FROM mv_staff);
----
0

# ==========================================
# Test 4: INSERT...SELECT (subquery path)
# ==========================================

statement ok
INSERT INTO staff SELECT * FROM temp_hires;

statement ok
PRAGMA refresh_options('memory', 'main', 'mv_staff');

query I
SELECT count(*) FROM (SELECT * FROM mv_staff EXCEPT ALL SELECT id, name, dept, salary FROM staff);
----
0

query I
SELECT count(*) FROM (SELECT id, name, dept, salary FROM staff EXCEPT ALL SELECT * FROM mv_staff);
----
0

# ==========================================
# Test 5: INSERT...SELECT FROM range() (table function)
# ==========================================

statement ok
INSERT INTO staff SELECT i + 100, 'Batch' || i::VARCHAR, 'eng', i * 10 FROM range(1, 4) t(i);

statement ok
PRAGMA refresh_options('memory', 'main', 'mv_staff');

query I
SELECT count(*) FROM (SELECT * FROM mv_staff EXCEPT ALL SELECT id, name, dept, salary FROM staff);
----
0

query I
SELECT count(*) FROM (SELECT id, name, dept, salary FROM staff EXCEPT ALL SELECT * FROM mv_staff);
----
0

# ==========================================
# Test 6: DELETE — single row with WHERE
# ==========================================

statement ok
DELETE FROM staff WHERE id = 3;

statement ok
PRAGMA refresh_options('memory', 'main', 'mv_staff');

query I
SELECT count(*) FROM (SELECT * FROM mv_staff EXCEPT ALL SELECT id, name, dept, salary FROM staff);
----
0

query I
SELECT count(*) FROM (SELECT id, name, dept, salary FROM staff EXCEPT ALL SELECT * FROM mv_staff);
----
0

# ==========================================
# Test 6: DELETE — multiple AND conditions
# ==========================================

statement ok
DELETE FROM staff WHERE dept = 'sales' AND salary >= 200;

statement ok
PRAGMA refresh_options('memory', 'main', 'mv_staff');

query I
SELECT count(*) FROM (SELECT * FROM mv_staff EXCEPT ALL SELECT id, name, dept, salary FROM staff);
----
0

query I
SELECT count(*) FROM (SELECT id, name, dept, salary FROM staff EXCEPT ALL SELECT * FROM mv_staff);
----
0

# ==========================================
# Test 7: DELETE — all rows (no WHERE)
# ==========================================

statement ok
DELETE FROM staff;

statement ok
PRAGMA refresh_options('memory', 'main', 'mv_staff');

query I
SELECT count(*) FROM mv_staff;
----
0

query I
SELECT count(*) FROM (SELECT * FROM mv_staff EXCEPT ALL SELECT id, name, dept, salary FROM staff);
----
0

# ==========================================
# Test 8: UPDATE — constant SET value
# ==========================================

statement ok
INSERT INTO staff VALUES (1, 'Alice', 'eng', 100), (2, 'Bob', 'sales', 200);

statement ok
PRAGMA refresh_options('memory', 'main', 'mv_staff');

query I
SELECT count(*) FROM (SELECT * FROM mv_staff EXCEPT ALL SELECT id, name, dept, salary FROM staff);
----
0

statement ok
UPDATE staff SET name = 'Alice2' WHERE id = 1;

statement ok
PRAGMA refresh_options('memory', 'main', 'mv_staff');

query I
SELECT count(*) FROM (SELECT * FROM mv_staff EXCEPT ALL SELECT id, name, dept, salary FROM staff);
----
0

query I
SELECT count(*) FROM (SELECT id, name, dept, salary FROM staff EXCEPT ALL SELECT * FROM mv_staff);
----
0

# ==========================================
# Test 9: End-to-end INSERT + IVM
# ==========================================

statement ok
INSERT INTO staff VALUES (10, 'Zara', 'eng', 500);

statement ok
PRAGMA refresh_options('memory', 'main', 'mv_staff');

query I
SELECT count(*) FROM (SELECT * FROM mv_staff EXCEPT ALL SELECT id, name, dept, salary FROM staff);
----
0

query I
SELECT count(*) FROM (SELECT id, name, dept, salary FROM staff EXCEPT ALL SELECT * FROM mv_staff);
----
0

# ==========================================
# Test 10: End-to-end DELETE + IVM
# ==========================================

statement ok
DELETE FROM staff WHERE id = 10;

statement ok
PRAGMA refresh_options('memory', 'main', 'mv_staff');

query I
SELECT count(*) FROM (SELECT * FROM mv_staff EXCEPT ALL SELECT id, name, dept, salary FROM staff);
----
0

query I
SELECT count(*) FROM (SELECT id, name, dept, salary FROM staff EXCEPT ALL SELECT * FROM mv_staff);
----
0

# ==========================================
# Test 11: End-to-end UPDATE + IVM
# ==========================================

statement ok
UPDATE staff SET name = 'Alice3' WHERE id = 1;

statement ok
PRAGMA refresh_options('memory', 'main', 'mv_staff');

query I
SELECT count(*) FROM (SELECT * FROM mv_staff EXCEPT ALL SELECT id, name, dept, salary FROM staff);
----
0

query I
SELECT count(*) FROM (SELECT id, name, dept, salary FROM staff EXCEPT ALL SELECT * FROM mv_staff);
----
0

# ==========================================
# Test 12: Short table name (prefix check safety)
# ==========================================

statement ok
CREATE TABLE ab (id INT, val INT);

statement ok
CREATE TABLE openivm_delta_ab AS SELECT *, 1::INTEGER AS openivm_multiplicity, now()::timestamp AS openivm_timestamp FROM ab LIMIT 0;

statement ok
INSERT INTO ab VALUES (1, 42);

query I
SELECT count(*) FROM openivm_delta_ab;
----
1

# ==========================================
# Test 13: Mixed INSERT + DELETE + UPDATE without PRAGMA between
# ==========================================

statement ok
INSERT INTO staff VALUES (20, 'Mixed', 'eng', 999);

statement ok
DELETE FROM staff WHERE id = 2;

statement ok
UPDATE staff SET salary = 111 WHERE id = 1;

statement ok
PRAGMA refresh_options('memory', 'main', 'mv_staff');

query I
SELECT count(*) FROM (SELECT * FROM mv_staff EXCEPT ALL SELECT id, name, dept, salary FROM staff);
----
0

query I
SELECT count(*) FROM (SELECT id, name, dept, salary FROM staff EXCEPT ALL SELECT * FROM mv_staff);
----
0

# ==========================================
# Test 14: INSERT with NULL values
# ==========================================

statement ok
INSERT INTO staff VALUES (30, NULL, NULL, NULL);

statement ok
PRAGMA refresh_options('memory', 'main', 'mv_staff');

query I
SELECT count(*) FROM (SELECT * FROM mv_staff EXCEPT ALL SELECT id, name, dept, salary FROM staff);
----
0

query I
SELECT count(*) FROM (SELECT id, name, dept, salary FROM staff EXCEPT ALL SELECT * FROM mv_staff);
----
0

# ==========================================
# Test 15: INSERT with single quotes in strings
# ==========================================

statement ok
INSERT INTO staff VALUES (31, 'O''Brien', 'eng', 100);

statement ok
PRAGMA refresh_options('memory', 'main', 'mv_staff');

query I
SELECT count(*) FROM (SELECT * FROM mv_staff EXCEPT ALL SELECT id, name, dept, salary FROM staff);
----
0

query I
SELECT count(*) FROM (SELECT id, name, dept, salary FROM staff EXCEPT ALL SELECT * FROM mv_staff);
----
0

# ==========================================
# STRESS TESTS
# ==========================================

# ==========================================
# Stress 1: INSERT empty string and zero
# ==========================================

statement ok
INSERT INTO staff VALUES (40, '', '', 0);

statement ok
PRAGMA refresh_options('memory', 'main', 'mv_staff');

query I
SELECT count(*) FROM (SELECT * FROM mv_staff EXCEPT ALL SELECT id, name, dept, salary FROM staff);
----
0

query I
SELECT count(*) FROM (SELECT id, name, dept, salary FROM staff EXCEPT ALL SELECT * FROM mv_staff);
----
0

# ==========================================
# Stress 2: INSERT negative numbers
# ==========================================

statement ok
INSERT INTO staff VALUES (41, 'Negative', 'eng', -999);

statement ok
PRAGMA refresh_options('memory', 'main', 'mv_staff');

query I
SELECT count(*) FROM (SELECT * FROM mv_staff EXCEPT ALL SELECT id, name, dept, salary FROM staff);
----
0

query I
SELECT count(*) FROM (SELECT id, name, dept, salary FROM staff EXCEPT ALL SELECT * FROM mv_staff);
----
0

# ==========================================
# Stress 3: INSERT then immediately DELETE same row
# ==========================================

statement ok
INSERT INTO staff VALUES (50, 'Ghost', 'eng', 0);

statement ok
DELETE FROM staff WHERE id = 50;

statement ok
PRAGMA refresh_options('memory', 'main', 'mv_staff');

query I
SELECT count(*) FROM (SELECT * FROM mv_staff EXCEPT ALL SELECT id, name, dept, salary FROM staff);
----
0

query I
SELECT count(*) FROM (SELECT id, name, dept, salary FROM staff EXCEPT ALL SELECT * FROM mv_staff);
----
0

# ==========================================
# Stress 4: UPDATE same row twice before PRAGMA
# ==========================================

statement ok
UPDATE staff SET name = 'FirstUpdate' WHERE id = 1;

statement ok
UPDATE staff SET name = 'SecondUpdate' WHERE id = 1;

statement ok
PRAGMA refresh_options('memory', 'main', 'mv_staff');

query I
SELECT count(*) FROM (SELECT * FROM mv_staff EXCEPT ALL SELECT id, name, dept, salary FROM staff);
----
0

query I
SELECT count(*) FROM (SELECT id, name, dept, salary FROM staff EXCEPT ALL SELECT * FROM mv_staff);
----
0

# ==========================================
# Stress 5: DELETE row that doesn't exist
# ==========================================

statement ok
DELETE FROM staff WHERE id = 99999;

statement ok
PRAGMA refresh_options('memory', 'main', 'mv_staff');

query I
SELECT count(*) FROM (SELECT * FROM mv_staff EXCEPT ALL SELECT id, name, dept, salary FROM staff);
----
0

query I
SELECT count(*) FROM (SELECT id, name, dept, salary FROM staff EXCEPT ALL SELECT * FROM mv_staff);
----
0

# ==========================================
# Stress 6: UPDATE row that doesn't exist
# ==========================================

statement ok
UPDATE staff SET name = 'nobody' WHERE id = 99999;

statement ok
PRAGMA refresh_options('memory', 'main', 'mv_staff');

query I
SELECT count(*) FROM (SELECT * FROM mv_staff EXCEPT ALL SELECT id, name, dept, salary FROM staff);
----
0

query I
SELECT count(*) FROM (SELECT id, name, dept, salary FROM staff EXCEPT ALL SELECT * FROM mv_staff);
----
0

# ==========================================
# Stress 7: INSERT very long string
# ==========================================

statement ok
INSERT INTO staff VALUES (60, 'AAAAAAAAAAAAAAAAAAAAAAAAAAAAAAAAAAAAAAAAAAAAAAAAAAAAAAAAAAAAAAAAAAAAAAAAAAAAAAAAAAAAAAAAAAAAAAAAAAAA', 'eng', 1);

statement ok
PRAGMA refresh_options('memory', 'main', 'mv_staff');

query I
SELECT count(*) FROM (SELECT * FROM mv_staff EXCEPT ALL SELECT id, name, dept, salary FROM staff);
----
0

query I
SELECT count(*) FROM (SELECT id, name, dept, salary FROM staff EXCEPT ALL SELECT * FROM mv_staff);
----
0

# ==========================================
# Stress 8: Rapid-fire INSERT + DELETE alternating
# ==========================================

statement ok
INSERT INTO staff VALUES (70, 'A', 'eng', 1);

statement ok
INSERT INTO staff VALUES (71, 'B', 'eng', 2);

statement ok
DELETE FROM staff WHERE id = 70;

statement ok
INSERT INTO staff VALUES (72, 'C', 'eng', 3);

statement ok
DELETE FROM staff WHERE id = 71;

statement ok
DELETE FROM staff WHERE id = 72;

statement ok
PRAGMA refresh_options('memory', 'main', 'mv_staff');

query I
SELECT count(*) FROM (SELECT * FROM mv_staff EXCEPT ALL SELECT id, name, dept, salary FROM staff);
----
0

query I
SELECT count(*) FROM (SELECT id, name, dept, salary FROM staff EXCEPT ALL SELECT * FROM mv_staff);
----
0

# ==========================================
# Stress 9: INSERT...SELECT with WHERE filter
# ==========================================

statement ok
CREATE TABLE candidates (id INT, name VARCHAR, dept VARCHAR, salary INT);

statement ok
INSERT INTO candidates VALUES (80, 'Yes', 'eng', 100), (81, 'No', 'fired', 50), (82, 'Also', 'eng', 200);

statement ok
INSERT INTO staff SELECT * FROM candidates WHERE dept = 'eng';

statement ok
PRAGMA refresh_options('memory', 'main', 'mv_staff');

query I
SELECT count(*) FROM (SELECT * FROM mv_staff EXCEPT ALL SELECT id, name, dept, salary FROM staff);
----
0

query I
SELECT count(*) FROM (SELECT id, name, dept, salary FROM staff EXCEPT ALL SELECT * FROM mv_staff);
----
0

# ==========================================
# Stress 10: Batch UPDATE multiple rows
# ==========================================

statement ok
UPDATE staff SET salary = 0 WHERE dept = 'eng';

statement ok
PRAGMA refresh_options('memory', 'main', 'mv_staff');

query I
SELECT count(*) FROM (SELECT * FROM mv_staff EXCEPT ALL SELECT id, name, dept, salary FROM staff);
----
0

query I
SELECT count(*) FROM (SELECT id, name, dept, salary FROM staff EXCEPT ALL SELECT * FROM mv_staff);
----
0

# ==========================================
# EMPTY DELTA TESTS — operations that produce zero delta rows
# ==========================================

# Snapshot current MV state for comparison
query I
SELECT count(*) FROM mv_staff;
----
9

# ==========================================
# Empty 1: INSERT...SELECT with WHERE that matches nothing
# ==========================================

statement ok
INSERT INTO staff SELECT * FROM candidates WHERE dept = 'nonexistent';

statement ok
PRAGMA refresh_options('memory', 'main', 'mv_staff');

query I
SELECT count(*) FROM (SELECT * FROM mv_staff EXCEPT ALL SELECT id, name, dept, salary FROM staff);
----
0

query I
SELECT count(*) FROM (SELECT id, name, dept, salary FROM staff EXCEPT ALL SELECT * FROM mv_staff);
----
0

query I
SELECT count(*) FROM mv_staff;
----
9

# ==========================================
# Empty 2: DELETE with WHERE that matches nothing
# ==========================================

statement ok
DELETE FROM staff WHERE id = -1;

statement ok
PRAGMA refresh_options('memory', 'main', 'mv_staff');

query I
SELECT count(*) FROM (SELECT * FROM mv_staff EXCEPT ALL SELECT id, name, dept, salary FROM staff);
----
0

query I
SELECT count(*) FROM (SELECT id, name, dept, salary FROM staff EXCEPT ALL SELECT * FROM mv_staff);
----
0

# ==========================================
# Empty 3: DELETE with complex WHERE that matches nothing
# ==========================================

statement ok
DELETE FROM staff WHERE dept = 'eng' AND salary > 999999;

statement ok
PRAGMA refresh_options('memory', 'main', 'mv_staff');

query I
SELECT count(*) FROM (SELECT * FROM mv_staff EXCEPT ALL SELECT id, name, dept, salary FROM staff);
----
0

query I
SELECT count(*) FROM (SELECT id, name, dept, salary FROM staff EXCEPT ALL SELECT * FROM mv_staff);
----
0

# ==========================================
# Empty 4: UPDATE with WHERE that matches nothing
# ==========================================

statement ok
UPDATE staff SET name = 'ghost' WHERE id = -1;

statement ok
PRAGMA refresh_options('memory', 'main', 'mv_staff');

query I
SELECT count(*) FROM (SELECT * FROM mv_staff EXCEPT ALL SELECT id, name, dept, salary FROM staff);
----
0

query I
SELECT count(*) FROM (SELECT id, name, dept, salary FROM staff EXCEPT ALL SELECT * FROM mv_staff);
----
0

# ==========================================
# Empty 5: INSERT...SELECT from empty source table
# ==========================================

statement ok
CREATE TABLE empty_source (id INT, name VARCHAR, dept VARCHAR, salary INT);

statement ok
INSERT INTO staff SELECT * FROM empty_source;

statement ok
PRAGMA refresh_options('memory', 'main', 'mv_staff');

query I
SELECT count(*) FROM (SELECT * FROM mv_staff EXCEPT ALL SELECT id, name, dept, salary FROM staff);
----
0

query I
SELECT count(*) FROM (SELECT id, name, dept, salary FROM staff EXCEPT ALL SELECT * FROM mv_staff);
----
0

# ==========================================
# Empty 6: PRAGMA with no changes at all (pure no-op)
# ==========================================

statement ok
PRAGMA refresh_options('memory', 'main', 'mv_staff');

query I
SELECT count(*) FROM (SELECT * FROM mv_staff EXCEPT ALL SELECT id, name, dept, salary FROM staff);
----
0

query I
SELECT count(*) FROM (SELECT id, name, dept, salary FROM staff EXCEPT ALL SELECT * FROM mv_staff);
----
0

# ==========================================
# Empty 7: Multiple no-op PRAGMAs in a row
# ==========================================

statement ok
PRAGMA refresh_options('memory', 'main', 'mv_staff');

statement ok
PRAGMA refresh_options('memory', 'main', 'mv_staff');

statement ok
PRAGMA refresh_options('memory', 'main', 'mv_staff');

query I
SELECT count(*) FROM (SELECT * FROM mv_staff EXCEPT ALL SELECT id, name, dept, salary FROM staff);
----
0

query I
SELECT count(*) FROM (SELECT id, name, dept, salary FROM staff EXCEPT ALL SELECT * FROM mv_staff);
----
0

# Final row count unchanged
query I
SELECT count(*) FROM mv_staff;
----
9

# ==========================================
# COMPLEX QUERY TESTS — test various SQL patterns
# ==========================================

# ==========================================
# Complex 1: DELETE with OR condition
# ==========================================

statement ok
INSERT INTO staff VALUES (90, 'OrTest1', 'eng', 10), (91, 'OrTest2', 'sales', 20), (92, 'OrTest3', 'hr', 30);

statement ok
PRAGMA refresh_options('memory', 'main', 'mv_staff');

statement ok
DELETE FROM staff WHERE id = 90 OR id = 92;

statement ok
PRAGMA refresh_options('memory', 'main', 'mv_staff');

query I
SELECT count(*) FROM (SELECT * FROM mv_staff EXCEPT ALL SELECT id, name, dept, salary FROM staff);
----
0

query I
SELECT count(*) FROM (SELECT id, name, dept, salary FROM staff EXCEPT ALL SELECT * FROM mv_staff);
----
0

# Only id=91 should remain from the 3 inserted
query I
SELECT count(*) FROM mv_staff WHERE id IN (90, 91, 92);
----
1

# ==========================================
# Complex 2: DELETE with IN (...)
# ==========================================

statement ok
INSERT INTO staff VALUES (93, 'InTest1', 'eng', 10), (94, 'InTest2', 'eng', 20), (95, 'InTest3', 'eng', 30);

statement ok
PRAGMA refresh_options('memory', 'main', 'mv_staff');

statement ok
DELETE FROM staff WHERE id IN (93, 95);

statement ok
PRAGMA refresh_options('memory', 'main', 'mv_staff');

query I
SELECT count(*) FROM (SELECT * FROM mv_staff EXCEPT ALL SELECT id, name, dept, salary FROM staff);
----
0

query I
SELECT count(*) FROM (SELECT id, name, dept, salary FROM staff EXCEPT ALL SELECT * FROM mv_staff);
----
0

# ==========================================
# Complex 3: DELETE with BETWEEN
# ==========================================

statement ok
INSERT INTO staff VALUES (100, 'Bet1', 'eng', 10), (101, 'Bet2', 'eng', 20), (102, 'Bet3', 'eng', 30), (103, 'Bet4', 'eng', 40);

statement ok
PRAGMA refresh_options('memory', 'main', 'mv_staff');

statement ok
DELETE FROM staff WHERE id BETWEEN 101 AND 102;

statement ok
PRAGMA refresh_options('memory', 'main', 'mv_staff');

query I
SELECT count(*) FROM (SELECT * FROM mv_staff EXCEPT ALL SELECT id, name, dept, salary FROM staff);
----
0

query I
SELECT count(*) FROM (SELECT id, name, dept, salary FROM staff EXCEPT ALL SELECT * FROM mv_staff);
----
0

# ==========================================
# Complex 4: DELETE with LIKE
# ==========================================

statement ok
INSERT INTO staff VALUES (110, 'LikeAlpha', 'eng', 1), (111, 'LikeBeta', 'eng', 2), (112, 'NoMatch', 'eng', 3);

statement ok
PRAGMA refresh_options('memory', 'main', 'mv_staff');

statement ok
DELETE FROM staff WHERE name LIKE 'Like%';

statement ok
PRAGMA refresh_options('memory', 'main', 'mv_staff');

query I
SELECT count(*) FROM (SELECT * FROM mv_staff EXCEPT ALL SELECT id, name, dept, salary FROM staff);
----
0

query I
SELECT count(*) FROM (SELECT id, name, dept, salary FROM staff EXCEPT ALL SELECT * FROM mv_staff);
----
0

# ==========================================
# Complex 5: DELETE with IS NULL
# ==========================================

statement ok
INSERT INTO staff VALUES (120, NULL, 'eng', 1), (121, 'NotNull', 'eng', 2);

statement ok
PRAGMA refresh_options('memory', 'main', 'mv_staff');

statement ok
DELETE FROM staff WHERE name IS NULL;

statement ok
PRAGMA refresh_options('memory', 'main', 'mv_staff');

query I
SELECT count(*) FROM (SELECT * FROM mv_staff EXCEPT ALL SELECT id, name, dept, salary FROM staff);
----
0

query I
SELECT count(*) FROM (SELECT id, name, dept, salary FROM staff EXCEPT ALL SELECT * FROM mv_staff);
----
0

# ==========================================
# Complex 6: UPDATE multiple columns at once
# ==========================================

statement ok
INSERT INTO staff VALUES (130, 'Multi', 'eng', 500);

statement ok
PRAGMA refresh_options('memory', 'main', 'mv_staff');

statement ok
UPDATE staff SET name = 'Updated', dept = 'sales', salary = 999 WHERE id = 130;

statement ok
PRAGMA refresh_options('memory', 'main', 'mv_staff');

query I
SELECT count(*) FROM (SELECT * FROM mv_staff EXCEPT ALL SELECT id, name, dept, salary FROM staff);
----
0

query I
SELECT count(*) FROM (SELECT id, name, dept, salary FROM staff EXCEPT ALL SELECT * FROM mv_staff);
----
0

query IIII
SELECT id, name, dept, salary FROM mv_staff WHERE id = 130;
----
130	Updated	sales	999

# ==========================================
# Complex 7: INSERT...SELECT with JOIN
# ==========================================

statement ok
CREATE TABLE dept_bonus (dept VARCHAR, bonus INT);

statement ok
INSERT INTO dept_bonus VALUES ('eng', 50), ('sales', 100);

statement ok
INSERT INTO staff SELECT s.id + 1000, s.name, s.dept, s.salary + d.bonus FROM staff s JOIN dept_bonus d ON s.dept = d.dept WHERE s.id = 130;

statement ok
PRAGMA refresh_options('memory', 'main', 'mv_staff');

query I
SELECT count(*) FROM (SELECT * FROM mv_staff EXCEPT ALL SELECT id, name, dept, salary FROM staff);
----
0

query I
SELECT count(*) FROM (SELECT id, name, dept, salary FROM staff EXCEPT ALL SELECT * FROM mv_staff);
----
0

# ==========================================
# Complex 8: INSERT...SELECT with aggregation
# ==========================================

statement ok
CREATE TABLE agg_target (id INT, name VARCHAR, dept VARCHAR, salary INT);

statement ok
CREATE TABLE openivm_delta_agg_target AS SELECT *, 1::INTEGER AS openivm_multiplicity, now()::timestamp AS openivm_timestamp FROM agg_target LIMIT 0;

statement ok
INSERT INTO agg_target SELECT 999, dept, dept, SUM(salary) FROM staff WHERE dept = 'eng' GROUP BY dept;

query I
SELECT count(*) FROM openivm_delta_agg_target;
----
1

# ==========================================
# Complex 9: DELETE with subquery (WHERE id IN (SELECT ...))
# ==========================================

statement ok
INSERT INTO staff VALUES (140, 'Sub1', 'temp', 1), (141, 'Sub2', 'temp', 2), (142, 'Sub3', 'keep', 3);

statement ok
PRAGMA refresh_options('memory', 'main', 'mv_staff');

# DELETE with subquery should track deleted base rows in the delta table.
statement ok
DELETE FROM staff WHERE dept IN (SELECT 'temp');

query I
SELECT count(*) FROM openivm_delta_staff WHERE dept = 'temp' AND openivm_multiplicity = -1;
----
2

statement ok
PRAGMA refresh_options('memory', 'main', 'mv_staff');

query I
SELECT count(*) FROM (SELECT * FROM mv_staff EXCEPT ALL SELECT id, name, dept, salary FROM staff);
----
0

query I
SELECT count(*) FROM (SELECT id, name, dept, salary FROM staff EXCEPT ALL SELECT * FROM mv_staff);
----
0

# ==========================================
# Complex 10: DELETE with >= and <= (range filter)
# ==========================================

statement ok
INSERT INTO staff VALUES (150, 'Range1', 'eng', 10), (151, 'Range2', 'eng', 20), (152, 'Range3', 'eng', 30);

statement ok
PRAGMA refresh_options('memory', 'main', 'mv_staff');

statement ok
DELETE FROM staff WHERE salary >= 10 AND salary <= 20 AND id >= 150;

statement ok
PRAGMA refresh_options('memory', 'main', 'mv_staff');

query I
SELECT count(*) FROM (SELECT * FROM mv_staff EXCEPT ALL SELECT id, name, dept, salary FROM staff);
----
0

query I
SELECT count(*) FROM (SELECT id, name, dept, salary FROM staff EXCEPT ALL SELECT * FROM mv_staff);
----
0

query I
SELECT count(*) FROM mv_staff WHERE id IN (150, 151, 152);
----
1

# ==========================================
# Mixed INSERT + DELETE + UPDATE before single pragma
# ==========================================

statement ok
INSERT INTO staff VALUES (200, 'Mixed1', 'eng', 100), (201, 'Mixed2', 'sales', 200);

statement ok
DELETE FROM staff WHERE id = 200;

statement ok
UPDATE staff SET salary = 999 WHERE id = 201;

statement ok
PRAGMA refresh_options('memory', 'main', 'mv_staff');

query I
SELECT count(*) FROM (SELECT * FROM mv_staff EXCEPT ALL SELECT id, name, dept, salary FROM staff);
----
0

query I
SELECT count(*) FROM (SELECT id, name, dept, salary FROM staff EXCEPT ALL SELECT * FROM mv_staff);
----
0

query I
SELECT salary FROM mv_staff WHERE id = 201;
----
999

# ==========================================
# Attached catalog with quoted identifier
# ==========================================

statement ok
ATTACH '__TEST_DIR__/hyphen-catalog.db' AS "hyphen-cat";

statement ok
CREATE TABLE "hyphen-cat".main.hy_staff(id INT, dept VARCHAR);

statement ok
CREATE MATERIALIZED VIEW "hyphen-cat".main.mv_hy_staff AS SELECT * FROM "hyphen-cat".main.hy_staff;

statement ok
INSERT INTO "hyphen-cat".main.hy_staff VALUES (1, 'eng');

statement ok
PRAGMA refresh('mv_hy_staff');

query I
SELECT count(*) FROM (
  SELECT * FROM "hyphen-cat".main.mv_hy_staff
  EXCEPT ALL
  SELECT * FROM "hyphen-cat".main.hy_staff
);
----
0

query I
SELECT count(*) FROM (
  SELECT * FROM "hyphen-cat".main.hy_staff
  EXCEPT ALL
  SELECT * FROM "hyphen-cat".main.mv_hy_staff
);
----
0

# ==========================================
# Regression: bulk INSERT ... SELECT with a large LIMIT.
# DuckDB places a STREAMING_LIMIT directly above the projection for large LIMIT values,
# so the INSERT's child is neither LOGICAL_PROJECTION nor LOGICAL_GET. The delta-capture
# rule previously handled only those two shapes and silently skipped delta population for
# any other shape, leaving the MV stale after refresh. Transactional capture now wraps the
# DML input as a streaming physical operator, independent of the source-plan shape.
# ==========================================

statement ok
CREATE TABLE bulk_base (id INT, v INT);

statement ok
INSERT INTO bulk_base SELECT i, i * 10 FROM range(1, 11) t(i);

statement ok
CREATE MATERIALIZED VIEW mv_bulk AS SELECT id, v FROM bulk_base;

statement ok
PRAGMA refresh('mv_bulk');

statement ok
CREATE TABLE bulk_src (id INT, v INT);

statement ok
INSERT INTO bulk_src SELECT i, i * 10 FROM range(100, 151) t(i);

# Large LIMIT -> STREAMING_LIMIT-topped insert plan (the previously-dropped shape).
statement ok
INSERT INTO bulk_base SELECT id, v FROM bulk_src LIMIT 50000;

# The 51 bulk rows must have been captured into the delta (was 0 before the fix).
query I
SELECT count(*) FROM openivm_delta_bulk_base;
----
51

statement ok
PRAGMA refresh('mv_bulk');

# MV must bag-equal the base after the bulk insert.
query I
SELECT count(*) FROM (SELECT * FROM mv_bulk EXCEPT ALL SELECT * FROM bulk_base);
----
0

query I
SELECT count(*) FROM (SELECT * FROM bulk_base EXCEPT ALL SELECT * FROM mv_bulk);
----
0

# ==========================================
# Regression: delta capture shares the base DML transaction.
# A rollback or failed constraint must roll back the corresponding delta rows too.
# ==========================================

statement ok
CREATE TABLE tx_atomic_src (
    id INTEGER PRIMARY KEY,
    grp INTEGER,
    v INTEGER NOT NULL DEFAULT 7
);

statement ok
INSERT INTO tx_atomic_src VALUES (1, 1, 10), (2, 1, 20), (3, 2, 30);

statement ok
CREATE MATERIALIZED VIEW tx_atomic_mv AS
SELECT grp, SUM(v) AS total, COUNT(*) AS n
FROM tx_atomic_src
GROUP BY grp;

# Batch conflicting DML before one rollback. The id=5 row is inserted, updated, and
# deleted in the same transaction; none of the eight logical delta rows may survive.
statement ok
BEGIN TRANSACTION;

statement ok
INSERT INTO tx_atomic_src (id, grp) VALUES (4, 2);

statement ok
UPDATE tx_atomic_src SET v = 15 WHERE id = 1;

statement ok
DELETE FROM tx_atomic_src WHERE id = 2;

statement ok
INSERT INTO tx_atomic_src VALUES (5, 3, 50);

statement ok
UPDATE tx_atomic_src SET v = 55 WHERE id = 5;

statement ok
DELETE FROM tx_atomic_src WHERE id = 5;

statement ok
ROLLBACK;

query I
SELECT count(*) FROM openivm_delta_tx_atomic_src;
----
0

statement ok
PRAGMA refresh('tx_atomic_mv');

query I
SELECT count(*) FROM (
    SELECT * FROM tx_atomic_mv
    EXCEPT ALL
    SELECT grp, SUM(v), COUNT(*) FROM tx_atomic_src GROUP BY grp
);
----
0

query I
SELECT count(*) FROM (
    SELECT grp, SUM(v), COUNT(*) FROM tx_atomic_src GROUP BY grp
    EXCEPT ALL
    SELECT * FROM tx_atomic_mv
);
----
0

# The same batch must remain incremental when committed.
statement ok
BEGIN TRANSACTION;

statement ok
INSERT INTO tx_atomic_src (id, grp) VALUES (4, 2);

statement ok
UPDATE tx_atomic_src SET v = 15 WHERE id = 1;

statement ok
DELETE FROM tx_atomic_src WHERE id = 2;

statement ok
INSERT INTO tx_atomic_src VALUES (5, 3, 50);

statement ok
UPDATE tx_atomic_src SET v = 55 WHERE id = 5;

statement ok
DELETE FROM tx_atomic_src WHERE id = 5;

statement ok
COMMIT;

query I
SELECT count(*) FROM openivm_delta_tx_atomic_src;
----
8

statement ok
PRAGMA refresh('tx_atomic_mv');

query I
SELECT count(*) FROM (
    SELECT * FROM tx_atomic_mv
    EXCEPT ALL
    SELECT grp, SUM(v), COUNT(*) FROM tx_atomic_src GROUP BY grp
);
----
0

query I
SELECT count(*) FROM (
    SELECT grp, SUM(v), COUNT(*) FROM tx_atomic_src GROUP BY grp
    EXCEPT ALL
    SELECT * FROM tx_atomic_mv
);
----
0

# Constraint failures happen after the capture operator has seen input, so these prove
# that both writes are part of the same transaction and roll back together.
statement error
INSERT INTO tx_atomic_src VALUES (1, 9, 999);
----
Duplicate key

statement error
UPDATE tx_atomic_src SET v = NULL WHERE id = 1;
----
NOT NULL

query I
SELECT count(*) FROM openivm_delta_tx_atomic_src;
----
8

statement ok
PRAGMA refresh('tx_atomic_mv');

query I
SELECT count(*) FROM (
    SELECT * FROM tx_atomic_mv
    EXCEPT ALL
    SELECT grp, SUM(v), COUNT(*) FROM tx_atomic_src GROUP BY grp
);
----
0

query I
SELECT count(*) FROM (
    SELECT grp, SUM(v), COUNT(*) FROM tx_atomic_src GROUP BY grp
    EXCEPT ALL
    SELECT * FROM tx_atomic_mv
);
----
0

# Generated columns are not physically stored in the base table, so capture must evaluate
# them for both old and new rows. RETURNING adds a projection above the DML operator; it must
# not hide the affected DML plan from the capture rule.
statement ok
CREATE TABLE tx_generated_src (
    a INTEGER,
    doubled INTEGER GENERATED ALWAYS AS (a * 2)
);

statement ok
INSERT INTO tx_generated_src (a) VALUES (1), (2);

statement ok
CREATE MATERIALIZED VIEW tx_generated_mv AS SELECT a, doubled FROM tx_generated_src;

query II
INSERT INTO tx_generated_src (a) VALUES (3) RETURNING a, doubled;
----
3	6

query II
UPDATE tx_generated_src SET a = a + 10 WHERE a = 1 RETURNING a, doubled;
----
11	22

query II
DELETE FROM tx_generated_src WHERE a = 2 RETURNING a, doubled;
----
2	4

query I
SELECT count(*) FROM openivm_delta_tx_generated_src;
----
4

statement ok
PRAGMA refresh('tx_generated_mv');

query I
SELECT count(*) FROM (
    SELECT * FROM tx_generated_mv
    EXCEPT ALL
    SELECT * FROM tx_generated_src
);
----
0

query I
SELECT count(*) FROM (
    SELECT * FROM tx_generated_src
    EXCEPT ALL
    SELECT * FROM tx_generated_mv
);
----
0

# UPDATE DEFAULT must be evaluated once and shared by base-table update and delta capture.
# A sequence default makes duplicate evaluation observable.
statement ok
CREATE SEQUENCE tx_default_seq START 100;

statement ok
CREATE TABLE tx_default_src (
    id INTEGER,
    v BIGINT DEFAULT nextval('tx_default_seq')
);

statement ok
INSERT INTO tx_default_src VALUES (1, 0);

statement ok
CREATE MATERIALIZED VIEW tx_default_mv AS SELECT id, v FROM tx_default_src;

statement ok
UPDATE tx_default_src SET v = DEFAULT WHERE id = 1;

query I
SELECT v FROM tx_default_src;
----
100

query I
SELECT v FROM openivm_delta_tx_default_src WHERE openivm_multiplicity = 1;
----
100

statement ok
PRAGMA refresh('tx_default_mv');

query I
SELECT count(*) FROM (
    SELECT * FROM tx_default_mv
    EXCEPT ALL
    SELECT * FROM tx_default_src
);
----
0

query I
SELECT count(*) FROM (
    SELECT * FROM tx_default_src
    EXCEPT ALL
    SELECT * FROM tx_default_mv
);
----
0

# ==========================================
# Actual outcomes for ON CONFLICT / OR REPLACE
# ==========================================

statement ok
CREATE TABLE conflict_src (
    id INTEGER PRIMARY KEY,
    v INTEGER NOT NULL DEFAULT 7,
    label VARCHAR
);

statement ok
INSERT INTO conflict_src VALUES (1, 10, 'one'), (2, 20, 'two');

statement ok
CREATE MATERIALIZED VIEW conflict_mv AS SELECT id, v, label FROM conflict_src;

# The rejected id=1 input is not an affected row and must not become a delta.
query III
INSERT INTO conflict_src VALUES (1, 999, 'ignored'), (3, 30, 'three')
ON CONFLICT DO NOTHING
RETURNING id, v, label;
----
3	30	three

query III
SELECT id, v, openivm_multiplicity
FROM openivm_delta_conflict_src
ORDER BY id, openivm_multiplicity;
----
3	30	1

statement ok
PRAGMA refresh('conflict_mv');

query I
SELECT count(*) FROM (
    SELECT * FROM conflict_mv
    EXCEPT ALL
    SELECT * FROM conflict_src
);
----
0

query I
SELECT count(*) FROM (
    SELECT * FROM conflict_src
    EXCEPT ALL
    SELECT * FROM conflict_mv
);
----
0

statement ok
DELETE FROM openivm_delta_conflict_src;

# Action predicates are resolved by DuckDB before capture: id=2 performs DO NOTHING,
# id=1 updates, and id=4 inserts.
query III
INSERT INTO conflict_src VALUES (1, 5, 'one-updated'), (2, -1, 'ignored'), (4, 40, 'four')
ON CONFLICT(id) DO UPDATE
SET v = conflict_src.v + excluded.v, label = excluded.label
WHERE excluded.v > 0
RETURNING id, v, label;
----
1	15	one-updated
4	40	four

query III
SELECT id, v, openivm_multiplicity
FROM openivm_delta_conflict_src
ORDER BY id, openivm_multiplicity, v;
----
1	10	-1
1	15	1
4	40	1

statement ok
PRAGMA refresh('conflict_mv');

query I
SELECT count(*) FROM (
    SELECT * FROM conflict_mv
    EXCEPT ALL
    SELECT * FROM conflict_src
);
----
0

query I
SELECT count(*) FROM (
    SELECT * FROM conflict_src
    EXCEPT ALL
    SELECT * FROM conflict_mv
);
----
0

statement ok
DELETE FROM openivm_delta_conflict_src;

# OR REPLACE is an update for the conflicting row and an insert for the fresh row.
query III
INSERT OR REPLACE INTO conflict_src VALUES (1, 50, 'replaced'), (5, 50, 'five')
RETURNING id, v, label;
----
1	50	replaced
5	50	five

query III
SELECT id, v, openivm_multiplicity
FROM openivm_delta_conflict_src
ORDER BY id, openivm_multiplicity, v;
----
1	15	-1
1	50	1
5	50	1

statement ok
PRAGMA refresh('conflict_mv');

query I
SELECT count(*) FROM (
    SELECT * FROM conflict_mv
    EXCEPT ALL
    SELECT * FROM conflict_src
);
----
0

query I
SELECT count(*) FROM (
    SELECT * FROM conflict_src
    EXCEPT ALL
    SELECT * FROM conflict_mv
);
----
0

# Capture runs before DuckDB's action sink. A failed conflict update must roll back
# both its provisional deltas and the base-table statement.
statement ok
DELETE FROM openivm_delta_conflict_src;

statement error
INSERT INTO conflict_src VALUES (1, 1, 'bad')
ON CONFLICT(id) DO UPDATE SET v = NULL;
----
NOT NULL

query I
SELECT count(*) FROM openivm_delta_conflict_src;
----
0

# Batch conflict update/insert, replacement, UPDATE, and DELETE before one refresh.
# id=6 is inserted, updated, and deleted in the same batch.
statement ok
INSERT INTO conflict_src VALUES (1, 1, 'again'), (6, 60, 'six')
ON CONFLICT(id) DO UPDATE SET v = conflict_src.v + excluded.v, label = excluded.label;

statement ok
INSERT OR REPLACE INTO conflict_src VALUES (4, 44, 'four-replaced');

statement ok
UPDATE conflict_src SET v = 66 WHERE id = 6;

statement ok
DELETE FROM conflict_src WHERE id = 6;

query I
SELECT count(*) FROM openivm_delta_conflict_src;
----
8

statement ok
PRAGMA refresh('conflict_mv');

query I
SELECT count(*) FROM (
    SELECT * FROM conflict_mv
    EXCEPT ALL
    SELECT * FROM conflict_src
);
----
0

query I
SELECT count(*) FROM (
    SELECT * FROM conflict_src
    EXCEPT ALL
    SELECT * FROM conflict_mv
);
----
0

# A volatile UPDATE DEFAULT is evaluated once and shared by capture and the action sink.
statement ok
CREATE SEQUENCE conflict_default_seq START 100;

statement ok
CREATE TABLE conflict_default_src (
    id INTEGER PRIMARY KEY,
    v BIGINT DEFAULT nextval('conflict_default_seq')
);

statement ok
INSERT INTO conflict_default_src VALUES (1, 0);

statement ok
CREATE MATERIALIZED VIEW conflict_default_mv AS SELECT id, v FROM conflict_default_src;

query II
INSERT INTO conflict_default_src(id) VALUES (1)
ON CONFLICT(id) DO UPDATE SET v = DEFAULT
RETURNING id, v;
----
1	101

query III
SELECT id, v, openivm_multiplicity
FROM openivm_delta_conflict_default_src
ORDER BY openivm_multiplicity;
----
1	0	-1
1	101	1

statement ok
PRAGMA refresh('conflict_default_mv');

query I
SELECT count(*) FROM (
    SELECT * FROM conflict_default_mv
    EXCEPT ALL
    SELECT * FROM conflict_default_src
);
----
0

query I
SELECT count(*) FROM (
    SELECT * FROM conflict_default_src
    EXCEPT ALL
    SELECT * FROM conflict_default_mv
);
----
0

# Generated delta columns are evaluated from both the old and resolved new row.
statement ok
CREATE TABLE conflict_generated_src (
    id INTEGER PRIMARY KEY,
    a INTEGER,
    doubled INTEGER GENERATED ALWAYS AS (a * 2)
);

statement ok
INSERT INTO conflict_generated_src(id, a) VALUES (1, 10);

statement ok
CREATE MATERIALIZED VIEW conflict_generated_mv AS
SELECT id, a, doubled FROM conflict_generated_src;

statement ok
INSERT INTO conflict_generated_src(id, a) VALUES (1, 5), (2, 20)
ON CONFLICT(id) DO UPDATE SET a = conflict_generated_src.a + excluded.a;

query IIII
SELECT id, a, doubled, openivm_multiplicity
FROM openivm_delta_conflict_generated_src
ORDER BY id, openivm_multiplicity;
----
1	10	20	-1
1	15	30	1
2	20	40	1

statement ok
PRAGMA refresh('conflict_generated_mv');

query I
SELECT count(*) FROM (
    SELECT * FROM conflict_generated_mv
    EXCEPT ALL
    SELECT * FROM conflict_generated_src
);
----
0

query I
SELECT count(*) FROM (
    SELECT * FROM conflict_generated_src
    EXCEPT ALL
    SELECT * FROM conflict_generated_mv
);
----
0

# Native MERGE uses the same resolved action boundary. Exercise DELETE, UPDATE,
# and INSERT actions together, including action-specific RETURNING rows.
statement ok
CREATE TABLE merge_src (id INTEGER PRIMARY KEY, v INTEGER);

statement ok
INSERT INTO merge_src VALUES (1, 10), (2, 20);

statement ok
CREATE MATERIALIZED VIEW merge_mv AS SELECT id, v FROM merge_src;

query TII
MERGE INTO merge_src
USING (VALUES (1, 5), (2, -1), (3, 30)) changes(id, v)
ON merge_src.id = changes.id
WHEN MATCHED AND changes.v < 0 THEN DELETE
WHEN MATCHED THEN UPDATE SET v = merge_src.v + changes.v
WHEN NOT MATCHED THEN INSERT VALUES (changes.id, changes.v)
RETURNING merge_action, id, v;
----
DELETE	2	20
UPDATE	1	15
INSERT	3	30

query III
SELECT id, v, openivm_multiplicity
FROM openivm_delta_merge_src
ORDER BY id, openivm_multiplicity;
----
1	10	-1
1	15	1
2	20	-1
3	30	1

statement ok
PRAGMA refresh('merge_mv');

query I
SELECT count(*) FROM (
    SELECT * FROM merge_mv
    EXCEPT ALL
    SELECT * FROM merge_src
);
----
0

query I
SELECT count(*) FROM (
    SELECT * FROM merge_src
    EXCEPT ALL
    SELECT * FROM merge_mv
);
----
0

# Duplicate source matches can make DuckDB choose a different update row than the
# input's first occurrence when it sorts and deduplicates target row IDs. Capture
# the target's actual final value rather than predicting which source row wins.
statement ok
CREATE TABLE merge_duplicate_src (id INTEGER PRIMARY KEY, v INTEGER);

statement ok
INSERT INTO merge_duplicate_src SELECT i, 0 FROM range(2500) r(i);

statement ok
CREATE MATERIALIZED VIEW merge_duplicate_mv AS SELECT id, v FROM merge_duplicate_src;

statement ok
CREATE TABLE merge_duplicate_changes AS
SELECT i AS id, x AS v
FROM range(2500) r(i), (VALUES (1), (2)) values_table(x);

statement ok
MERGE INTO merge_duplicate_src
USING merge_duplicate_changes
ON merge_duplicate_src.id = merge_duplicate_changes.id
WHEN MATCHED THEN UPDATE SET v = merge_duplicate_changes.v;

statement ok
PRAGMA refresh('merge_duplicate_mv');

query I
SELECT count(*) FROM (
    SELECT * FROM merge_duplicate_mv
    EXCEPT ALL
    SELECT * FROM merge_duplicate_src
);
----
0

query I
SELECT count(*) FROM (
    SELECT * FROM merge_duplicate_src
    EXCEPT ALL
    SELECT * FROM merge_duplicate_mv
);
----
0

# A MERGE can update a committed row while deleting a row inserted earlier in
# the same transaction. The deleted local row ID must not be refetched as a
# positive postimage when the MERGE actions finalize.
statement ok
CREATE TABLE merge_mixed_visibility_src (id INTEGER PRIMARY KEY, v INTEGER);

statement ok
INSERT INTO merge_mixed_visibility_src VALUES (1, 10);

statement ok
CREATE MATERIALIZED VIEW merge_mixed_visibility_mv AS
SELECT id, v FROM merge_mixed_visibility_src;

statement ok
BEGIN TRANSACTION;

statement ok
INSERT INTO merge_mixed_visibility_src VALUES (2, 20);

statement ok
MERGE INTO merge_mixed_visibility_src
USING (VALUES (1, 5), (2, -1)) changes(id, v)
ON merge_mixed_visibility_src.id = changes.id
WHEN MATCHED AND changes.v < 0 THEN DELETE
WHEN MATCHED THEN UPDATE SET v = merge_mixed_visibility_src.v + changes.v;

statement ok
COMMIT;

query III
SELECT id, v, openivm_multiplicity
FROM openivm_delta_merge_mixed_visibility_src
ORDER BY id, v, openivm_multiplicity;
----
1	10	-1
1	15	1
2	20	-1
2	20	1

statement ok
PRAGMA refresh('merge_mixed_visibility_mv');

query I
SELECT count(*) FROM (
    SELECT * FROM merge_mixed_visibility_mv
    EXCEPT ALL
    SELECT * FROM merge_mixed_visibility_src
);
----
0

query I
SELECT count(*) FROM (
    SELECT * FROM merge_mixed_visibility_src
    EXCEPT ALL
    SELECT * FROM merge_mixed_visibility_mv
);
----
0
