# name: test/sql/ivm_aggregate_ungrouped.test
# description: Test IVM with ungrouped (scalar) aggregation
# group: [sql]

require openivm

statement ok
CREATE TABLE scores (id INT, value INT, label VARCHAR);

statement ok
INSERT INTO scores VALUES (1, 10, 'a'), (2, 20, 'b'), (3, 30, 'c');

statement ok
create materialized view score_totals as (select sum(value) as total, count(label) as cnt from scores);

query II
SELECT total, cnt FROM score_totals;
----
60	3

# --- Insert ---
statement ok
INSERT INTO scores VALUES (4, 40, 'd');

statement ok
pragma ivm('score_totals');

query II
SELECT total, cnt FROM score_totals;
----
100	4

# --- Delete ---
statement ok
DELETE FROM scores WHERE id = 1;

statement ok
pragma ivm('score_totals');

query II
SELECT total, cnt FROM score_totals;
----
90	3

# --- Mixed insert + delete ---
statement ok
INSERT INTO scores VALUES (5, 50, 'e');

statement ok
DELETE FROM scores WHERE id = 2;

statement ok
pragma ivm('score_totals');

query II
SELECT total, cnt FROM score_totals;
----
120	3

# --- No-op PRAGMA ---
statement ok
pragma ivm('score_totals');

query II
SELECT total, cnt FROM score_totals;
----
120	3

# --- Batch insert ---
statement ok
INSERT INTO scores VALUES (6, 10, 'f'), (7, 20, 'g'), (8, 30, 'h');

statement ok
pragma ivm('score_totals');

query II
SELECT total, cnt FROM score_totals;
----
180	6

# --- Delete multiple rows at once ---
statement ok
DELETE FROM scores WHERE value <= 20;

statement ok
pragma ivm('score_totals');

# Remaining: id=3(30), id=4(40), id=5(50), id=8(30) = 150, cnt=4
query II
SELECT total, cnt FROM score_totals;
----
150	4
