# name: test/sql/left_join_emptied_group.test
# description: LEFT JOIN aggregate MVs must DROP a group once its last preserved-side row is deleted,
# group: [sql]

#              while KEEPING groups that merely have no match (NULL-padded). Previously the empty-group
#              cleanup was skipped for any view carrying openivm_match_count, so emptied groups lingered
#              forever as zeroed rows (e.g. `B | 0 | 0`) where a recompute drops them. The two cases are
#              only distinguishable via openivm_count_star, which counts LEFT JOIN OUTPUT rows: it is 1
#              for a NULL-padded group and 0 for an emptied one. That in turn requires the secondary
#              delta to emit the null-padded reappearance at EVERY level, including a single LEFT JOIN.

require openivm

statement ok
SET openivm_cascade_refresh = 'off';

statement ok
CREATE TABLE cu (id INT, name VARCHAR);

statement ok
CREATE TABLE od (cust_id INT, amount INT);

statement ok
INSERT INTO cu VALUES (1,'Alice'),(2,'Bob'),(3,'Carol'),(4,'Dave');

# Alice has 2 orders, Bob 1, Carol none (already NULL-padded), Dave none
statement ok
INSERT INTO od VALUES (1,100),(1,200),(2,50);

statement ok
CREATE MATERIALIZED VIEW mv_lj AS
    SELECT c.name, SUM(o.amount) AS total, COUNT(o.amount) AS cnt
    FROM cu c LEFT JOIN od o ON c.id = o.cust_id
    GROUP BY c.name;

query I
SELECT COUNT(*) FROM (
    SELECT c.name, SUM(o.amount), COUNT(o.amount) FROM cu c LEFT JOIN od o ON c.id=o.cust_id GROUP BY c.name
    EXCEPT ALL SELECT name, total, cnt FROM mv_lj
);
----
0

# Batch: Alice loses ALL her orders (group must SURVIVE as NULL/0 -- she still has a customer row),
# and Dave's customer row is deleted (group must DISAPPEAR).
statement ok
DELETE FROM od WHERE cust_id = 1;

statement ok
DELETE FROM cu WHERE id = 4;

statement ok
PRAGMA refresh('mv_lj');

query I
SELECT COUNT(*) FROM (
    SELECT c.name, SUM(o.amount), COUNT(o.amount) FROM cu c LEFT JOIN od o ON c.id=o.cust_id GROUP BY c.name
    EXCEPT ALL SELECT name, total, cnt FROM mv_lj
);
----
0

query I
SELECT COUNT(*) FROM (
    SELECT name, total, cnt FROM mv_lj
    EXCEPT ALL
    SELECT c.name, SUM(o.amount), COUNT(o.amount) FROM cu c LEFT JOIN od o ON c.id=o.cust_id GROUP BY c.name
);
----
0

# Alice unmatched but present; Carol still NULL-padded; Dave gone entirely
query III
SELECT name, total, cnt FROM mv_lj ORDER BY name;
----
Alice	NULL	0
Bob	50	1
Carol	NULL	0

# count_star must reflect OUTPUT rows: 1 for a surviving unmatched group, not 0
query I
SELECT openivm_count_star FROM openivm_data_mv_lj WHERE name = 'Alice';
----
1

# Deleting the last customer of an already-unmatched group must drop it
statement ok
DELETE FROM cu WHERE id = 3;

statement ok
PRAGMA refresh('mv_lj');

query I
SELECT COUNT(*) FROM mv_lj WHERE name = 'Carol';
----
0

query I
SELECT COUNT(*) FROM (
    SELECT c.name, SUM(o.amount), COUNT(o.amount) FROM cu c LEFT JOIN od o ON c.id=o.cust_id GROUP BY c.name
    EXCEPT ALL SELECT name, total, cnt FROM mv_lj
);
----
0

query I
SELECT COUNT(*) FROM (
    SELECT name, total, cnt FROM mv_lj
    EXCEPT ALL
    SELECT c.name, SUM(o.amount), COUNT(o.amount) FROM cu c LEFT JOIN od o ON c.id=o.cust_id GROUP BY c.name
);
----
0

# A group can come back: re-add Alice's order, and re-add Carol entirely
statement ok
INSERT INTO od VALUES (1,999);

statement ok
INSERT INTO cu VALUES (3,'Carol');

statement ok
PRAGMA refresh('mv_lj');

query III
SELECT name, total, cnt FROM mv_lj ORDER BY name;
----
Alice	999	1
Bob	50	1
Carol	NULL	0

query I
SELECT COUNT(*) FROM (
    SELECT name, total, cnt FROM mv_lj
    EXCEPT ALL
    SELECT c.name, SUM(o.amount), COUNT(o.amount) FROM cu c LEFT JOIN od o ON c.id=o.cust_id GROUP BY c.name
);
----
0

# ---- same lifecycle in a 3-table LEFT JOIN pipeline ----
statement ok
CREATE TABLE li (oid INT, cust_id INT, qty INT);

statement ok
INSERT INTO li VALUES (1,1,3),(2,2,4);

statement ok
CREATE MATERIALIZED VIEW mv_pipe AS
    SELECT c.name, COUNT(o.amount) AS n_ord, COUNT(l.oid) AS n_li
    FROM cu c LEFT JOIN od o ON c.id = o.cust_id LEFT JOIN li l ON l.cust_id = c.id
    GROUP BY c.name;

statement ok
DELETE FROM cu WHERE id = 2;

statement ok
PRAGMA refresh('mv_pipe');

query I
SELECT COUNT(*) FROM mv_pipe WHERE name = 'Bob';
----
0

query I
SELECT COUNT(*) FROM (
    SELECT c.name, COUNT(o.amount), COUNT(l.oid)
    FROM cu c LEFT JOIN od o ON c.id=o.cust_id LEFT JOIN li l ON l.cust_id=c.id GROUP BY c.name
    EXCEPT ALL SELECT name, n_ord, n_li FROM mv_pipe
);
----
0

query I
SELECT COUNT(*) FROM (
    SELECT name, n_ord, n_li FROM mv_pipe
    EXCEPT ALL
    SELECT c.name, COUNT(o.amount), COUNT(l.oid)
    FROM cu c LEFT JOIN od o ON c.id=o.cust_id LEFT JOIN li l ON l.cust_id=c.id GROUP BY c.name
);
----
0
