# name: test/sql/left_join.test
# description: Test IVM with LEFT JOIN
# group: [sql]

require openivm

statement ok
SET openivm_cascade_refresh = 'off';

# ============================================================
# Setup
# ============================================================

statement ok
CREATE TABLE customers (id INT, name VARCHAR);

statement ok
CREATE TABLE orders (customer_id INT, product VARCHAR, amount INT);

statement ok
INSERT INTO customers VALUES (1, 'Alice'), (2, 'Bob'), (3, 'Charlie');

statement ok
INSERT INTO orders VALUES (1, 'Widget', 100), (1, 'Gadget', 200);

statement ok
CREATE MATERIALIZED VIEW customer_orders AS
    SELECT c.name, o.product, o.amount
    FROM customers c LEFT JOIN orders o ON c.id = o.customer_id;

# Initial: Alice has 2 orders, Bob and Charlie have NULL
query III
SELECT * FROM customer_orders ORDER BY name, product NULLS LAST;
----
Alice	Gadget	200
Alice	Widget	100
Bob	NULL	NULL
Charlie	NULL	NULL

# ============================================================
# Insert into right side: Bob gets an order (NULL row should be replaced)
# ============================================================

statement ok
INSERT INTO orders VALUES (2, 'Bolt', 50);

statement ok
PRAGMA refresh('customer_orders');

query I
SELECT COUNT(*) FROM (
    SELECT c.name, o.product, o.amount FROM customers c LEFT JOIN orders o ON c.id = o.customer_id
    EXCEPT ALL
    SELECT * FROM customer_orders
);
----
0

query I
SELECT COUNT(*) FROM (
    SELECT * FROM customer_orders
    EXCEPT ALL
    SELECT c.name, o.product, o.amount FROM customers c LEFT JOIN orders o ON c.id = o.customer_id
);
----
0

# ============================================================
# Delete from right side: remove Alice's only remaining order
# (she should get a NULL row back)
# ============================================================

statement ok
DELETE FROM orders WHERE customer_id = 1 AND product = 'Widget';

statement ok
PRAGMA refresh('customer_orders');

query I
SELECT COUNT(*) FROM (
    SELECT c.name, o.product, o.amount FROM customers c LEFT JOIN orders o ON c.id = o.customer_id
    EXCEPT ALL
    SELECT * FROM customer_orders
);
----
0

query I
SELECT COUNT(*) FROM (
    SELECT * FROM customer_orders
    EXCEPT ALL
    SELECT c.name, o.product, o.amount FROM customers c LEFT JOIN orders o ON c.id = o.customer_id
);
----
0

# ============================================================
# Insert into left side (new customer with no orders → NULL extended)
# ============================================================

statement ok
INSERT INTO customers VALUES (4, 'Dave');

statement ok
PRAGMA refresh('customer_orders');

query I
SELECT COUNT(*) FROM (
    SELECT c.name, o.product, o.amount FROM customers c LEFT JOIN orders o ON c.id = o.customer_id
    EXCEPT ALL
    SELECT * FROM customer_orders
);
----
0

query I
SELECT COUNT(*) FROM (
    SELECT * FROM customer_orders
    EXCEPT ALL
    SELECT c.name, o.product, o.amount FROM customers c LEFT JOIN orders o ON c.id = o.customer_id
);
----
0

# ============================================================
# Mixed: insert + delete + update, single refresh
# ============================================================

statement ok
INSERT INTO orders VALUES (3, 'Screw', 10), (4, 'Nail', 5);

statement ok
DELETE FROM orders WHERE customer_id = 2;

statement ok
PRAGMA refresh('customer_orders');

query I
SELECT COUNT(*) FROM (
    SELECT c.name, o.product, o.amount FROM customers c LEFT JOIN orders o ON c.id = o.customer_id
    EXCEPT ALL
    SELECT * FROM customer_orders
);
----
0

query I
SELECT COUNT(*) FROM (
    SELECT * FROM customer_orders
    EXCEPT ALL
    SELECT c.name, o.product, o.amount FROM customers c LEFT JOIN orders o ON c.id = o.customer_id
);
----
0

# ============================================================
# RIGHT JOIN (DuckDB rewrites to LEFT internally)
# ============================================================

statement ok
CREATE TABLE products (id INT, pname VARCHAR);

statement ok
CREATE TABLE sales (product_id INT, qty INT);

statement ok
INSERT INTO products VALUES (1, 'Alpha'), (2, 'Beta'), (3, 'Gamma');

statement ok
INSERT INTO sales VALUES (1, 10);

statement ok
CREATE MATERIALIZED VIEW product_sales AS
    SELECT p.pname, s.qty FROM sales s RIGHT JOIN products p ON s.product_id = p.id;

statement ok
INSERT INTO sales VALUES (2, 20);

statement ok
PRAGMA refresh('product_sales');

query I
SELECT COUNT(*) FROM (
    SELECT p.pname, s.qty FROM sales s RIGHT JOIN products p ON s.product_id = p.id
    EXCEPT ALL
    SELECT pname, qty FROM product_sales
);
----
0

query I
SELECT COUNT(*) FROM (
    SELECT pname, qty FROM product_sales
    EXCEPT ALL
    SELECT p.pname, s.qty FROM sales s RIGHT JOIN products p ON s.product_id = p.id
);
----
0

# ============================================================
# LEFT JOIN with WHERE filter
# ============================================================

statement ok
CREATE TABLE items (id INT, item_name VARCHAR);

statement ok
CREATE TABLE prices (item_id INT, price INT);

statement ok
INSERT INTO items VALUES (1, 'A'), (2, 'B'), (3, 'C');

statement ok
INSERT INTO prices VALUES (1, 100);

statement ok
CREATE MATERIALIZED VIEW item_prices AS
    SELECT i.item_name, p.price
    FROM items i LEFT JOIN prices p ON i.id = p.item_id
    WHERE i.id > 0;

statement ok
INSERT INTO prices VALUES (2, 200);

statement ok
PRAGMA refresh('item_prices');

query I
SELECT COUNT(*) FROM (
    SELECT i.item_name, p.price FROM items i LEFT JOIN prices p ON i.id = p.item_id WHERE i.id > 0
    EXCEPT ALL
    SELECT item_name, price FROM item_prices
);
----
0

query I
SELECT COUNT(*) FROM (
    SELECT item_name, price FROM item_prices
    EXCEPT ALL
    SELECT i.item_name, p.price FROM items i LEFT JOIN prices p ON i.id = p.item_id WHERE i.id > 0
);
----
0

# ============================================================
# Mixed joins: INNER + LEFT in same query
# ============================================================

statement ok
CREATE TABLE departments (id INT, dept_name VARCHAR);

statement ok
CREATE TABLE employees (id INT, dept_id INT, emp_name VARCHAR);

statement ok
CREATE TABLE bonuses (emp_id INT, bonus INT);

statement ok
INSERT INTO departments VALUES (1, 'Eng'), (2, 'Sales');

statement ok
INSERT INTO employees VALUES (1, 1, 'Alice'), (2, 1, 'Bob'), (3, 2, 'Charlie');

statement ok
INSERT INTO bonuses VALUES (1, 1000);

statement ok
CREATE MATERIALIZED VIEW emp_bonus AS
    SELECT e.emp_name, d.dept_name, b.bonus
    FROM employees e
    INNER JOIN departments d ON e.dept_id = d.id
    LEFT JOIN bonuses b ON e.id = b.emp_id;

statement ok
INSERT INTO bonuses VALUES (2, 500);

statement ok
PRAGMA refresh('emp_bonus');

query I
SELECT COUNT(*) FROM (
    SELECT e.emp_name, d.dept_name, b.bonus
    FROM employees e INNER JOIN departments d ON e.dept_id = d.id LEFT JOIN bonuses b ON e.id = b.emp_id
    EXCEPT ALL
    SELECT emp_name, dept_name, bonus FROM emp_bonus
);
----
0

query I
SELECT COUNT(*) FROM (
    SELECT emp_name, dept_name, bonus FROM emp_bonus
    EXCEPT ALL
    SELECT e.emp_name, d.dept_name, b.bonus
    FROM employees e INNER JOIN departments d ON e.dept_id = d.id LEFT JOIN bonuses b ON e.id = b.emp_id
);
----
0

# ============================================================
# NULL join keys in LEFT JOIN
# NULL != NULL in join, so NULL keys never match
# ============================================================

statement ok
CREATE TABLE lj_l (id INT, name VARCHAR);

statement ok
CREATE TABLE lj_r (ref_id INT, val INT);

statement ok
INSERT INTO lj_l VALUES (1, 'a'), (NULL, 'b'), (3, 'c');

statement ok
INSERT INTO lj_r VALUES (1, 100), (NULL, 200);

statement ok
CREATE MATERIALIZED VIEW lj_null_keys AS
    SELECT l.name, r.val FROM lj_l l LEFT JOIN lj_r r ON l.id = r.ref_id;

statement ok
PRAGMA refresh('lj_null_keys');

query I
SELECT COUNT(*) FROM (
    SELECT l.name, r.val FROM lj_l l LEFT JOIN lj_r r ON l.id = r.ref_id
    EXCEPT ALL
    SELECT * FROM lj_null_keys
);
----
0

query I
SELECT COUNT(*) FROM (
    SELECT * FROM lj_null_keys
    EXCEPT ALL
    SELECT l.name, r.val FROM lj_l l LEFT JOIN lj_r r ON l.id = r.ref_id
);
----
0

# Insert into right: ref_id=3 now matches left id=3
statement ok
INSERT INTO lj_r VALUES (3, 300);

statement ok
PRAGMA refresh('lj_null_keys');

query I
SELECT COUNT(*) FROM (
    SELECT l.name, r.val FROM lj_l l LEFT JOIN lj_r r ON l.id = r.ref_id
    EXCEPT ALL
    SELECT * FROM lj_null_keys
);
----
0

query I
SELECT COUNT(*) FROM (
    SELECT * FROM lj_null_keys
    EXCEPT ALL
    SELECT l.name, r.val FROM lj_l l LEFT JOIN lj_r r ON l.id = r.ref_id
);
----
0

# Delete from right: ref_id=1 removed, name='a' becomes NULL-extended
statement ok
DELETE FROM lj_r WHERE ref_id = 1;

statement ok
PRAGMA refresh('lj_null_keys');

query I
SELECT COUNT(*) FROM (
    SELECT l.name, r.val FROM lj_l l LEFT JOIN lj_r r ON l.id = r.ref_id
    EXCEPT ALL
    SELECT * FROM lj_null_keys
);
----
0

query I
SELECT COUNT(*) FROM (
    SELECT * FROM lj_null_keys
    EXCEPT ALL
    SELECT l.name, r.val FROM lj_l l LEFT JOIN lj_r r ON l.id = r.ref_id
);
----
0

# Delete from left: remove the NULL-keyed row
statement ok
DELETE FROM lj_l WHERE id IS NULL;

statement ok
PRAGMA refresh('lj_null_keys');

query I
SELECT COUNT(*) FROM (
    SELECT l.name, r.val FROM lj_l l LEFT JOIN lj_r r ON l.id = r.ref_id
    EXCEPT ALL
    SELECT * FROM lj_null_keys
);
----
0

query I
SELECT COUNT(*) FROM (
    SELECT * FROM lj_null_keys
    EXCEPT ALL
    SELECT l.name, r.val FROM lj_l l LEFT JOIN lj_r r ON l.id = r.ref_id
);
----
0

# ============================================================
# LEFT JOIN where entire right table is empty
# ============================================================

statement ok
CREATE TABLE lj_emp_l (id INT, name VARCHAR);

statement ok
CREATE TABLE lj_emp_r (ref_id INT, score INT);

statement ok
INSERT INTO lj_emp_l VALUES (1, 'x'), (2, 'y'), (3, 'z');

# lj_emp_r is intentionally empty — all left rows should be NULL-extended

statement ok
CREATE MATERIALIZED VIEW lj_empty_right AS
    SELECT l.name, r.score FROM lj_emp_l l LEFT JOIN lj_emp_r r ON l.id = r.ref_id;

statement ok
PRAGMA refresh('lj_empty_right');

query I
SELECT COUNT(*) FROM (
    SELECT l.name, r.score FROM lj_emp_l l LEFT JOIN lj_emp_r r ON l.id = r.ref_id
    EXCEPT ALL
    SELECT * FROM lj_empty_right
);
----
0

query I
SELECT COUNT(*) FROM (
    SELECT * FROM lj_empty_right
    EXCEPT ALL
    SELECT l.name, r.score FROM lj_emp_l l LEFT JOIN lj_emp_r r ON l.id = r.ref_id
);
----
0

# Insert one match — 'x' gets a real score, 'y' and 'z' still NULL-extended
statement ok
INSERT INTO lj_emp_r VALUES (1, 10);

statement ok
PRAGMA refresh('lj_empty_right');

query I
SELECT COUNT(*) FROM (
    SELECT l.name, r.score FROM lj_emp_l l LEFT JOIN lj_emp_r r ON l.id = r.ref_id
    EXCEPT ALL
    SELECT * FROM lj_empty_right
);
----
0

query I
SELECT COUNT(*) FROM (
    SELECT * FROM lj_empty_right
    EXCEPT ALL
    SELECT l.name, r.score FROM lj_emp_l l LEFT JOIN lj_emp_r r ON l.id = r.ref_id
);
----
0

# Insert matches for all left rows using generate_series
statement ok
INSERT INTO lj_emp_r SELECT id, id*10 FROM generate_series(1,3) t(id);

statement ok
PRAGMA refresh('lj_empty_right');

query I
SELECT COUNT(*) FROM (
    SELECT l.name, r.score FROM lj_emp_l l LEFT JOIN lj_emp_r r ON l.id = r.ref_id
    EXCEPT ALL
    SELECT * FROM lj_empty_right
);
----
0

query I
SELECT COUNT(*) FROM (
    SELECT * FROM lj_empty_right
    EXCEPT ALL
    SELECT l.name, r.score FROM lj_emp_l l LEFT JOIN lj_emp_r r ON l.id = r.ref_id
);
----
0

# Delete all from right — all rows back to NULL-extended
statement ok
DELETE FROM lj_emp_r;

statement ok
PRAGMA refresh('lj_empty_right');

query I
SELECT COUNT(*) FROM (
    SELECT l.name, r.score FROM lj_emp_l l LEFT JOIN lj_emp_r r ON l.id = r.ref_id
    EXCEPT ALL
    SELECT * FROM lj_empty_right
);
----
0

query I
SELECT COUNT(*) FROM (
    SELECT * FROM lj_empty_right
    EXCEPT ALL
    SELECT l.name, r.score FROM lj_emp_l l LEFT JOIN lj_emp_r r ON l.id = r.ref_id
);
----
0

# ==========================================
# Right side empty → repopulated with different values
# ==========================================

statement ok
CREATE TABLE lj_repop_l (id INT, name VARCHAR);

statement ok
CREATE TABLE lj_repop_r (ref_id INT, score INT);

statement ok
INSERT INTO lj_repop_l VALUES (1, 'Alice'), (2, 'Bob'), (3, 'Carol');

statement ok
INSERT INTO lj_repop_r VALUES (1, 100), (2, 200), (3, 300);

statement ok
CREATE MATERIALIZED VIEW lj_repop AS
    SELECT l.name, r.score FROM lj_repop_l l LEFT JOIN lj_repop_r r ON l.id = r.ref_id;

# DELETE all right side → all NULL-extended
statement ok
DELETE FROM lj_repop_r;

statement ok
PRAGMA refresh('lj_repop');

query I
SELECT COUNT(*) FROM (
    SELECT l.name, r.score FROM lj_repop_l l LEFT JOIN lj_repop_r r ON l.id = r.ref_id
    EXCEPT ALL SELECT * FROM lj_repop
);
----
0

query I
SELECT COUNT(*) FROM (
    SELECT * FROM lj_repop
    EXCEPT ALL SELECT l.name, r.score FROM lj_repop_l l LEFT JOIN lj_repop_r r ON l.id = r.ref_id
);
----
0

# Repopulate with DIFFERENT matches (only ids 1 and 3, not 2)
statement ok
INSERT INTO lj_repop_r VALUES (1, 999), (3, 777);

statement ok
PRAGMA refresh('lj_repop');

query I
SELECT COUNT(*) FROM (
    SELECT l.name, r.score FROM lj_repop_l l LEFT JOIN lj_repop_r r ON l.id = r.ref_id
    EXCEPT ALL SELECT * FROM lj_repop
);
----
0

query I
SELECT COUNT(*) FROM (
    SELECT * FROM lj_repop
    EXCEPT ALL SELECT l.name, r.score FROM lj_repop_l l LEFT JOIN lj_repop_r r ON l.id = r.ref_id
);
----
0

# ==========================================
# LEFT JOIN aggregate: incremental MERGE (Larson & Zhou)
# Tests NULL↔value transitions with openivm_match_count
# ==========================================

statement ok
CREATE TABLE lj_cust (id INT, name VARCHAR);

statement ok
CREATE TABLE lj_ord (id INT, cust_id INT, amount INT);

statement ok
INSERT INTO lj_cust VALUES (1,'Alice'), (2,'Bob'), (3,'Carol');

statement ok
INSERT INTO lj_ord VALUES (1,1,100), (2,1,200), (3,2,150);

statement ok
CREATE MATERIALIZED VIEW mv_lj_agg AS
    SELECT c.name, SUM(o.amount) as total, COUNT(o.amount) as cnt
    FROM lj_cust c LEFT JOIN lj_ord o ON c.id = o.cust_id
    GROUP BY c.name;

# Initial: Carol has NULL total, cnt=0 (no orders)
query III
SELECT name, total, cnt FROM mv_lj_agg ORDER BY name;
----
Alice	300	2
Bob	150	1
Carol	NULL	0

# --- NULL→value transition: insert order for Carol ---
statement ok
INSERT INTO lj_ord VALUES (4,3,500);

statement ok
PRAGMA refresh('mv_lj_agg');

query I
SELECT count(*) FROM (
    SELECT c.name, SUM(o.amount), COUNT(o.amount)
    FROM lj_cust c LEFT JOIN lj_ord o ON c.id = o.cust_id GROUP BY c.name
    EXCEPT ALL SELECT * FROM mv_lj_agg
);
----
0

query I
SELECT count(*) FROM (
    SELECT * FROM mv_lj_agg
    EXCEPT ALL SELECT c.name, SUM(o.amount), COUNT(o.amount)
    FROM lj_cust c LEFT JOIN lj_ord o ON c.id = o.cust_id GROUP BY c.name
);
----
0

# --- value→NULL transition: delete Carol's orders ---
statement ok
DELETE FROM lj_ord WHERE cust_id = 3;

statement ok
PRAGMA refresh('mv_lj_agg');

# Carol should still exist with NULL/0
query III
SELECT name, total, cnt FROM mv_lj_agg ORDER BY name;
----
Alice	300	2
Bob	150	1
Carol	NULL	0

query I
SELECT count(*) FROM (
    SELECT c.name, SUM(o.amount), COUNT(o.amount)
    FROM lj_cust c LEFT JOIN lj_ord o ON c.id = o.cust_id GROUP BY c.name
    EXCEPT ALL SELECT * FROM mv_lj_agg
);
----
0

query I
SELECT count(*) FROM (
    SELECT * FROM mv_lj_agg
    EXCEPT ALL SELECT c.name, SUM(o.amount), COUNT(o.amount)
    FROM lj_cust c LEFT JOIN lj_ord o ON c.id = o.cust_id GROUP BY c.name
);
----
0

# --- Mixed DML: inserts + deletes on both sides ---
statement ok
INSERT INTO lj_ord VALUES (5,1,50), (6,3,200), (7,2,300);

statement ok
DELETE FROM lj_ord WHERE id = 2;

statement ok
PRAGMA refresh('mv_lj_agg');

query I
SELECT count(*) FROM (
    SELECT c.name, SUM(o.amount), COUNT(o.amount)
    FROM lj_cust c LEFT JOIN lj_ord o ON c.id = o.cust_id GROUP BY c.name
    EXCEPT ALL SELECT * FROM mv_lj_agg
);
----
0

query I
SELECT count(*) FROM (
    SELECT * FROM mv_lj_agg
    EXCEPT ALL SELECT c.name, SUM(o.amount), COUNT(o.amount)
    FROM lj_cust c LEFT JOIN lj_ord o ON c.id = o.cust_id GROUP BY c.name
);
----
0

# --- Fallback: disable flag, should use group-recompute ---
statement ok
SET openivm_left_join_merge = false;

statement ok
INSERT INTO lj_ord VALUES (8,3,100);

statement ok
PRAGMA refresh('mv_lj_agg');

query I
SELECT count(*) FROM (
    SELECT c.name, SUM(o.amount), COUNT(o.amount)
    FROM lj_cust c LEFT JOIN lj_ord o ON c.id = o.cust_id GROUP BY c.name
    EXCEPT ALL SELECT * FROM mv_lj_agg
);
----
0

statement ok
SET openivm_left_join_merge = true;

# --- COUNT(*) on unmatched groups survives no-op UPDATE (q0059 regression) ---
# Bug: the LJ MERGE applied `CASE mc_new > 0 THEN update ELSE null_val` to
# count_star, zeroing it on unmatched groups. But count_star counts the
# NULL-padded LJ output rows and is left-side-driven — it must not be reset
# when match_count stays at 0. Ensures an UPDATE on an unmatched left-side
# row's non-key column doesn't zero count_star.

statement ok
CREATE TABLE lj_left (k INT, extra INT);

statement ok
CREATE TABLE lj_right (k INT, v INT);

statement ok
INSERT INTO lj_left VALUES (1,10), (2,20), (3,30);

statement ok
INSERT INTO lj_right VALUES (1,100);

statement ok
CREATE MATERIALIZED VIEW mv_lj_cstar AS
    SELECT l.k, COUNT(*) AS n
    FROM lj_left l LEFT JOIN lj_right r ON l.k = r.k
    GROUP BY l.k;

query I
SELECT count(*) FROM (
    SELECT * FROM mv_lj_cstar
    EXCEPT ALL SELECT l.k, COUNT(*) FROM lj_left l LEFT JOIN lj_right r ON l.k = r.k GROUP BY l.k
);
----
0

query I
SELECT count(*) FROM (
    SELECT l.k, COUNT(*) FROM lj_left l LEFT JOIN lj_right r ON l.k = r.k GROUP BY l.k
    EXCEPT ALL SELECT * FROM mv_lj_cstar
);
----
0

statement ok
UPDATE lj_left SET extra = 200 WHERE k = 2;

statement ok
PRAGMA refresh('mv_lj_cstar');

query I
SELECT count(*) FROM (
    SELECT * FROM mv_lj_cstar
    EXCEPT ALL SELECT l.k, COUNT(*) FROM lj_left l LEFT JOIN lj_right r ON l.k = r.k GROUP BY l.k
);
----
0

query I
SELECT count(*) FROM (
    SELECT l.k, COUNT(*) FROM lj_left l LEFT JOIN lj_right r ON l.k = r.k GROUP BY l.k
    EXCEPT ALL SELECT * FROM mv_lj_cstar
);
----
0

statement ok
UPDATE lj_left SET extra = 300 WHERE k = 1;

statement ok
PRAGMA refresh('mv_lj_cstar');

query I
SELECT count(*) FROM (
    SELECT * FROM mv_lj_cstar
    EXCEPT ALL SELECT l.k, COUNT(*) FROM lj_left l LEFT JOIN lj_right r ON l.k = r.k GROUP BY l.k
);
----
0

query I
SELECT count(*) FROM (
    SELECT l.k, COUNT(*) FROM lj_left l LEFT JOIN lj_right r ON l.k = r.k GROUP BY l.k
    EXCEPT ALL SELECT * FROM mv_lj_cstar
);
----
0

# Fix E — LEFT/RIGHT/OUTER JOIN aggregate with COALESCE-wrapped aggregate or
# non-pass-through projection. The Larson & Zhou MERGE assumes raw
# SUM(NULL)=NULL semantics when match_count=0, which produces the wrong value
# for SUM(COALESCE(x, 0)) (expects 0) or COALESCE(SUM(x), 0) (expects 0 at
# the wrapper). The parser detects non-BCR aggregate arguments or non-BCR
# projection expressions over aggregate output and routes these to
# group-recompute (found_minmax=true).

# query_1502 shape: COALESCE wraps the SUM in the projection.
statement ok
CREATE TABLE fixe_stock (sw INT, si INT, sq INT);

statement ok
INSERT INTO fixe_stock VALUES (1, 100, 10), (1, 200, 20), (2, 100, 30);

statement ok
CREATE TABLE fixe_ol (olw INT, oli INT, oln INT, olq INT);

statement ok
INSERT INTO fixe_ol VALUES (1, 100, 1, 5), (1, 100, 2, 3);

statement ok
CREATE MATERIALIZED VIEW fixe_mv AS SELECT s.sw, s.si, s.sq, COUNT(ol.oln) AS sales, COALESCE(SUM(ol.olq), 0) AS ordered FROM fixe_stock s LEFT JOIN fixe_ol ol ON s.si = ol.oli AND s.sw = ol.olw GROUP BY s.sw, s.si, s.sq;

statement ok
INSERT INTO fixe_ol VALUES (2, 100, 1, 100);

statement ok
INSERT INTO fixe_stock VALUES (1, 300, 40);

statement ok
UPDATE fixe_ol SET olq = 7 WHERE oli = 100 AND olw = 1 AND oln = 1;

statement ok
DELETE FROM fixe_ol WHERE oli = 100 AND olw = 1 AND oln = 2;

statement ok
PRAGMA refresh('fixe_mv');

query I
SELECT count(*) FROM (SELECT * FROM fixe_mv EXCEPT ALL SELECT s.sw, s.si, s.sq, COUNT(ol.oln), COALESCE(SUM(ol.olq), 0) FROM fixe_stock s LEFT JOIN fixe_ol ol ON s.si = ol.oli AND s.sw = ol.olw GROUP BY s.sw, s.si, s.sq);
----
0

query I
SELECT count(*) FROM (SELECT s.sw, s.si, s.sq, COUNT(ol.oln), COALESCE(SUM(ol.olq), 0) FROM fixe_stock s LEFT JOIN fixe_ol ol ON s.si = ol.oli AND s.sw = ol.olw GROUP BY s.sw, s.si, s.sq EXCEPT ALL SELECT * FROM fixe_mv);
----
0

# query_1696/1699 shape: SUM(COALESCE(h.col, 0)) + AVG(h.col) — COALESCE
# inside the aggregate argument, plus AVG on the same null-padded column.
statement ok
CREATE TABLE fixe_c (cid INT, cw INT);

statement ok
INSERT INTO fixe_c VALUES (100, 1), (101, 1), (200, 2);

statement ok
CREATE TABLE fixe_h (hcid INT, hcw INT, hamt DECIMAL(6,2));

statement ok
INSERT INTO fixe_h VALUES (100, 1, 50), (100, 1, 25);

statement ok
CREATE MATERIALIZED VIEW fixe_mv2 AS SELECT c.cid, COUNT(*) AS n, SUM(COALESCE(h.hamt, 0)) AS tot, AVG(h.hamt) AS avg_val FROM fixe_c c LEFT JOIN fixe_h h ON c.cid = h.hcid AND c.cw = h.hcw GROUP BY c.cid;

statement ok
INSERT INTO fixe_h VALUES (101, 1, 30);

statement ok
INSERT INTO fixe_c VALUES (201, 2);

statement ok
UPDATE fixe_h SET hamt = 60 WHERE hcid = 100 AND hamt = 50;

statement ok
DELETE FROM fixe_h WHERE hcid = 100 AND hamt = 25;

statement ok
PRAGMA refresh('fixe_mv2');

query I
SELECT count(*) FROM (SELECT * FROM fixe_mv2 EXCEPT ALL SELECT c.cid, COUNT(*), SUM(COALESCE(h.hamt, 0))::DECIMAL(38,2), AVG(h.hamt)::DOUBLE FROM fixe_c c LEFT JOIN fixe_h h ON c.cid = h.hcid AND c.cw = h.hcw GROUP BY c.cid);
----
0

query I
SELECT count(*) FROM (SELECT c.cid, COUNT(*), SUM(COALESCE(h.hamt, 0))::DECIMAL(38,2), AVG(h.hamt)::DOUBLE FROM fixe_c c LEFT JOIN fixe_h h ON c.cid = h.hcid AND c.cw = h.hcw GROUP BY c.cid EXCEPT ALL SELECT * FROM fixe_mv2);
----
0


# ============================================================
# Multi-LEFT-JOIN cascade: deeper-right delta must propagate
# (regression — pre-fix the global DemoteLeftJoins collapsed
# every LJ in the IE term to INNER, so a Δ in the rightmost
# table never reached openivm_left_key for keys whose intermediate
# LJ produced NULL — the affected rows stayed stale.)
# ============================================================

statement ok
CREATE TABLE mlc_base (k INT, v INT);

statement ok
CREATE TABLE mlc_d1 (k INT, x1 INT);

statement ok
CREATE TABLE mlc_d2 (k INT, x2 INT);

statement ok
CREATE TABLE mlc_d3 (k INT, x3 INT);

statement ok
INSERT INTO mlc_base VALUES (1, 10), (2, 20);

statement ok
INSERT INTO mlc_d1 VALUES (1, 1);

statement ok
INSERT INTO mlc_d2 VALUES (1, 2);

statement ok
INSERT INTO mlc_d3 VALUES (1, 3);

statement ok
CREATE MATERIALIZED VIEW mlc_mv AS
    SELECT b.k, b.v, mlc_d1.x1, mlc_d2.x2, mlc_d3.x3
    FROM mlc_base b
    LEFT JOIN mlc_d1 ON b.k = mlc_d1.k
    LEFT JOIN mlc_d2 ON b.k = mlc_d2.k
    LEFT JOIN mlc_d3 ON b.k = mlc_d3.k;

# Deeper-right Δ for an existing-but-unmatched base key:
#   k=2 has no d1/d2/d3 row → MV row was (2,20,NULL,NULL,NULL).
#   After inserting matching rows in d2 only, MV row should
#   become (2,20,NULL,22,NULL).
statement ok
INSERT INTO mlc_d2 VALUES (2, 22);

statement ok
PRAGMA refresh('mlc_mv');

query I
SELECT COUNT(*) FROM (
    SELECT b.k, b.v, mlc_d1.x1, mlc_d2.x2, mlc_d3.x3
    FROM mlc_base b LEFT JOIN mlc_d1 ON b.k = mlc_d1.k
    LEFT JOIN mlc_d2 ON b.k = mlc_d2.k LEFT JOIN mlc_d3 ON b.k = mlc_d3.k
    EXCEPT ALL SELECT * FROM mlc_mv
);
----
0

query I
SELECT COUNT(*) FROM (
    SELECT * FROM mlc_mv
    EXCEPT ALL
    SELECT b.k, b.v, mlc_d1.x1, mlc_d2.x2, mlc_d3.x3
    FROM mlc_base b LEFT JOIN mlc_d1 ON b.k = mlc_d1.k
    LEFT JOIN mlc_d2 ON b.k = mlc_d2.k LEFT JOIN mlc_d3 ON b.k = mlc_d3.k
);
----
0

# Mixed Δ across multiple right-side tables in one refresh,
# including a brand-new base key (3) and another previously
# unmatched key (2) that picks up matches in some but not all
# right tables.
statement ok
INSERT INTO mlc_base VALUES (3, 30);

statement ok
INSERT INTO mlc_d3 VALUES (3, 33);

statement ok
INSERT INTO mlc_d1 VALUES (2, 21);

statement ok
PRAGMA refresh('mlc_mv');

query I
SELECT COUNT(*) FROM (
    SELECT b.k, b.v, mlc_d1.x1, mlc_d2.x2, mlc_d3.x3
    FROM mlc_base b LEFT JOIN mlc_d1 ON b.k = mlc_d1.k
    LEFT JOIN mlc_d2 ON b.k = mlc_d2.k LEFT JOIN mlc_d3 ON b.k = mlc_d3.k
    EXCEPT ALL SELECT * FROM mlc_mv
);
----
0

query I
SELECT COUNT(*) FROM (
    SELECT * FROM mlc_mv
    EXCEPT ALL
    SELECT b.k, b.v, mlc_d1.x1, mlc_d2.x2, mlc_d3.x3
    FROM mlc_base b LEFT JOIN mlc_d1 ON b.k = mlc_d1.k
    LEFT JOIN mlc_d2 ON b.k = mlc_d2.k LEFT JOIN mlc_d3 ON b.k = mlc_d3.k
);
----
0

# Delete from a deeper-right table: the matched MV row should
# revert to NULL on that side.
statement ok
DELETE FROM mlc_d2 WHERE k = 1;

statement ok
PRAGMA refresh('mlc_mv');

query I
SELECT COUNT(*) FROM (
    SELECT b.k, b.v, mlc_d1.x1, mlc_d2.x2, mlc_d3.x3
    FROM mlc_base b LEFT JOIN mlc_d1 ON b.k = mlc_d1.k
    LEFT JOIN mlc_d2 ON b.k = mlc_d2.k LEFT JOIN mlc_d3 ON b.k = mlc_d3.k
    EXCEPT ALL SELECT * FROM mlc_mv
);
----
0

query I
SELECT COUNT(*) FROM (
    SELECT * FROM mlc_mv
    EXCEPT ALL
    SELECT b.k, b.v, mlc_d1.x1, mlc_d2.x2, mlc_d3.x3
    FROM mlc_base b LEFT JOIN mlc_d1 ON b.k = mlc_d1.k
    LEFT JOIN mlc_d2 ON b.k = mlc_d2.k LEFT JOIN mlc_d3 ON b.k = mlc_d3.k
);
----
0

# Regression: a LEFT JOIN beneath a UNION ALL cannot get the outer-join match-count rewrite
# (it would break set-op branch arity), so the view must be routed to FULL_REFRESH and recompute
# correctly — NOT left as an incremental projection with missing match-count state (which produced
# wrong results: EXCEPT ALL fwd=1/rev=2 before the fix).
statement ok
CREATE TABLE ljua_a(k INT, va INT);

statement ok
CREATE TABLE ljua_b(k INT, vb INT);

statement ok
CREATE TABLE ljua_c(k INT, vc INT);

statement ok
CREATE TABLE ljua_d(k INT, vd INT);

statement ok
INSERT INTO ljua_a VALUES (1,1),(2,2);

statement ok
INSERT INTO ljua_b VALUES (1,10);

statement ok
INSERT INTO ljua_c VALUES (3,3);

statement ok
INSERT INTO ljua_d VALUES (3,30);

statement ok
CREATE MATERIALIZED VIEW mv_ljua AS
    SELECT ljua_a.k, ljua_b.vb FROM ljua_a LEFT JOIN ljua_b USING(k)
    UNION ALL
    SELECT ljua_c.k, ljua_d.vd FROM ljua_c LEFT JOIN ljua_d USING(k);

# Outer join beneath UNION ALL → FULL_REFRESH (type 3)
query I
SELECT type FROM openivm_views WHERE view_name = 'mv_ljua';
----
3

# Batched conflicting DML across all four sources before a single refresh
statement ok
INSERT INTO ljua_b VALUES (2,20);

statement ok
DELETE FROM ljua_b WHERE k=1;

statement ok
INSERT INTO ljua_a VALUES (4,4);

statement ok
DELETE FROM ljua_d WHERE k=3;

statement ok
PRAGMA refresh('mv_ljua');

query I
SELECT COUNT(*) FROM (
    (SELECT ljua_a.k, ljua_b.vb FROM ljua_a LEFT JOIN ljua_b USING(k)
     UNION ALL SELECT ljua_c.k, ljua_d.vd FROM ljua_c LEFT JOIN ljua_d USING(k))
    EXCEPT ALL SELECT * FROM mv_ljua
);
----
0

query I
SELECT COUNT(*) FROM (
    SELECT * FROM mv_ljua
    EXCEPT ALL
    (SELECT ljua_a.k, ljua_b.vb FROM ljua_a LEFT JOIN ljua_b USING(k)
     UNION ALL SELECT ljua_c.k, ljua_d.vd FROM ljua_c LEFT JOIN ljua_d USING(k))
);
----
0

# A grouped aggregate above LEFT JOINs beneath UNION ALL can avoid the hidden match-count
# rewrite and use current-diff group recompute instead.
statement ok
CREATE TABLE ljua_ag_a(k INT, va INT);

statement ok
CREATE TABLE ljua_ag_b(k INT, vb INT);

statement ok
CREATE TABLE ljua_ag_c(k INT, vc INT);

statement ok
CREATE TABLE ljua_ag_d(k INT, vd INT);

statement ok
INSERT INTO ljua_ag_a VALUES (1,1),(2,2);

statement ok
INSERT INTO ljua_ag_b VALUES (1,10);

statement ok
INSERT INTO ljua_ag_c VALUES (3,3);

statement ok
INSERT INTO ljua_ag_d VALUES (3,30);

statement ok
CREATE MATERIALIZED VIEW mv_ljua_ag AS
    SELECT k, SUM(v) AS total_v, MIN(vb) AS min_vb, COUNT(*) AS row_count
    FROM (
        SELECT ljua_ag_a.k, COALESCE(ljua_ag_b.vb, 0) AS v, ljua_ag_b.vb
        FROM ljua_ag_a LEFT JOIN ljua_ag_b USING(k)
        UNION ALL
        SELECT ljua_ag_c.k, COALESCE(ljua_ag_d.vd, 0) AS v, ljua_ag_d.vd AS vb
        FROM ljua_ag_c LEFT JOIN ljua_ag_d USING(k)
    ) u
    GROUP BY k
    HAVING COUNT(*) >= 0;

query IT
SELECT type, group_recompute_affected_mode FROM openivm_views WHERE view_name = 'mv_ljua_ag';
----
6	current_diff

# Batched conflicting DML changes both old and new output groups before one refresh.
statement ok
INSERT INTO ljua_ag_b VALUES (2,20);

statement ok
DELETE FROM ljua_ag_b WHERE k=1;

statement ok
INSERT INTO ljua_ag_a VALUES (4,4);

statement ok
DELETE FROM ljua_ag_d WHERE k=3;

statement ok
PRAGMA refresh('mv_ljua_ag');

query I
SELECT COUNT(*) FROM (
    (SELECT k, SUM(v) AS total_v, MIN(vb) AS min_vb, COUNT(*) AS row_count
     FROM (
         SELECT ljua_ag_a.k, COALESCE(ljua_ag_b.vb, 0) AS v, ljua_ag_b.vb
         FROM ljua_ag_a LEFT JOIN ljua_ag_b USING(k)
         UNION ALL
         SELECT ljua_ag_c.k, COALESCE(ljua_ag_d.vd, 0) AS v, ljua_ag_d.vd AS vb
         FROM ljua_ag_c LEFT JOIN ljua_ag_d USING(k)
     ) u
     GROUP BY k
     HAVING COUNT(*) >= 0)
    EXCEPT ALL SELECT * FROM mv_ljua_ag
);
----
0

query I
SELECT COUNT(*) FROM (
    SELECT * FROM mv_ljua_ag
    EXCEPT ALL
    (SELECT k, SUM(v) AS total_v, MIN(vb) AS min_vb, COUNT(*) AS row_count
     FROM (
         SELECT ljua_ag_a.k, COALESCE(ljua_ag_b.vb, 0) AS v, ljua_ag_b.vb
         FROM ljua_ag_a LEFT JOIN ljua_ag_b USING(k)
         UNION ALL
         SELECT ljua_ag_c.k, COALESCE(ljua_ag_d.vd, 0) AS v, ljua_ag_d.vd AS vb
         FROM ljua_ag_c LEFT JOIN ljua_ag_d USING(k)
     ) u
     GROUP BY k
     HAVING COUNT(*) >= 0)
);
----
0

# ============================================================
# LEFT JOIN with a table-function / VALUES preserved side and a
# cast or derived (EXTRACT) join key.
# Regression: RewriteOuterJoinSupport's ReadColumnRefBinding only read a bare
# BOUND_COLUMN_REF, so a CAST/EXTRACT-wrapped null-side key left the match-count
# binding at the default ColumnBinding (INVALID_INDEX), which then could not be
# serialized by LPTS (NotImplementedException). Now the inner column ref is
# unwrapped. The generate_series/range/VALUES side is constant; only the base
# table produces deltas.
# ============================================================

statement ok
CREATE TABLE tflj_cust (C_ID INT, C_W_ID INT);

statement ok
INSERT INTO tflj_cust VALUES (1,1),(2,2),(3,3),(4,1),(5,2);

# (a) cast on the null-side equi key (INT col = BIGINT series)
statement ok
CREATE MATERIALIZED VIEW tflj_cast_mv AS
  SELECT s AS wid, COUNT(c.C_ID) AS cust_count
  FROM generate_series(1, 5) t(s) LEFT JOIN tflj_cust c ON c.C_W_ID = t.s GROUP BY s;

# (b) EXTRACT-derived null-side key
statement ok
CREATE TABLE tflj_ord (O_ID INT, O_ENTRY_D TIMESTAMP);

statement ok
INSERT INTO tflj_ord VALUES (1,'2024-01-15'),(2,'2024-03-20'),(3,'2024-03-25');

statement ok
CREATE MATERIALIZED VIEW tflj_extract_mv AS
  SELECT g.m AS month_num, COUNT(o.O_ID) AS orders
  FROM generate_series(1, 12) g(m) LEFT JOIN tflj_ord o ON EXTRACT(MONTH FROM o.O_ENTRY_D) = g.m GROUP BY g.m;

# (c) inequality null-side key with a cast, over VALUES
statement ok
CREATE MATERIALIZED VIEW tflj_ineq_mv AS
  SELECT m.lbl, COUNT(c.C_ID) AS customers
  FROM (VALUES (1,'a'),(2,'b'),(3,'c')) AS m(thr, lbl) LEFT JOIN tflj_cust c ON c.C_W_ID <= m.thr GROUP BY m.lbl;

# Batch conflicting DML across both base tables before one refresh.
statement ok
INSERT INTO tflj_cust VALUES (6,3),(7,1),(8,5);

statement ok
DELETE FROM tflj_cust WHERE C_ID=2;

statement ok
UPDATE tflj_cust SET C_W_ID=4 WHERE C_ID=4;

statement ok
INSERT INTO tflj_ord VALUES (4,'2024-03-10'),(5,'2024-05-05');

statement ok
DELETE FROM tflj_ord WHERE O_ID=1;

statement ok
UPDATE tflj_ord SET O_ENTRY_D='2024-03-28' WHERE O_ID=3;

statement ok
PRAGMA refresh('tflj_cast_mv');

statement ok
PRAGMA refresh('tflj_extract_mv');

statement ok
PRAGMA refresh('tflj_ineq_mv');

# (a) cast — EXCEPT ALL both directions
query I
SELECT COUNT(*) FROM (
  (SELECT s AS wid, COUNT(c.C_ID) AS cust_count FROM generate_series(1, 5) t(s) LEFT JOIN tflj_cust c ON c.C_W_ID = t.s GROUP BY s)
  EXCEPT ALL SELECT * FROM tflj_cast_mv
);
----
0

query I
SELECT COUNT(*) FROM (
  SELECT * FROM tflj_cast_mv
  EXCEPT ALL (SELECT s AS wid, COUNT(c.C_ID) AS cust_count FROM generate_series(1, 5) t(s) LEFT JOIN tflj_cust c ON c.C_W_ID = t.s GROUP BY s)
);
----
0

# (b) EXTRACT — EXCEPT ALL both directions
query I
SELECT COUNT(*) FROM (
  (SELECT g.m AS month_num, COUNT(o.O_ID) AS orders FROM generate_series(1, 12) g(m) LEFT JOIN tflj_ord o ON EXTRACT(MONTH FROM o.O_ENTRY_D) = g.m GROUP BY g.m)
  EXCEPT ALL SELECT * FROM tflj_extract_mv
);
----
0

query I
SELECT COUNT(*) FROM (
  SELECT * FROM tflj_extract_mv
  EXCEPT ALL (SELECT g.m AS month_num, COUNT(o.O_ID) AS orders FROM generate_series(1, 12) g(m) LEFT JOIN tflj_ord o ON EXTRACT(MONTH FROM o.O_ENTRY_D) = g.m GROUP BY g.m)
);
----
0

# (c) inequality over VALUES — EXCEPT ALL both directions
query I
SELECT COUNT(*) FROM (
  (SELECT m.lbl, COUNT(c.C_ID) AS customers FROM (VALUES (1,'a'),(2,'b'),(3,'c')) AS m(thr, lbl) LEFT JOIN tflj_cust c ON c.C_W_ID <= m.thr GROUP BY m.lbl)
  EXCEPT ALL SELECT * FROM tflj_ineq_mv
);
----
0

query I
SELECT COUNT(*) FROM (
  SELECT * FROM tflj_ineq_mv
  EXCEPT ALL (SELECT m.lbl, COUNT(c.C_ID) AS customers FROM (VALUES (1,'a'),(2,'b'),(3,'c')) AS m(thr, lbl) LEFT JOIN tflj_cust c ON c.C_W_ID <= m.thr GROUP BY m.lbl)
);
----
0
