# name: test/sql/left_join_pipeline_secondary_delta.test
# description: LEFT JOIN pipeline aggregate over a preserved/intermediate-side column must stay correct under
# group: [sql]

#              inner-table deletes (Larson & Zhou secondary deltas). Deleting an order's last line must re-insert
#              the NULL-padded row so COUNT(o.oid) still counts that order. Regression for the secondary-delta bug.

require openivm

statement ok
SET openivm_cascade_refresh = 'off';

# ============================================================
# Setup: cust (preserved) LEFT JOIN ord (intermediate) LEFT JOIN line (inner)
#   n_ord = COUNT(o.oid)  <- aggregate over the INTERMEDIATE preserved-side column (the buggy case)
#   n_line = COUNT(l.lid), rev = SUM(l.amt)  <- inner-side aggregates
# ============================================================

statement ok
CREATE TABLE cust (cid INT, nation VARCHAR);

statement ok
CREATE TABLE ord (oid INT, cid INT);

statement ok
CREATE TABLE line (lid INT, oid INT, amt INT);

statement ok
INSERT INTO cust VALUES (1,'A'),(2,'A'),(3,'B');

# c1 -> o10,o11 ; c2 -> o12 ; c3 -> (no orders)
statement ok
INSERT INTO ord VALUES (10,1),(11,1),(12,2);

# o10 has 2 lines, o11 has 1 line, o12 has NO lines (already NULL-padded)
statement ok
INSERT INTO line VALUES (100,10,5),(101,10,7),(102,11,9);

statement ok
CREATE MATERIALIZED VIEW mv AS
    SELECT c.nation, COUNT(o.oid) AS n_ord, COUNT(l.lid) AS n_line, SUM(l.amt) AS rev
    FROM cust c
    LEFT JOIN ord o ON o.cid = c.cid
    LEFT JOIN line l ON l.oid = o.oid
    GROUP BY c.nation;

# initial cross-check (both directions)
query I
SELECT COUNT(*) FROM (
    SELECT c.nation, COUNT(o.oid) AS n_ord, COUNT(l.lid) AS n_line, SUM(l.amt) AS rev
    FROM cust c LEFT JOIN ord o ON o.cid=c.cid LEFT JOIN line l ON l.oid=o.oid GROUP BY c.nation
    EXCEPT ALL SELECT nation, n_ord, n_line, rev FROM mv
);
----
0

query I
SELECT COUNT(*) FROM (
    SELECT nation, n_ord, n_line, rev FROM mv
    EXCEPT ALL
    SELECT c.nation, COUNT(o.oid), COUNT(l.lid), SUM(l.amt)
    FROM cust c LEFT JOIN ord o ON o.cid=c.cid LEFT JOIN line l ON l.oid=o.oid GROUP BY c.nation
);
----
0

# ============================================================
# Batched mixed DML before ONE refresh (exercises secondary deltas in BOTH directions):
#   - DELETE line 102  -> o11 loses its LAST line   => NULL-padded (A,o11,NULL) reappears; COUNT(o.oid) must NOT drop
#   - INSERT line 103  -> o12 gains its FIRST line  => NULL-padded (A,o12,NULL) removed, real row added
#   - DELETE line 100  -> o10 still has l101        => no secondary delta, just n_line/rev drop
#   - INSERT ord 13    -> c3 (B) gains an order with no lines => (B,o13,NULL)
#   - INSERT cust 4    -> new B customer, no orders  => (B,NULL,NULL)
# ============================================================

statement ok
DELETE FROM line WHERE lid = 102;

statement ok
INSERT INTO line VALUES (103, 12, 4);

statement ok
DELETE FROM line WHERE lid = 100;

statement ok
INSERT INTO ord VALUES (13, 3);

statement ok
INSERT INTO cust VALUES (4, 'B');

statement ok
PRAGMA refresh('mv');

# cross-check both directions after the batched refresh
query I
SELECT COUNT(*) FROM (
    SELECT c.nation, COUNT(o.oid) AS n_ord, COUNT(l.lid) AS n_line, SUM(l.amt) AS rev
    FROM cust c LEFT JOIN ord o ON o.cid=c.cid LEFT JOIN line l ON l.oid=o.oid GROUP BY c.nation
    EXCEPT ALL SELECT nation, n_ord, n_line, rev FROM mv
);
----
0

query I
SELECT COUNT(*) FROM (
    SELECT nation, n_ord, n_line, rev FROM mv
    EXCEPT ALL
    SELECT c.nation, COUNT(o.oid), COUNT(l.lid), SUM(l.amt)
    FROM cust c LEFT JOIN ord o ON o.cid=c.cid LEFT JOIN line l ON l.oid=o.oid GROUP BY c.nation
);
----
0

# ============================================================
# Second batch: drive an order's line count back up and another down, plus a delete of a whole order
# ============================================================

statement ok
INSERT INTO line VALUES (104, 11, 3), (105, 13, 8);


statement ok
DELETE FROM line WHERE lid = 101;

statement ok
DELETE FROM ord WHERE oid = 12;

statement ok
PRAGMA refresh('mv');

query I
SELECT COUNT(*) FROM (
    SELECT c.nation, COUNT(o.oid) AS n_ord, COUNT(l.lid) AS n_line, SUM(l.amt) AS rev
    FROM cust c LEFT JOIN ord o ON o.cid=c.cid LEFT JOIN line l ON l.oid=o.oid GROUP BY c.nation
    EXCEPT ALL SELECT nation, n_ord, n_line, rev FROM mv
);
----
0

query I
SELECT COUNT(*) FROM (
    SELECT nation, n_ord, n_line, rev FROM mv
    EXCEPT ALL
    SELECT c.nation, COUNT(o.oid), COUNT(l.lid), SUM(l.amt)
    FROM cust c LEFT JOIN ord o ON o.cid=c.cid LEFT JOIN line l ON l.oid=o.oid GROUP BY c.nation
);
----
0

# ============================================================
# Third batch: preserved-side row that is BRAND NEW in the same batch as its first inner row.
# ord 20 is inserted AND immediately gets its first line, all before one refresh. No NULL-padded
# (B,o20,NULL) row was ever materialized, so the secondary-delta correction must NOT fire for it
# (firing would subtract a dangling row that never existed). Also covers the same-batch churn case:
# ord 21 is inserted with a line and then both are deleted again (net effect: never existed).
# ============================================================

statement ok
INSERT INTO ord VALUES (20, 3);

statement ok
INSERT INTO line VALUES (200, 20, 11);

statement ok
INSERT INTO ord VALUES (21, 3);

statement ok
INSERT INTO line VALUES (201, 21, 6);

statement ok
DELETE FROM line WHERE lid = 201;

statement ok
DELETE FROM ord WHERE oid = 21;

statement ok
PRAGMA refresh('mv');

query I
SELECT COUNT(*) FROM (
    SELECT c.nation, COUNT(o.oid) AS n_ord, COUNT(l.lid) AS n_line, SUM(l.amt) AS rev
    FROM cust c LEFT JOIN ord o ON o.cid=c.cid LEFT JOIN line l ON l.oid=o.oid GROUP BY c.nation
    EXCEPT ALL SELECT nation, n_ord, n_line, rev FROM mv
);
----
0

query I
SELECT COUNT(*) FROM (
    SELECT nation, n_ord, n_line, rev FROM mv
    EXCEPT ALL
    SELECT c.nation, COUNT(o.oid), COUNT(l.lid), SUM(l.amt)
    FROM cust c LEFT JOIN ord o ON o.cid=c.cid LEFT JOIN line l ON l.oid=o.oid GROUP BY c.nation
);
----
0

# ============================================================
# Fourth batch: an order's LAST line and the order ITSELF deleted together in one batch (the
# downward-transition double-count case). ord 20 loses line 200 and is deleted at the same time, so
# the kept-outer-join term must not emit a phantom NULL-padded (B,o20,NULL) row on top of the real
# removal supplied by the higher-order term. Simultaneously ord 22 (pre-existing after this batch's
# insert of its own line) exercises the upward direction, which must NOT be excluded.
# ============================================================

statement ok
INSERT INTO ord VALUES (22, 1);

statement ok
PRAGMA refresh('mv');

statement ok
DELETE FROM line WHERE lid = 200;

statement ok
DELETE FROM ord WHERE oid = 20;

statement ok
INSERT INTO line VALUES (202, 22, 4);

statement ok
PRAGMA refresh('mv');

query I
SELECT COUNT(*) FROM (
    SELECT c.nation, COUNT(o.oid) AS n_ord, COUNT(l.lid) AS n_line, SUM(l.amt) AS rev
    FROM cust c LEFT JOIN ord o ON o.cid=c.cid LEFT JOIN line l ON l.oid=o.oid GROUP BY c.nation
    EXCEPT ALL SELECT nation, n_ord, n_line, rev FROM mv
);
----
0

query I
SELECT COUNT(*) FROM (
    SELECT nation, n_ord, n_line, rev FROM mv
    EXCEPT ALL
    SELECT c.nation, COUNT(o.oid), COUNT(l.lid), SUM(l.amt)
    FROM cust c LEFT JOIN ord o ON o.cid=c.cid LEFT JOIN line l ON l.oid=o.oid GROUP BY c.nation
);
----
0

# ============================================================
# Fifth batch: the same pipeline refreshed with openivm_left_join_merge=false, which routes
# CompileAggregateGroups to group-recompute instead of the delta-arithmetic MERGE. Plain coverage
# that a pipeline view with secondary-delta metadata still refreshes correctly on the recompute
# path, and that switching back to the MERGE path afterwards is also correct (the secondary is a
# per-refresh decision, not a permanent one). The existing left_join.test coverage of this flag uses
# a single LEFT JOIN, which never generates secondary metadata, so this shape was untested.
#
# NOTE: this does NOT reproduce the duplicate-key refresh failure seen on the group-recompute path
# at TPC-H scale -- that failure is PRE-EXISTING (it reproduces on commit 7697928, before any of the
# secondary-delta work) and needs 2+ MVs over shared base tables or a prior MERGE-path refresh.
# Tracked separately; do not treat this section as covering it.
# ============================================================

statement ok
SET openivm_left_join_merge = false;

statement ok
INSERT INTO ord VALUES (30, 2);

statement ok
INSERT INTO line VALUES (300, 30, 12);

statement ok
DELETE FROM line WHERE lid = 104;

statement ok
PRAGMA refresh('mv');

query I
SELECT COUNT(*) FROM (
    SELECT c.nation, COUNT(o.oid) AS n_ord, COUNT(l.lid) AS n_line, SUM(l.amt) AS rev
    FROM cust c LEFT JOIN ord o ON o.cid=c.cid LEFT JOIN line l ON l.oid=o.oid GROUP BY c.nation
    EXCEPT ALL SELECT nation, n_ord, n_line, rev FROM mv
);
----
0

query I
SELECT COUNT(*) FROM (
    SELECT nation, n_ord, n_line, rev FROM mv
    EXCEPT ALL
    SELECT c.nation, COUNT(o.oid), COUNT(l.lid), SUM(l.amt)
    FROM cust c LEFT JOIN ord o ON o.cid=c.cid LEFT JOIN line l ON l.oid=o.oid GROUP BY c.nation
);
----
0

statement ok
SET openivm_left_join_merge = true;

# Back on the MERGE path, a further batch must still be correct (the guard must not have
# disabled the secondary permanently -- it is a per-refresh decision).

statement ok
DELETE FROM line WHERE lid = 300;

statement ok
INSERT INTO line VALUES (301, 22, 5);

statement ok
PRAGMA refresh('mv');

query I
SELECT COUNT(*) FROM (
    SELECT c.nation, COUNT(o.oid) AS n_ord, COUNT(l.lid) AS n_line, SUM(l.amt) AS rev
    FROM cust c LEFT JOIN ord o ON o.cid=c.cid LEFT JOIN line l ON l.oid=o.oid GROUP BY c.nation
    EXCEPT ALL SELECT nation, n_ord, n_line, rev FROM mv
);
----
0

query I
SELECT COUNT(*) FROM (
    SELECT nation, n_ord, n_line, rev FROM mv
    EXCEPT ALL
    SELECT c.nation, COUNT(o.oid), COUNT(l.lid), SUM(l.amt)
    FROM cust c LEFT JOIN ord o ON o.cid=c.cid LEFT JOIN line l ON l.oid=o.oid GROUP BY c.nation
);
----
0
