# name: test/sql/left_join_affected_pushdown.test
# description: Generic lineage-driven LEFT JOIN affected-key pushdown (replaces the former fact_market_history hardcode)
# group: [sql]

require openivm

statement ok
SET openivm_cascade_refresh = 'off';

statement ok
SET openivm_files_path='__TEST_DIR__';

# ============================================================
# D1: inner joins feeding a LEFT JOIN; the preserved-side left key
# flows from a single source (security). Same shape as fact_market_history.
# ============================================================

statement ok
CREATE TABLE company(cid INT, cname VARCHAR);

statement ok
CREATE TABLE security(sk INT, cid INT, sname VARCHAR);

statement ok
CREATE TABLE market(sk INT, px INT);

statement ok
INSERT INTO company VALUES (10, 'Acme'), (20, 'Globex');

statement ok
INSERT INTO security VALUES (1, 10, 'ACM'), (2, 20, 'GLX');

statement ok
INSERT INTO market VALUES (1, 100);

statement ok
CREATE MATERIALIZED VIEW mh AS
    SELECT sec.sk, sec.sname, c.cname, m.px
    FROM company c JOIN security sec ON c.cid = sec.cid
    LEFT JOIN market m ON sec.sk = m.sk;

statement ok
UPDATE openivm_views
SET lineage_json = replace(lineage_json, '"security"', '"openivm_data_security"')
WHERE view_name = 'mh';

query I
SELECT COUNT(*) FROM (
  SELECT sec.sk, sec.sname, c.cname, m.px FROM company c JOIN security sec ON c.cid = sec.cid
  LEFT JOIN market m ON sec.sk = m.sk
  EXCEPT ALL SELECT * FROM mh
);
----
0

# Batch a mix of INSERT + DELETE across all three sources before one refresh.
statement ok
INSERT INTO market VALUES (2, 200);

statement ok
INSERT INTO security VALUES (3, 10, 'ACM2');

statement ok
INSERT INTO company VALUES (30, 'Initech');

statement ok
DELETE FROM market WHERE sk = 1;

statement ok
PRAGMA refresh('mh');

# The lineage-driven pushdown must FIRE: the recompute query pushes an EXISTS on
# the affected keys into the key's source binding.
query I
SELECT contains(content, 'openivm_lj_src') AND contains(content, 'openivm_affected')
FROM read_text('__TEST_DIR__/openivm_upsert_queries_mh.sql');
----
true

query I
SELECT COUNT(*) FROM (
  SELECT sec.sk, sec.sname, c.cname, m.px FROM company c JOIN security sec ON c.cid = sec.cid
  LEFT JOIN market m ON sec.sk = m.sk
  EXCEPT ALL SELECT * FROM mh
);
----
0

query I
SELECT COUNT(*) FROM (
  SELECT * FROM mh
  EXCEPT ALL
  SELECT sec.sk, sec.sname, c.cname, m.px FROM company c JOIN security sec ON c.cid = sec.cid
  LEFT JOIN market m ON sec.sk = m.sk
);
----
0

# ============================================================
# D1b: same optimization in an attached native file catalog. The
# pushed source must keep the source catalog qualification.
# ============================================================

statement ok
ATTACH '__TEST_DIR__/native_left_join_pushdown.db' AS native_lj;

statement ok
CREATE TABLE native_lj.company_file(cid INT, cname VARCHAR);

statement ok
CREATE TABLE native_lj.security_file(sk INT, cid INT, sname VARCHAR);

statement ok
CREATE TABLE native_lj.market_file(sk INT, px INT);

statement ok
INSERT INTO native_lj.company_file VALUES (10, 'Acme'), (20, 'Globex');

statement ok
INSERT INTO native_lj.security_file VALUES (1, 10, 'ACM'), (2, 20, 'GLX');

statement ok
INSERT INTO native_lj.market_file VALUES (1, 100);

statement ok
CREATE MATERIALIZED VIEW native_lj.mh_file AS
    SELECT sec.sk, sec.sname, c.cname, m.px
    FROM native_lj.company_file c JOIN native_lj.security_file sec ON c.cid = sec.cid
    LEFT JOIN native_lj.market_file m ON sec.sk = m.sk;

statement ok
INSERT INTO native_lj.market_file VALUES (2, 200);

statement ok
INSERT INTO native_lj.security_file VALUES (3, 10, 'ACM2');

statement ok
PRAGMA refresh('mh_file');

query I
SELECT contains(content, 'openivm_lj_src') AND contains(content, 'openivm_affected')
FROM read_text('__TEST_DIR__/openivm_upsert_queries_mh_file.sql');
----
true

query I
SELECT contains(content, 'native_lj.main.security_file')
FROM read_text('__TEST_DIR__/openivm_upsert_queries_mh_file.sql');
----
true

query I
SELECT COUNT(*) FROM (
  SELECT sec.sk, sec.sname, c.cname, m.px
  FROM native_lj.company_file c JOIN native_lj.security_file sec ON c.cid = sec.cid
  LEFT JOIN native_lj.market_file m ON sec.sk = m.sk
  EXCEPT ALL SELECT * FROM native_lj.mh_file
);
----
0

query I
SELECT COUNT(*) FROM (
  SELECT * FROM native_lj.mh_file
  EXCEPT ALL
  SELECT sec.sk, sec.sname, c.cname, m.px
  FROM native_lj.company_file c JOIN native_lj.security_file sec ON c.cid = sec.cid
  LEFT JOIN native_lj.market_file m ON sec.sk = m.sk
);
----
0

# ============================================================
# D2: derived (non-identity) left key -> no lineage -> full-recompute
# fallback. Results must still be correct (the optimization is skipped, not wrong).
# ============================================================

statement ok
CREATE TABLE la(k INT, v INT);

statement ok
CREATE TABLE lb(k INT, w INT);

statement ok
INSERT INTO la VALUES (1, 5), (2, 6);

statement ok
INSERT INTO lb VALUES (2, 99);

statement ok
CREATE MATERIALIZED VIEW mh2 AS
    SELECT la.k, la.v, lb.w
    FROM la LEFT JOIN lb ON la.k + 1 = lb.k;

statement ok
INSERT INTO lb VALUES (3, 100);

statement ok
INSERT INTO la VALUES (3, 7);

statement ok
PRAGMA refresh('mh2');

# Derived join key: pushdown does not fire; falls back to full LEFT JOIN recompute.
query I
SELECT contains(content, 'openivm_lj_src') FROM read_text('__TEST_DIR__/openivm_upsert_queries_mh2.sql');
----
false

query I
SELECT COUNT(*) FROM (
  SELECT la.k, la.v, lb.w FROM la LEFT JOIN lb ON la.k + 1 = lb.k
  EXCEPT ALL SELECT * FROM mh2
);
----
0

query I
SELECT COUNT(*) FROM (
  SELECT * FROM mh2
  EXCEPT ALL
  SELECT la.k, la.v, lb.w FROM la LEFT JOIN lb ON la.k + 1 = lb.k
);
----
0

# ============================================================
# Tier-1 insert-only append fast path (Q2: nullable side quiet).
# fact_market_history shape: preserved side (daily JOIN sec) LEFT JOIN fin where the
# LEFT JOIN contributes NO output column (pure fan-out / existence multiplier).
# A delta on the PRESERVED side only cannot cause a NULL->matched flip, so the view
# delta is purely insert-only and is appended directly (no affected-key recompute).
# ============================================================
statement ok
CREATE TABLE t1_sec(sym VARCHAR, ckey INT);

statement ok
CREATE TABLE t1_daily(sym VARCHAR, px INT);

statement ok
CREATE TABLE t1_fin(ckey INT, val INT);

statement ok
INSERT INTO t1_sec VALUES ('A',10),('B',20),('C',30);

# ckey 10 has 2 financial periods (fan-out x2), 20 has 1, 30 has none (NULL-extended)
statement ok
INSERT INTO t1_fin VALUES (10,1),(10,2),(20,5);

statement ok
INSERT INTO t1_daily VALUES ('A',100),('B',200),('C',300);

statement ok
CREATE MATERIALIZED VIEW t1_mh AS
    SELECT s.ckey, d.sym, d.px
    FROM t1_daily d JOIN t1_sec s ON d.sym=s.sym
    LEFT JOIN t1_fin f ON f.ckey=s.ckey;

# Preserved-side-only append -> Tier 1: emitted apply is a direct INSERT append
# (generate_series over the view delta), NOT a delete-affected + recompute.
statement ok
INSERT INTO t1_daily VALUES ('A',101),('B',201),('C',301);

statement ok
PRAGMA refresh('t1_mh');

query I
SELECT contains(content, 'generate_series')
   AND NOT contains(content, 'openivm_affected')
FROM read_text('__TEST_DIR__/openivm_upsert_queries_t1_mh.sql');
----
true

# Bag-exact vs full recompute (fan-out multiplicity preserved).
query I
SELECT COUNT(*) FROM (
  SELECT s.ckey, d.sym, d.px FROM t1_daily d JOIN t1_sec s ON d.sym=s.sym LEFT JOIN t1_fin f ON f.ckey=s.ckey
  EXCEPT ALL SELECT * FROM t1_mh);
----
0

query I
SELECT COUNT(*) FROM (
  SELECT * FROM t1_mh
  EXCEPT ALL SELECT s.ckey, d.sym, d.px FROM t1_daily d JOIN t1_sec s ON d.sym=s.sym LEFT JOIN t1_fin f ON f.ckey=s.ckey);
----
0

# Nullable-side (fin) change must NOT take the fast path — a NULL->matched flip is
# possible, so it falls back to the affected-key recompute. Correctness still holds.
statement ok
INSERT INTO t1_fin VALUES (20,6);

statement ok
PRAGMA refresh('t1_mh');

query I
SELECT contains(content, 'openivm_affected')
FROM read_text('__TEST_DIR__/openivm_upsert_queries_t1_mh.sql');
----
true

query I
SELECT COUNT(*) FROM (
  SELECT s.ckey, d.sym, d.px FROM t1_daily d JOIN t1_sec s ON d.sym=s.sym LEFT JOIN t1_fin f ON f.ckey=s.ckey
  EXCEPT ALL SELECT * FROM t1_mh);
----
0

query I
SELECT COUNT(*) FROM (
  SELECT * FROM t1_mh
  EXCEPT ALL SELECT s.ckey, d.sym, d.px FROM t1_daily d JOIN t1_sec s ON d.sym=s.sym LEFT JOIN t1_fin f ON f.ckey=s.ckey);
----
0

# Structural nullable-source detection sees through a subquery RHS (a textual scan can't):
# preserved-side delta still takes Tier 1, nullable-side delta inside the subquery recomputes.
statement ok
CREATE TABLE t2_sec(sym VARCHAR, ckey INT);

statement ok
CREATE TABLE t2_daily(sym VARCHAR, px INT);

statement ok
CREATE TABLE t2_fin(ckey INT, val INT);

statement ok
INSERT INTO t2_sec VALUES ('A',10),('B',20);

statement ok
INSERT INTO t2_fin VALUES (10,1),(10,2),(20,5);

statement ok
INSERT INTO t2_daily VALUES ('A',100),('B',200);

statement ok
CREATE MATERIALIZED VIEW t2_mh AS
    SELECT s.ckey, d.sym, d.px
    FROM t2_daily d JOIN t2_sec s ON d.sym=s.sym
    LEFT JOIN (SELECT ckey FROM t2_fin) f ON f.ckey=s.ckey;

statement ok
INSERT INTO t2_daily VALUES ('A',101);

statement ok
PRAGMA refresh('t2_mh');

# Tier 1 even though the nullable side is a subquery (plan walk resolved t2_fin).
query I
SELECT contains(content, 'generate_series') AND NOT contains(content, 'openivm_affected')
FROM read_text('__TEST_DIR__/openivm_upsert_queries_t2_mh.sql');
----
true

query I
SELECT COUNT(*) FROM (
  SELECT s.ckey, d.sym, d.px FROM t2_daily d JOIN t2_sec s ON d.sym=s.sym LEFT JOIN (SELECT ckey FROM t2_fin) f ON f.ckey=s.ckey
  EXCEPT ALL SELECT * FROM t2_mh);
----
0

query I
SELECT COUNT(*) FROM (
  SELECT * FROM t2_mh
  EXCEPT ALL SELECT s.ckey, d.sym, d.px FROM t2_daily d JOIN t2_sec s ON d.sym=s.sym LEFT JOIN (SELECT ckey FROM t2_fin) f ON f.ckey=s.ckey);
----
0
