# name: test/sql/left_join_pipeline_secondary_delta.test
# description: LEFT JOIN pipeline aggregate over a preserved/intermediate-side column must stay correct under
# group: [sql]

#              inner-table deletes (Larson & Zhou secondary deltas). Deleting an order's last line must re-insert
#              the NULL-padded row so COUNT(o.oid) still counts that order. Regression for the secondary-delta bug.

require openivm

statement ok
SET openivm_cascade_refresh = 'off';

# ============================================================
# Setup: cust (preserved) LEFT JOIN ord (intermediate) LEFT JOIN line (inner)
#   n_ord = COUNT(o.oid)  <- aggregate over the INTERMEDIATE preserved-side column (the buggy case)
#   n_line = COUNT(l.lid), rev = SUM(l.amt)  <- inner-side aggregates
# ============================================================

statement ok
CREATE TABLE cust (cid INT, nation VARCHAR);

statement ok
CREATE TABLE ord (oid INT, cid INT);

statement ok
CREATE TABLE line (lid INT, oid INT, amt INT);

statement ok
INSERT INTO cust VALUES (1,'A'),(2,'A'),(3,'B');

# c1 -> o10,o11 ; c2 -> o12 ; c3 -> (no orders)
statement ok
INSERT INTO ord VALUES (10,1),(11,1),(12,2);

# o10 has 2 lines, o11 has 1 line, o12 has NO lines (already NULL-padded)
statement ok
INSERT INTO line VALUES (100,10,5),(101,10,7),(102,11,9);

statement ok
CREATE MATERIALIZED VIEW mv AS
    SELECT c.nation, COUNT(o.oid) AS n_ord, COUNT(l.lid) AS n_line, SUM(l.amt) AS rev
    FROM cust c
    LEFT JOIN ord o ON o.cid = c.cid
    LEFT JOIN line l ON l.oid = o.oid
    GROUP BY c.nation;

# initial cross-check (both directions)
query I
SELECT COUNT(*) FROM (
    SELECT c.nation, COUNT(o.oid) AS n_ord, COUNT(l.lid) AS n_line, SUM(l.amt) AS rev
    FROM cust c LEFT JOIN ord o ON o.cid=c.cid LEFT JOIN line l ON l.oid=o.oid GROUP BY c.nation
    EXCEPT ALL SELECT nation, n_ord, n_line, rev FROM mv
);
----
0

query I
SELECT COUNT(*) FROM (
    SELECT nation, n_ord, n_line, rev FROM mv
    EXCEPT ALL
    SELECT c.nation, COUNT(o.oid), COUNT(l.lid), SUM(l.amt)
    FROM cust c LEFT JOIN ord o ON o.cid=c.cid LEFT JOIN line l ON l.oid=o.oid GROUP BY c.nation
);
----
0

# ============================================================
# Unsupported LEFT JOIN secondary-delta shapes must use affected-group
# recomputation.  The arithmetic correction is valid only for one direct
# equality predicate between distinct source tables.
# ============================================================

# SUM over the preserved side cannot be corrected by the secondary-delta
# generator.  When the unmatched row becomes matched, the primary delta must
# not be merged without its missing null-padded-row retraction.
statement ok
CREATE TABLE ljfb_left (id INT, val INT);

statement ok
CREATE TABLE ljfb_right (id INT, payload INT);

statement ok
INSERT INTO ljfb_left VALUES (1, 10), (2, 20);

statement ok
CREATE MATERIALIZED VIEW ljfb_preserved_sum AS
    SELECT l.id, SUM(l.val) AS total
    FROM ljfb_left l LEFT JOIN ljfb_right r ON l.id = r.id
    GROUP BY l.id;

query I
SELECT type FROM openivm_views WHERE view_name = 'ljfb_preserved_sum';
----
6

statement ok
INSERT INTO ljfb_right VALUES (1, 100), (2, 200);

statement ok
UPDATE ljfb_right SET payload = 101 WHERE id = 1;

statement ok
DELETE FROM ljfb_right WHERE id = 2;

statement ok
PRAGMA refresh('ljfb_preserved_sum');

query I
SELECT COUNT(*) FROM (
    SELECT * FROM ljfb_preserved_sum
    EXCEPT ALL
    SELECT l.id, SUM(l.val)
    FROM ljfb_left l LEFT JOIN ljfb_right r ON l.id = r.id
    GROUP BY l.id
);
----
0

query I
SELECT COUNT(*) FROM (
    SELECT l.id, SUM(l.val)
    FROM ljfb_left l LEFT JOIN ljfb_right r ON l.id = r.id
    GROUP BY l.id
    EXCEPT ALL
    SELECT * FROM ljfb_preserved_sum
);
----
0

# A self-referencing LEFT JOIN cannot use independent preserved/inner delta
# accounting because both occurrences share one physical delta table.
statement ok
CREATE TABLE ljfb_self (id INT, parent_id INT, val INT);

statement ok
INSERT INTO ljfb_self VALUES (1, NULL, 10), (2, 1, 20), (3, 99, 30);

statement ok
CREATE MATERIALIZED VIEW ljfb_self_mv AS
    SELECT child.id, COUNT(parent.id) AS parents, SUM(parent.val) AS parent_total
    FROM ljfb_self child LEFT JOIN ljfb_self parent ON child.parent_id = parent.id
    GROUP BY child.id;

query I
SELECT type FROM openivm_views WHERE view_name = 'ljfb_self_mv';
----
6

statement ok
INSERT INTO ljfb_self VALUES (99, NULL, 90), (4, 1, 40);

statement ok
UPDATE ljfb_self SET parent_id = 99 WHERE id = 2;

statement ok
DELETE FROM ljfb_self WHERE id = 1;

statement ok
PRAGMA refresh('ljfb_self_mv');

query I
SELECT COUNT(*) FROM (
    SELECT * FROM ljfb_self_mv
    EXCEPT ALL
    SELECT child.id, COUNT(parent.id), SUM(parent.val)
    FROM ljfb_self child LEFT JOIN ljfb_self parent ON child.parent_id = parent.id
    GROUP BY child.id
);
----
0

query I
SELECT COUNT(*) FROM (
    SELECT child.id, COUNT(parent.id), SUM(parent.val)
    FROM ljfb_self child LEFT JOIN ljfb_self parent ON child.parent_id = parent.id
    GROUP BY child.id
    EXCEPT ALL
    SELECT * FROM ljfb_self_mv
);
----
0

# A compound equality predicate cannot be reduced to conditions[0]: another
# row sharing only the first key must not hide an unmatched/matched transition.
statement ok
CREATE TABLE ljfb_comp_left (a INT, b INT);

statement ok
CREATE TABLE ljfb_comp_right (a INT, b INT, val INT);

statement ok
INSERT INTO ljfb_comp_left VALUES (1, 1), (1, 2), (2, 1);

statement ok
INSERT INTO ljfb_comp_right VALUES (1, 2, 20);

statement ok
CREATE MATERIALIZED VIEW ljfb_comp_mv AS
    SELECT l.a, l.b, COUNT(r.val) AS matches, SUM(r.val) AS total
    FROM ljfb_comp_left l LEFT JOIN ljfb_comp_right r ON l.a = r.a AND l.b = r.b
    GROUP BY l.a, l.b;

query I
SELECT type FROM openivm_views WHERE view_name = 'ljfb_comp_mv';
----
6

statement ok
INSERT INTO ljfb_comp_right VALUES (1, 1, 10), (2, 1, 30);

statement ok
UPDATE ljfb_comp_right SET val = 11 WHERE a = 1 AND b = 1;

statement ok
DELETE FROM ljfb_comp_right WHERE a = 2 AND b = 1;

statement ok
PRAGMA refresh('ljfb_comp_mv');

query I
SELECT COUNT(*) FROM (
    SELECT * FROM ljfb_comp_mv
    EXCEPT ALL
    SELECT l.a, l.b, COUNT(r.val), SUM(r.val)
    FROM ljfb_comp_left l LEFT JOIN ljfb_comp_right r ON l.a = r.a AND l.b = r.b
    GROUP BY l.a, l.b
);
----
0

query I
SELECT COUNT(*) FROM (
    SELECT l.a, l.b, COUNT(r.val), SUM(r.val)
    FROM ljfb_comp_left l LEFT JOIN ljfb_comp_right r ON l.a = r.a AND l.b = r.b
    GROUP BY l.a, l.b
    EXCEPT ALL
    SELECT * FROM ljfb_comp_mv
);
----
0

# Non-equality predicates need the complete predicate to find groups that lose
# their final match, so they also use affected-group recomputation.
statement ok
CREATE TABLE ljfb_range_left (id INT, threshold INT);

statement ok
CREATE TABLE ljfb_range_right (id INT, val INT);

statement ok
INSERT INTO ljfb_range_left VALUES (1, 10), (2, 20);

statement ok
INSERT INTO ljfb_range_right VALUES (10, 5), (20, 15);

statement ok
CREATE MATERIALIZED VIEW ljfb_range_mv AS
    SELECT l.id, COUNT(r.id) AS matches, SUM(r.val) AS total
    FROM ljfb_range_left l LEFT JOIN ljfb_range_right r ON r.val < l.threshold
    GROUP BY l.id;

query I
SELECT type FROM openivm_views WHERE view_name = 'ljfb_range_mv';
----
6

statement ok
INSERT INTO ljfb_range_right VALUES (30, 8), (40, 25);

statement ok
UPDATE ljfb_range_right SET val = 12 WHERE id = 10;

statement ok
DELETE FROM ljfb_range_right WHERE id = 20;

statement ok
PRAGMA refresh('ljfb_range_mv');

query I
SELECT COUNT(*) FROM (
    SELECT * FROM ljfb_range_mv
    EXCEPT ALL
    SELECT l.id, COUNT(r.id), SUM(r.val)
    FROM ljfb_range_left l LEFT JOIN ljfb_range_right r ON r.val < l.threshold
    GROUP BY l.id
);
----
0

query I
SELECT COUNT(*) FROM (
    SELECT l.id, COUNT(r.id), SUM(r.val)
    FROM ljfb_range_left l LEFT JOIN ljfb_range_right r ON r.val < l.threshold
    GROUP BY l.id
    EXCEPT ALL
    SELECT * FROM ljfb_range_mv
);
----
0

# A right-only ON predicate is represented as a filter on the inner subtree,
# not necessarily as a second LogicalComparisonJoin condition.  Base-table
# key counts would include inactive rows and miss the last-match transition.
statement ok
CREATE TABLE ljfb_filter_left (id INT);

statement ok
CREATE TABLE ljfb_filter_right (id INT, active BOOLEAN, val INT);

statement ok
INSERT INTO ljfb_filter_left VALUES (1), (2);

statement ok
INSERT INTO ljfb_filter_right VALUES (1, true, 10), (1, false, 99), (2, true, 20);

statement ok
CREATE MATERIALIZED VIEW ljfb_filter_mv AS
    SELECT l.id, COUNT(r.val) AS matches, SUM(r.val) AS total
    FROM ljfb_filter_left l LEFT JOIN ljfb_filter_right r ON l.id = r.id AND r.active = true
    GROUP BY l.id;

query I
SELECT type FROM openivm_views WHERE view_name = 'ljfb_filter_mv';
----
6

statement ok
INSERT INTO ljfb_filter_right VALUES (2, false, 200), (1, true, 11);

statement ok
UPDATE ljfb_filter_right SET val = 12 WHERE id = 1 AND active;

statement ok
DELETE FROM ljfb_filter_right WHERE id = 2 AND active;

statement ok
PRAGMA refresh('ljfb_filter_mv');

query I
SELECT COUNT(*) FROM (
    SELECT * FROM ljfb_filter_mv
    EXCEPT ALL
    SELECT l.id, COUNT(r.val), SUM(r.val)
    FROM ljfb_filter_left l LEFT JOIN ljfb_filter_right r ON l.id = r.id AND r.active = true
    GROUP BY l.id
);
----
0

query I
SELECT COUNT(*) FROM (
    SELECT l.id, COUNT(r.val), SUM(r.val)
    FROM ljfb_filter_left l LEFT JOIN ljfb_filter_right r ON l.id = r.id AND r.active = true
    GROUP BY l.id
    EXCEPT ALL
    SELECT * FROM ljfb_filter_mv
);
----
0

# Secondary source identities are structured arrays: a comma in a valid quoted
# table identifier must not split one join level into multiple levels.
statement ok
CREATE TABLE lj_comma_left (id INT);

statement ok
CREATE TABLE "lj,r" (id INT, val INT);

statement ok
INSERT INTO lj_comma_left VALUES (1), (2);

statement ok
INSERT INTO "lj,r" VALUES (1, 10), (2, 20);

statement ok
CREATE MATERIALIZED VIEW lj_comma_mv AS
    SELECT l.id, COUNT(r.val) AS matches, SUM(r.val) AS total
    FROM lj_comma_left l LEFT JOIN "lj,r" r ON l.id = r.id
    GROUP BY l.id;

query I
SELECT type FROM openivm_views WHERE view_name = 'lj_comma_mv';
----
0

query I
SELECT contains(leftjoin_secondary_meta_json, '"inner_tables":["lj,r"]')::INT
FROM openivm_views WHERE view_name = 'lj_comma_mv';
----
1

statement ok
DELETE FROM "lj,r" WHERE id = 1;

statement ok
INSERT INTO "lj,r" VALUES (2, 21);

statement ok
UPDATE "lj,r" SET val = 22 WHERE id = 2 AND val = 21;

statement ok
PRAGMA refresh('lj_comma_mv');

query I
SELECT COUNT(*) FROM (
    SELECT * FROM lj_comma_mv
    EXCEPT ALL
    SELECT l.id, COUNT(r.val), SUM(r.val)
    FROM lj_comma_left l LEFT JOIN "lj,r" r ON l.id = r.id
    GROUP BY l.id
);
----
0

query I
SELECT COUNT(*) FROM (
    SELECT l.id, COUNT(r.val), SUM(r.val)
    FROM lj_comma_left l LEFT JOIN "lj,r" r ON l.id = r.id
    GROUP BY l.id
    EXCEPT ALL
    SELECT * FROM lj_comma_mv
);
----
0

# Existing MVs can still carry the legacy comma-delimited identity fields.
# If such metadata is ambiguous, refresh must use affected-group recompute
# instead of silently dropping the required secondary correction.
statement ok
UPDATE openivm_views
SET leftjoin_secondary_meta_json =
    replace(leftjoin_secondary_meta_json, '"inner_tables":["lj,r"]', '"inner_table":"lj,r"')
WHERE view_name = 'lj_comma_mv';

statement ok
UPDATE openivm_views
SET leftjoin_secondary_meta_json =
    replace(leftjoin_secondary_meta_json, '"inner_keys":["id"]', '"inner_key":"id"')
WHERE view_name = 'lj_comma_mv';

statement ok
UPDATE openivm_views
SET leftjoin_secondary_meta_json =
    replace(leftjoin_secondary_meta_json, '"pres_tables":["lj_comma_left"]', '"pres_table":"lj_comma_left"')
WHERE view_name = 'lj_comma_mv';

statement ok
UPDATE openivm_views
SET leftjoin_secondary_meta_json =
    replace(leftjoin_secondary_meta_json, '"pres_keys":["id"]', '"pres_key":"id"')
WHERE view_name = 'lj_comma_mv';

statement ok
DELETE FROM "lj,r" WHERE id = 2;

statement ok
PRAGMA refresh('lj_comma_mv');

query I
SELECT COUNT(*) FROM (
    SELECT * FROM lj_comma_mv
    EXCEPT ALL
    SELECT l.id, COUNT(r.val), SUM(r.val)
    FROM lj_comma_left l LEFT JOIN "lj,r" r ON l.id = r.id
    GROUP BY l.id
);
----
0

query I
SELECT COUNT(*) FROM (
    SELECT l.id, COUNT(r.val), SUM(r.val)
    FROM lj_comma_left l LEFT JOIN "lj,r" r ON l.id = r.id
    GROUP BY l.id
    EXCEPT ALL
    SELECT * FROM lj_comma_mv
);
----
0

# ============================================================
# Batched mixed DML before ONE refresh (exercises secondary deltas in BOTH directions):
#   - DELETE line 102  -> o11 loses its LAST line   => NULL-padded (A,o11,NULL) reappears; COUNT(o.oid) must NOT drop
#   - INSERT line 103  -> o12 gains its FIRST line  => NULL-padded (A,o12,NULL) removed, real row added
#   - DELETE line 100  -> o10 still has l101        => no secondary delta, just n_line/rev drop
#   - INSERT ord 13    -> c3 (B) gains an order with no lines => (B,o13,NULL)
#   - INSERT cust 4    -> new B customer, no orders  => (B,NULL,NULL)
# ============================================================

statement ok
DELETE FROM line WHERE lid = 102;

statement ok
INSERT INTO line VALUES (103, 12, 4);

statement ok
DELETE FROM line WHERE lid = 100;

statement ok
INSERT INTO ord VALUES (13, 3);

statement ok
INSERT INTO cust VALUES (4, 'B');

statement ok
PRAGMA refresh('mv');

# cross-check both directions after the batched refresh
query I
SELECT COUNT(*) FROM (
    SELECT c.nation, COUNT(o.oid) AS n_ord, COUNT(l.lid) AS n_line, SUM(l.amt) AS rev
    FROM cust c LEFT JOIN ord o ON o.cid=c.cid LEFT JOIN line l ON l.oid=o.oid GROUP BY c.nation
    EXCEPT ALL SELECT nation, n_ord, n_line, rev FROM mv
);
----
0

query I
SELECT COUNT(*) FROM (
    SELECT nation, n_ord, n_line, rev FROM mv
    EXCEPT ALL
    SELECT c.nation, COUNT(o.oid), COUNT(l.lid), SUM(l.amt)
    FROM cust c LEFT JOIN ord o ON o.cid=c.cid LEFT JOIN line l ON l.oid=o.oid GROUP BY c.nation
);
----
0

# ============================================================
# Second batch: drive an order's line count back up and another down, plus a delete of a whole order
# ============================================================

statement ok
INSERT INTO line VALUES (104, 11, 3), (105, 13, 8);


statement ok
DELETE FROM line WHERE lid = 101;

statement ok
DELETE FROM ord WHERE oid = 12;

statement ok
PRAGMA refresh('mv');

query I
SELECT COUNT(*) FROM (
    SELECT c.nation, COUNT(o.oid) AS n_ord, COUNT(l.lid) AS n_line, SUM(l.amt) AS rev
    FROM cust c LEFT JOIN ord o ON o.cid=c.cid LEFT JOIN line l ON l.oid=o.oid GROUP BY c.nation
    EXCEPT ALL SELECT nation, n_ord, n_line, rev FROM mv
);
----
0

query I
SELECT COUNT(*) FROM (
    SELECT nation, n_ord, n_line, rev FROM mv
    EXCEPT ALL
    SELECT c.nation, COUNT(o.oid), COUNT(l.lid), SUM(l.amt)
    FROM cust c LEFT JOIN ord o ON o.cid=c.cid LEFT JOIN line l ON l.oid=o.oid GROUP BY c.nation
);
----
0

# ============================================================
# Third batch: preserved-side row that is BRAND NEW in the same batch as its first inner row.
# ord 20 is inserted AND immediately gets its first line, all before one refresh. No NULL-padded
# (B,o20,NULL) row was ever materialized, so the secondary-delta correction must NOT fire for it
# (firing would subtract a dangling row that never existed). Also covers the same-batch churn case:
# ord 21 is inserted with a line and then both are deleted again (net effect: never existed).
# ============================================================

statement ok
INSERT INTO ord VALUES (20, 3);

statement ok
INSERT INTO line VALUES (200, 20, 11);

statement ok
INSERT INTO ord VALUES (21, 3);

statement ok
INSERT INTO line VALUES (201, 21, 6);

statement ok
DELETE FROM line WHERE lid = 201;

statement ok
DELETE FROM ord WHERE oid = 21;

statement ok
PRAGMA refresh('mv');

query I
SELECT COUNT(*) FROM (
    SELECT c.nation, COUNT(o.oid) AS n_ord, COUNT(l.lid) AS n_line, SUM(l.amt) AS rev
    FROM cust c LEFT JOIN ord o ON o.cid=c.cid LEFT JOIN line l ON l.oid=o.oid GROUP BY c.nation
    EXCEPT ALL SELECT nation, n_ord, n_line, rev FROM mv
);
----
0

query I
SELECT COUNT(*) FROM (
    SELECT nation, n_ord, n_line, rev FROM mv
    EXCEPT ALL
    SELECT c.nation, COUNT(o.oid), COUNT(l.lid), SUM(l.amt)
    FROM cust c LEFT JOIN ord o ON o.cid=c.cid LEFT JOIN line l ON l.oid=o.oid GROUP BY c.nation
);
----
0

# ============================================================
# Fourth batch: an order's LAST line and the order ITSELF deleted together in one batch (the
# downward-transition double-count case). ord 20 loses line 200 and is deleted at the same time, so
# the kept-outer-join term must not emit a phantom NULL-padded (B,o20,NULL) row on top of the real
# removal supplied by the higher-order term. Simultaneously ord 22 (pre-existing after this batch's
# insert of its own line) exercises the upward direction, which must NOT be excluded.
# ============================================================

statement ok
INSERT INTO ord VALUES (22, 1);

statement ok
PRAGMA refresh('mv');

statement ok
DELETE FROM line WHERE lid = 200;

statement ok
DELETE FROM ord WHERE oid = 20;

statement ok
INSERT INTO line VALUES (202, 22, 4);

statement ok
PRAGMA refresh('mv');

query I
SELECT COUNT(*) FROM (
    SELECT c.nation, COUNT(o.oid) AS n_ord, COUNT(l.lid) AS n_line, SUM(l.amt) AS rev
    FROM cust c LEFT JOIN ord o ON o.cid=c.cid LEFT JOIN line l ON l.oid=o.oid GROUP BY c.nation
    EXCEPT ALL SELECT nation, n_ord, n_line, rev FROM mv
);
----
0

query I
SELECT COUNT(*) FROM (
    SELECT nation, n_ord, n_line, rev FROM mv
    EXCEPT ALL
    SELECT c.nation, COUNT(o.oid), COUNT(l.lid), SUM(l.amt)
    FROM cust c LEFT JOIN ord o ON o.cid=c.cid LEFT JOIN line l ON l.oid=o.oid GROUP BY c.nation
);
----
0

# ============================================================
# Fifth batch: the same pipeline refreshed with openivm_left_join_merge=false, which routes
# CompileAggregateGroups to group-recompute instead of the delta-arithmetic MERGE. Plain coverage
# that a pipeline view with secondary-delta metadata still refreshes correctly on the recompute
# path, and that switching back to the MERGE path afterwards is also correct (the secondary is a
# per-refresh decision, not a permanent one). The existing left_join.test coverage of this flag uses
# a single LEFT JOIN, which never generates secondary metadata, so this shape was untested.
#
# NOTE: this does NOT reproduce the duplicate-key refresh failure seen on the group-recompute path
# at TPC-H scale -- that failure is PRE-EXISTING (it reproduces on commit 7697928, before any of the
# secondary-delta work) and needs 2+ MVs over shared base tables or a prior MERGE-path refresh.
# Tracked separately; do not treat this section as covering it.
# ============================================================

statement ok
SET openivm_left_join_merge = false;

statement ok
INSERT INTO ord VALUES (30, 2);

statement ok
INSERT INTO line VALUES (300, 30, 12);

statement ok
DELETE FROM line WHERE lid = 104;

statement ok
PRAGMA refresh('mv');

query I
SELECT COUNT(*) FROM (
    SELECT c.nation, COUNT(o.oid) AS n_ord, COUNT(l.lid) AS n_line, SUM(l.amt) AS rev
    FROM cust c LEFT JOIN ord o ON o.cid=c.cid LEFT JOIN line l ON l.oid=o.oid GROUP BY c.nation
    EXCEPT ALL SELECT nation, n_ord, n_line, rev FROM mv
);
----
0

query I
SELECT COUNT(*) FROM (
    SELECT nation, n_ord, n_line, rev FROM mv
    EXCEPT ALL
    SELECT c.nation, COUNT(o.oid), COUNT(l.lid), SUM(l.amt)
    FROM cust c LEFT JOIN ord o ON o.cid=c.cid LEFT JOIN line l ON l.oid=o.oid GROUP BY c.nation
);
----
0

statement ok
SET openivm_left_join_merge = true;

# Back on the MERGE path, a further batch must still be correct (the guard must not have
# disabled the secondary permanently -- it is a per-refresh decision).

statement ok
DELETE FROM line WHERE lid = 300;

statement ok
INSERT INTO line VALUES (301, 22, 5);

statement ok
PRAGMA refresh('mv');

query I
SELECT COUNT(*) FROM (
    SELECT c.nation, COUNT(o.oid) AS n_ord, COUNT(l.lid) AS n_line, SUM(l.amt) AS rev
    FROM cust c LEFT JOIN ord o ON o.cid=c.cid LEFT JOIN line l ON l.oid=o.oid GROUP BY c.nation
    EXCEPT ALL SELECT nation, n_ord, n_line, rev FROM mv
);
----
0

query I
SELECT COUNT(*) FROM (
    SELECT nation, n_ord, n_line, rev FROM mv
    EXCEPT ALL
    SELECT c.nation, COUNT(o.oid), COUNT(l.lid), SUM(l.amt)
    FROM cust c LEFT JOIN ord o ON o.cid=c.cid LEFT JOIN line l ON l.oid=o.oid GROUP BY c.nation
);
----
0
