# name: test/sql/mv_aggregate.test
# description: Test IVM with all aggregate types (SUM, COUNT, MIN, MAX, AVG, grouped and ungrouped)
# group: [sql]

require openivm

statement ok
CREATE TABLE sales (id INT, region VARCHAR, amount INT);

statement ok
INSERT INTO sales VALUES (1, 'east', 100), (2, 'west', 200), (3, 'east', 150);

statement ok
create materialized view sales_summary as (select region, sum(amount) as total, count(amount) as cnt from sales group by region);

query III
SELECT region, total, cnt FROM sales_summary ORDER BY region;
----
east	250	2
west	200	1

# --- Insert into existing group ---
statement ok
INSERT INTO sales VALUES (4, 'east', 50);

statement ok
pragma ivm('sales_summary');

query III
SELECT region, total, cnt FROM sales_summary ORDER BY region;
----
east	300	3
west	200	1

# --- Insert into new group ---
statement ok
INSERT INTO sales VALUES (5, 'north', 300);

statement ok
pragma ivm('sales_summary');

query III
SELECT region, total, cnt FROM sales_summary ORDER BY region;
----
east	300	3
north	300	1
west	200	1

# --- Delete from existing group ---
statement ok
DELETE FROM sales WHERE id = 1;

statement ok
pragma ivm('sales_summary');

query III
SELECT region, total, cnt FROM sales_summary ORDER BY region;
----
east	200	2
north	300	1
west	200	1

# --- Multiple inserts in same group ---
statement ok
INSERT INTO sales VALUES (6, 'west', 75), (7, 'west', 25);

statement ok
pragma ivm('sales_summary');

query III
SELECT region, total, cnt FROM sales_summary ORDER BY region;
----
east	200	2
north	300	1
west	300	3

# --- No-op PRAGMA ---
statement ok
pragma ivm('sales_summary');

query III
SELECT region, total, cnt FROM sales_summary ORDER BY region;
----
east	200	2
north	300	1
west	300	3

# --- Batch insert into multiple groups at once ---
statement ok
INSERT INTO sales VALUES (10, 'south', 100), (11, 'south', 200), (12, 'north', 50);

statement ok
pragma ivm('sales_summary');

query III
SELECT region, total, cnt FROM sales_summary WHERE region IN ('south', 'north') ORDER BY region;
----
north	350	2
south	300	2

# --- Mixed insert + delete in same cycle ---
statement ok
INSERT INTO sales VALUES (13, 'west', 100);

statement ok
DELETE FROM sales WHERE id = 6;

statement ok
pragma ivm('sales_summary');

query III
SELECT region, total, cnt FROM sales_summary WHERE region = 'west';
----
west	325	3

# --- Delete ALL rows from a group ---
statement ok
DELETE FROM sales WHERE region = 'east';

statement ok
pragma ivm('sales_summary');

query III
SELECT region, total, cnt FROM sales_summary WHERE region != 'east' ORDER BY region;
----
north	350	2
south	300	2
west	325	3

# ==========================================
# NULL values as GROUP BY keys
# ==========================================

statement ok
CREATE TABLE nullable_grp (grp VARCHAR, val INT);

statement ok
INSERT INTO nullable_grp VALUES ('a', 10), (NULL, 20), ('a', 30), (NULL, 40);

statement ok
CREATE MATERIALIZED VIEW mv_null_grp AS SELECT grp, SUM(val) AS total FROM nullable_grp GROUP BY grp;

query II
SELECT grp, total FROM mv_null_grp ORDER BY grp NULLS LAST;
----
a	40
NULL	60

statement ok
INSERT INTO nullable_grp VALUES (NULL, 5), ('b', 100);

statement ok
pragma ivm('mv_null_grp');

query II
SELECT grp, total FROM mv_null_grp ORDER BY grp NULLS LAST;
----
a	40
b	100
NULL	65

# Cross-check
query II
SELECT grp, SUM(val) FROM nullable_grp GROUP BY grp ORDER BY grp NULLS LAST;
----
a	40
b	100
NULL	65

# Delete all NULLs
statement ok
DELETE FROM nullable_grp WHERE grp IS NULL;

statement ok
pragma ivm('mv_null_grp');

query II
SELECT grp, total FROM mv_null_grp ORDER BY grp;
----
a	40
b	100

# ==========================================
# DECIMAL / NUMERIC columns in SUM
# ==========================================

statement ok
CREATE TABLE decimals (category VARCHAR, amount DECIMAL(10,2));

statement ok
INSERT INTO decimals VALUES ('x', 10.50), ('x', 20.75), ('y', 100.00);

statement ok
CREATE MATERIALIZED VIEW mv_dec AS SELECT category, SUM(amount) AS total FROM decimals GROUP BY category;

query II
SELECT category, total FROM mv_dec ORDER BY category;
----
x	31.25
y	100.00

statement ok
INSERT INTO decimals VALUES ('x', 0.01), ('y', 99.99);

statement ok
pragma ivm('mv_dec');

query II
SELECT category, total FROM mv_dec ORDER BY category;
----
x	31.26
y	199.99

# Cross-check
query II
SELECT category, SUM(amount) FROM decimals GROUP BY category ORDER BY category;
----
x	31.26
y	199.99

# ==========================================
# BIGINT columns
# ==========================================

statement ok
CREATE TABLE big_nums (grp INT, val BIGINT);

statement ok
INSERT INTO big_nums VALUES (1, 9223372036854775000), (1, 100);

statement ok
CREATE MATERIALIZED VIEW mv_big AS SELECT grp, SUM(val) AS total FROM big_nums GROUP BY grp;

query II
SELECT grp, total FROM mv_big;
----
1	9223372036854775100

statement ok
INSERT INTO big_nums VALUES (1, 500);

statement ok
pragma ivm('mv_big');

query II
SELECT grp, total FROM mv_big;
----
1	9223372036854775600

# ==========================================
# DATE columns as GROUP BY keys
# ==========================================

statement ok
CREATE TABLE daily_sales (sale_date DATE, amount INT);

statement ok
INSERT INTO daily_sales VALUES ('2024-01-01', 100), ('2024-01-01', 200), ('2024-01-02', 300);

statement ok
CREATE MATERIALIZED VIEW mv_daily AS SELECT sale_date, SUM(amount) AS total FROM daily_sales GROUP BY sale_date;

query II
SELECT sale_date, total FROM mv_daily ORDER BY sale_date;
----
2024-01-01	300
2024-01-02	300

statement ok
INSERT INTO daily_sales VALUES ('2024-01-02', 50), ('2024-01-03', 400);

statement ok
pragma ivm('mv_daily');

query II
SELECT sale_date, total FROM mv_daily ORDER BY sale_date;
----
2024-01-01	300
2024-01-02	350
2024-01-03	400

# Cross-check
query II
SELECT sale_date, SUM(amount) FROM daily_sales GROUP BY sale_date ORDER BY sale_date;
----
2024-01-01	300
2024-01-02	350
2024-01-03	400

# ==========================================
# Empty table → CREATE MV → INSERT → refresh
# ==========================================

statement ok
CREATE TABLE empty_base (id INT, val INT);

statement ok
CREATE MATERIALIZED VIEW mv_empty AS SELECT id, SUM(val) AS total FROM empty_base GROUP BY id;

query II
SELECT id, total FROM mv_empty;
----

statement ok
INSERT INTO empty_base VALUES (1, 100), (2, 200);

statement ok
pragma ivm('mv_empty');

query II
SELECT id, total FROM mv_empty ORDER BY id;
----
1	100
2	200

# ==========================================
# Large batch INSERT (1000 rows)
# ==========================================

statement ok
CREATE TABLE batch_tbl (grp INT, val INT);

statement ok
CREATE MATERIALIZED VIEW mv_batch AS SELECT grp, SUM(val) AS total, COUNT(*) AS cnt FROM batch_tbl GROUP BY grp;

statement ok
INSERT INTO batch_tbl SELECT i % 10, i FROM range(1000) t(i);

statement ok
pragma ivm('mv_batch');

# Cross-check
query I
SELECT COUNT(*) FROM (
    SELECT grp, SUM(val) AS total, COUNT(*) AS cnt FROM batch_tbl GROUP BY grp
    EXCEPT
    SELECT grp, total, cnt FROM mv_batch
);
----
0

# ==========================================
# DELETE all rows → MV should be empty
# ==========================================

statement ok
CREATE TABLE del_all (grp VARCHAR, val INT);

statement ok
INSERT INTO del_all VALUES ('a', 1), ('b', 2);

statement ok
CREATE MATERIALIZED VIEW mv_del_all AS SELECT grp, SUM(val) AS total FROM del_all GROUP BY grp;

statement ok
DELETE FROM del_all;

statement ok
pragma ivm('mv_del_all');

query II
SELECT grp, total FROM mv_del_all;
----

# ==========================================
# UNGROUPED (SCALAR) AGGREGATES
# ==========================================


statement ok
CREATE TABLE scores (id INT, value INT, label VARCHAR);

statement ok
INSERT INTO scores VALUES (1, 10, 'a'), (2, 20, 'b'), (3, 30, 'c');

statement ok
create materialized view score_totals as (select sum(value) as total, count(label) as cnt from scores);

query II
SELECT total, cnt FROM score_totals;
----
60	3

# --- Insert ---
statement ok
INSERT INTO scores VALUES (4, 40, 'd');

statement ok
pragma ivm('score_totals');

query II
SELECT total, cnt FROM score_totals;
----
100	4

# --- Delete ---
statement ok
DELETE FROM scores WHERE id = 1;

statement ok
pragma ivm('score_totals');

query II
SELECT total, cnt FROM score_totals;
----
90	3

# --- Mixed insert + delete ---
statement ok
INSERT INTO scores VALUES (5, 50, 'e');

statement ok
DELETE FROM scores WHERE id = 2;

statement ok
pragma ivm('score_totals');

query II
SELECT total, cnt FROM score_totals;
----
120	3

# --- No-op PRAGMA ---
statement ok
pragma ivm('score_totals');

query II
SELECT total, cnt FROM score_totals;
----
120	3

# --- Batch insert ---
statement ok
INSERT INTO scores VALUES (6, 10, 'f'), (7, 20, 'g'), (8, 30, 'h');

statement ok
pragma ivm('score_totals');

query II
SELECT total, cnt FROM score_totals;
----
180	6

# --- Delete multiple rows at once ---
statement ok
DELETE FROM scores WHERE value <= 20;

statement ok
pragma ivm('score_totals');

# Remaining: id=3(30), id=4(40), id=5(50), id=8(30) = 150, cnt=4
query II
SELECT total, cnt FROM score_totals;
----
150	4


# ==========================================
# MIN / MAX AGGREGATES
# ==========================================

# Test 1: MIN with GROUP BY

statement ok
CREATE TABLE t1 (id INT, grp VARCHAR, val INT);

statement ok
INSERT INTO t1 VALUES (1, 'a', 10), (2, 'a', 20), (3, 'b', 30), (4, 'b', 5);

statement ok
CREATE MATERIALIZED VIEW mv_min AS SELECT grp, MIN(val) AS min_val FROM t1 GROUP BY grp;

statement ok
INSERT INTO t1 VALUES (5, 'a', 3);

statement ok
PRAGMA ivm('mv_min');

query II
SELECT grp, min_val FROM mv_min ORDER BY grp;
----
a	3
b	5

statement ok
DELETE FROM t1 WHERE id = 5;

statement ok
PRAGMA ivm('mv_min');

query II
SELECT grp, min_val FROM mv_min ORDER BY grp;
----
a	10
b	5

# Test 2: MAX with GROUP BY

statement ok
CREATE TABLE t2 (id INT, grp VARCHAR, val INT);

statement ok
INSERT INTO t2 VALUES (1, 'x', 100), (2, 'x', 200), (3, 'y', 50), (4, 'y', 75);

statement ok
CREATE MATERIALIZED VIEW mv_max AS SELECT grp, MAX(val) AS max_val FROM t2 GROUP BY grp;

statement ok
INSERT INTO t2 VALUES (5, 'y', 300);

statement ok
PRAGMA ivm('mv_max');

query II
SELECT grp, max_val FROM mv_max ORDER BY grp;
----
x	200
y	300

statement ok
DELETE FROM t2 WHERE id = 5;

statement ok
PRAGMA ivm('mv_max');

query II
SELECT grp, max_val FROM mv_max ORDER BY grp;
----
x	200
y	75

# Test 3: Mixed aggregates (SUM + MIN + MAX)

statement ok
CREATE TABLE t3 (id INT, grp VARCHAR, a INT, b INT, c INT);

statement ok
INSERT INTO t3 VALUES (1, 'g1', 10, 100, 1), (2, 'g1', 20, 200, 2), (3, 'g2', 30, 300, 3);

statement ok
CREATE MATERIALIZED VIEW mv_mixed AS SELECT grp, SUM(a) AS sum_a, MIN(b) AS min_b, MAX(c) AS max_c FROM t3 GROUP BY grp;

statement ok
INSERT INTO t3 VALUES (4, 'g1', 5, 50, 10);

statement ok
PRAGMA ivm('mv_mixed');

query IIII
SELECT grp, sum_a, min_b, max_c FROM mv_mixed ORDER BY grp;
----
g1	35	50	10
g2	30	300	3

statement ok
DELETE FROM t3 WHERE id = 4;

statement ok
PRAGMA ivm('mv_mixed');

query IIII
SELECT grp, sum_a, min_b, max_c FROM mv_mixed ORDER BY grp;
----
g1	30	100	2
g2	30	300	3

# Test 5: Ungrouped MIN aggregate

statement ok
CREATE TABLE t5 (id INT, val INT);

statement ok
INSERT INTO t5 VALUES (1, 100), (2, 50), (3, 200);

statement ok
CREATE MATERIALIZED VIEW mv_simple_min AS SELECT MIN(val) AS min_val FROM t5;

statement ok
INSERT INTO t5 VALUES (4, 10);

statement ok
PRAGMA ivm('mv_simple_min');

query I
SELECT min_val FROM mv_simple_min;
----
10

statement ok
DELETE FROM t5 WHERE id = 4;

statement ok
PRAGMA ivm('mv_simple_min');

query I
SELECT min_val FROM mv_simple_min;
----
50

# Test 6: MIN/MAX with JOIN + GROUP BY

statement ok
CREATE TABLE departments (dept_id INT, dept_name VARCHAR);

statement ok
INSERT INTO departments VALUES (1, 'engineering'), (2, 'sales');

statement ok
CREATE TABLE employees (id INT, dept_id INT, salary INT);

statement ok
INSERT INTO employees VALUES (1, 1, 100), (2, 1, 200), (3, 2, 150), (4, 2, 300);

statement ok
CREATE MATERIALIZED VIEW mv_dept_salaries AS
    SELECT d.dept_name, MIN(e.salary) AS min_salary, MAX(e.salary) AS max_salary
    FROM departments d INNER JOIN employees e ON e.dept_id = d.dept_id
    GROUP BY d.dept_name;

statement ok
INSERT INTO employees VALUES (5, 1, 50);

statement ok
PRAGMA ivm('mv_dept_salaries');

query III
SELECT dept_name, min_salary, max_salary FROM mv_dept_salaries ORDER BY dept_name;
----
engineering	50	200
sales	150	300

statement ok
DELETE FROM employees WHERE id = 5;

statement ok
PRAGMA ivm('mv_dept_salaries');

query III
SELECT dept_name, min_salary, max_salary FROM mv_dept_salaries ORDER BY dept_name;
----
engineering	100	200
sales	150	300

statement ok
INSERT INTO departments VALUES (3, 'marketing');

statement ok
INSERT INTO employees VALUES (6, 3, 75);

statement ok
PRAGMA ivm('mv_dept_salaries');

query III
SELECT dept_name, min_salary, max_salary FROM mv_dept_salaries ORDER BY dept_name;
----
engineering	100	200
marketing	75	75
sales	150	300

# ==========================================
# AVG aggregate (group-recompute strategy)
# ==========================================

statement ok
CREATE TABLE avg_data (grp VARCHAR, val DOUBLE);

statement ok
INSERT INTO avg_data VALUES ('a', 10), ('a', 20), ('b', 30);

statement ok
CREATE MATERIALIZED VIEW mv_avg AS SELECT grp, AVG(val) AS avg_val FROM avg_data GROUP BY grp;

query II
SELECT grp, avg_val FROM mv_avg ORDER BY grp;
----
a	15.0
b	30.0

statement ok
INSERT INTO avg_data VALUES ('a', 40), ('c', 100);

statement ok
pragma ivm('mv_avg');

query II
SELECT grp, avg_val FROM mv_avg ORDER BY grp;
----
a	23.333333333333332
b	30.0
c	100.0

# Cross-check
query II
SELECT grp, AVG(val) FROM avg_data GROUP BY grp ORDER BY grp;
----
a	23.333333333333332
b	30.0
c	100.0

# Delete from group
statement ok
DELETE FROM avg_data WHERE grp = 'a' AND val = 10;

statement ok
pragma ivm('mv_avg');

query II
SELECT grp, avg_val FROM mv_avg ORDER BY grp;
----
a	30.0
b	30.0
c	100.0

# Ungrouped AVG
statement ok
CREATE TABLE avg_ungrouped (val INT);

statement ok
INSERT INTO avg_ungrouped VALUES (10), (20), (30);

statement ok
CREATE MATERIALIZED VIEW mv_avg_scalar AS SELECT AVG(val) AS avg_val FROM avg_ungrouped;

query I
SELECT avg_val FROM mv_avg_scalar;
----
20.0

statement ok
INSERT INTO avg_ungrouped VALUES (40);

statement ok
pragma ivm('mv_avg_scalar');

query I
SELECT avg_val FROM mv_avg_scalar;
----
25.0

# Cross-check
query I
SELECT AVG(val) FROM avg_ungrouped;
----
25.0

# ==========================================
# HAVING clause (optimized to FILTER above AGGREGATE by DuckDB)
# ==========================================

statement ok
CREATE TABLE having_test (region VARCHAR, amount INT);

statement ok
INSERT INTO having_test VALUES ('a', 100), ('a', 200), ('b', 50), ('c', 10);

statement ok
CREATE MATERIALIZED VIEW mv_having AS SELECT region, SUM(amount) AS total FROM having_test GROUP BY region HAVING SUM(amount) > 60;

query II
SELECT region, total FROM mv_having ORDER BY region;
----
a	300

statement ok
INSERT INTO having_test VALUES ('b', 100), ('c', 200);

statement ok
PRAGMA ivm('mv_having');

# Cross-check
query I
SELECT COUNT(*) FROM (
    SELECT region, SUM(amount) AS total FROM having_test GROUP BY region HAVING SUM(amount) > 60
    EXCEPT ALL
    SELECT region, total FROM mv_having
);
----
0

query I
SELECT COUNT(*) FROM (
    SELECT region, total FROM mv_having
    EXCEPT ALL
    SELECT region, SUM(amount) AS total FROM having_test GROUP BY region HAVING SUM(amount) > 60
);
----
0

# ==========================================
# CASE WHEN in aggregates
# ==========================================

statement ok
CREATE TABLE case_test (category VARCHAR, value INT);

statement ok
INSERT INTO case_test VALUES ('a', 10), ('a', -5), ('b', 20), ('b', -3);

statement ok
CREATE MATERIALIZED VIEW mv_case AS SELECT category, SUM(CASE WHEN value > 0 THEN value ELSE 0 END) AS pos_sum FROM case_test GROUP BY category;

query II
SELECT category, pos_sum FROM mv_case ORDER BY category;
----
a	10
b	20

statement ok
INSERT INTO case_test VALUES ('a', 30), ('b', -100), ('c', 50);

statement ok
PRAGMA ivm('mv_case');

# Cross-check
query I
SELECT COUNT(*) FROM (
    SELECT category, SUM(CASE WHEN value > 0 THEN value ELSE 0 END) AS pos_sum FROM case_test GROUP BY category
    EXCEPT ALL
    SELECT category, pos_sum FROM mv_case
);
----
0

query I
SELECT COUNT(*) FROM (
    SELECT category, pos_sum FROM mv_case
    EXCEPT ALL
    SELECT category, SUM(CASE WHEN value > 0 THEN value ELSE 0 END) AS pos_sum FROM case_test GROUP BY category
);
----
0

# ==========================================
# NULL values in aggregate columns with edge case deletions
# ==========================================

statement ok
CREATE TABLE agg_null_edge (grp VARCHAR, val INT);

statement ok
INSERT INTO agg_null_edge VALUES ('a', 10), ('a', NULL), ('b', NULL), ('b', NULL), ('c', 30);

statement ok
CREATE MATERIALIZED VIEW mv_agg_null_edge AS
    SELECT grp, SUM(val) AS total, COUNT(*) AS cnt, COUNT(val) AS cnt_val
    FROM agg_null_edge GROUP BY grp;

statement ok
PRAGMA ivm('mv_agg_null_edge');

# Cross-check after initial load
query I
SELECT COUNT(*) FROM (
    SELECT grp, SUM(val) AS total, COUNT(*) AS cnt, COUNT(val) AS cnt_val FROM agg_null_edge GROUP BY grp
    EXCEPT ALL
    SELECT grp, total, cnt, cnt_val FROM mv_agg_null_edge
);
----
0

query I
SELECT COUNT(*) FROM (
    SELECT grp, total, cnt, cnt_val FROM mv_agg_null_edge
    EXCEPT ALL
    SELECT grp, SUM(val) AS total, COUNT(*) AS cnt, COUNT(val) AS cnt_val FROM agg_null_edge GROUP BY grp
);
----
0

# Delete all NULL vals — group 'b' loses all rows (cnt becomes 0 → group removed)
statement ok
DELETE FROM agg_null_edge WHERE val IS NULL;

statement ok
PRAGMA ivm('mv_agg_null_edge');

query I
SELECT COUNT(*) FROM (
    SELECT grp, SUM(val) AS total, COUNT(*) AS cnt, COUNT(val) AS cnt_val FROM agg_null_edge GROUP BY grp
    EXCEPT ALL
    SELECT grp, total, cnt, cnt_val FROM mv_agg_null_edge
);
----
0

query I
SELECT COUNT(*) FROM (
    SELECT grp, total, cnt, cnt_val FROM mv_agg_null_edge
    EXCEPT ALL
    SELECT grp, SUM(val) AS total, COUNT(*) AS cnt, COUNT(val) AS cnt_val FROM agg_null_edge GROUP BY grp
);
----
0

# Insert only NULLs into 'a': SUM unchanged, COUNT(*) increases, COUNT(val) unchanged
statement ok
INSERT INTO agg_null_edge VALUES ('a', NULL), ('a', NULL);

statement ok
PRAGMA ivm('mv_agg_null_edge');

query I
SELECT COUNT(*) FROM (
    SELECT grp, SUM(val) AS total, COUNT(*) AS cnt, COUNT(val) AS cnt_val FROM agg_null_edge GROUP BY grp
    EXCEPT ALL
    SELECT grp, total, cnt, cnt_val FROM mv_agg_null_edge
);
----
0

query I
SELECT COUNT(*) FROM (
    SELECT grp, total, cnt, cnt_val FROM mv_agg_null_edge
    EXCEPT ALL
    SELECT grp, SUM(val) AS total, COUNT(*) AS cnt, COUNT(val) AS cnt_val FROM agg_null_edge GROUP BY grp
);
----
0

# ==========================================
# UPDATE that changes GROUP BY key (row moves between groups)
# ==========================================

statement ok
CREATE TABLE agg_grp_move (grp VARCHAR, val INT);

statement ok
INSERT INTO agg_grp_move VALUES ('x', 10), ('x', 20), ('y', 30);

statement ok
CREATE MATERIALIZED VIEW mv_agg_grp_move AS
    SELECT grp, SUM(val) AS total FROM agg_grp_move GROUP BY grp;

statement ok
PRAGMA ivm('mv_agg_grp_move');

# Cross-check after initial load
query I
SELECT COUNT(*) FROM (
    SELECT grp, SUM(val) AS total FROM agg_grp_move GROUP BY grp
    EXCEPT ALL
    SELECT grp, total FROM mv_agg_grp_move
);
----
0

query I
SELECT COUNT(*) FROM (
    SELECT grp, total FROM mv_agg_grp_move
    EXCEPT ALL
    SELECT grp, SUM(val) AS total FROM agg_grp_move GROUP BY grp
);
----
0

# Move row from x to y: UPDATE val=20 row's grp from 'x' to 'y'
statement ok
UPDATE agg_grp_move SET grp = 'y' WHERE val = 20;

statement ok
PRAGMA ivm('mv_agg_grp_move');

# x total: 10, y total: 50
query I
SELECT COUNT(*) FROM (
    SELECT grp, SUM(val) AS total FROM agg_grp_move GROUP BY grp
    EXCEPT ALL
    SELECT grp, total FROM mv_agg_grp_move
);
----
0

query I
SELECT COUNT(*) FROM (
    SELECT grp, total FROM mv_agg_grp_move
    EXCEPT ALL
    SELECT grp, SUM(val) AS total FROM agg_grp_move GROUP BY grp
);
----
0

# Move row from y to new group z: UPDATE val=30 row's grp from 'y' to 'z'
statement ok
UPDATE agg_grp_move SET grp = 'z' WHERE val = 30;

statement ok
PRAGMA ivm('mv_agg_grp_move');

query I
SELECT COUNT(*) FROM (
    SELECT grp, SUM(val) AS total FROM agg_grp_move GROUP BY grp
    EXCEPT ALL
    SELECT grp, total FROM mv_agg_grp_move
);
----
0

query I
SELECT COUNT(*) FROM (
    SELECT grp, total FROM mv_agg_grp_move
    EXCEPT ALL
    SELECT grp, SUM(val) AS total FROM agg_grp_move GROUP BY grp
);
----
0


# ==========================================
# JOIN + GROUP BY + HAVING
# ==========================================

statement ok
CREATE TABLE ajh_orders (id INT, cust_id INT, amount INT);

statement ok
CREATE TABLE ajh_customers (id INT, region VARCHAR);

statement ok
INSERT INTO ajh_customers VALUES (1, 'US'), (2, 'EU'), (3, 'US');

statement ok
INSERT INTO ajh_orders VALUES (1, 1, 100), (2, 1, 200), (3, 2, 150), (4, 3, 50);

statement ok
CREATE MATERIALIZED VIEW mv_big_regions AS
    SELECT c.region, SUM(o.amount) AS total, COUNT(*) AS cnt
    FROM ajh_orders o INNER JOIN ajh_customers c ON o.cust_id = c.id
    GROUP BY c.region
    HAVING SUM(o.amount) > 200;

# Only US qualifies (350 > 200), EU has 150
query III
SELECT region, total, cnt FROM mv_big_regions ORDER BY region;
----
US	350	3

# Add orders to EU so it crosses the threshold
statement ok
INSERT INTO ajh_orders VALUES (5, 2, 200);

statement ok
PRAGMA ivm('mv_big_regions');

query I
SELECT COUNT(*) FROM (
    SELECT c.region, SUM(o.amount), COUNT(*)
    FROM ajh_orders o INNER JOIN ajh_customers c ON o.cust_id = c.id
    GROUP BY c.region HAVING SUM(o.amount) > 200
    EXCEPT ALL SELECT * FROM mv_big_regions
);
----
0

query I
SELECT COUNT(*) FROM (
    SELECT * FROM mv_big_regions
    EXCEPT ALL SELECT c.region, SUM(o.amount), COUNT(*)
    FROM ajh_orders o INNER JOIN ajh_customers c ON o.cust_id = c.id
    GROUP BY c.region HAVING SUM(o.amount) > 200
);
----
0

# Delete enough from US to drop below threshold
statement ok
DELETE FROM ajh_orders WHERE cust_id = 1 AND amount = 200;

statement ok
PRAGMA ivm('mv_big_regions');

query I
SELECT COUNT(*) FROM (
    SELECT c.region, SUM(o.amount), COUNT(*)
    FROM ajh_orders o INNER JOIN ajh_customers c ON o.cust_id = c.id
    GROUP BY c.region HAVING SUM(o.amount) > 200
    EXCEPT ALL SELECT * FROM mv_big_regions
);
----
0

query I
SELECT COUNT(*) FROM (
    SELECT * FROM mv_big_regions
    EXCEPT ALL SELECT c.region, SUM(o.amount), COUNT(*)
    FROM ajh_orders o INNER JOIN ajh_customers c ON o.cust_id = c.id
    GROUP BY c.region HAVING SUM(o.amount) > 200
);
----
0

# Insert new customer + orders in one batch
statement ok
INSERT INTO ajh_customers VALUES (4, 'APAC');

statement ok
INSERT INTO ajh_orders VALUES (6, 4, 500), (7, 4, 100);

statement ok
PRAGMA ivm('mv_big_regions');

query I
SELECT COUNT(*) FROM (
    SELECT c.region, SUM(o.amount), COUNT(*)
    FROM ajh_orders o INNER JOIN ajh_customers c ON o.cust_id = c.id
    GROUP BY c.region HAVING SUM(o.amount) > 200
    EXCEPT ALL SELECT * FROM mv_big_regions
);
----
0

query I
SELECT COUNT(*) FROM (
    SELECT * FROM mv_big_regions
    EXCEPT ALL SELECT c.region, SUM(o.amount), COUNT(*)
    FROM ajh_orders o INNER JOIN ajh_customers c ON o.cust_id = c.id
    GROUP BY c.region HAVING SUM(o.amount) > 200
);
----
0

# ==========================================
# GROUP disappears entirely (single-row group deleted)
# ==========================================

statement ok
CREATE TABLE agg_vanish (grp VARCHAR, val INT);

statement ok
INSERT INTO agg_vanish VALUES ('p', 10), ('q', 20), ('r', 30);

statement ok
CREATE MATERIALIZED VIEW mv_agg_vanish AS
    SELECT grp, SUM(val) AS total FROM agg_vanish GROUP BY grp;

statement ok
PRAGMA ivm('mv_agg_vanish');

# Cross-check after initial load
query I
SELECT COUNT(*) FROM (
    SELECT grp, SUM(val) AS total FROM agg_vanish GROUP BY grp
    EXCEPT ALL
    SELECT * FROM mv_agg_vanish
);
----
0

query I
SELECT COUNT(*) FROM (
    SELECT * FROM mv_agg_vanish
    EXCEPT ALL
    SELECT grp, SUM(val) AS total FROM agg_vanish GROUP BY grp
);
----
0

# Delete the only row in group 'q' — group should vanish
statement ok
DELETE FROM agg_vanish WHERE grp = 'q';

statement ok
PRAGMA ivm('mv_agg_vanish');

query I
SELECT COUNT(*) FROM (
    SELECT grp, SUM(val) AS total FROM agg_vanish GROUP BY grp
    EXCEPT ALL
    SELECT * FROM mv_agg_vanish
);
----
0

query I
SELECT COUNT(*) FROM (
    SELECT * FROM mv_agg_vanish
    EXCEPT ALL
    SELECT grp, SUM(val) AS total FROM agg_vanish GROUP BY grp
);
----
0

# ==========================================
# UPDATE moves rows between groups (changes GROUP BY key)
# ==========================================

statement ok
CREATE TABLE agg_key_move (grp VARCHAR, val INT);

statement ok
INSERT INTO agg_key_move VALUES ('m', 10), ('m', 20), ('n', 30), ('n', 40);

statement ok
CREATE MATERIALIZED VIEW mv_agg_key_move AS
    SELECT grp, SUM(val) AS total, COUNT(*) AS cnt FROM agg_key_move GROUP BY grp;

statement ok
PRAGMA ivm('mv_agg_key_move');

# Cross-check after initial load
query I
SELECT COUNT(*) FROM (
    SELECT grp, SUM(val) AS total, COUNT(*) AS cnt FROM agg_key_move GROUP BY grp
    EXCEPT ALL
    SELECT * FROM mv_agg_key_move
);
----
0

query I
SELECT COUNT(*) FROM (
    SELECT * FROM mv_agg_key_move
    EXCEPT ALL
    SELECT grp, SUM(val) AS total, COUNT(*) AS cnt FROM agg_key_move GROUP BY grp
);
----
0

# Move val=20 from 'm' to 'n'
statement ok
UPDATE agg_key_move SET grp = 'n' WHERE val = 20;

statement ok
PRAGMA ivm('mv_agg_key_move');

# m: total=10 cnt=1, n: total=90 cnt=3
query I
SELECT COUNT(*) FROM (
    SELECT grp, SUM(val) AS total, COUNT(*) AS cnt FROM agg_key_move GROUP BY grp
    EXCEPT ALL
    SELECT * FROM mv_agg_key_move
);
----
0

query I
SELECT COUNT(*) FROM (
    SELECT * FROM mv_agg_key_move
    EXCEPT ALL
    SELECT grp, SUM(val) AS total, COUNT(*) AS cnt FROM agg_key_move GROUP BY grp
);
----
0

# Move remaining 'm' row to brand-new group 'o' — 'm' vanishes, 'o' appears
statement ok
UPDATE agg_key_move SET grp = 'o' WHERE grp = 'm';

statement ok
PRAGMA ivm('mv_agg_key_move');

query I
SELECT COUNT(*) FROM (
    SELECT grp, SUM(val) AS total, COUNT(*) AS cnt FROM agg_key_move GROUP BY grp
    EXCEPT ALL
    SELECT * FROM mv_agg_key_move
);
----
0

query I
SELECT COUNT(*) FROM (
    SELECT * FROM mv_agg_key_move
    EXCEPT ALL
    SELECT grp, SUM(val) AS total, COUNT(*) AS cnt FROM agg_key_move GROUP BY grp
);
----
0

# ==========================================
# LEFT JOIN + AGGREGATE (SUM over NULL-extended rows)
# ==========================================

statement ok
CREATE TABLE lja_customers (id INT, name VARCHAR);

statement ok
CREATE TABLE lja_orders (cust_id INT, amount INT);

statement ok
INSERT INTO lja_customers VALUES (1, 'Alice'), (2, 'Bob'), (3, 'Carol');

statement ok
INSERT INTO lja_orders VALUES (1, 100), (1, 200), (2, 50);

statement ok
CREATE MATERIALIZED VIEW mv_cust_totals AS
    SELECT c.name, SUM(o.amount) AS total, COUNT(o.amount) AS cnt
    FROM lja_customers c LEFT JOIN lja_orders o ON c.id = o.cust_id
    GROUP BY c.name;

# Carol has no orders → total=NULL, cnt=0
query I
SELECT COUNT(*) FROM (
    SELECT c.name, SUM(o.amount), COUNT(o.amount)
    FROM lja_customers c LEFT JOIN lja_orders o ON c.id = o.cust_id GROUP BY c.name
    EXCEPT ALL SELECT * FROM mv_cust_totals
);
----
0

# Add order for Carol + delete all orders for Alice
statement ok
INSERT INTO lja_orders VALUES (3, 75);

statement ok
DELETE FROM lja_orders WHERE cust_id = 1;

statement ok
PRAGMA ivm('mv_cust_totals');

query I
SELECT COUNT(*) FROM (
    SELECT c.name, SUM(o.amount), COUNT(o.amount)
    FROM lja_customers c LEFT JOIN lja_orders o ON c.id = o.cust_id GROUP BY c.name
    EXCEPT ALL SELECT * FROM mv_cust_totals
);
----
0

query I
SELECT COUNT(*) FROM (
    SELECT * FROM mv_cust_totals
    EXCEPT ALL SELECT c.name, SUM(o.amount), COUNT(o.amount)
    FROM lja_customers c LEFT JOIN lja_orders o ON c.id = o.cust_id GROUP BY c.name
);
----
0

# Delete all orders — everyone NULL-extended
statement ok
DELETE FROM lja_orders;

statement ok
PRAGMA ivm('mv_cust_totals');

query I
SELECT COUNT(*) FROM (
    SELECT c.name, SUM(o.amount), COUNT(o.amount)
    FROM lja_customers c LEFT JOIN lja_orders o ON c.id = o.cust_id GROUP BY c.name
    EXCEPT ALL SELECT * FROM mv_cust_totals
);
----
0

query I
SELECT COUNT(*) FROM (
    SELECT * FROM mv_cust_totals
    EXCEPT ALL SELECT c.name, SUM(o.amount), COUNT(o.amount)
    FROM lja_customers c LEFT JOIN lja_orders o ON c.id = o.cust_id GROUP BY c.name
);
----
0

# ==========================================
# STDDEV and VARIANCE decomposition
# ==========================================

statement ok
CREATE TABLE sd_base (id INT, grp VARCHAR, val DOUBLE);

statement ok
INSERT INTO sd_base VALUES (1,'a',10), (2,'a',20), (3,'a',30), (4,'b',5), (5,'b',15), (6,'b',25);

statement ok
CREATE MATERIALIZED VIEW mv_stddev AS
    SELECT grp, stddev(val) as sd, variance(val) as vr, stddev_pop(val) as sdp, var_pop(val) as vrp
    FROM sd_base GROUP BY grp;

# Cross-check initial
query I
SELECT COUNT(*) FROM (
    SELECT grp, round(sd,6), round(vr,6), round(sdp,6), round(vrp,6) FROM mv_stddev
    EXCEPT ALL
    SELECT grp, round(stddev(val),6), round(variance(val),6), round(stddev_pop(val),6), round(var_pop(val),6)
    FROM sd_base GROUP BY grp
);
----
0

# --- INSERT into existing groups + new group ---
statement ok
INSERT INTO sd_base VALUES (7,'a',40), (8,'b',35), (9,'c',100);

statement ok
PRAGMA ivm('mv_stddev');

query I
SELECT COUNT(*) FROM (
    SELECT grp, round(sd,6), round(vr,6), round(sdp,6), round(vrp,6) FROM mv_stddev
    EXCEPT ALL
    SELECT grp, round(stddev(val),6), round(variance(val),6), round(stddev_pop(val),6), round(var_pop(val),6)
    FROM sd_base GROUP BY grp
);
----
0

query I
SELECT COUNT(*) FROM (
    SELECT grp, round(stddev(val),6), round(variance(val),6), round(stddev_pop(val),6), round(var_pop(val),6)
    FROM sd_base GROUP BY grp
    EXCEPT ALL
    SELECT grp, round(sd,6), round(vr,6), round(sdp,6), round(vrp,6) FROM mv_stddev
);
----
0

# --- DELETE + mixed DML ---
statement ok
DELETE FROM sd_base WHERE id IN (1, 4);

statement ok
INSERT INTO sd_base VALUES (10,'c',200), (11,'a',50);

statement ok
PRAGMA ivm('mv_stddev');

query I
SELECT COUNT(*) FROM (
    SELECT grp, round(sd,6), round(vr,6), round(sdp,6), round(vrp,6) FROM mv_stddev
    EXCEPT ALL
    SELECT grp, round(stddev(val),6), round(variance(val),6), round(stddev_pop(val),6), round(var_pop(val),6)
    FROM sd_base GROUP BY grp
);
----
0

query I
SELECT COUNT(*) FROM (
    SELECT grp, round(stddev(val),6), round(variance(val),6), round(stddev_pop(val),6), round(var_pop(val),6)
    FROM sd_base GROUP BY grp
    EXCEPT ALL
    SELECT grp, round(sd,6), round(vr,6), round(sdp,6), round(vrp,6) FROM mv_stddev
);
----
0
