# name: test/sql/mv_distinct.test
# description: Test IVM with SELECT DISTINCT
# group: [sql]

require openivm

statement ok
SET ivm_cascade_refresh = 'off';

# ============================================================
# Basic DISTINCT
# ============================================================

statement ok
CREATE TABLE colors (id INT, color VARCHAR);

statement ok
INSERT INTO colors VALUES (1, 'red'), (2, 'blue'), (3, 'red'), (4, 'green');

statement ok
CREATE MATERIALIZED VIEW distinct_colors AS SELECT DISTINCT color FROM colors;

query I
SELECT * FROM distinct_colors ORDER BY color;
----
blue
green
red

# Insert duplicate — should not change DISTINCT result
statement ok
INSERT INTO colors VALUES (5, 'red'), (6, 'blue');

statement ok
PRAGMA ivm('distinct_colors');

query I
SELECT COUNT(*) FROM (SELECT DISTINCT color FROM colors EXCEPT ALL SELECT * FROM distinct_colors);
----
0

query I
SELECT COUNT(*) FROM (SELECT * FROM distinct_colors EXCEPT ALL SELECT DISTINCT color FROM colors);
----
0

# Insert new value
statement ok
INSERT INTO colors VALUES (7, 'yellow');

statement ok
PRAGMA ivm('distinct_colors');

query I
SELECT COUNT(*) FROM (SELECT DISTINCT color FROM colors EXCEPT ALL SELECT * FROM distinct_colors);
----
0

query I
SELECT COUNT(*) FROM (SELECT * FROM distinct_colors EXCEPT ALL SELECT DISTINCT color FROM colors);
----
0

# Delete all of one color — should remove from DISTINCT result
statement ok
DELETE FROM colors WHERE color = 'green';

statement ok
PRAGMA ivm('distinct_colors');

query I
SELECT COUNT(*) FROM (SELECT DISTINCT color FROM colors EXCEPT ALL SELECT * FROM distinct_colors);
----
0

query I
SELECT COUNT(*) FROM (SELECT * FROM distinct_colors EXCEPT ALL SELECT DISTINCT color FROM colors);
----
0

# ============================================================
# DISTINCT with multiple columns
# ============================================================

statement ok
CREATE TABLE pairs (a VARCHAR, b INT);

statement ok
INSERT INTO pairs VALUES ('x', 1), ('x', 2), ('y', 1), ('x', 1);

statement ok
CREATE MATERIALIZED VIEW distinct_pairs AS SELECT DISTINCT a, b FROM pairs;

query II
SELECT a, b FROM distinct_pairs ORDER BY a, b;
----
x	1
x	2
y	1

# Insert duplicate pair — no change
statement ok
INSERT INTO pairs VALUES ('x', 1), ('y', 1);

statement ok
PRAGMA ivm('distinct_pairs');

query I
SELECT COUNT(*) FROM (SELECT DISTINCT a, b FROM pairs EXCEPT ALL SELECT a, b FROM distinct_pairs);
----
0

# Delete one copy of a duplicate — should still exist
statement ok
DELETE FROM pairs WHERE a = 'x' AND b = 1;

statement ok
PRAGMA ivm('distinct_pairs');

# x,1 still exists in pairs (was inserted twice before, deleted once)
query I
SELECT COUNT(*) FROM (SELECT DISTINCT a, b FROM pairs EXCEPT ALL SELECT a, b FROM distinct_pairs);
----
0

query I
SELECT COUNT(*) FROM (SELECT a, b FROM distinct_pairs EXCEPT ALL SELECT DISTINCT a, b FROM pairs);
----
0

# ============================================================
# Mixed INSERT + DELETE + INSERT before single refresh
# ============================================================

statement ok
INSERT INTO colors VALUES (10, 'purple'), (11, 'purple'), (12, 'orange');

statement ok
DELETE FROM colors WHERE color = 'yellow';

statement ok
INSERT INTO colors VALUES (13, 'yellow');

statement ok
PRAGMA ivm('distinct_colors');

query I
SELECT COUNT(*) FROM (SELECT DISTINCT color FROM colors EXCEPT ALL SELECT * FROM distinct_colors);
----
0

query I
SELECT COUNT(*) FROM (SELECT * FROM distinct_colors EXCEPT ALL SELECT DISTINCT color FROM colors);
----
0

# ============================================================
# DISTINCT with all-NULL rows
# ============================================================

statement ok
CREATE TABLE dist_all_null (a INT, b VARCHAR);

statement ok
INSERT INTO dist_all_null VALUES (NULL, NULL), (NULL, NULL), (1, NULL), (NULL, 'x');

statement ok
CREATE MATERIALIZED VIEW mv_dist_all_null AS SELECT DISTINCT a, b FROM dist_all_null;

statement ok
PRAGMA ivm('mv_dist_all_null');

# Should have 3 distinct rows: (NULL, NULL), (1, NULL), (NULL, 'x')
query I
SELECT COUNT(*) FROM (
    SELECT DISTINCT a, b FROM dist_all_null
    EXCEPT ALL
    SELECT a, b FROM mv_dist_all_null
);
----
0

query I
SELECT COUNT(*) FROM (
    SELECT a, b FROM mv_dist_all_null
    EXCEPT ALL
    SELECT DISTINCT a, b FROM dist_all_null
);
----
0

# Delete both copies of (NULL, NULL) — it should disappear from DISTINCT
statement ok
DELETE FROM dist_all_null WHERE a IS NULL AND b IS NULL;

statement ok
PRAGMA ivm('mv_dist_all_null');

query I
SELECT COUNT(*) FROM (
    SELECT DISTINCT a, b FROM dist_all_null
    EXCEPT ALL
    SELECT a, b FROM mv_dist_all_null
);
----
0

query I
SELECT COUNT(*) FROM (
    SELECT a, b FROM mv_dist_all_null
    EXCEPT ALL
    SELECT DISTINCT a, b FROM dist_all_null
);
----
0

# Insert (NULL, NULL) back — it should reappear
statement ok
INSERT INTO dist_all_null VALUES (NULL, NULL);

statement ok
PRAGMA ivm('mv_dist_all_null');

query I
SELECT COUNT(*) FROM (
    SELECT DISTINCT a, b FROM dist_all_null
    EXCEPT ALL
    SELECT a, b FROM mv_dist_all_null
);
----
0

query I
SELECT COUNT(*) FROM (
    SELECT a, b FROM mv_dist_all_null
    EXCEPT ALL
    SELECT DISTINCT a, b FROM dist_all_null
);
----
0

# ============================================================
# DISTINCT with expression that collapses values
# ============================================================

statement ok
CREATE TABLE dist_collapse (val INT);

statement ok
INSERT INTO dist_collapse VALUES (-5), (5), (-10), (10), (0), (0);

statement ok
CREATE MATERIALIZED VIEW mv_dist_collapse AS SELECT DISTINCT ABS(val) AS abs_val FROM dist_collapse;

statement ok
PRAGMA ivm('mv_dist_collapse');

# Should have 3 distinct abs values: 0, 5, 10
query I
SELECT COUNT(*) FROM (
    SELECT DISTINCT ABS(val) AS abs_val FROM dist_collapse
    EXCEPT ALL
    SELECT * FROM mv_dist_collapse
);
----
0

query I
SELECT COUNT(*) FROM (
    SELECT * FROM mv_dist_collapse
    EXCEPT ALL
    SELECT DISTINCT ABS(val) AS abs_val FROM dist_collapse
);
----
0

# Delete val=-5 — ABS(5) still exists from val=5, so no change in DISTINCT
statement ok
DELETE FROM dist_collapse WHERE val = -5;

statement ok
PRAGMA ivm('mv_dist_collapse');

query I
SELECT COUNT(*) FROM (
    SELECT DISTINCT ABS(val) AS abs_val FROM dist_collapse
    EXCEPT ALL
    SELECT * FROM mv_dist_collapse
);
----
0

query I
SELECT COUNT(*) FROM (
    SELECT * FROM mv_dist_collapse
    EXCEPT ALL
    SELECT DISTINCT ABS(val) AS abs_val FROM dist_collapse
);
----
0

# Delete val=5 — now ABS(5) has no source left, should be removed
statement ok
DELETE FROM dist_collapse WHERE val = 5;

statement ok
PRAGMA ivm('mv_dist_collapse');

query I
SELECT COUNT(*) FROM (
    SELECT DISTINCT ABS(val) AS abs_val FROM dist_collapse
    EXCEPT ALL
    SELECT * FROM mv_dist_collapse
);
----
0

query I
SELECT COUNT(*) FROM (
    SELECT * FROM mv_dist_collapse
    EXCEPT ALL
    SELECT DISTINCT ABS(val) AS abs_val FROM dist_collapse
);
----
0

# Insert two -5s — ABS(5) comes back
statement ok
INSERT INTO dist_collapse VALUES (-5), (-5);

statement ok
PRAGMA ivm('mv_dist_collapse');

query I
SELECT COUNT(*) FROM (
    SELECT DISTINCT ABS(val) AS abs_val FROM dist_collapse
    EXCEPT ALL
    SELECT * FROM mv_dist_collapse
);
----
0

query I
SELECT COUNT(*) FROM (
    SELECT * FROM mv_dist_collapse
    EXCEPT ALL
    SELECT DISTINCT ABS(val) AS abs_val FROM dist_collapse
);
----
0

# ==========================================
# DISTINCT on a 2-table join
# ==========================================

statement ok
CREATE TABLE dist_j_orders (id INT, product VARCHAR);

statement ok
CREATE TABLE dist_j_products (name VARCHAR, category VARCHAR);

statement ok
INSERT INTO dist_j_products VALUES ('A', 'X'), ('B', 'X'), ('C', 'Y');

statement ok
INSERT INTO dist_j_orders VALUES (1, 'A'), (2, 'A'), (3, 'B'), (4, 'C');

statement ok
CREATE MATERIALIZED VIEW mv_dist_join AS
    SELECT DISTINCT p.category FROM dist_j_orders o INNER JOIN dist_j_products p ON o.product = p.name;

query I
SELECT * FROM mv_dist_join ORDER BY 1;
----
X
Y

# Insert more orders for same categories — DISTINCT should not change
statement ok
INSERT INTO dist_j_orders VALUES (5, 'B'), (6, 'A');

statement ok
PRAGMA ivm('mv_dist_join');

query I
SELECT COUNT(*) FROM (
    SELECT DISTINCT p.category FROM dist_j_orders o INNER JOIN dist_j_products p ON o.product = p.name
    EXCEPT ALL SELECT * FROM mv_dist_join
);
----
0

query I
SELECT COUNT(*) FROM (
    SELECT * FROM mv_dist_join
    EXCEPT ALL SELECT DISTINCT p.category FROM dist_j_orders o INNER JOIN dist_j_products p ON o.product = p.name
);
----
0

# Delete all orders for category Y — it should disappear
statement ok
DELETE FROM dist_j_orders WHERE product = 'C';

statement ok
PRAGMA ivm('mv_dist_join');

query I
SELECT COUNT(*) FROM (
    SELECT DISTINCT p.category FROM dist_j_orders o INNER JOIN dist_j_products p ON o.product = p.name
    EXCEPT ALL SELECT * FROM mv_dist_join
);
----
0

query I
SELECT COUNT(*) FROM (
    SELECT * FROM mv_dist_join
    EXCEPT ALL SELECT DISTINCT p.category FROM dist_j_orders o INNER JOIN dist_j_products p ON o.product = p.name
);
----
0

# ============================================================
# UNION (implicit DISTINCT) — regression for rewriter_benchmark
# query_0076 etc.: a projection above the DISTINCT referenced
# the UNION's output bindings; replacing DISTINCT with an
# AGGREGATE left those BCRs dangling and LPTS emitted the old
# table-index column names.
# ============================================================

statement ok
CREATE TABLE u_dist_a (id INT);

statement ok
CREATE TABLE u_dist_b (id INT);

statement ok
CREATE TABLE u_dist_c (id INT);

statement ok
INSERT INTO u_dist_a VALUES (1), (2), (3);

statement ok
INSERT INTO u_dist_b VALUES (2), (3), (4);

statement ok
INSERT INTO u_dist_c VALUES (3), (4), (5);

statement ok
CREATE MATERIALIZED VIEW mv_union_distinct AS
    SELECT id FROM u_dist_a
    UNION
    SELECT id FROM u_dist_b
    UNION
    SELECT id FROM u_dist_c;

# Batch: insert into all three + delete from one, single refresh.
# id=1 gets deleted from a and simultaneously inserted into c — net
# effect on the UNION is zero (c already carries it).
statement ok
INSERT INTO u_dist_a VALUES (10);

statement ok
INSERT INTO u_dist_b VALUES (5), (5);

statement ok
INSERT INTO u_dist_c VALUES (1);

statement ok
DELETE FROM u_dist_a WHERE id = 1;

statement ok
PRAGMA ivm('mv_union_distinct');

query I
SELECT COUNT(*) FROM (
    (SELECT id FROM u_dist_a UNION SELECT id FROM u_dist_b UNION SELECT id FROM u_dist_c)
    EXCEPT ALL SELECT * FROM mv_union_distinct
);
----
0

query I
SELECT COUNT(*) FROM (
    SELECT * FROM mv_union_distinct
    EXCEPT ALL
    (SELECT id FROM u_dist_a UNION SELECT id FROM u_dist_b UNION SELECT id FROM u_dist_c)
);
----
0

# UNION with a literal column forcing a projection above the DISTINCT
statement ok
CREATE MATERIALIZED VIEW mv_union_labeled AS
    SELECT id, 'a' AS src FROM u_dist_a
    UNION
    SELECT id, 'b' FROM u_dist_b;

statement ok
INSERT INTO u_dist_a VALUES (100);

statement ok
DELETE FROM u_dist_b WHERE id = 4;

statement ok
PRAGMA ivm('mv_union_labeled');

query I
SELECT COUNT(*) FROM (
    (SELECT id, 'a' AS src FROM u_dist_a UNION SELECT id, 'b' FROM u_dist_b)
    EXCEPT ALL SELECT * FROM mv_union_labeled
);
----
0

query I
SELECT COUNT(*) FROM (
    SELECT * FROM mv_union_labeled
    EXCEPT ALL
    (SELECT id, 'a' AS src FROM u_dist_a UNION SELECT id, 'b' FROM u_dist_b)
);
----
0
