# name: test/sql/scd2_range_join_accel.test
# description: SCD-2 range-join delta timestamp-domain acceleration
# group: [sql]

require openivm

statement ok
CREATE TABLE off_fact(id INT, dim_id INT, ts TIMESTAMP, amount INT);

statement ok
CREATE TABLE off_dim(dim_id INT, attr VARCHAR, effective_timestamp TIMESTAMP, end_timestamp TIMESTAMP);

statement ok
INSERT INTO off_fact VALUES (1, 10, '2024-01-15', 100), (2, 10, '2024-02-10', 200), (3, 20, '2024-01-20', 300);

statement ok
INSERT INTO off_dim VALUES (10, 'old', '2024-01-01', '2024-02-01'), (10, 'new', '2024-02-01', '9999-12-31'), (20, 'beta', '2024-01-01', '9999-12-31');

statement ok
SET openivm_scd2_range_join_accel = false;

statement ok
CREATE MATERIALIZED VIEW off_mv_scd2 AS
    SELECT f.id, f.dim_id, f.ts, f.amount, d.attr
    FROM off_fact f
    JOIN off_dim d
      ON f.dim_id = d.dim_id
     AND d.effective_timestamp <= f.ts
     AND f.ts < d.end_timestamp;

query I
SELECT COUNT(*) FROM (
    SELECT f.id, f.dim_id, f.ts, f.amount, d.attr
    FROM off_fact f JOIN off_dim d
      ON f.dim_id = d.dim_id AND d.effective_timestamp <= f.ts AND f.ts < d.end_timestamp
    EXCEPT ALL
    SELECT id, dim_id, ts, amount, attr FROM off_mv_scd2
);
----
0

query I
SELECT COUNT(*) FROM (
    SELECT id, dim_id, ts, amount, attr FROM off_mv_scd2
    EXCEPT ALL
    SELECT f.id, f.dim_id, f.ts, f.amount, d.attr
    FROM off_fact f JOIN off_dim d
      ON f.dim_id = d.dim_id AND d.effective_timestamp <= f.ts AND f.ts < d.end_timestamp
);
----
0

statement ok
INSERT INTO off_fact VALUES (4, 10, '2024-03-10', 400);

query I
SELECT COALESCE(bool_or(contains(sql, 'openivm_scd2_probe_min')), false)
FROM openivm_compile_with_facts('off_mv_scd2', '{"target_dialect":"duckdb","compile_only":true}');
----
false

statement ok
PRAGMA refresh('off_mv_scd2');

query I
SELECT COUNT(*) FROM (
    SELECT f.id, f.dim_id, f.ts, f.amount, d.attr
    FROM off_fact f JOIN off_dim d
      ON f.dim_id = d.dim_id AND d.effective_timestamp <= f.ts AND f.ts < d.end_timestamp
    EXCEPT ALL
    SELECT id, dim_id, ts, amount, attr FROM off_mv_scd2
);
----
0

query I
SELECT COUNT(*) FROM (
    SELECT id, dim_id, ts, amount, attr FROM off_mv_scd2
    EXCEPT ALL
    SELECT f.id, f.dim_id, f.ts, f.amount, d.attr
    FROM off_fact f JOIN off_dim d
      ON f.dim_id = d.dim_id AND d.effective_timestamp <= f.ts AND f.ts < d.end_timestamp
);
----
0

statement ok
UPDATE off_dim SET end_timestamp = '2024-03-01' WHERE dim_id = 10 AND attr = 'new';

statement ok
INSERT INTO off_dim VALUES (10, 'latest', '2024-03-01', '9999-12-31');

statement ok
PRAGMA refresh('off_mv_scd2');

query I
SELECT COUNT(*) FROM (
    SELECT f.id, f.dim_id, f.ts, f.amount, d.attr
    FROM off_fact f JOIN off_dim d
      ON f.dim_id = d.dim_id AND d.effective_timestamp <= f.ts AND f.ts < d.end_timestamp
    EXCEPT ALL
    SELECT id, dim_id, ts, amount, attr FROM off_mv_scd2
);
----
0

query I
SELECT COUNT(*) FROM (
    SELECT id, dim_id, ts, amount, attr FROM off_mv_scd2
    EXCEPT ALL
    SELECT f.id, f.dim_id, f.ts, f.amount, d.attr
    FROM off_fact f JOIN off_dim d
      ON f.dim_id = d.dim_id AND d.effective_timestamp <= f.ts AND f.ts < d.end_timestamp
);
----
0

statement ok
INSERT INTO off_fact VALUES (5, 10, '2024-04-10', 500);

statement ok
UPDATE off_dim SET end_timestamp = '2024-04-01' WHERE dim_id = 10 AND attr = 'latest';

statement ok
INSERT INTO off_dim VALUES (10, 'future', '2024-04-01', '9999-12-31');

statement ok
PRAGMA refresh('off_mv_scd2');

query I
SELECT COUNT(*) FROM (
    SELECT f.id, f.dim_id, f.ts, f.amount, d.attr
    FROM off_fact f JOIN off_dim d
      ON f.dim_id = d.dim_id AND d.effective_timestamp <= f.ts AND f.ts < d.end_timestamp
    EXCEPT ALL
    SELECT id, dim_id, ts, amount, attr FROM off_mv_scd2
);
----
0

query I
SELECT COUNT(*) FROM (
    SELECT id, dim_id, ts, amount, attr FROM off_mv_scd2
    EXCEPT ALL
    SELECT f.id, f.dim_id, f.ts, f.amount, d.attr
    FROM off_fact f JOIN off_dim d
      ON f.dim_id = d.dim_id AND d.effective_timestamp <= f.ts AND f.ts < d.end_timestamp
);
----
0

statement ok
CREATE TABLE on_fact(id INT, dim_id INT, dm_date DATE, amount INT);

statement ok
CREATE TABLE on_dim(dim_id INT, attr VARCHAR, effective_timestamp DATE, end_timestamp DATE);

statement ok
INSERT INTO on_fact VALUES (1, 10, '2024-01-15', 100), (2, 10, '2024-02-10', 200), (3, 20, '2024-01-20', 300);

statement ok
INSERT INTO on_dim VALUES (10, 'old', '2024-01-01', '2024-02-01'), (10, 'new', '2024-02-01', '9999-12-31'), (20, 'beta', '2024-01-01', '9999-12-31');

statement ok
SET openivm_scd2_range_join_accel = true;

statement ok
CREATE MATERIALIZED VIEW on_mv_scd2 AS
    SELECT f.id, f.dim_id, f.dm_date, f.amount, d.attr
    FROM on_fact f
    JOIN on_dim d
      ON f.dim_id = d.dim_id
     AND f.dm_date BETWEEN d.effective_timestamp AND d.end_timestamp;

query I
SELECT COUNT(*) FROM (
    SELECT f.id, f.dim_id, f.dm_date, f.amount, d.attr
    FROM on_fact f JOIN on_dim d
      ON f.dim_id = d.dim_id AND f.dm_date BETWEEN d.effective_timestamp AND d.end_timestamp
    EXCEPT ALL
    SELECT id, dim_id, dm_date, amount, attr FROM on_mv_scd2
);
----
0

query I
SELECT COUNT(*) FROM (
    SELECT id, dim_id, dm_date, amount, attr FROM on_mv_scd2
    EXCEPT ALL
    SELECT f.id, f.dim_id, f.dm_date, f.amount, d.attr
    FROM on_fact f JOIN on_dim d
      ON f.dim_id = d.dim_id AND f.dm_date BETWEEN d.effective_timestamp AND d.end_timestamp
);
----
0

# A leading equality join makes DuckDB retain the SCD2 comparisons in a FILTER.
# They must be collected during the existing join-facts traversal too.
statement ok
CREATE TABLE chained_fact(id INT, lookup_id INT, dim_id INT, dm_date DATE, amount INT);

statement ok
CREATE TABLE chained_lookup(lookup_id INT, lookup_label VARCHAR);

statement ok
CREATE TABLE chained_dim(dim_id INT, dim_label VARCHAR, effective_timestamp DATE, end_timestamp DATE);

statement ok
INSERT INTO chained_fact VALUES
    (1, 100, 10, DATE '2024-01-15', 100),
    (2, 200, 10, DATE '2024-02-15', 200);

statement ok
INSERT INTO chained_lookup VALUES (100, 'one'), (200, 'two');

statement ok
INSERT INTO chained_dim VALUES
    (10, 'old', DATE '2024-01-01', DATE '2024-01-31'),
    (10, 'current', DATE '2024-02-01', DATE '9999-12-31');

statement ok
CREATE MATERIALIZED VIEW chained_scd2 AS
    SELECT f.id, l.lookup_label, d.dim_label, f.dm_date, f.amount
    FROM chained_fact f
    JOIN chained_lookup l ON f.lookup_id = l.lookup_id
    JOIN chained_dim d
      ON f.dim_id = d.dim_id
     AND f.dm_date BETWEEN d.effective_timestamp AND d.end_timestamp;

# Batch conflicting fact and dimension mutations before one refresh.
statement ok
INSERT INTO chained_fact VALUES
    (3, 100, 10, DATE '2024-03-15', 300),
    (4, 200, 10, DATE '2024-03-20', 400);

statement ok
UPDATE chained_fact SET amount = 350 WHERE id = 3;

statement ok
DELETE FROM chained_fact WHERE id = 4;

statement ok
UPDATE chained_dim
SET end_timestamp = DATE '2024-02-29'
WHERE dim_id = 10 AND dim_label = 'current';

statement ok
INSERT INTO chained_dim VALUES (10, 'latest', DATE '2024-03-01', DATE '9999-12-31');

query I
SELECT COALESCE(bool_or(contains(sql, 'openivm_scd2_probe_min')), false)
FROM openivm_compile_with_facts('chained_scd2', '{"target_dialect":"duckdb","compile_only":true}');
----
true

statement ok
PRAGMA refresh('chained_scd2');

query I
SELECT COUNT(*) FROM (
    SELECT f.id, l.lookup_label, d.dim_label, f.dm_date, f.amount
    FROM chained_fact f
    JOIN chained_lookup l ON f.lookup_id = l.lookup_id
    JOIN chained_dim d
      ON f.dim_id = d.dim_id
     AND f.dm_date BETWEEN d.effective_timestamp AND d.end_timestamp
    EXCEPT ALL
    SELECT id, lookup_label, dim_label, dm_date, amount FROM chained_scd2
);
----
0

query I
SELECT COUNT(*) FROM (
    SELECT id, lookup_label, dim_label, dm_date, amount FROM chained_scd2
    EXCEPT ALL
    SELECT f.id, l.lookup_label, d.dim_label, f.dm_date, f.amount
    FROM chained_fact f
    JOIN chained_lookup l ON f.lookup_id = l.lookup_id
    JOIN chained_dim d
      ON f.dim_id = d.dim_id
     AND f.dm_date BETWEEN d.effective_timestamp AND d.end_timestamp
);
----
0

statement ok
INSERT INTO on_fact VALUES (4, 10, '2024-03-10', 400);

query I
SELECT COALESCE(bool_or(contains(sql, 'openivm_scd2_probe_min')), false)
FROM openivm_compile_with_facts('on_mv_scd2', '{"target_dialect":"duckdb","compile_only":true}');
----
true

statement ok
PRAGMA refresh('on_mv_scd2');

query I
SELECT COUNT(*) FROM (
    SELECT f.id, f.dim_id, f.dm_date, f.amount, d.attr
    FROM on_fact f JOIN on_dim d
      ON f.dim_id = d.dim_id AND f.dm_date BETWEEN d.effective_timestamp AND d.end_timestamp
    EXCEPT ALL
    SELECT id, dim_id, dm_date, amount, attr FROM on_mv_scd2
);
----
0

query I
SELECT COUNT(*) FROM (
    SELECT id, dim_id, dm_date, amount, attr FROM on_mv_scd2
    EXCEPT ALL
    SELECT f.id, f.dim_id, f.dm_date, f.amount, d.attr
    FROM on_fact f JOIN on_dim d
      ON f.dim_id = d.dim_id AND f.dm_date BETWEEN d.effective_timestamp AND d.end_timestamp
);
----
0

statement ok
UPDATE on_dim SET end_timestamp = '2024-03-01' WHERE dim_id = 10 AND attr = 'new';

statement ok
INSERT INTO on_dim VALUES (10, 'latest', '2024-03-01', '9999-12-31');

statement ok
PRAGMA refresh('on_mv_scd2');

query I
SELECT COUNT(*) FROM (
    SELECT f.id, f.dim_id, f.dm_date, f.amount, d.attr
    FROM on_fact f JOIN on_dim d
      ON f.dim_id = d.dim_id AND f.dm_date BETWEEN d.effective_timestamp AND d.end_timestamp
    EXCEPT ALL
    SELECT id, dim_id, dm_date, amount, attr FROM on_mv_scd2
);
----
0

query I
SELECT COUNT(*) FROM (
    SELECT id, dim_id, dm_date, amount, attr FROM on_mv_scd2
    EXCEPT ALL
    SELECT f.id, f.dim_id, f.dm_date, f.amount, d.attr
    FROM on_fact f JOIN on_dim d
      ON f.dim_id = d.dim_id AND f.dm_date BETWEEN d.effective_timestamp AND d.end_timestamp
);
----
0

statement ok
INSERT INTO on_fact VALUES (5, 10, '2024-04-10', 500);

statement ok
UPDATE on_dim SET end_timestamp = '2024-04-01' WHERE dim_id = 10 AND attr = 'latest';

statement ok
INSERT INTO on_dim VALUES (10, 'future', '2024-04-01', '9999-12-31');

statement ok
PRAGMA refresh('on_mv_scd2');

query I
SELECT COUNT(*) FROM (
    SELECT f.id, f.dim_id, f.dm_date, f.amount, d.attr
    FROM on_fact f JOIN on_dim d
      ON f.dim_id = d.dim_id AND f.dm_date BETWEEN d.effective_timestamp AND d.end_timestamp
    EXCEPT ALL
    SELECT id, dim_id, dm_date, amount, attr FROM on_mv_scd2
);
----
0

query I
SELECT COUNT(*) FROM (
    SELECT id, dim_id, dm_date, amount, attr FROM on_mv_scd2
    EXCEPT ALL
    SELECT f.id, f.dim_id, f.dm_date, f.amount, d.attr
    FROM on_fact f JOIN on_dim d
      ON f.dim_id = d.dim_id AND f.dm_date BETWEEN d.effective_timestamp AND d.end_timestamp
);
----
0
