# name: test/sql/semi_anti_join.test
# description: Test aux-state IVM for SEMI and ANTI joins
# group: [sql]

require openivm

# SEMI JOIN with an arbitrary non-equi predicate. The MV output is the left tuple
# identity so the aux table can maintain per-left-tuple match counts.
statement ok
CREATE TABLE saj_l (id INT, x INT);

statement ok
CREATE TABLE saj_r (rid INT, y INT);

statement ok
INSERT INTO saj_l VALUES (1, 10), (1, 10), (2, 20), (3, 30), (4, 40);

statement ok
INSERT INTO saj_r VALUES (100, 8), (101, 100), (102, 41);

statement ok
CREATE MATERIALIZED VIEW mv_saj_semi AS
    SELECT l.id, l.x FROM saj_l l SEMI JOIN saj_r r ON abs(l.x - r.y) <= 2;

query II
SELECT type, (semi_anti_aux_meta_json IS NOT NULL)::INT FROM openivm_views WHERE view_name = 'mv_saj_semi';
----
9	1

query I
SELECT COUNT(*) FROM (
    SELECT l.id, l.x FROM saj_l l SEMI JOIN saj_r r ON abs(l.x - r.y) <= 2
    EXCEPT ALL SELECT id, x FROM mv_saj_semi
);
----
0

query I
SELECT COUNT(*) FROM (
    SELECT id, x FROM mv_saj_semi
    EXCEPT ALL SELECT l.id, l.x FROM saj_l l SEMI JOIN saj_r r ON abs(l.x - r.y) <= 2
);
----
0

# Batch conflicting changes before one refresh:
# - right insert makes id=2 visible
# - right delete removes the only match for id=4
# - left insert adds a second id=3 row that is visible through y=32
# - left delete removes one duplicate id=1 row
statement ok
INSERT INTO saj_r VALUES (103, 21), (104, 32);

statement ok
DELETE FROM saj_r WHERE rid = 102;

statement ok
INSERT INTO saj_l VALUES (3, 30);

statement ok
DELETE FROM saj_l WHERE rowid IN (SELECT rowid FROM saj_l WHERE id = 1 AND x = 10 LIMIT 1);

statement ok
PRAGMA refresh('mv_saj_semi');

query I
SELECT COUNT(*) FROM (
    SELECT l.id, l.x FROM saj_l l SEMI JOIN saj_r r ON abs(l.x - r.y) <= 2
    EXCEPT ALL SELECT id, x FROM mv_saj_semi
);
----
0

query I
SELECT COUNT(*) FROM (
    SELECT id, x FROM mv_saj_semi
    EXCEPT ALL SELECT l.id, l.x FROM saj_l l SEMI JOIN saj_r r ON abs(l.x - r.y) <= 2
);
----
0

# The previous batch inserted a new left tuple and its matching right tuple in the
# same refresh. Deleting that right tuple now must drop the left tuple; this catches
# double-counting of current S plus ΔS during aux initialization.
statement ok
DELETE FROM saj_r WHERE rid = 104;

statement ok
PRAGMA refresh('mv_saj_semi');

query I
SELECT COUNT(*) FROM (
    SELECT l.id, l.x FROM saj_l l SEMI JOIN saj_r r ON abs(l.x - r.y) <= 2
    EXCEPT ALL SELECT id, x FROM mv_saj_semi
);
----
0

query I
SELECT COUNT(*) FROM (
    SELECT id, x FROM mv_saj_semi
    EXCEPT ALL SELECT l.id, l.x FROM saj_l l SEMI JOIN saj_r r ON abs(l.x - r.y) <= 2
);
----
0

# ============================================================
# ANTI JOIN under GROUP BY. This currently uses FULL_REFRESH rather
# than aux-state SEMI/ANTI, but it must remain correct for batched DML.
# ============================================================

statement ok
CREATE TABLE ag_l (id INT, grp INT, x INT);

statement ok
CREATE TABLE ag_r (rid INT, y INT);

statement ok
INSERT INTO ag_l VALUES (1, 1, 10), (2, 1, 20), (3, 2, 30), (4, 2, 40), (5, 3, 50);

statement ok
INSERT INTO ag_r VALUES (1, 10), (2, 41);

statement ok
CREATE MATERIALIZED VIEW mv_ag_anti AS
    SELECT l.grp, COUNT(*) AS cnt, SUM(l.x) AS total
    FROM ag_l l ANTI JOIN ag_r r ON abs(l.x - r.y) <= 1
    GROUP BY l.grp;

statement ok
INSERT INTO ag_r VALUES (3, 20), (4, 50);

statement ok
DELETE FROM ag_r WHERE rid = 2;

statement ok
UPDATE ag_l SET x = 11 WHERE id = 3;

statement ok
INSERT INTO ag_l VALUES (6, 3, 60), (7, 3, 20);

statement ok
PRAGMA refresh('mv_ag_anti');

query I
SELECT COUNT(*) FROM (
    SELECT l.grp, COUNT(*) AS cnt, SUM(l.x) AS total
    FROM ag_l l ANTI JOIN ag_r r ON abs(l.x - r.y) <= 1
    GROUP BY l.grp
    EXCEPT ALL SELECT grp, cnt, total FROM mv_ag_anti
);
----
0

query I
SELECT COUNT(*) FROM (
    SELECT grp, cnt, total FROM mv_ag_anti
    EXCEPT ALL
    SELECT l.grp, COUNT(*) AS cnt, SUM(l.x) AS total
    FROM ag_l l ANTI JOIN ag_r r ON abs(l.x - r.y) <= 1
    GROUP BY l.grp
);
----
0

# ============================================================
# ANTI JOIN after an inner-join chain. The left side of ANTI is a
# subplan, not a single base table, so this must not use the simple
# aux-state extractor.
# ============================================================

statement ok
CREATE TABLE cj_orders (oid INT, cust_id INT, amount INT);

statement ok
CREATE TABLE cj_customers (cid INT, region VARCHAR);

statement ok
CREATE TABLE cj_blocked (bid INT, region VARCHAR, min_amount INT);

statement ok
INSERT INTO cj_orders VALUES (1, 10, 40), (2, 10, 120), (3, 20, 80), (4, 30, 15);

statement ok
INSERT INTO cj_customers VALUES (10, 'north'), (20, 'south'), (30, 'west');

statement ok
INSERT INTO cj_blocked VALUES (1, 'north', 100), (2, 'west', 10);

statement ok
CREATE MATERIALIZED VIEW mv_chain_anti AS
    SELECT o.oid, c.region, o.amount
    FROM cj_orders o JOIN cj_customers c ON o.cust_id = c.cid
    ANTI JOIN cj_blocked b ON c.region = b.region AND o.amount >= b.min_amount;

statement ok
INSERT INTO cj_blocked VALUES (3, 'south', 50);

statement ok
DELETE FROM cj_blocked WHERE bid = 2;

statement ok
UPDATE cj_orders SET amount = 105 WHERE oid = 1;

statement ok
INSERT INTO cj_orders VALUES (5, 30, 20);

statement ok
PRAGMA refresh('mv_chain_anti');

query I
SELECT COUNT(*) FROM (
    SELECT o.oid, c.region, o.amount
    FROM cj_orders o JOIN cj_customers c ON o.cust_id = c.cid
    ANTI JOIN cj_blocked b ON c.region = b.region AND o.amount >= b.min_amount
    EXCEPT ALL SELECT oid, region, amount FROM mv_chain_anti
);
----
0

query I
SELECT COUNT(*) FROM (
    SELECT oid, region, amount FROM mv_chain_anti
    EXCEPT ALL
    SELECT o.oid, c.region, o.amount
    FROM cj_orders o JOIN cj_customers c ON o.cust_id = c.cid
    ANTI JOIN cj_blocked b ON c.region = b.region AND o.amount >= b.min_amount
);
----
0

# ============================================================
# SEMI/ANTI with subquery inputs.
# ============================================================

statement ok
CREATE TABLE sq_l (id INT, x INT);

statement ok
CREATE TABLE sq_r (rid INT, y INT, active BOOLEAN);

statement ok
INSERT INTO sq_l VALUES (1, 10), (2, 20), (3, 30), (4, 40);

statement ok
INSERT INTO sq_r VALUES (1, 10, true), (2, 20, false), (3, 99, true);

statement ok
CREATE MATERIALIZED VIEW mv_subq_semi AS
    SELECT l.id, l.x
    FROM sq_l l SEMI JOIN (SELECT y FROM sq_r WHERE active) r ON l.x = r.y;

statement ok
CREATE MATERIALIZED VIEW mv_subq_anti AS
    SELECT l.id, l.x
    FROM sq_l l ANTI JOIN (SELECT y FROM sq_r WHERE active) r ON l.x = r.y;

statement ok
UPDATE sq_r SET active = true WHERE rid = 2;

statement ok
INSERT INTO sq_r VALUES (4, 40, true);

statement ok
DELETE FROM sq_l WHERE id = 1;

statement ok
INSERT INTO sq_l VALUES (5, 50);

statement ok
PRAGMA refresh('mv_subq_semi');

statement ok
PRAGMA refresh('mv_subq_anti');

query I
SELECT COUNT(*) FROM (
    SELECT l.id, l.x FROM sq_l l SEMI JOIN (SELECT y FROM sq_r WHERE active) r ON l.x = r.y
    EXCEPT ALL SELECT id, x FROM mv_subq_semi
);
----
0

query I
SELECT COUNT(*) FROM (
    SELECT id, x FROM mv_subq_semi
    EXCEPT ALL SELECT l.id, l.x FROM sq_l l SEMI JOIN (SELECT y FROM sq_r WHERE active) r ON l.x = r.y
);
----
0

query I
SELECT COUNT(*) FROM (
    SELECT l.id, l.x FROM sq_l l ANTI JOIN (SELECT y FROM sq_r WHERE active) r ON l.x = r.y
    EXCEPT ALL SELECT id, x FROM mv_subq_anti
);
----
0

query I
SELECT COUNT(*) FROM (
    SELECT id, x FROM mv_subq_anti
    EXCEPT ALL SELECT l.id, l.x FROM sq_l l ANTI JOIN (SELECT y FROM sq_r WHERE active) r ON l.x = r.y
);
----
0

# NOT IN with computed output columns keeps expression-valued aux columns.
statement ok
CREATE TABLE in_cast_l (id INT, x INT);

statement ok
CREATE TABLE in_cast_r (rid INT, y BIGINT);

statement ok
INSERT INTO in_cast_l VALUES (1, 10), (2, 20), (3, 30), (4, 40);

statement ok
INSERT INTO in_cast_r VALUES (1, 20), (2, 99);

statement ok
CREATE MATERIALIZED VIEW mv_not_in_cast AS
    SELECT CAST(x AS BIGINT) AS item_id
    FROM in_cast_l
    WHERE CAST(x AS BIGINT) NOT IN (SELECT CAST(y AS BIGINT) FROM in_cast_r);

query I
SELECT (semi_anti_aux_meta_json IS NOT NULL)::INT FROM openivm_views WHERE view_name = 'mv_not_in_cast';
----
1

statement ok
INSERT INTO in_cast_l VALUES (5, 50), (6, 20);

statement ok
DELETE FROM in_cast_r WHERE rid = 1;

statement ok
INSERT INTO in_cast_r VALUES (3, 30), (4, 50);

statement ok
PRAGMA refresh('mv_not_in_cast');

query I
SELECT COUNT(*) FROM (
    SELECT CAST(x AS BIGINT) AS item_id
    FROM in_cast_l
    WHERE CAST(x AS BIGINT) NOT IN (SELECT CAST(y AS BIGINT) FROM in_cast_r)
    EXCEPT ALL SELECT item_id FROM mv_not_in_cast
);
----
0

query I
SELECT COUNT(*) FROM (
    SELECT item_id FROM mv_not_in_cast
    EXCEPT ALL
    SELECT CAST(x AS BIGINT) AS item_id
    FROM in_cast_l
    WHERE CAST(x AS BIGINT) NOT IN (SELECT CAST(y AS BIGINT) FROM in_cast_r)
);
----
0

# IN/NOT IN subqueries need SQL's null-aware MARK semantics, not null-safe
# SEMI/ANTI equality. The aux state keeps match counts for performance and
# stores null-aware side state for NOT IN visibility.
statement ok
CREATE TABLE in_null_l (x INT);

statement ok
CREATE TABLE in_null_r (y INT);

statement ok
INSERT INTO in_null_l VALUES (1), (2);

statement ok
INSERT INTO in_null_r VALUES (1), (NULL);

statement ok
CREATE MATERIALIZED VIEW mv_in_null AS
    SELECT x FROM in_null_l WHERE x IN (SELECT y FROM in_null_r);

query I
SELECT (semi_anti_aux_meta_json IS NOT NULL)::INT FROM openivm_views WHERE view_name = 'mv_in_null';
----
1

query I
SELECT COUNT(*) FROM (
    SELECT x FROM in_null_l WHERE x IN (SELECT y FROM in_null_r)
    EXCEPT ALL SELECT x FROM mv_in_null
);
----
0

query I
SELECT COUNT(*) FROM (
    SELECT x FROM mv_in_null
    EXCEPT ALL SELECT x FROM in_null_l WHERE x IN (SELECT y FROM in_null_r)
);
----
0

statement ok
INSERT INTO in_null_l VALUES (NULL), (2);

statement ok
INSERT INTO in_null_r VALUES (2);

statement ok
PRAGMA refresh('mv_in_null');

query I
SELECT COUNT(*) FROM (
    SELECT x FROM in_null_l WHERE x IN (SELECT y FROM in_null_r)
    EXCEPT ALL SELECT x FROM mv_in_null
);
----
0

query I
SELECT COUNT(*) FROM (
    SELECT x FROM mv_in_null
    EXCEPT ALL SELECT x FROM in_null_l WHERE x IN (SELECT y FROM in_null_r)
);
----
0

query I
SELECT COUNT(*) FROM mv_in_null WHERE x IS NULL;
----
0

statement ok
CREATE TABLE in_shadow_l (x INT);

statement ok
CREATE TABLE in_shadow_r (y INT);

statement ok
INSERT INTO in_shadow_l VALUES (1), (2), (3);

statement ok
INSERT INTO in_shadow_r VALUES (1);

statement ok
CREATE MATERIALIZED VIEW mv_in_shadow AS
    SELECT x + 1 AS x FROM in_shadow_l WHERE x IN (SELECT y FROM in_shadow_r);

query I
SELECT (semi_anti_aux_meta_json IS NOT NULL)::INT FROM openivm_views WHERE view_name = 'mv_in_shadow';
----
1

query I
SELECT COUNT(*) FROM (
    SELECT x + 1 AS x FROM in_shadow_l WHERE x IN (SELECT y FROM in_shadow_r)
    EXCEPT ALL SELECT x FROM mv_in_shadow
);
----
0

query I
SELECT COUNT(*) FROM (
    SELECT x FROM mv_in_shadow
    EXCEPT ALL SELECT x + 1 AS x FROM in_shadow_l WHERE x IN (SELECT y FROM in_shadow_r)
);
----
0

statement ok
INSERT INTO in_shadow_r VALUES (2);

statement ok
INSERT INTO in_shadow_l VALUES (4);

statement ok
PRAGMA refresh('mv_in_shadow');

query I
SELECT COUNT(*) FROM (
    SELECT x + 1 AS x FROM in_shadow_l WHERE x IN (SELECT y FROM in_shadow_r)
    EXCEPT ALL SELECT x FROM mv_in_shadow
);
----
0

query I
SELECT COUNT(*) FROM (
    SELECT x FROM mv_in_shadow
    EXCEPT ALL SELECT x + 1 AS x FROM in_shadow_l WHERE x IN (SELECT y FROM in_shadow_r)
);
----
0

statement ok
CREATE TABLE in_prefix_l (x INT, x1 INT);

statement ok
CREATE TABLE in_prefix_r (y INT);

statement ok
INSERT INTO in_prefix_l VALUES (1, 10), (2, 20), (3, -1);

statement ok
INSERT INTO in_prefix_r VALUES (10);

statement ok
CREATE MATERIALIZED VIEW mv_in_prefix AS
    SELECT l.x + 100 AS x, l.x1
    FROM in_prefix_l l
    WHERE l.x1 IN (SELECT y FROM in_prefix_r) AND l.x1 > 0;

query I
SELECT (semi_anti_aux_meta_json IS NOT NULL)::INT FROM openivm_views WHERE view_name = 'mv_in_prefix';
----
1

query I
SELECT COUNT(*) FROM (
    SELECT l.x + 100 AS x, l.x1
    FROM in_prefix_l l
    WHERE l.x1 IN (SELECT y FROM in_prefix_r) AND l.x1 > 0
    EXCEPT ALL SELECT x, x1 FROM mv_in_prefix
);
----
0

query I
SELECT COUNT(*) FROM (
    SELECT x, x1 FROM mv_in_prefix
    EXCEPT ALL
    SELECT l.x + 100 AS x, l.x1
    FROM in_prefix_l l
    WHERE l.x1 IN (SELECT y FROM in_prefix_r) AND l.x1 > 0
);
----
0

statement ok
INSERT INTO in_prefix_r VALUES (20);

statement ok
INSERT INTO in_prefix_l VALUES (4, 20);

statement ok
PRAGMA refresh('mv_in_prefix');

query I
SELECT COUNT(*) FROM (
    SELECT l.x + 100 AS x, l.x1
    FROM in_prefix_l l
    WHERE l.x1 IN (SELECT y FROM in_prefix_r) AND l.x1 > 0
    EXCEPT ALL SELECT x, x1 FROM mv_in_prefix
);
----
0

query I
SELECT COUNT(*) FROM (
    SELECT x, x1 FROM mv_in_prefix
    EXCEPT ALL
    SELECT l.x + 100 AS x, l.x1
    FROM in_prefix_l l
    WHERE l.x1 IN (SELECT y FROM in_prefix_r) AND l.x1 > 0
);
----
0

statement ok
CREATE TABLE not_in_null_l (x INT);

statement ok
CREATE TABLE not_in_null_r (y INT, active BOOLEAN);

statement ok
INSERT INTO not_in_null_l VALUES (1), (2), (NULL);

statement ok
INSERT INTO not_in_null_r VALUES (1, true), (NULL, true), (NULL, false);

statement ok
CREATE MATERIALIZED VIEW mv_not_in_null AS
    SELECT x FROM not_in_null_l WHERE x NOT IN (SELECT y FROM not_in_null_r WHERE active);

query I
SELECT (semi_anti_aux_meta_json IS NOT NULL)::INT FROM openivm_views WHERE view_name = 'mv_not_in_null';
----
1

query I
SELECT COUNT(*) FROM (
    SELECT x FROM not_in_null_l WHERE x NOT IN (SELECT y FROM not_in_null_r WHERE active)
    EXCEPT ALL SELECT x FROM mv_not_in_null
);
----
0

query I
SELECT COUNT(*) FROM (
    SELECT x FROM mv_not_in_null
    EXCEPT ALL SELECT x FROM not_in_null_l WHERE x NOT IN (SELECT y FROM not_in_null_r WHERE active)
);
----
0

statement ok
INSERT INTO not_in_null_l VALUES (3);

statement ok
PRAGMA refresh('mv_not_in_null');

query I
SELECT COUNT(*) FROM (
    SELECT x FROM not_in_null_l WHERE x NOT IN (SELECT y FROM not_in_null_r WHERE active)
    EXCEPT ALL SELECT x FROM mv_not_in_null
);
----
0

query I
SELECT COUNT(*) FROM (
    SELECT x FROM mv_not_in_null
    EXCEPT ALL SELECT x FROM not_in_null_l WHERE x NOT IN (SELECT y FROM not_in_null_r WHERE active)
);
----
0

statement ok
DELETE FROM not_in_null_r WHERE y IS NULL AND active;

statement ok
PRAGMA refresh('mv_not_in_null');

query I
SELECT COUNT(*) FROM (
    SELECT x FROM not_in_null_l WHERE x NOT IN (SELECT y FROM not_in_null_r WHERE active)
    EXCEPT ALL SELECT x FROM mv_not_in_null
);
----
0

query I
SELECT COUNT(*) FROM (
    SELECT x FROM mv_not_in_null
    EXCEPT ALL SELECT x FROM not_in_null_l WHERE x NOT IN (SELECT y FROM not_in_null_r WHERE active)
);
----
0

query II
SELECT COUNT(*), COUNT(*) FILTER (WHERE x IS NULL) FROM mv_not_in_null;
----
2	0

statement ok
DELETE FROM not_in_null_r WHERE active;

statement ok
PRAGMA refresh('mv_not_in_null');

query I
SELECT COUNT(*) FROM (
    SELECT x FROM not_in_null_l WHERE x NOT IN (SELECT y FROM not_in_null_r WHERE active)
    EXCEPT ALL SELECT x FROM mv_not_in_null
);
----
0

query I
SELECT COUNT(*) FROM (
    SELECT x FROM mv_not_in_null
    EXCEPT ALL SELECT x FROM not_in_null_l WHERE x NOT IN (SELECT y FROM not_in_null_r WHERE active)
);
----
0

query II
SELECT COUNT(*), COUNT(*) FILTER (WHERE x IS NULL) FROM mv_not_in_null;
----
4	1

statement ok
CREATE TABLE not_in_corr_l (x INT, z INT);

statement ok
CREATE TABLE not_in_corr_r (y INT, z INT);

statement ok
INSERT INTO not_in_corr_l VALUES (1, 10), (2, 10), (3, 20), (NULL, 30);

statement ok
INSERT INTO not_in_corr_r VALUES (1, 10), (NULL, 10), (2, 20);

statement ok
CREATE MATERIALIZED VIEW mv_not_in_corr AS
    SELECT x, z FROM not_in_corr_l l WHERE x NOT IN (SELECT y FROM not_in_corr_r r WHERE r.z = l.z);

query I
SELECT (semi_anti_aux_meta_json IS NOT NULL)::INT FROM openivm_views WHERE view_name = 'mv_not_in_corr';
----
1

query I
SELECT COUNT(*) FROM (
    SELECT x, z FROM not_in_corr_l l WHERE x NOT IN (SELECT y FROM not_in_corr_r r WHERE r.z = l.z)
    EXCEPT ALL SELECT x, z FROM mv_not_in_corr
);
----
0

query I
SELECT COUNT(*) FROM (
    SELECT x, z FROM mv_not_in_corr
    EXCEPT ALL SELECT x, z FROM not_in_corr_l l WHERE x NOT IN (SELECT y FROM not_in_corr_r r WHERE r.z = l.z)
);
----
0

statement ok
INSERT INTO not_in_corr_r VALUES (NULL, 20);

statement ok
INSERT INTO not_in_corr_l VALUES (4, 30);

statement ok
PRAGMA refresh('mv_not_in_corr');

query I
SELECT COUNT(*) FROM (
    SELECT x, z FROM not_in_corr_l l WHERE x NOT IN (SELECT y FROM not_in_corr_r r WHERE r.z = l.z)
    EXCEPT ALL SELECT x, z FROM mv_not_in_corr
);
----
0

query I
SELECT COUNT(*) FROM (
    SELECT x, z FROM mv_not_in_corr
    EXCEPT ALL SELECT x, z FROM not_in_corr_l l WHERE x NOT IN (SELECT y FROM not_in_corr_r r WHERE r.z = l.z)
);
----
0

statement ok
CREATE TABLE not_in_shadow_l (x INT);

statement ok
CREATE TABLE not_in_shadow_r (y INT);

statement ok
INSERT INTO not_in_shadow_l VALUES (1), (2), (3);

statement ok
INSERT INTO not_in_shadow_r VALUES (2);

statement ok
CREATE MATERIALIZED VIEW mv_not_in_shadow AS
    SELECT x + 1 AS x FROM not_in_shadow_l WHERE x NOT IN (SELECT y FROM not_in_shadow_r);

query I
SELECT (semi_anti_aux_meta_json IS NOT NULL)::INT FROM openivm_views WHERE view_name = 'mv_not_in_shadow';
----
1

query I
SELECT COUNT(*) FROM (
    SELECT x + 1 AS x FROM not_in_shadow_l WHERE x NOT IN (SELECT y FROM not_in_shadow_r)
    EXCEPT ALL SELECT x FROM mv_not_in_shadow
);
----
0

query I
SELECT COUNT(*) FROM (
    SELECT x FROM mv_not_in_shadow
    EXCEPT ALL SELECT x + 1 AS x FROM not_in_shadow_l WHERE x NOT IN (SELECT y FROM not_in_shadow_r)
);
----
0

statement ok
INSERT INTO not_in_shadow_r VALUES (NULL);

statement ok
INSERT INTO not_in_shadow_l VALUES (4);

statement ok
PRAGMA refresh('mv_not_in_shadow');

query I
SELECT COUNT(*) FROM (
    SELECT x + 1 AS x FROM not_in_shadow_l WHERE x NOT IN (SELECT y FROM not_in_shadow_r)
    EXCEPT ALL SELECT x FROM mv_not_in_shadow
);
----
0

query I
SELECT COUNT(*) FROM (
    SELECT x FROM mv_not_in_shadow
    EXCEPT ALL SELECT x + 1 AS x FROM not_in_shadow_l WHERE x NOT IN (SELECT y FROM not_in_shadow_r)
);
----
0

# ============================================================
# EXISTS / NOT EXISTS subqueries lower to SEMI/ANTI joins. These
# should use the same aux-state path, including arbitrary correlated
# predicates and an outer filter stacked around the subquery.
# ============================================================

statement ok
CREATE TABLE exists_l (id INT, x INT, keep BOOLEAN);

statement ok
CREATE TABLE exists_r (rid INT, y INT, active BOOLEAN);

statement ok
INSERT INTO exists_l VALUES (1, 10, true), (1, 10, true), (2, 20, true), (3, 30, false), (4, 40, true);

statement ok
INSERT INTO exists_r VALUES (10, 8, true), (11, 20, false), (12, 99, true);

statement ok
CREATE MATERIALIZED VIEW mv_exists_semi AS
    SELECT l.id, l.x
    FROM exists_l l
    WHERE l.keep AND EXISTS (
        SELECT 1 FROM exists_r r
        WHERE r.active AND abs(l.x - r.y) <= 2
    );

statement ok
CREATE MATERIALIZED VIEW mv_exists_anti AS
    SELECT l.id, l.x
    FROM exists_l l
    WHERE NOT EXISTS (
        SELECT 1 FROM exists_r r
        WHERE r.active AND abs(l.x - r.y) <= 2
    ) AND l.keep;

query I
SELECT COUNT(*) FROM openivm_views
WHERE view_name IN ('mv_exists_semi', 'mv_exists_anti') AND semi_anti_aux_meta_json IS NOT NULL;
----
2

statement ok
UPDATE exists_r SET active = true WHERE rid = 11;

statement ok
INSERT INTO exists_r VALUES (13, 41, true), (14, 30, true);

statement ok
DELETE FROM exists_r WHERE rid = 10;

statement ok
UPDATE exists_l SET keep = true WHERE id = 3;

statement ok
INSERT INTO exists_l VALUES (5, 50, true), (6, 40, true);

statement ok
PRAGMA refresh('mv_exists_semi');

statement ok
PRAGMA refresh('mv_exists_anti');

query I
SELECT COUNT(*) FROM (
    SELECT l.id, l.x
    FROM exists_l l
    WHERE l.keep AND EXISTS (
        SELECT 1 FROM exists_r r
        WHERE r.active AND abs(l.x - r.y) <= 2
    )
    EXCEPT ALL SELECT id, x FROM mv_exists_semi
);
----
0

query I
SELECT COUNT(*) FROM (
    SELECT id, x FROM mv_exists_semi
    EXCEPT ALL
    SELECT l.id, l.x
    FROM exists_l l
    WHERE l.keep AND EXISTS (
        SELECT 1 FROM exists_r r
        WHERE r.active AND abs(l.x - r.y) <= 2
    )
);
----
0

query I
SELECT COUNT(*) FROM (
    SELECT l.id, l.x
    FROM exists_l l
    WHERE NOT EXISTS (
        SELECT 1 FROM exists_r r
        WHERE r.active AND abs(l.x - r.y) <= 2
    ) AND l.keep
    EXCEPT ALL SELECT id, x FROM mv_exists_anti
);
----
0

query I
SELECT COUNT(*) FROM (
    SELECT id, x FROM mv_exists_anti
    EXCEPT ALL
    SELECT l.id, l.x
    FROM exists_l l
    WHERE NOT EXISTS (
        SELECT 1 FROM exists_r r
        WHERE r.active AND abs(l.x - r.y) <= 2
    ) AND l.keep
);
----
0

# Multiple independent equality-correlated NOT EXISTS subqueries used to serialize
# as MARK joins plus NOT(mark). Convert them to ANTI before LPTS and reduce each
# RHS to distinct non-null source keys, not a delimiter-key cross product.
statement ok
CREATE TABLE exists_multi_l (id INT, grp INT, x INT, y INT);

statement ok
CREATE TABLE exists_multi_rx (a INT, active BOOLEAN);

statement ok
CREATE TABLE exists_multi_ry (b INT, active BOOLEAN);

statement ok
INSERT INTO exists_multi_l VALUES (1, 1, 10, 100), (2, 1, 20, 200), (3, 2, NULL, 300), (4, 2, 40, NULL);

statement ok
INSERT INTO exists_multi_rx VALUES (10, true), (NULL, true), (99, false);

statement ok
INSERT INTO exists_multi_ry VALUES (200, true), (NULL, true), (999, false);

statement ok
CREATE MATERIALIZED VIEW mv_exists_multi_anti_group AS
    SELECT grp, COUNT(*) AS cnt
    FROM exists_multi_l l
    WHERE NOT EXISTS (
        SELECT 1 FROM exists_multi_rx rx
        WHERE rx.active AND rx.a = l.x
    )
    AND NOT EXISTS (
        SELECT 1 FROM exists_multi_ry ry
        WHERE ry.active AND ry.b = l.y
    )
    GROUP BY grp;

query I
SELECT COUNT(*) FROM openivm_views
WHERE view_name = 'mv_exists_multi_anti_group'
  AND (length(lower(sql_string)) - length(replace(lower(sql_string), 'anti join', ''))) / length('anti join') = 2
  AND strpos(lower(sql_string), '__mark') = 0
  AND strpos(lower(sql_string), ' on (true)') = 0
  AND strpos(lower(sql_string), 'is not null') > 0;
----
1

statement ok
INSERT INTO exists_multi_rx VALUES (40, true);

statement ok
DELETE FROM exists_multi_ry WHERE b = 200;

statement ok
INSERT INTO exists_multi_l VALUES (5, 3, 99, 999), (6, 3, NULL, NULL);

statement ok
PRAGMA refresh('mv_exists_multi_anti_group');

query I
SELECT COUNT(*) FROM (
    SELECT grp, COUNT(*) AS cnt
    FROM exists_multi_l l
    WHERE NOT EXISTS (
        SELECT 1 FROM exists_multi_rx rx
        WHERE rx.active AND rx.a = l.x
    )
    AND NOT EXISTS (
        SELECT 1 FROM exists_multi_ry ry
        WHERE ry.active AND ry.b = l.y
    )
    GROUP BY grp
    EXCEPT ALL SELECT grp, cnt FROM mv_exists_multi_anti_group
);
----
0

query I
SELECT COUNT(*) FROM (
    SELECT grp, cnt FROM mv_exists_multi_anti_group
    EXCEPT ALL
    SELECT grp, COUNT(*) AS cnt
    FROM exists_multi_l l
    WHERE NOT EXISTS (
        SELECT 1 FROM exists_multi_rx rx
        WHERE rx.active AND rx.a = l.x
    )
    AND NOT EXISTS (
        SELECT 1 FROM exists_multi_ry ry
        WHERE ry.active AND ry.b = l.y
    )
    GROUP BY grp
);
----
0

# ============================================================
# EXISTS / NOT EXISTS combined with other operators. Aggregates and
# UNION ALL are outside the simple aux-state shape, so they must stay
# correct through the fallback paths.
# ============================================================

statement ok
CREATE TABLE combo_l (id INT, grp INT, x INT);

statement ok
CREATE TABLE combo_r (rid INT, y INT, active BOOLEAN);

statement ok
INSERT INTO combo_l VALUES (1, 1, 10), (2, 1, 20), (3, 2, 30), (4, 2, 40), (5, 3, 50);

statement ok
INSERT INTO combo_r VALUES (10, 10, true), (11, 19, true), (12, 40, false);

statement ok
CREATE MATERIALIZED VIEW mv_exists_group AS
    SELECT l.grp, COUNT(*) AS cnt, SUM(l.x) AS total
    FROM combo_l l
    WHERE NOT EXISTS (
        SELECT 1 FROM combo_r r
        WHERE r.active AND abs(l.x - r.y) <= 1
    )
    GROUP BY l.grp;

query I
SELECT type FROM openivm_views WHERE view_name = 'mv_exists_group';
----
6

statement ok
CREATE MATERIALIZED VIEW mv_exists_union AS
    SELECT l.id, l.x
    FROM combo_l l
    WHERE EXISTS (
        SELECT 1 FROM combo_r r
        WHERE r.active AND abs(l.x - r.y) <= 1
    )
    UNION ALL
    SELECT l.id, l.x
    FROM combo_l l
    WHERE NOT EXISTS (
        SELECT 1 FROM combo_r r
        WHERE r.active AND abs(l.x - r.y) <= 1
    ) AND l.grp = 3;

query I
SELECT COUNT(*) FROM openivm_views
WHERE view_name IN ('mv_exists_group', 'mv_exists_union') AND semi_anti_aux_meta_json IS NOT NULL;
----
0

statement ok
UPDATE combo_r SET active = true WHERE rid = 12;

statement ok
INSERT INTO combo_r VALUES (13, 31, true), (14, 50, true);

statement ok
DELETE FROM combo_r WHERE rid = 10;

statement ok
UPDATE combo_l SET x = 18 WHERE id = 3;

statement ok
INSERT INTO combo_l VALUES (6, 3, 60), (7, 1, 11);

statement ok
PRAGMA refresh('mv_exists_group');

statement ok
PRAGMA refresh('mv_exists_union');

query I
SELECT COUNT(*) FROM (
    SELECT l.grp, COUNT(*) AS cnt, SUM(l.x) AS total
    FROM combo_l l
    WHERE NOT EXISTS (
        SELECT 1 FROM combo_r r
        WHERE r.active AND abs(l.x - r.y) <= 1
    )
    GROUP BY l.grp
    EXCEPT ALL SELECT grp, cnt, total FROM mv_exists_group
);
----
0

query I
SELECT COUNT(*) FROM (
    SELECT grp, cnt, total FROM mv_exists_group
    EXCEPT ALL
    SELECT l.grp, COUNT(*) AS cnt, SUM(l.x) AS total
    FROM combo_l l
    WHERE NOT EXISTS (
        SELECT 1 FROM combo_r r
        WHERE r.active AND abs(l.x - r.y) <= 1
    )
    GROUP BY l.grp
);
----
0

query I
SELECT COUNT(*) FROM (
    SELECT * FROM (
        SELECT l.id, l.x
        FROM combo_l l
        WHERE EXISTS (
            SELECT 1 FROM combo_r r
            WHERE r.active AND abs(l.x - r.y) <= 1
        )
        UNION ALL
        SELECT l.id, l.x
        FROM combo_l l
        WHERE NOT EXISTS (
            SELECT 1 FROM combo_r r
            WHERE r.active AND abs(l.x - r.y) <= 1
        ) AND l.grp = 3
    ) expected_union
    EXCEPT ALL SELECT id, x FROM mv_exists_union
);
----
0

query I
SELECT COUNT(*) FROM (
    SELECT id, x FROM mv_exists_union
    EXCEPT ALL
    SELECT * FROM (
        SELECT l.id, l.x
        FROM combo_l l
        WHERE EXISTS (
            SELECT 1 FROM combo_r r
            WHERE r.active AND abs(l.x - r.y) <= 1
        )
        UNION ALL
        SELECT l.id, l.x
        FROM combo_l l
        WHERE NOT EXISTS (
            SELECT 1 FROM combo_r r
            WHERE r.active AND abs(l.x - r.y) <= 1
        ) AND l.grp = 3
    ) expected_union
);
----
0

# ANTI JOIN uses the same aux table shape but the visibility transition is inverted.
statement ok
CREATE TABLE aaj_l (id INT, x INT);

statement ok
CREATE TABLE aaj_r (rid INT, y INT);

statement ok
INSERT INTO aaj_l VALUES (1, 10), (2, 20), (3, 30), (3, 30), (4, 40);

statement ok
INSERT INTO aaj_r VALUES (200, 8), (201, 41);

statement ok
CREATE MATERIALIZED VIEW mv_saj_anti AS
    SELECT l.id, l.x FROM aaj_l l ANTI JOIN aaj_r r ON abs(l.x - r.y) <= 2;

query I
SELECT COUNT(*) FROM (
    SELECT l.id, l.x FROM aaj_l l ANTI JOIN aaj_r r ON abs(l.x - r.y) <= 2
    EXCEPT ALL SELECT id, x FROM mv_saj_anti
);
----
0

query I
SELECT COUNT(*) FROM (
    SELECT id, x FROM mv_saj_anti
    EXCEPT ALL SELECT l.id, l.x FROM aaj_l l ANTI JOIN aaj_r r ON abs(l.x - r.y) <= 2
);
----
0

# ============================================================
# Duplicate RHS matches: SEMI should not disappear until the last
# matching right tuple is deleted; ANTI should not reappear early.
# ============================================================

statement ok
CREATE TABLE dup_l (id INT, x INT);

statement ok
CREATE TABLE dup_r (rid INT, y INT);

statement ok
INSERT INTO dup_l VALUES (1, 10), (2, 20), (3, 30);

statement ok
INSERT INTO dup_r VALUES (10, 10), (11, 10), (20, 20);

statement ok
CREATE MATERIALIZED VIEW mv_dup_semi AS
    SELECT l.id, l.x FROM dup_l l SEMI JOIN dup_r r ON l.x = r.y;

statement ok
CREATE MATERIALIZED VIEW mv_dup_anti AS
    SELECT l.id, l.x FROM dup_l l ANTI JOIN dup_r r ON l.x = r.y;

statement ok
DELETE FROM dup_r WHERE rid = 10;

statement ok
PRAGMA refresh('mv_dup_semi');

statement ok
PRAGMA refresh('mv_dup_anti');

query I
SELECT COUNT(*) FROM (
    SELECT l.id, l.x FROM dup_l l SEMI JOIN dup_r r ON l.x = r.y
    EXCEPT ALL SELECT id, x FROM mv_dup_semi
);
----
0

query I
SELECT COUNT(*) FROM (
    SELECT id, x FROM mv_dup_semi
    EXCEPT ALL SELECT l.id, l.x FROM dup_l l SEMI JOIN dup_r r ON l.x = r.y
);
----
0

query I
SELECT COUNT(*) FROM (
    SELECT l.id, l.x FROM dup_l l ANTI JOIN dup_r r ON l.x = r.y
    EXCEPT ALL SELECT id, x FROM mv_dup_anti
);
----
0

query I
SELECT COUNT(*) FROM (
    SELECT id, x FROM mv_dup_anti
    EXCEPT ALL SELECT l.id, l.x FROM dup_l l ANTI JOIN dup_r r ON l.x = r.y
);
----
0

statement ok
DELETE FROM dup_r WHERE rid = 11;

statement ok
PRAGMA refresh('mv_dup_semi');

statement ok
PRAGMA refresh('mv_dup_anti');

query I
SELECT COUNT(*) FROM (
    SELECT l.id, l.x FROM dup_l l SEMI JOIN dup_r r ON l.x = r.y
    EXCEPT ALL SELECT id, x FROM mv_dup_semi
);
----
0

query I
SELECT COUNT(*) FROM (
    SELECT id, x FROM mv_dup_semi
    EXCEPT ALL SELECT l.id, l.x FROM dup_l l SEMI JOIN dup_r r ON l.x = r.y
);
----
0

query I
SELECT COUNT(*) FROM (
    SELECT l.id, l.x FROM dup_l l ANTI JOIN dup_r r ON l.x = r.y
    EXCEPT ALL SELECT id, x FROM mv_dup_anti
);
----
0

query I
SELECT COUNT(*) FROM (
    SELECT id, x FROM mv_dup_anti
    EXCEPT ALL SELECT l.id, l.x FROM dup_l l ANTI JOIN dup_r r ON l.x = r.y
);
----
0

# ============================================================
# UPDATEs are tracked as delete+insert deltas. Exercise left-side
# identity movement, right-side match movement, and NULL-safe predicates.
# ============================================================

statement ok
CREATE TABLE upd_l (id INT, x INT);

statement ok
CREATE TABLE upd_r (rid INT, y INT);

statement ok
INSERT INTO upd_l VALUES (1, 10), (2, NULL), (3, 30), (4, 40);

statement ok
INSERT INTO upd_r VALUES (100, 10), (101, NULL), (102, 99);

statement ok
CREATE MATERIALIZED VIEW mv_upd_semi AS
    SELECT l.id, l.x FROM upd_l l SEMI JOIN upd_r r ON l.x IS NOT DISTINCT FROM r.y;

statement ok
CREATE MATERIALIZED VIEW mv_upd_anti AS
    SELECT l.id, l.x FROM upd_l l ANTI JOIN upd_r r ON l.x IS NOT DISTINCT FROM r.y;

statement ok
UPDATE upd_l SET x = 99 WHERE id = 3;

statement ok
UPDATE upd_r SET y = 40 WHERE rid = 102;

statement ok
DELETE FROM upd_r WHERE rid = 101;

statement ok
INSERT INTO upd_l VALUES (5, NULL), (5, NULL);

statement ok
PRAGMA refresh('mv_upd_semi');

statement ok
PRAGMA refresh('mv_upd_anti');

query I
SELECT COUNT(*) FROM (
    SELECT l.id, l.x FROM upd_l l SEMI JOIN upd_r r ON l.x IS NOT DISTINCT FROM r.y
    EXCEPT ALL SELECT id, x FROM mv_upd_semi
);
----
0

query I
SELECT COUNT(*) FROM (
    SELECT id, x FROM mv_upd_semi
    EXCEPT ALL SELECT l.id, l.x FROM upd_l l SEMI JOIN upd_r r ON l.x IS NOT DISTINCT FROM r.y
);
----
0

query I
SELECT COUNT(*) FROM (
    SELECT l.id, l.x FROM upd_l l ANTI JOIN upd_r r ON l.x IS NOT DISTINCT FROM r.y
    EXCEPT ALL SELECT id, x FROM mv_upd_anti
);
----
0

query I
SELECT COUNT(*) FROM (
    SELECT id, x FROM mv_upd_anti
    EXCEPT ALL SELECT l.id, l.x FROM upd_l l ANTI JOIN upd_r r ON l.x IS NOT DISTINCT FROM r.y
);
----
0

# ============================================================
# Stacked FILTER above SEMI/ANTI. The aux state tracks all left
# tuples; refresh only materializes rows that pass the outer filter.
# ============================================================

statement ok
CREATE TABLE stack_l (id INT, x INT);

statement ok
CREATE TABLE stack_r (rid INT, y INT);

statement ok
INSERT INTO stack_l VALUES (1, 10), (2, 20), (3, 30), (4, 40), (5, 50);

statement ok
INSERT INTO stack_r VALUES (1, 10), (2, 21), (3, 70);

statement ok
CREATE MATERIALIZED VIEW mv_stack_semi AS
    SELECT l.id, l.x FROM stack_l l SEMI JOIN stack_r r ON abs(l.x - r.y) <= 1 WHERE l.id >= 2;

statement ok
CREATE MATERIALIZED VIEW mv_stack_anti AS
    SELECT l.id, l.x FROM stack_l l ANTI JOIN stack_r r ON abs(l.x - r.y) <= 1 WHERE l.id >= 2;

statement ok
INSERT INTO stack_r VALUES (4, 40), (5, 51);

statement ok
UPDATE stack_l SET id = 6 WHERE id = 1;

statement ok
DELETE FROM stack_r WHERE rid = 2;

statement ok
INSERT INTO stack_l VALUES (7, 70);

statement ok
PRAGMA refresh('mv_stack_semi');

statement ok
PRAGMA refresh('mv_stack_anti');

query I
SELECT COUNT(*) FROM (
    SELECT l.id, l.x FROM stack_l l SEMI JOIN stack_r r ON abs(l.x - r.y) <= 1 WHERE l.id >= 2
    EXCEPT ALL SELECT id, x FROM mv_stack_semi
);
----
0

query I
SELECT COUNT(*) FROM (
    SELECT id, x FROM mv_stack_semi
    EXCEPT ALL SELECT l.id, l.x FROM stack_l l SEMI JOIN stack_r r ON abs(l.x - r.y) <= 1 WHERE l.id >= 2
);
----
0

query I
SELECT COUNT(*) FROM (
    SELECT l.id, l.x FROM stack_l l ANTI JOIN stack_r r ON abs(l.x - r.y) <= 1 WHERE l.id >= 2
    EXCEPT ALL SELECT id, x FROM mv_stack_anti
);
----
0

query I
SELECT COUNT(*) FROM (
    SELECT id, x FROM mv_stack_anti
    EXCEPT ALL SELECT l.id, l.x FROM stack_l l ANTI JOIN stack_r r ON abs(l.x - r.y) <= 1 WHERE l.id >= 2
);
----
0

statement ok
DELETE FROM upd_l WHERE id = 5;

statement ok
INSERT INTO upd_r VALUES (103, NULL);

statement ok
INSERT INTO upd_l VALUES (6, NULL);

statement ok
PRAGMA refresh('mv_upd_semi');

statement ok
PRAGMA refresh('mv_upd_anti');

query I
SELECT COUNT(*) FROM (
    SELECT l.id, l.x FROM upd_l l SEMI JOIN upd_r r ON l.x IS NOT DISTINCT FROM r.y
    EXCEPT ALL SELECT id, x FROM mv_upd_semi
);
----
0

query I
SELECT COUNT(*) FROM (
    SELECT id, x FROM mv_upd_semi
    EXCEPT ALL SELECT l.id, l.x FROM upd_l l SEMI JOIN upd_r r ON l.x IS NOT DISTINCT FROM r.y
);
----
0

query I
SELECT COUNT(*) FROM (
    SELECT l.id, l.x FROM upd_l l ANTI JOIN upd_r r ON l.x IS NOT DISTINCT FROM r.y
    EXCEPT ALL SELECT id, x FROM mv_upd_anti
);
----
0

query I
SELECT COUNT(*) FROM (
    SELECT id, x FROM mv_upd_anti
    EXCEPT ALL SELECT l.id, l.x FROM upd_l l ANTI JOIN upd_r r ON l.x IS NOT DISTINCT FROM r.y
);
----
0

statement ok
INSERT INTO aaj_r VALUES (202, 20), (203, 29);

statement ok
DELETE FROM aaj_r WHERE rid = 201;

statement ok
INSERT INTO aaj_l VALUES (5, 50);

statement ok
DELETE FROM aaj_l WHERE id = 1;

statement ok
PRAGMA refresh('mv_saj_anti');

query I
SELECT COUNT(*) FROM (
    SELECT l.id, l.x FROM aaj_l l ANTI JOIN aaj_r r ON abs(l.x - r.y) <= 2
    EXCEPT ALL SELECT id, x FROM mv_saj_anti
);
----
0

query I
SELECT COUNT(*) FROM (
    SELECT id, x FROM mv_saj_anti
    EXCEPT ALL SELECT l.id, l.x FROM aaj_l l ANTI JOIN aaj_r r ON abs(l.x - r.y) <= 2
);
----
0
