# name: test/sql/transactional_lifecycle.test
# description: Materialized-view lifecycle operations participate in the caller transaction
# group: [sql]

require openivm

require parquet

statement ok
INSTALL ducklake;

statement ok
LOAD ducklake;

load __TEST_DIR__/openivm_transactional_lifecycle.db

# CREATE rollback removes every object created for the MV.
statement ok
CREATE TABLE lifecycle_create_src (id INTEGER, v INTEGER);

statement ok
INSERT INTO lifecycle_create_src VALUES (1, 10);

statement ok
BEGIN TRANSACTION;

statement ok
CREATE MATERIALIZED VIEW lifecycle_create_mv AS
SELECT id, v FROM lifecycle_create_src;

statement ok
ROLLBACK;

query IIII
SELECT
    (SELECT count(*) FROM duckdb_views() WHERE view_name = 'lifecycle_create_mv'),
    (SELECT count(*) FROM duckdb_tables() WHERE table_name = 'openivm_data_lifecycle_create_mv'),
    (SELECT count(*) FROM duckdb_tables() WHERE table_name = 'openivm_delta_lifecycle_create_mv'),
    (SELECT count(*) FROM duckdb_tables() WHERE table_name = 'openivm_views');
----
0	0	0	0

# REPLACE rollback restores the old definition, data, and refresh metadata.
statement ok
CREATE TABLE lifecycle_replace_src (id INTEGER, old_v INTEGER, new_v INTEGER);

statement ok
INSERT INTO lifecycle_replace_src VALUES (1, 10, 100);

statement ok
CREATE MATERIALIZED VIEW lifecycle_replace_mv REFRESH EVERY '5 minutes' AS
SELECT id, old_v AS v FROM lifecycle_replace_src;

statement ok
BEGIN TRANSACTION;

statement ok
CREATE OR REPLACE MATERIALIZED VIEW lifecycle_replace_mv REFRESH EVERY '10 minutes' AS
SELECT id, new_v AS v FROM lifecycle_replace_src;

statement ok
ROLLBACK;

query II
SELECT id, v FROM lifecycle_replace_mv;
----
1	10

query I
SELECT refresh_interval FROM openivm_views WHERE view_name = 'lifecycle_replace_mv';
----
300

# A replacement that fails during initial materialization also preserves the old MV.
statement ok
CREATE TABLE lifecycle_failed_replace_src (id INTEGER, txt VARCHAR);

statement ok
INSERT INTO lifecycle_failed_replace_src VALUES (1, 'not-an-integer');

statement ok
CREATE MATERIALIZED VIEW lifecycle_failed_replace_mv AS
SELECT id, txt FROM lifecycle_failed_replace_src;

statement error
CREATE OR REPLACE MATERIALIZED VIEW lifecycle_failed_replace_mv AS
SELECT id, CAST(txt AS INTEGER) AS txt FROM lifecycle_failed_replace_src;
----
Could not convert

query II
SELECT id, txt FROM lifecycle_failed_replace_mv;
----
1	not-an-integer

# ALTER rollback leaves the previous schedule unchanged.
statement ok
BEGIN TRANSACTION;

statement ok
ALTER MATERIALIZED VIEW lifecycle_replace_mv SET REFRESH EVERY '30 minutes';

statement ok
ROLLBACK;

query I
SELECT refresh_interval FROM openivm_views WHERE view_name = 'lifecycle_replace_mv';
----
300

# DROP rollback restores the user view, backing state, metadata, and refreshability.
statement ok
CREATE TABLE lifecycle_drop_src (id INTEGER, v INTEGER);

statement ok
INSERT INTO lifecycle_drop_src VALUES (1, 10);

statement ok
CREATE MATERIALIZED VIEW lifecycle_drop_mv AS
SELECT id, v FROM lifecycle_drop_src;

statement ok
BEGIN TRANSACTION;

statement ok
DROP VIEW lifecycle_drop_mv;

statement ok
ROLLBACK;

query III
SELECT
    (SELECT count(*) FROM duckdb_views() WHERE view_name = 'lifecycle_drop_mv'),
    (SELECT count(*) FROM duckdb_tables() WHERE table_name = 'openivm_data_lifecycle_drop_mv'),
    (SELECT count(*) FROM openivm_views WHERE view_name = 'lifecycle_drop_mv');
----
1	1	1

statement ok
INSERT INTO lifecycle_drop_src VALUES (2, 20);

statement ok
PRAGMA refresh('lifecycle_drop_mv');

query I
SELECT count(*) FROM (
    SELECT * FROM lifecycle_drop_mv
    EXCEPT ALL
    SELECT * FROM lifecycle_drop_src
);
----
0

query I
SELECT count(*) FROM (
    SELECT * FROM lifecycle_drop_src
    EXCEPT ALL
    SELECT * FROM lifecycle_drop_mv
);
----
0

# Metadata replay is based on the statement target, not literals in a valid
# backing-table query.
statement ok
CREATE TABLE lifecycle_metadata_literal_src (id INTEGER);

statement ok
INSERT INTO lifecycle_metadata_literal_src VALUES (1);

statement ok
BEGIN TRANSACTION;

statement ok
CREATE MATERIALIZED VIEW lifecycle_metadata_literal_mv AS
SELECT id, 'openivm_views' AS marker FROM lifecycle_metadata_literal_src;

statement ok
INSERT INTO lifecycle_metadata_literal_src VALUES (2);

statement ok
PRAGMA refresh('lifecycle_metadata_literal_mv');

query I
SELECT count(*) FROM (
    SELECT * FROM lifecycle_metadata_literal_mv
    EXCEPT ALL
    SELECT id, 'openivm_views' AS marker FROM lifecycle_metadata_literal_src
);
----
0

query I
SELECT count(*) FROM (
    SELECT id, 'openivm_views' AS marker FROM lifecycle_metadata_literal_src
    EXCEPT ALL
    SELECT * FROM lifecycle_metadata_literal_mv
);
----
0

statement ok
COMMIT;

# Native source deltas live beside the source, including non-default schemas.
statement ok
CREATE SCHEMA lifecycle_alt;

statement ok
CREATE TABLE lifecycle_alt.drop_src (id INTEGER);

statement ok
INSERT INTO lifecycle_alt.drop_src VALUES (1), (2);

statement ok
CREATE MATERIALIZED VIEW lifecycle_alt_drop_mv AS
SELECT id FROM lifecycle_alt.drop_src;

query I
SELECT count(*) FROM (
    SELECT * FROM lifecycle_alt_drop_mv
    EXCEPT ALL
    SELECT * FROM lifecycle_alt.drop_src
);
----
0

query I
SELECT count(*) FROM (
    SELECT * FROM lifecycle_alt.drop_src
    EXCEPT ALL
    SELECT * FROM lifecycle_alt_drop_mv
);
----
0

query I
SELECT count(*) FROM information_schema.tables
WHERE table_schema = 'lifecycle_alt' AND table_name = 'openivm_delta_drop_src';
----
1

statement ok
DROP VIEW lifecycle_alt_drop_mv;

query I
SELECT count(*) FROM information_schema.tables
WHERE table_schema = 'lifecycle_alt' AND table_name = 'openivm_delta_drop_src';
----
0

# A schema-qualified DROP of an ordinary same-named view must not clean up the
# tracked MV in another schema. Metadata currently uses a bare view name, so
# cleanup must first prove the exact catalog entry is OpenIVM's generated view.
statement ok
CREATE TABLE lifecycle_drop_collision_src (id INTEGER);

statement ok
INSERT INTO lifecycle_drop_collision_src VALUES (1);

statement ok
CREATE MATERIALIZED VIEW lifecycle_drop_collision_mv AS
SELECT * FROM lifecycle_drop_collision_src;

statement ok
CREATE SCHEMA lifecycle_drop_collision_schema;

statement ok
CREATE VIEW lifecycle_drop_collision_schema.lifecycle_drop_collision_mv AS
SELECT 99 AS id;

statement ok
DROP VIEW lifecycle_drop_collision_schema.lifecycle_drop_collision_mv;

query III
SELECT
    (SELECT count(*) FROM duckdb_views() WHERE schema_name = 'main'
        AND view_name = 'lifecycle_drop_collision_mv'),
    (SELECT count(*) FROM duckdb_tables() WHERE table_name = 'openivm_data_lifecycle_drop_collision_mv'),
    (SELECT count(*) FROM openivm_views WHERE view_name = 'lifecycle_drop_collision_mv');
----
1	1	1

statement ok
INSERT INTO lifecycle_drop_collision_src VALUES (2);

statement ok
PRAGMA refresh('lifecycle_drop_collision_mv');

query I
SELECT count(*) FROM (
    SELECT * FROM lifecycle_drop_collision_mv
    EXCEPT ALL
    SELECT * FROM lifecycle_drop_collision_src
);
----
0

query I
SELECT count(*) FROM (
    SELECT * FROM lifecycle_drop_collision_src
    EXCEPT ALL
    SELECT * FROM lifecycle_drop_collision_mv
);
----
0

# Refresh rollback restores the MV and leaves its source delta available for retry.
statement ok
CREATE TABLE lifecycle_refresh_src (id INTEGER, v INTEGER);

statement ok
INSERT INTO lifecycle_refresh_src VALUES (1, 10);

statement ok
CREATE MATERIALIZED VIEW lifecycle_refresh_mv AS
SELECT id, v FROM lifecycle_refresh_src;

statement ok
INSERT INTO lifecycle_refresh_src VALUES (2, 20);

statement ok
BEGIN TRANSACTION;

statement ok
PRAGMA refresh('lifecycle_refresh_mv');

query II
SELECT id, v FROM lifecycle_refresh_mv ORDER BY id;
----
1	10
2	20

statement ok
ROLLBACK;

query II
SELECT id, v FROM lifecycle_refresh_mv ORDER BY id;
----
1	10

query I
SELECT count(*) FROM openivm_delta_lifecycle_refresh_src;
----
1

statement ok
PRAGMA refresh('lifecycle_refresh_mv');

query I
SELECT count(*) FROM (
    SELECT * FROM lifecycle_refresh_mv
    EXCEPT ALL
    SELECT * FROM lifecycle_refresh_src
);
----
0

query I
SELECT count(*) FROM (
    SELECT * FROM lifecycle_refresh_src
    EXCEPT ALL
    SELECT * FROM lifecycle_refresh_mv
);
----
0

# Transaction-local DML is visible to refresh and rolls back together.
statement ok
CREATE TABLE lifecycle_local_refresh_src (id INTEGER, v INTEGER);

statement ok
INSERT INTO lifecycle_local_refresh_src VALUES (1, 10);

statement ok
CREATE MATERIALIZED VIEW lifecycle_local_refresh_mv AS
SELECT id, v FROM lifecycle_local_refresh_src;

statement ok
BEGIN TRANSACTION;

statement ok
INSERT INTO lifecycle_local_refresh_src VALUES (2, 20);

statement ok
PRAGMA refresh('lifecycle_local_refresh_mv');

query I
SELECT count(*) FROM (
    SELECT * FROM lifecycle_local_refresh_mv
    EXCEPT ALL
    SELECT * FROM lifecycle_local_refresh_src
);
----
0

query I
SELECT count(*) FROM (
    SELECT * FROM lifecycle_local_refresh_src
    EXCEPT ALL
    SELECT * FROM lifecycle_local_refresh_mv
);
----
0

statement ok
ROLLBACK;

query I
SELECT count(*) FROM (
    SELECT * FROM lifecycle_local_refresh_mv
    EXCEPT ALL
    SELECT * FROM lifecycle_local_refresh_src
);
----
0

query I
SELECT count(*) FROM (
    SELECT * FROM lifecycle_local_refresh_src
    EXCEPT ALL
    SELECT * FROM lifecycle_local_refresh_mv
);
----
0

# A source table, MV metadata, backing tables, and refresh created in one
# explicit transaction must all be visible through the caller's snapshot.
statement ok
BEGIN TRANSACTION;

statement ok
CREATE TABLE lifecycle_same_tx_src (id INTEGER, v INTEGER);

statement ok
INSERT INTO lifecycle_same_tx_src VALUES (1, 10), (2, 20);

statement ok
CREATE MATERIALIZED VIEW lifecycle_same_tx_mv AS
SELECT id, v FROM lifecycle_same_tx_src;

statement ok
INSERT INTO lifecycle_same_tx_src VALUES (3, 30), (4, 40);

statement ok
UPDATE lifecycle_same_tx_src SET v = 21 WHERE id = 2;

statement ok
DELETE FROM lifecycle_same_tx_src WHERE id = 4;

statement ok
PRAGMA refresh('lifecycle_same_tx_mv');

query I
SELECT count(*) FROM (
    SELECT * FROM lifecycle_same_tx_mv
    EXCEPT ALL
    SELECT * FROM lifecycle_same_tx_src
);
----
0

query I
SELECT count(*) FROM (
    SELECT * FROM lifecycle_same_tx_src
    EXCEPT ALL
    SELECT * FROM lifecycle_same_tx_mv
);
----
0

statement ok
COMMIT;

# A same-transaction replacement must compile refresh from the replacement
# definition and source metadata, not the committed definition visible to a
# helper connection.
statement ok
CREATE TABLE lifecycle_same_tx_replace_src (id INTEGER, old_v INTEGER, new_v INTEGER);

statement ok
INSERT INTO lifecycle_same_tx_replace_src VALUES (1, 10, 100), (2, 20, 200);

statement ok
CREATE MATERIALIZED VIEW lifecycle_same_tx_replace_mv AS
SELECT id, old_v AS v FROM lifecycle_same_tx_replace_src;

statement ok
BEGIN TRANSACTION;

statement ok
CREATE OR REPLACE MATERIALIZED VIEW lifecycle_same_tx_replace_mv AS
SELECT id, new_v AS v FROM lifecycle_same_tx_replace_src;

statement ok
INSERT INTO lifecycle_same_tx_replace_src VALUES (3, 30, 300), (4, 40, 400);

statement ok
UPDATE lifecycle_same_tx_replace_src SET new_v = 201 WHERE id = 2;

statement ok
DELETE FROM lifecycle_same_tx_replace_src WHERE id = 4;

statement ok
PRAGMA refresh('lifecycle_same_tx_replace_mv');

query I
SELECT count(*) FROM (
    SELECT * FROM lifecycle_same_tx_replace_mv
    EXCEPT ALL
    SELECT id, new_v AS v FROM lifecycle_same_tx_replace_src
);
----
0

query I
SELECT count(*) FROM (
    SELECT id, new_v AS v FROM lifecycle_same_tx_replace_src
    EXCEPT ALL
    SELECT * FROM lifecycle_same_tx_replace_mv
);
----
0

statement ok
COMMIT;

# CREATE followed by DROP in one transaction must not orphan generated state
# or metadata that a helper connection cannot yet observe.
statement ok
CREATE TABLE lifecycle_same_tx_drop_src (id INTEGER);

statement ok
BEGIN TRANSACTION;

statement ok
CREATE MATERIALIZED VIEW lifecycle_same_tx_drop_mv AS
SELECT * FROM lifecycle_same_tx_drop_src;

statement ok
DROP VIEW lifecycle_same_tx_drop_mv;

statement ok
COMMIT;

query IIIII
SELECT
    (SELECT count(*) FROM duckdb_views() WHERE view_name = 'lifecycle_same_tx_drop_mv'),
    (SELECT count(*) FROM duckdb_tables() WHERE table_name = 'openivm_data_lifecycle_same_tx_drop_mv'),
    (SELECT count(*) FROM duckdb_tables() WHERE table_name = 'openivm_delta_lifecycle_same_tx_drop_mv'),
    (SELECT count(*) FROM duckdb_tables() WHERE table_name = 'openivm_delta_lifecycle_same_tx_drop_src'),
    (SELECT count(*) FROM openivm_views WHERE view_name = 'lifecycle_same_tx_drop_mv');
----
0	0	0	0	0

# DROP ownership is the exact catalog/schema identity recorded at CREATE time.
# A same-named ordinary view that deliberately references the backing table must
# not be able to destroy the tracked MV.
statement ok
CREATE TABLE lifecycle_exact_drop_src (id INTEGER);

statement ok
INSERT INTO lifecycle_exact_drop_src VALUES (1), (2);

statement ok
CREATE MATERIALIZED VIEW lifecycle_exact_drop_mv AS
SELECT * FROM lifecycle_exact_drop_src;

statement ok
CREATE SCHEMA lifecycle_spoof;

statement ok
CREATE VIEW lifecycle_spoof.lifecycle_exact_drop_mv AS
SELECT * FROM main.openivm_data_lifecycle_exact_drop_mv;

statement ok
DROP VIEW lifecycle_spoof.lifecycle_exact_drop_mv;

query I
SELECT count(*) FROM (
    SELECT * FROM lifecycle_exact_drop_mv
    EXCEPT ALL
    SELECT * FROM lifecycle_exact_drop_src
);
----
0

query I
SELECT count(*) FROM (
    SELECT * FROM lifecycle_exact_drop_src
    EXCEPT ALL
    SELECT * FROM lifecycle_exact_drop_mv
);
----
0

query III
SELECT
    (SELECT count(*) FROM openivm_views WHERE view_name = 'lifecycle_exact_drop_mv'),
    (SELECT count(*) FROM duckdb_tables() WHERE table_name = 'openivm_data_lifecycle_exact_drop_mv'),
    (SELECT count(*) FROM duckdb_views()
     WHERE schema_name = 'lifecycle_spoof' AND view_name = 'lifecycle_exact_drop_mv');
----
1	1	0

# A transaction-local DROP must be visible to a subsequent CREATE of the same
# MV name, including refresh compilation against the replacement metadata.
statement ok
CREATE TABLE lifecycle_drop_recreate_src (id INTEGER, old_v INTEGER, new_v INTEGER);

statement ok
INSERT INTO lifecycle_drop_recreate_src VALUES (1, 10, 100);

statement ok
CREATE MATERIALIZED VIEW lifecycle_drop_recreate_mv AS
SELECT id, old_v AS v FROM lifecycle_drop_recreate_src;

statement ok
BEGIN TRANSACTION;

statement ok
DROP VIEW lifecycle_drop_recreate_mv;

statement ok
CREATE MATERIALIZED VIEW lifecycle_drop_recreate_mv AS
SELECT id, new_v AS v FROM lifecycle_drop_recreate_src;

statement ok
INSERT INTO lifecycle_drop_recreate_src VALUES (2, 20, 200);

statement ok
UPDATE lifecycle_drop_recreate_src SET new_v = 101 WHERE id = 1;

statement ok
PRAGMA refresh('lifecycle_drop_recreate_mv');

query I
SELECT count(*) FROM (
    SELECT * FROM lifecycle_drop_recreate_mv
    EXCEPT ALL
    SELECT id, new_v AS v FROM lifecycle_drop_recreate_src
);
----
0

query I
SELECT count(*) FROM (
    SELECT id, new_v AS v FROM lifecycle_drop_recreate_src
    EXCEPT ALL
    SELECT * FROM lifecycle_drop_recreate_mv
);
----
0

statement ok
COMMIT;

# Stabilizing generated metadata timestamps must not rewrite now() text inside
# the stored view SQL.
statement ok
CREATE TABLE lifecycle_now_literal_src (id INTEGER);

statement ok
INSERT INTO lifecycle_now_literal_src VALUES (1);

statement ok
BEGIN TRANSACTION;

statement ok
CREATE MATERIALIZED VIEW lifecycle_now_literal_mv AS
SELECT id, 'now()' AS marker FROM lifecycle_now_literal_src;

statement ok
INSERT INTO lifecycle_now_literal_src VALUES (2);

statement ok
PRAGMA refresh('lifecycle_now_literal_mv');

query I
SELECT count(*) FROM (
    SELECT * FROM lifecycle_now_literal_mv
    EXCEPT ALL
    SELECT id, 'now()' AS marker FROM lifecycle_now_literal_src
);
----
0

query I
SELECT count(*) FROM (
    SELECT id, 'now()' AS marker FROM lifecycle_now_literal_src
    EXCEPT ALL
    SELECT * FROM lifecycle_now_literal_mv
);
----
0

statement ok
COMMIT;

# A refresh keeps its OpenIVM locks until the surrounding transaction ends.
# The second connection starts while the first transaction is sleeping after
# refresh and must wait for rollback before it can consume the restored delta.
statement ok
CREATE TABLE lifecycle_lock_src (id INTEGER, v INTEGER);

statement ok
INSERT INTO lifecycle_lock_src VALUES (1, 10);

statement ok
CREATE MATERIALIZED VIEW lifecycle_lock_mv AS
SELECT id, v FROM lifecycle_lock_src;

statement ok
INSERT INTO lifecycle_lock_src VALUES (2, 20);

statement ok
CREATE TABLE lifecycle_lock_timing (phase VARCHAR, observed_at TIMESTAMP);

concurrentloop threadid 0 2

onlyif threadid=0
statement ok
BEGIN TRANSACTION;

onlyif threadid=0
statement ok
PRAGMA refresh('lifecycle_lock_mv');

onlyif threadid=0
statement ok
SELECT sleep_ms(1200);

onlyif threadid=0
statement ok
ROLLBACK;

onlyif threadid=1
statement ok
SELECT sleep_ms(200);

onlyif threadid=1
statement ok
INSERT INTO lifecycle_lock_timing VALUES ('before', now()::TIMESTAMP);

onlyif threadid=1
statement ok
PRAGMA refresh('lifecycle_lock_mv');

onlyif threadid=1
statement ok
INSERT INTO lifecycle_lock_timing VALUES ('after', now()::TIMESTAMP);

endloop

query I
SELECT epoch_ms(max(observed_at)) - epoch_ms(min(observed_at)) >= 700
FROM lifecycle_lock_timing;
----
true

query I
SELECT count(*) FROM (
    SELECT * FROM lifecycle_lock_mv
    EXCEPT ALL
    SELECT * FROM lifecycle_lock_src
);
----
0

query I
SELECT count(*) FROM (
    SELECT * FROM lifecycle_lock_src
    EXCEPT ALL
    SELECT * FROM lifecycle_lock_mv
);
----
0

# DuckLake cannot share the native metadata transaction. Its replacement data
# is therefore built under an unpublished staging name and published only after
# materialization succeeds.
statement ok
ATTACH '__TEST_DIR__/openivm_transactional_lifecycle.ducklake' AS lifecycle_dl (TYPE ducklake);

statement ok
CREATE TABLE lifecycle_dl.replace_src (id INTEGER, old_v INTEGER, txt VARCHAR);

statement ok
INSERT INTO lifecycle_dl.replace_src VALUES (1, 10, 'bad');

statement ok
CREATE MATERIALIZED VIEW lifecycle_dl.replace_mv AS
SELECT id, old_v AS v FROM lifecycle_dl.replace_src;

statement error
CREATE OR REPLACE MATERIALIZED VIEW lifecycle_dl.replace_mv AS
SELECT id, CAST(txt AS INTEGER) AS v FROM lifecycle_dl.replace_src;
----
Could not convert

query II
SELECT id, v FROM lifecycle_dl.replace_mv;
----
1	10

query I
SELECT count(*) FROM duckdb_tables()
WHERE database_name = 'lifecycle_dl'
  AND table_name = 'openivm_stage_replace_mv';
----
0

statement ok
CREATE OR REPLACE MATERIALIZED VIEW lifecycle_dl.replace_mv AS
SELECT id, length(txt) AS v FROM lifecycle_dl.replace_src;

statement ok
INSERT INTO lifecycle_dl.replace_src VALUES (2, 20, 'four');

statement ok
PRAGMA refresh('replace_mv');

query I
SELECT count(*) FROM (
    SELECT id, v FROM lifecycle_dl.replace_mv
    EXCEPT ALL
    SELECT id, length(txt) AS v FROM lifecycle_dl.replace_src
);
----
0

query I
SELECT count(*) FROM (
    SELECT id, length(txt) AS v FROM lifecycle_dl.replace_src
    EXCEPT ALL
    SELECT id, v FROM lifecycle_dl.replace_mv
);
----
0
