# name: test/sql/window_running_aggregate_incremental.test
# description: Gated cumulative running-window suffix extension is bag-equal and falls back per backdated partition.
# group: [sql]

require openivm

statement ok
SET openivm_files_path='__TEST_DIR__';

statement ok
SET openivm_running_window_incremental=true;

statement ok
CREATE TABLE wrai_sales (id INT, k VARCHAR, d INT, x INT);

statement ok
INSERT INTO wrai_sales VALUES
    (1, 'a', 1, 10),
    (2, 'a', 2, 5),
    (3, 'b', 1, 7),
    (4, 'c', 1, 3),
    (11, NULL, 1, 4),
    (12, NULL, 2, 6);

statement ok
CREATE MATERIALIZED VIEW wrai_sum_mv AS
    SELECT id, k, d, x, SUM(x) OVER (PARTITION BY k ORDER BY d) AS running_sum
    FROM wrai_sales;

statement ok
CREATE MATERIALIZED VIEW wrai_max_mv AS
    SELECT id, k, d, x, MAX(x) OVER (PARTITION BY k ORDER BY d) AS running_max
    FROM wrai_sales;

statement ok
INSERT INTO wrai_sales VALUES
    (5, 'a', 3, 8),
    (6, 'b', 2, 9),
    (7, 'c', 2, 4),
    (13, NULL, 3, 2);

query I
SELECT CASE WHEN string_agg(sql, ' ' ORDER BY stmt_order) LIKE '%openivm_run_fast_wrai_sum_mv%'
         AND string_agg(sql, ' ' ORDER BY stmt_order) LIKE '%openivm_run_fallback_wrai_sum_mv%'
    THEN 1 ELSE 0 END
FROM openivm_compile_with_facts(
    'wrai_sum_mv',
    '{"target_dialect":"duckdb","compile_only":true,"assume_insert_only":true,"running_window_incremental":true}'
)
WHERE stmt_kind = 'data';
----
1

statement ok
PRAGMA refresh('wrai_sum_mv');

statement ok
PRAGMA refresh('wrai_max_mv');

query I
SELECT COUNT(*) FROM (
    SELECT * FROM openivm_data_wrai_sum_mv
    EXCEPT ALL
    SELECT id, k, d, x, SUM(x) OVER (PARTITION BY k ORDER BY d) AS running_sum FROM wrai_sales
);
----
0

query I
SELECT COUNT(*) FROM (
    SELECT id, k, d, x, SUM(x) OVER (PARTITION BY k ORDER BY d) AS running_sum FROM wrai_sales
    EXCEPT ALL
    SELECT * FROM openivm_data_wrai_sum_mv
);
----
0

query I
SELECT COUNT(*) FROM (
    SELECT * FROM openivm_data_wrai_max_mv
    EXCEPT ALL
    SELECT id, k, d, x, MAX(x) OVER (PARTITION BY k ORDER BY d) AS running_max FROM wrai_sales
);
----
0

query I
SELECT COUNT(*) FROM (
    SELECT id, k, d, x, MAX(x) OVER (PARTITION BY k ORDER BY d) AS running_max FROM wrai_sales
    EXCEPT ALL
    SELECT * FROM openivm_data_wrai_max_mv
);
----
0

statement ok
INSERT INTO wrai_sales VALUES
    (8, 'a', 0, 11),
    (9, 'b', 3, 2),
    (10, 'd', 1, 6),
    (14, NULL, 0, 13);

statement ok
PRAGMA refresh('wrai_sum_mv');

statement ok
PRAGMA refresh('wrai_max_mv');

query I
SELECT COUNT(*) FROM (
    SELECT * FROM openivm_data_wrai_sum_mv
    EXCEPT ALL
    SELECT id, k, d, x, SUM(x) OVER (PARTITION BY k ORDER BY d) AS running_sum FROM wrai_sales
);
----
0

query I
SELECT COUNT(*) FROM (
    SELECT id, k, d, x, SUM(x) OVER (PARTITION BY k ORDER BY d) AS running_sum FROM wrai_sales
    EXCEPT ALL
    SELECT * FROM openivm_data_wrai_sum_mv
);
----
0

query I
SELECT COUNT(*) FROM (
    SELECT * FROM openivm_data_wrai_max_mv
    EXCEPT ALL
    SELECT id, k, d, x, MAX(x) OVER (PARTITION BY k ORDER BY d) AS running_max FROM wrai_sales
);
----
0

query I
SELECT COUNT(*) FROM (
    SELECT id, k, d, x, MAX(x) OVER (PARTITION BY k ORDER BY d) AS running_max FROM wrai_sales
    EXCEPT ALL
    SELECT * FROM openivm_data_wrai_max_mv
);
----
0

# Appending a NULL-only suffix retains an existing SUM, but an all-NULL partition stays NULL.
statement ok
CREATE TABLE wrai_nulls (id INT, k INT, d INT, x INT);

statement ok
INSERT INTO wrai_nulls VALUES (1,1,1,10),(2,2,1,NULL),(3,NULL,1,5);

statement ok
CREATE MATERIALIZED VIEW wrai_nulls_mv AS
SELECT id,k,d,x,SUM(x) OVER (PARTITION BY k ORDER BY d) AS s FROM wrai_nulls;

statement ok
INSERT INTO wrai_nulls VALUES (4,1,2,NULL),(5,1,3,NULL),(6,2,2,NULL),(7,NULL,2,NULL),(8,3,1,NULL);

statement ok
PRAGMA refresh('wrai_nulls_mv');

query I
SELECT COUNT(*) FROM (
 (SELECT * FROM wrai_nulls_mv EXCEPT ALL SELECT id,k,d,x,SUM(x) OVER (PARTITION BY k ORDER BY d) AS s FROM wrai_nulls)
 UNION ALL
 (SELECT id,k,d,x,SUM(x) OVER (PARTITION BY k ORDER BY d) AS s FROM wrai_nulls EXCEPT ALL SELECT * FROM wrai_nulls_mv)
);
----
0

# Conflicting changes force delta consolidation before the same window is refreshed again.
statement ok
INSERT INTO wrai_nulls VALUES (9,1,4,NULL),(10,2,3,7),(11,2,4,NULL);

statement ok
UPDATE wrai_nulls SET x=3 WHERE id=4;

statement ok
DELETE FROM wrai_nulls WHERE id IN (1,10);

statement ok
INSERT INTO wrai_nulls VALUES (1,1,1,2),(10,2,3,NULL);

statement ok
PRAGMA refresh('wrai_nulls_mv');

query I
SELECT COUNT(*) FROM (
 (SELECT * FROM wrai_nulls_mv EXCEPT ALL SELECT id,k,d,x,SUM(x) OVER (PARTITION BY k ORDER BY d) AS s FROM wrai_nulls)
 UNION ALL
 (SELECT id,k,d,x,SUM(x) OVER (PARTITION BY k ORDER BY d) AS s FROM wrai_nulls EXCEPT ALL SELECT * FROM wrai_nulls_mv)
);
----
0

# Persist ROWS peer positions: negative sums make MAX(value) an invalid final-row seed.
load __TEST_DIR__/wrai_rows.db

statement ok
SET openivm_files_path='__TEST_DIR__';

statement ok
SET openivm_running_window_incremental=true;

statement ok
SET openivm_cascade_refresh='both';

statement ok
CREATE TABLE wrai_rows(k INT,d INT,x INT);

statement ok
INSERT INTO wrai_rows VALUES (1,1,6),(1,2,-3),(1,2,-3),(2,1,NULL),(NULL,1,4);

statement ok
CREATE MATERIALIZED VIEW wrai_rows_mv AS SELECT k,d,x,SUM(x) OVER (PARTITION BY k ORDER BY d ROWS BETWEEN UNBOUNDED PRECEDING AND CURRENT ROW) AS s,COUNT(x) OVER (PARTITION BY k ORDER BY d ROWS BETWEEN UNBOUNDED PRECEDING AND CURRENT ROW) AS n,COUNT(*) OVER (PARTITION BY k ORDER BY d ROWS BETWEEN UNBOUNDED PRECEDING AND CURRENT ROW) AS rows_n,MIN(x) OVER (PARTITION BY k ORDER BY d ROWS BETWEEN UNBOUNDED PRECEDING AND CURRENT ROW) AS lo,MAX(x) OVER (PARTITION BY k ORDER BY d ROWS BETWEEN UNBOUNDED PRECEDING AND CURRENT ROW) AS hi FROM wrai_rows;

statement ok
CREATE MATERIALIZED VIEW wrai_rows_child AS SELECT * FROM wrai_rows_mv;

statement ok
INSERT INTO wrai_rows VALUES (1,3,2),(1,3,2),(1,3,2),(2,2,NULL),(NULL,2,NULL);

query I
SELECT CASE WHEN string_agg(sql,' ' ORDER BY stmt_order) LIKE '%openivm_run_suffix_wrai_rows_mv%'
 AND string_agg(sql,' ' ORDER BY stmt_order) LIKE '%ROWS BETWEEN UNBOUNDED PRECEDING AND CURRENT ROW%'
 AND string_agg(sql,' ' ORDER BY stmt_order) LIKE '%MAX_BY(%openivm_rows_position_%'
 AND string_agg(sql,' ' ORDER BY stmt_order) LIKE '%INSERT INTO openivm_delta_wrai_rows_mv%'
 THEN 1 ELSE 0 END
FROM openivm_compile_with_facts('wrai_rows_mv','{"target_dialect":"duckdb","compile_only":true,"assume_insert_only":true,"running_window_incremental":true,"force_view_delta_cascade":true}')
WHERE stmt_kind='data';
----
1

statement ok
PRAGMA refresh_pipeline('wrai_rows_child');

query I
SELECT COUNT(*) FROM ((SELECT * FROM wrai_rows_mv EXCEPT ALL SELECT k,d,x,SUM(x) OVER (PARTITION BY k ORDER BY d ROWS BETWEEN UNBOUNDED PRECEDING AND CURRENT ROW) AS s,COUNT(x) OVER (PARTITION BY k ORDER BY d ROWS BETWEEN UNBOUNDED PRECEDING AND CURRENT ROW) AS n,COUNT(*) OVER (PARTITION BY k ORDER BY d ROWS BETWEEN UNBOUNDED PRECEDING AND CURRENT ROW) AS rows_n,MIN(x) OVER (PARTITION BY k ORDER BY d ROWS BETWEEN UNBOUNDED PRECEDING AND CURRENT ROW) AS lo,MAX(x) OVER (PARTITION BY k ORDER BY d ROWS BETWEEN UNBOUNDED PRECEDING AND CURRENT ROW) AS hi FROM wrai_rows) UNION ALL (SELECT k,d,x,SUM(x) OVER (PARTITION BY k ORDER BY d ROWS BETWEEN UNBOUNDED PRECEDING AND CURRENT ROW) AS s,COUNT(x) OVER (PARTITION BY k ORDER BY d ROWS BETWEEN UNBOUNDED PRECEDING AND CURRENT ROW) AS n,COUNT(*) OVER (PARTITION BY k ORDER BY d ROWS BETWEEN UNBOUNDED PRECEDING AND CURRENT ROW) AS rows_n,MIN(x) OVER (PARTITION BY k ORDER BY d ROWS BETWEEN UNBOUNDED PRECEDING AND CURRENT ROW) AS lo,MAX(x) OVER (PARTITION BY k ORDER BY d ROWS BETWEEN UNBOUNDED PRECEDING AND CURRENT ROW) AS hi FROM wrai_rows EXCEPT ALL SELECT * FROM wrai_rows_mv));
----
0

query I
SELECT COUNT(*) FROM ((SELECT * FROM wrai_rows_child EXCEPT ALL SELECT k,d,x,s,n,rows_n,lo,hi FROM (SELECT k,d,x,SUM(x) OVER (PARTITION BY k ORDER BY d ROWS BETWEEN UNBOUNDED PRECEDING AND CURRENT ROW) AS s,COUNT(x) OVER (PARTITION BY k ORDER BY d ROWS BETWEEN UNBOUNDED PRECEDING AND CURRENT ROW) AS n,COUNT(*) OVER (PARTITION BY k ORDER BY d ROWS BETWEEN UNBOUNDED PRECEDING AND CURRENT ROW) AS rows_n,MIN(x) OVER (PARTITION BY k ORDER BY d ROWS BETWEEN UNBOUNDED PRECEDING AND CURRENT ROW) AS lo,MAX(x) OVER (PARTITION BY k ORDER BY d ROWS BETWEEN UNBOUNDED PRECEDING AND CURRENT ROW) AS hi FROM wrai_rows) q) UNION ALL (SELECT k,d,x,s,n,rows_n,lo,hi FROM (SELECT k,d,x,SUM(x) OVER (PARTITION BY k ORDER BY d ROWS BETWEEN UNBOUNDED PRECEDING AND CURRENT ROW) AS s,COUNT(x) OVER (PARTITION BY k ORDER BY d ROWS BETWEEN UNBOUNDED PRECEDING AND CURRENT ROW) AS n,COUNT(*) OVER (PARTITION BY k ORDER BY d ROWS BETWEEN UNBOUNDED PRECEDING AND CURRENT ROW) AS rows_n,MIN(x) OVER (PARTITION BY k ORDER BY d ROWS BETWEEN UNBOUNDED PRECEDING AND CURRENT ROW) AS lo,MAX(x) OVER (PARTITION BY k ORDER BY d ROWS BETWEEN UNBOUNDED PRECEDING AND CURRENT ROW) AS hi FROM wrai_rows) q EXCEPT ALL SELECT * FROM wrai_rows_child));
----
0

restart

statement ok
SET openivm_files_path='__TEST_DIR__';

statement ok
SET openivm_running_window_incremental=true;

statement ok
SET openivm_cascade_refresh='both';

statement ok
INSERT INTO wrai_rows VALUES (1,3,2),(1,3,2),(2,3,3),(2,3,3),(NULL,3,-2),(NULL,3,-2);

statement ok
PRAGMA refresh_pipeline('wrai_rows_child');

query I
SELECT COUNT(*) FROM ((SELECT * FROM wrai_rows_mv EXCEPT ALL SELECT k,d,x,SUM(x) OVER (PARTITION BY k ORDER BY d ROWS BETWEEN UNBOUNDED PRECEDING AND CURRENT ROW) AS s,COUNT(x) OVER (PARTITION BY k ORDER BY d ROWS BETWEEN UNBOUNDED PRECEDING AND CURRENT ROW) AS n,COUNT(*) OVER (PARTITION BY k ORDER BY d ROWS BETWEEN UNBOUNDED PRECEDING AND CURRENT ROW) AS rows_n,MIN(x) OVER (PARTITION BY k ORDER BY d ROWS BETWEEN UNBOUNDED PRECEDING AND CURRENT ROW) AS lo,MAX(x) OVER (PARTITION BY k ORDER BY d ROWS BETWEEN UNBOUNDED PRECEDING AND CURRENT ROW) AS hi FROM wrai_rows) UNION ALL (SELECT k,d,x,SUM(x) OVER (PARTITION BY k ORDER BY d ROWS BETWEEN UNBOUNDED PRECEDING AND CURRENT ROW) AS s,COUNT(x) OVER (PARTITION BY k ORDER BY d ROWS BETWEEN UNBOUNDED PRECEDING AND CURRENT ROW) AS n,COUNT(*) OVER (PARTITION BY k ORDER BY d ROWS BETWEEN UNBOUNDED PRECEDING AND CURRENT ROW) AS rows_n,MIN(x) OVER (PARTITION BY k ORDER BY d ROWS BETWEEN UNBOUNDED PRECEDING AND CURRENT ROW) AS lo,MAX(x) OVER (PARTITION BY k ORDER BY d ROWS BETWEEN UNBOUNDED PRECEDING AND CURRENT ROW) AS hi FROM wrai_rows EXCEPT ALL SELECT * FROM wrai_rows_mv));
----
0

query I
SELECT COUNT(*) FROM ((SELECT * FROM wrai_rows_child EXCEPT ALL SELECT k,d,x,s,n,rows_n,lo,hi FROM (SELECT k,d,x,SUM(x) OVER (PARTITION BY k ORDER BY d ROWS BETWEEN UNBOUNDED PRECEDING AND CURRENT ROW) AS s,COUNT(x) OVER (PARTITION BY k ORDER BY d ROWS BETWEEN UNBOUNDED PRECEDING AND CURRENT ROW) AS n,COUNT(*) OVER (PARTITION BY k ORDER BY d ROWS BETWEEN UNBOUNDED PRECEDING AND CURRENT ROW) AS rows_n,MIN(x) OVER (PARTITION BY k ORDER BY d ROWS BETWEEN UNBOUNDED PRECEDING AND CURRENT ROW) AS lo,MAX(x) OVER (PARTITION BY k ORDER BY d ROWS BETWEEN UNBOUNDED PRECEDING AND CURRENT ROW) AS hi FROM wrai_rows) q) UNION ALL (SELECT k,d,x,s,n,rows_n,lo,hi FROM (SELECT k,d,x,SUM(x) OVER (PARTITION BY k ORDER BY d ROWS BETWEEN UNBOUNDED PRECEDING AND CURRENT ROW) AS s,COUNT(x) OVER (PARTITION BY k ORDER BY d ROWS BETWEEN UNBOUNDED PRECEDING AND CURRENT ROW) AS n,COUNT(*) OVER (PARTITION BY k ORDER BY d ROWS BETWEEN UNBOUNDED PRECEDING AND CURRENT ROW) AS rows_n,MIN(x) OVER (PARTITION BY k ORDER BY d ROWS BETWEEN UNBOUNDED PRECEDING AND CURRENT ROW) AS lo,MAX(x) OVER (PARTITION BY k ORDER BY d ROWS BETWEEN UNBOUNDED PRECEDING AND CURRENT ROW) AS hi FROM wrai_rows) q EXCEPT ALL SELECT * FROM wrai_rows_child));
----
0

# Consolidate conflicting DML and rebuild positions only in affected partitions.

statement ok
INSERT INTO wrai_rows VALUES (1,2,-3),(1,4,5),(1,4,5),(2,4,NULL);

statement ok
UPDATE wrai_rows SET x=-1 WHERE k=1 AND d=3;

statement ok
DELETE FROM wrai_rows WHERE k=1 AND d=1;

statement ok
INSERT INTO wrai_rows VALUES (1,1,8);

statement ok
PRAGMA refresh_pipeline('wrai_rows_child');

query I
SELECT COUNT(*) FROM ((SELECT * FROM wrai_rows_mv EXCEPT ALL SELECT k,d,x,SUM(x) OVER (PARTITION BY k ORDER BY d ROWS BETWEEN UNBOUNDED PRECEDING AND CURRENT ROW) AS s,COUNT(x) OVER (PARTITION BY k ORDER BY d ROWS BETWEEN UNBOUNDED PRECEDING AND CURRENT ROW) AS n,COUNT(*) OVER (PARTITION BY k ORDER BY d ROWS BETWEEN UNBOUNDED PRECEDING AND CURRENT ROW) AS rows_n,MIN(x) OVER (PARTITION BY k ORDER BY d ROWS BETWEEN UNBOUNDED PRECEDING AND CURRENT ROW) AS lo,MAX(x) OVER (PARTITION BY k ORDER BY d ROWS BETWEEN UNBOUNDED PRECEDING AND CURRENT ROW) AS hi FROM wrai_rows) UNION ALL (SELECT k,d,x,SUM(x) OVER (PARTITION BY k ORDER BY d ROWS BETWEEN UNBOUNDED PRECEDING AND CURRENT ROW) AS s,COUNT(x) OVER (PARTITION BY k ORDER BY d ROWS BETWEEN UNBOUNDED PRECEDING AND CURRENT ROW) AS n,COUNT(*) OVER (PARTITION BY k ORDER BY d ROWS BETWEEN UNBOUNDED PRECEDING AND CURRENT ROW) AS rows_n,MIN(x) OVER (PARTITION BY k ORDER BY d ROWS BETWEEN UNBOUNDED PRECEDING AND CURRENT ROW) AS lo,MAX(x) OVER (PARTITION BY k ORDER BY d ROWS BETWEEN UNBOUNDED PRECEDING AND CURRENT ROW) AS hi FROM wrai_rows EXCEPT ALL SELECT * FROM wrai_rows_mv));
----
0

query I
SELECT COUNT(*) FROM ((SELECT * FROM wrai_rows_child EXCEPT ALL SELECT k,d,x,s,n,rows_n,lo,hi FROM (SELECT k,d,x,SUM(x) OVER (PARTITION BY k ORDER BY d ROWS BETWEEN UNBOUNDED PRECEDING AND CURRENT ROW) AS s,COUNT(x) OVER (PARTITION BY k ORDER BY d ROWS BETWEEN UNBOUNDED PRECEDING AND CURRENT ROW) AS n,COUNT(*) OVER (PARTITION BY k ORDER BY d ROWS BETWEEN UNBOUNDED PRECEDING AND CURRENT ROW) AS rows_n,MIN(x) OVER (PARTITION BY k ORDER BY d ROWS BETWEEN UNBOUNDED PRECEDING AND CURRENT ROW) AS lo,MAX(x) OVER (PARTITION BY k ORDER BY d ROWS BETWEEN UNBOUNDED PRECEDING AND CURRENT ROW) AS hi FROM wrai_rows) q) UNION ALL (SELECT k,d,x,s,n,rows_n,lo,hi FROM (SELECT k,d,x,SUM(x) OVER (PARTITION BY k ORDER BY d ROWS BETWEEN UNBOUNDED PRECEDING AND CURRENT ROW) AS s,COUNT(x) OVER (PARTITION BY k ORDER BY d ROWS BETWEEN UNBOUNDED PRECEDING AND CURRENT ROW) AS n,COUNT(*) OVER (PARTITION BY k ORDER BY d ROWS BETWEEN UNBOUNDED PRECEDING AND CURRENT ROW) AS rows_n,MIN(x) OVER (PARTITION BY k ORDER BY d ROWS BETWEEN UNBOUNDED PRECEDING AND CURRENT ROW) AS lo,MAX(x) OVER (PARTITION BY k ORDER BY d ROWS BETWEEN UNBOUNDED PRECEDING AND CURRENT ROW) AS hi FROM wrai_rows) q EXCEPT ALL SELECT * FROM wrai_rows_child));
----
0

statement ok
INSERT INTO wrai_rows VALUES (1,5,NULL),(1,5,NULL),(2,5,4);

statement ok
PRAGMA refresh_pipeline('wrai_rows_child');

query I
SELECT COUNT(*) FROM ((SELECT * FROM wrai_rows_mv EXCEPT ALL SELECT k,d,x,SUM(x) OVER (PARTITION BY k ORDER BY d ROWS BETWEEN UNBOUNDED PRECEDING AND CURRENT ROW) AS s,COUNT(x) OVER (PARTITION BY k ORDER BY d ROWS BETWEEN UNBOUNDED PRECEDING AND CURRENT ROW) AS n,COUNT(*) OVER (PARTITION BY k ORDER BY d ROWS BETWEEN UNBOUNDED PRECEDING AND CURRENT ROW) AS rows_n,MIN(x) OVER (PARTITION BY k ORDER BY d ROWS BETWEEN UNBOUNDED PRECEDING AND CURRENT ROW) AS lo,MAX(x) OVER (PARTITION BY k ORDER BY d ROWS BETWEEN UNBOUNDED PRECEDING AND CURRENT ROW) AS hi FROM wrai_rows) UNION ALL (SELECT k,d,x,SUM(x) OVER (PARTITION BY k ORDER BY d ROWS BETWEEN UNBOUNDED PRECEDING AND CURRENT ROW) AS s,COUNT(x) OVER (PARTITION BY k ORDER BY d ROWS BETWEEN UNBOUNDED PRECEDING AND CURRENT ROW) AS n,COUNT(*) OVER (PARTITION BY k ORDER BY d ROWS BETWEEN UNBOUNDED PRECEDING AND CURRENT ROW) AS rows_n,MIN(x) OVER (PARTITION BY k ORDER BY d ROWS BETWEEN UNBOUNDED PRECEDING AND CURRENT ROW) AS lo,MAX(x) OVER (PARTITION BY k ORDER BY d ROWS BETWEEN UNBOUNDED PRECEDING AND CURRENT ROW) AS hi FROM wrai_rows EXCEPT ALL SELECT * FROM wrai_rows_mv));
----
0

query I
SELECT COUNT(*) FROM ((SELECT * FROM wrai_rows_child EXCEPT ALL SELECT k,d,x,s,n,rows_n,lo,hi FROM (SELECT k,d,x,SUM(x) OVER (PARTITION BY k ORDER BY d ROWS BETWEEN UNBOUNDED PRECEDING AND CURRENT ROW) AS s,COUNT(x) OVER (PARTITION BY k ORDER BY d ROWS BETWEEN UNBOUNDED PRECEDING AND CURRENT ROW) AS n,COUNT(*) OVER (PARTITION BY k ORDER BY d ROWS BETWEEN UNBOUNDED PRECEDING AND CURRENT ROW) AS rows_n,MIN(x) OVER (PARTITION BY k ORDER BY d ROWS BETWEEN UNBOUNDED PRECEDING AND CURRENT ROW) AS lo,MAX(x) OVER (PARTITION BY k ORDER BY d ROWS BETWEEN UNBOUNDED PRECEDING AND CURRENT ROW) AS hi FROM wrai_rows) q) UNION ALL (SELECT k,d,x,s,n,rows_n,lo,hi FROM (SELECT k,d,x,SUM(x) OVER (PARTITION BY k ORDER BY d ROWS BETWEEN UNBOUNDED PRECEDING AND CURRENT ROW) AS s,COUNT(x) OVER (PARTITION BY k ORDER BY d ROWS BETWEEN UNBOUNDED PRECEDING AND CURRENT ROW) AS n,COUNT(*) OVER (PARTITION BY k ORDER BY d ROWS BETWEEN UNBOUNDED PRECEDING AND CURRENT ROW) AS rows_n,MIN(x) OVER (PARTITION BY k ORDER BY d ROWS BETWEEN UNBOUNDED PRECEDING AND CURRENT ROW) AS lo,MAX(x) OVER (PARTITION BY k ORDER BY d ROWS BETWEEN UNBOUNDED PRECEDING AND CURRENT ROW) AS hi FROM wrai_rows) q EXCEPT ALL SELECT * FROM wrai_rows_child));
----
0

# NULL endpoints, mixed frames, and nested ROWS seeds. Identical peers make the
# full-query bag deterministic even though SQL leaves their relative order unspecified.
statement ok
CREATE TABLE wrnull_first(k INT,d INT,x INT);

statement ok
INSERT INTO wrnull_first VALUES (1,NULL,4),(1,NULL,4),(1,1,-2),(1,1,-2),(2,1,NULL);

statement ok
CREATE VIEW wrnull_first_rows_expected AS SELECT *, SUM(x) OVER (PARTITION BY k ORDER BY d NULLS FIRST ROWS BETWEEN UNBOUNDED PRECEDING AND CURRENT ROW) s, AVG(x) OVER (PARTITION BY k ORDER BY d NULLS FIRST ROWS BETWEEN UNBOUNDED PRECEDING AND CURRENT ROW) a, COUNT(x) OVER (PARTITION BY k ORDER BY d NULLS FIRST ROWS BETWEEN UNBOUNDED PRECEDING AND CURRENT ROW) n FROM wrnull_first;

statement ok
CREATE MATERIALIZED VIEW wrnull_first_rows AS SELECT *, SUM(x) OVER (PARTITION BY k ORDER BY d NULLS FIRST ROWS BETWEEN UNBOUNDED PRECEDING AND CURRENT ROW) s, AVG(x) OVER (PARTITION BY k ORDER BY d NULLS FIRST ROWS BETWEEN UNBOUNDED PRECEDING AND CURRENT ROW) a, COUNT(x) OVER (PARTITION BY k ORDER BY d NULLS FIRST ROWS BETWEEN UNBOUNDED PRECEDING AND CURRENT ROW) n FROM wrnull_first;

statement ok
CREATE VIEW wrnull_first_mixed_expected AS SELECT *, SUM(x) OVER (PARTITION BY k ORDER BY d NULLS FIRST ROWS BETWEEN UNBOUNDED PRECEDING AND CURRENT ROW) s, SUM(x) OVER (PARTITION BY k ORDER BY d NULLS FIRST) r FROM wrnull_first;

statement ok
CREATE MATERIALIZED VIEW wrnull_first_mixed AS SELECT *, SUM(x) OVER (PARTITION BY k ORDER BY d NULLS FIRST ROWS BETWEEN UNBOUNDED PRECEDING AND CURRENT ROW) s, SUM(x) OVER (PARTITION BY k ORDER BY d NULLS FIRST) r FROM wrnull_first;

statement ok
INSERT INTO wrnull_first VALUES (1,2,2),(1,2,2),(2,2,4),(2,2,4);

statement ok
PRAGMA refresh('wrnull_first_rows');

query I
SELECT COUNT(*) FROM ((SELECT * FROM wrnull_first_rows EXCEPT ALL SELECT * FROM wrnull_first_rows_expected) UNION ALL (SELECT * FROM wrnull_first_rows_expected EXCEPT ALL SELECT * FROM wrnull_first_rows));
----
0

statement ok
PRAGMA refresh('wrnull_first_mixed');

query I
SELECT COUNT(*) FROM ((SELECT * FROM wrnull_first_mixed EXCEPT ALL SELECT * FROM wrnull_first_mixed_expected) UNION ALL (SELECT * FROM wrnull_first_mixed_expected EXCEPT ALL SELECT * FROM wrnull_first_mixed));
----
0

statement ok
INSERT INTO wrnull_first VALUES (1,NULL,4),(1,NULL,4),(2,NULL,NULL),(3,NULL,6),(3,NULL,6);

statement ok
PRAGMA refresh('wrnull_first_rows');

query I
SELECT COUNT(*) FROM ((SELECT * FROM wrnull_first_rows EXCEPT ALL SELECT * FROM wrnull_first_rows_expected) UNION ALL (SELECT * FROM wrnull_first_rows_expected EXCEPT ALL SELECT * FROM wrnull_first_rows));
----
0

statement ok
PRAGMA refresh('wrnull_first_mixed');

query I
SELECT COUNT(*) FROM ((SELECT * FROM wrnull_first_mixed EXCEPT ALL SELECT * FROM wrnull_first_mixed_expected) UNION ALL (SELECT * FROM wrnull_first_mixed_expected EXCEPT ALL SELECT * FROM wrnull_first_mixed));
----
0

statement ok
INSERT INTO wrnull_first VALUES (1,3,-2),(1,3,-2),(3,1,2),(3,1,2);

statement ok
PRAGMA refresh('wrnull_first_rows');

query I
SELECT COUNT(*) FROM ((SELECT * FROM wrnull_first_rows EXCEPT ALL SELECT * FROM wrnull_first_rows_expected) UNION ALL (SELECT * FROM wrnull_first_rows_expected EXCEPT ALL SELECT * FROM wrnull_first_rows));
----
0

statement ok
PRAGMA refresh('wrnull_first_mixed');

query I
SELECT COUNT(*) FROM ((SELECT * FROM wrnull_first_mixed EXCEPT ALL SELECT * FROM wrnull_first_mixed_expected) UNION ALL (SELECT * FROM wrnull_first_mixed_expected EXCEPT ALL SELECT * FROM wrnull_first_mixed));
----
0

statement ok
CREATE TABLE wrnull_last(k INT,d INT,x INT);

statement ok
INSERT INTO wrnull_last VALUES (1,NULL,4),(1,NULL,4),(1,1,-2),(1,1,-2),(2,1,NULL);

statement ok
CREATE VIEW wrnull_last_rows_expected AS SELECT *, SUM(x) OVER (PARTITION BY k ORDER BY d NULLS LAST ROWS BETWEEN UNBOUNDED PRECEDING AND CURRENT ROW) s, AVG(x) OVER (PARTITION BY k ORDER BY d NULLS LAST ROWS BETWEEN UNBOUNDED PRECEDING AND CURRENT ROW) a, COUNT(x) OVER (PARTITION BY k ORDER BY d NULLS LAST ROWS BETWEEN UNBOUNDED PRECEDING AND CURRENT ROW) n FROM wrnull_last;

statement ok
CREATE MATERIALIZED VIEW wrnull_last_rows AS SELECT *, SUM(x) OVER (PARTITION BY k ORDER BY d NULLS LAST ROWS BETWEEN UNBOUNDED PRECEDING AND CURRENT ROW) s, AVG(x) OVER (PARTITION BY k ORDER BY d NULLS LAST ROWS BETWEEN UNBOUNDED PRECEDING AND CURRENT ROW) a, COUNT(x) OVER (PARTITION BY k ORDER BY d NULLS LAST ROWS BETWEEN UNBOUNDED PRECEDING AND CURRENT ROW) n FROM wrnull_last;

statement ok
CREATE VIEW wrnull_last_mixed_expected AS SELECT *, SUM(x) OVER (PARTITION BY k ORDER BY d NULLS LAST ROWS BETWEEN UNBOUNDED PRECEDING AND CURRENT ROW) s, SUM(x) OVER (PARTITION BY k ORDER BY d NULLS LAST) r FROM wrnull_last;

statement ok
CREATE MATERIALIZED VIEW wrnull_last_mixed AS SELECT *, SUM(x) OVER (PARTITION BY k ORDER BY d NULLS LAST ROWS BETWEEN UNBOUNDED PRECEDING AND CURRENT ROW) s, SUM(x) OVER (PARTITION BY k ORDER BY d NULLS LAST) r FROM wrnull_last;

statement ok
INSERT INTO wrnull_last VALUES (1,2,2),(1,2,2),(2,2,4),(2,2,4);

statement ok
PRAGMA refresh('wrnull_last_rows');

query I
SELECT COUNT(*) FROM ((SELECT * FROM wrnull_last_rows EXCEPT ALL SELECT * FROM wrnull_last_rows_expected) UNION ALL (SELECT * FROM wrnull_last_rows_expected EXCEPT ALL SELECT * FROM wrnull_last_rows));
----
0

statement ok
PRAGMA refresh('wrnull_last_mixed');

query I
SELECT COUNT(*) FROM ((SELECT * FROM wrnull_last_mixed EXCEPT ALL SELECT * FROM wrnull_last_mixed_expected) UNION ALL (SELECT * FROM wrnull_last_mixed_expected EXCEPT ALL SELECT * FROM wrnull_last_mixed));
----
0

statement ok
INSERT INTO wrnull_last VALUES (1,NULL,4),(1,NULL,4),(2,NULL,NULL),(3,NULL,6),(3,NULL,6);

statement ok
PRAGMA refresh('wrnull_last_rows');

query I
SELECT COUNT(*) FROM ((SELECT * FROM wrnull_last_rows EXCEPT ALL SELECT * FROM wrnull_last_rows_expected) UNION ALL (SELECT * FROM wrnull_last_rows_expected EXCEPT ALL SELECT * FROM wrnull_last_rows));
----
0

statement ok
PRAGMA refresh('wrnull_last_mixed');

query I
SELECT COUNT(*) FROM ((SELECT * FROM wrnull_last_mixed EXCEPT ALL SELECT * FROM wrnull_last_mixed_expected) UNION ALL (SELECT * FROM wrnull_last_mixed_expected EXCEPT ALL SELECT * FROM wrnull_last_mixed));
----
0

statement ok
INSERT INTO wrnull_last VALUES (1,3,-2),(1,3,-2),(3,1,2),(3,1,2);

statement ok
PRAGMA refresh('wrnull_last_rows');

query I
SELECT COUNT(*) FROM ((SELECT * FROM wrnull_last_rows EXCEPT ALL SELECT * FROM wrnull_last_rows_expected) UNION ALL (SELECT * FROM wrnull_last_rows_expected EXCEPT ALL SELECT * FROM wrnull_last_rows));
----
0

statement ok
PRAGMA refresh('wrnull_last_mixed');

query I
SELECT COUNT(*) FROM ((SELECT * FROM wrnull_last_mixed EXCEPT ALL SELECT * FROM wrnull_last_mixed_expected) UNION ALL (SELECT * FROM wrnull_last_mixed_expected EXCEPT ALL SELECT * FROM wrnull_last_mixed));
----
0

statement ok
CREATE TABLE wrnested(k INT,d INT,x INT);

statement ok
INSERT INTO wrnested VALUES (1,1,6),(1,2,-3),(1,2,-3);

statement ok
CREATE VIEW wrnested_expected AS WITH c AS (SELECT *, MIN(x) OVER (PARTITION BY k ORDER BY d ROWS BETWEEN UNBOUNDED PRECEDING AND CURRENT ROW) lo FROM wrnested), f AS (SELECT *, CASE WHEN x=lo THEN d END flag FROM c) SELECT k,d,x,lo,MAX(flag) OVER (PARTITION BY k ORDER BY d ROWS BETWEEN UNBOUNDED PRECEDING AND CURRENT ROW) last_low FROM f;

statement ok
CREATE MATERIALIZED VIEW wrnested_mv AS WITH c AS (SELECT *, MIN(x) OVER (PARTITION BY k ORDER BY d ROWS BETWEEN UNBOUNDED PRECEDING AND CURRENT ROW) lo FROM wrnested), f AS (SELECT *, CASE WHEN x=lo THEN d END flag FROM c) SELECT k,d,x,lo,MAX(flag) OVER (PARTITION BY k ORDER BY d ROWS BETWEEN UNBOUNDED PRECEDING AND CURRENT ROW) last_low FROM f;

statement ok
INSERT INTO wrnested VALUES (1,3,-4),(1,3,-4),(2,1,5);

query I
SELECT CAST(string_agg(sql,' ' ORDER BY stmt_order) LIKE '%openivm_run_suffix_wrnested_mv%' AS INTEGER) FROM openivm_compile_with_facts('wrnested_mv','{"target_dialect":"duckdb","compile_only":true,"assume_insert_only":true,"running_window_incremental":true}');
----
1

statement ok
PRAGMA refresh('wrnested_mv');

query I
SELECT COUNT(*) FROM ((SELECT * FROM wrnested_mv EXCEPT ALL SELECT * FROM wrnested_expected) UNION ALL (SELECT * FROM wrnested_expected EXCEPT ALL SELECT * FROM wrnested_mv));
----
0

statement ok
INSERT INTO wrnested VALUES (1,3,-4),(1,4,-5),(1,4,-5),(2,2,4);

query I
SELECT CAST(string_agg(sql,' ' ORDER BY stmt_order) LIKE '%openivm_run_suffix_wrnested_mv%' AS INTEGER) FROM openivm_compile_with_facts('wrnested_mv','{"target_dialect":"duckdb","compile_only":true,"assume_insert_only":true,"running_window_incremental":true}');
----
1

statement ok
PRAGMA refresh('wrnested_mv');

query I
SELECT COUNT(*) FROM ((SELECT * FROM wrnested_mv EXCEPT ALL SELECT * FROM wrnested_expected) UNION ALL (SELECT * FROM wrnested_expected EXCEPT ALL SELECT * FROM wrnested_mv));
----
0


# An unused source column cannot shadow the internal suffix position.
statement ok
CREATE TABLE wrnames(k INT,d INT,x INT,openivm_rows_position_suffix INT);

statement ok
INSERT INTO wrnames VALUES (1,1,6,99),(1,2,-3,99),(1,2,-3,99);

statement ok
CREATE MATERIALIZED VIEW wrnames_mv AS SELECT k,d,x,SUM(x) OVER (PARTITION BY k ORDER BY d ROWS BETWEEN UNBOUNDED PRECEDING AND CURRENT ROW) s FROM wrnames;

statement ok
INSERT INTO wrnames VALUES (1,3,2,99),(1,3,2,99);

statement ok
PRAGMA refresh('wrnames_mv');

query I
WITH expected AS (SELECT k,d,x,SUM(x) OVER (PARTITION BY k ORDER BY d ROWS BETWEEN UNBOUNDED PRECEDING AND CURRENT ROW) s FROM wrnames)
SELECT COUNT(*) FROM ((SELECT * FROM wrnames_mv EXCEPT ALL SELECT * FROM expected) UNION ALL (SELECT * FROM expected EXCEPT ALL SELECT * FROM wrnames_mv));
----
0

# Maintenance state must not depend on the public projection.
statement ok
CREATE TABLE wf_source(k INT,d INT,x BIGINT);

statement ok
INSERT INTO wf_source VALUES (1,1,9007199254740993),(2,1,NULL),(3,1,6);

statement ok
CREATE VIEW wf_avg_expected AS SELECT k,d,AVG(x) OVER (PARTITION BY k ORDER BY d ROWS BETWEEN UNBOUNDED PRECEDING AND CURRENT ROW) a FROM wf_source;

statement ok
CREATE MATERIALIZED VIEW wf_avg AS SELECT k,d,AVG(x) OVER (PARTITION BY k ORDER BY d ROWS BETWEEN UNBOUNDED PRECEDING AND CURRENT ROW) a FROM wf_source;

statement ok
CREATE VIEW wf_order_expected AS SELECT k,x,SUM(x) OVER (PARTITION BY k ORDER BY d ROWS BETWEEN UNBOUNDED PRECEDING AND CURRENT ROW) s FROM wf_source;

statement ok
CREATE MATERIALIZED VIEW wf_order AS SELECT k,x,SUM(x) OVER (PARTITION BY k ORDER BY d ROWS BETWEEN UNBOUNDED PRECEDING AND CURRENT ROW) s FROM wf_source;

statement ok
CREATE VIEW wf_range_expected AS SELECT k,AVG(x) OVER (PARTITION BY k ORDER BY d) a FROM wf_source;

statement ok
CREATE MATERIALIZED VIEW wf_range AS SELECT k,AVG(x) OVER (PARTITION BY k ORDER BY d) a FROM wf_source;

statement ok
CREATE VIEW wf_alias_expected AS SELECT k,d AS event_date,x,SUM(x) OVER (PARTITION BY k ORDER BY d ROWS BETWEEN UNBOUNDED PRECEDING AND CURRENT ROW) s FROM wf_source;

statement ok
CREATE MATERIALIZED VIEW wf_alias AS SELECT k,d AS event_date,x,SUM(x) OVER (PARTITION BY k ORDER BY d ROWS BETWEEN UNBOUNDED PRECEDING AND CURRENT ROW) s FROM wf_source;

statement ok
CREATE MATERIALIZED VIEW wf_child AS SELECT * FROM wf_avg;

statement ok
CREATE VIEW wf_child_expected AS SELECT * FROM wf_avg_expected;

statement ok
INSERT INTO wf_source VALUES (1,2,-9007199254740992),(2,2,4),(3,2,-3);

query I
SELECT CAST(string_agg(sql,' ' ORDER BY stmt_order) LIKE '%openivm_run_result_wf_avg%' AS INTEGER) FROM openivm_compile_with_facts('wf_avg','{"target_dialect":"duckdb","compile_only":true,"assume_insert_only":true,"running_window_incremental":true}');
----
1

statement ok
PRAGMA refresh('wf_avg');

query I
SELECT COUNT(*) FROM ((SELECT * FROM wf_avg EXCEPT ALL SELECT * FROM wf_avg_expected) UNION ALL (SELECT * FROM wf_avg_expected EXCEPT ALL SELECT * FROM wf_avg));
----
0

query I
SELECT CAST(string_agg(sql,' ' ORDER BY stmt_order) LIKE '%openivm_run_result_wf_order%' AS INTEGER) FROM openivm_compile_with_facts('wf_order','{"target_dialect":"duckdb","compile_only":true,"assume_insert_only":true,"running_window_incremental":true}');
----
1

statement ok
PRAGMA refresh('wf_order');

query I
SELECT COUNT(*) FROM ((SELECT * FROM wf_order EXCEPT ALL SELECT * FROM wf_order_expected) UNION ALL (SELECT * FROM wf_order_expected EXCEPT ALL SELECT * FROM wf_order));
----
0

query I
SELECT CAST(string_agg(sql,' ' ORDER BY stmt_order) LIKE '%openivm_run_result_wf_range%' AS INTEGER) FROM openivm_compile_with_facts('wf_range','{"target_dialect":"duckdb","compile_only":true,"assume_insert_only":true,"running_window_incremental":true}');
----
1

statement ok
PRAGMA refresh('wf_range');

query I
SELECT COUNT(*) FROM ((SELECT * FROM wf_range EXCEPT ALL SELECT * FROM wf_range_expected) UNION ALL (SELECT * FROM wf_range_expected EXCEPT ALL SELECT * FROM wf_range));
----
0

query I
SELECT CAST(string_agg(sql,' ' ORDER BY stmt_order) LIKE '%openivm_run_result_wf_alias%' AS INTEGER) FROM openivm_compile_with_facts('wf_alias','{"target_dialect":"duckdb","compile_only":true,"assume_insert_only":true,"running_window_incremental":true}');
----
1

statement ok
PRAGMA refresh('wf_alias');

query I
SELECT COUNT(*) FROM ((SELECT * FROM wf_alias EXCEPT ALL SELECT * FROM wf_alias_expected) UNION ALL (SELECT * FROM wf_alias_expected EXCEPT ALL SELECT * FROM wf_alias));
----
0

query I
SELECT COUNT(*) FROM ((SELECT * FROM wf_child EXCEPT ALL SELECT * FROM wf_child_expected) UNION ALL (SELECT * FROM wf_child_expected EXCEPT ALL SELECT * FROM wf_child));
----
0

restart

statement ok
SET openivm_files_path='__TEST_DIR__';

statement ok
SET openivm_running_window_incremental=true;

statement ok
SET openivm_cascade_refresh='both';

statement ok
INSERT INTO wf_source VALUES (1,3,2),(2,3,6),(3,3,7);

statement ok
UPDATE wf_source SET x=8 WHERE k=2 AND d=3;

statement ok
DELETE FROM wf_source WHERE k=3 AND d=3;

statement ok
DELETE FROM wf_source WHERE k=3 AND d=1;

statement ok
UPDATE wf_source SET x=2 WHERE k=3 AND d=2;

statement ok
PRAGMA refresh('wf_avg');

query I
SELECT COUNT(*) FROM ((SELECT * FROM wf_avg EXCEPT ALL SELECT * FROM wf_avg_expected) UNION ALL (SELECT * FROM wf_avg_expected EXCEPT ALL SELECT * FROM wf_avg));
----
0

statement ok
PRAGMA refresh('wf_order');

query I
SELECT COUNT(*) FROM ((SELECT * FROM wf_order EXCEPT ALL SELECT * FROM wf_order_expected) UNION ALL (SELECT * FROM wf_order_expected EXCEPT ALL SELECT * FROM wf_order));
----
0

statement ok
PRAGMA refresh('wf_range');

query I
SELECT COUNT(*) FROM ((SELECT * FROM wf_range EXCEPT ALL SELECT * FROM wf_range_expected) UNION ALL (SELECT * FROM wf_range_expected EXCEPT ALL SELECT * FROM wf_range));
----
0

statement ok
PRAGMA refresh('wf_alias');

query I
SELECT COUNT(*) FROM ((SELECT * FROM wf_alias EXCEPT ALL SELECT * FROM wf_alias_expected) UNION ALL (SELECT * FROM wf_alias_expected EXCEPT ALL SELECT * FROM wf_alias));
----
0

query I
SELECT COUNT(*) FROM ((SELECT * FROM wf_child EXCEPT ALL SELECT * FROM wf_child_expected) UNION ALL (SELECT * FROM wf_child_expected EXCEPT ALL SELECT * FROM wf_child));
----
0

statement ok
INSERT INTO wf_source VALUES (1,4,3),(2,4,NULL),(3,4,-2);

statement ok
PRAGMA refresh('wf_avg');

query I
SELECT COUNT(*) FROM ((SELECT * FROM wf_avg EXCEPT ALL SELECT * FROM wf_avg_expected) UNION ALL (SELECT * FROM wf_avg_expected EXCEPT ALL SELECT * FROM wf_avg));
----
0

statement ok
PRAGMA refresh('wf_order');

query I
SELECT COUNT(*) FROM ((SELECT * FROM wf_order EXCEPT ALL SELECT * FROM wf_order_expected) UNION ALL (SELECT * FROM wf_order_expected EXCEPT ALL SELECT * FROM wf_order));
----
0

statement ok
PRAGMA refresh('wf_range');

query I
SELECT COUNT(*) FROM ((SELECT * FROM wf_range EXCEPT ALL SELECT * FROM wf_range_expected) UNION ALL (SELECT * FROM wf_range_expected EXCEPT ALL SELECT * FROM wf_range));
----
0

statement ok
PRAGMA refresh('wf_alias');

query I
SELECT COUNT(*) FROM ((SELECT * FROM wf_alias EXCEPT ALL SELECT * FROM wf_alias_expected) UNION ALL (SELECT * FROM wf_alias_expected EXCEPT ALL SELECT * FROM wf_alias));
----
0

query I
SELECT COUNT(*) FROM ((SELECT * FROM wf_child EXCEPT ALL SELECT * FROM wf_child_expected) UNION ALL (SELECT * FROM wf_child_expected EXCEPT ALL SELECT * FROM wf_child));
----
0

# Descending windows cannot use the suffix path: do not store unused positions.
statement ok
CREATE MATERIALIZED VIEW wf_desc AS SELECT *,SUM(x) OVER (PARTITION BY k ORDER BY d DESC ROWS BETWEEN UNBOUNDED PRECEDING AND CURRENT ROW) s FROM wf_source;

query I
SELECT COUNT(*) FROM information_schema.columns WHERE table_name='openivm_data_wf_desc' AND column_name LIKE 'openivm_rows_position_%';
----
0

# Publishing an unordered native window scopes both old and new rows by its raw delta.
query I
SELECT CAST(sql LIKE '%WHERE EXISTS (SELECT 1 FROM openivm_delta_wf_avg d WHERE%' AS INTEGER) FROM openivm_compile_with_facts('wf_avg','{"target_dialect":"duckdb","compile_only":true,"assume_insert_only":true,"running_window_incremental":true}') WHERE sql LIKE 'CREATE TEMP TABLE openivm_publish_next_wf_avg AS%';
----
1

# Partition removal and moves must retract the formerly published rows.
statement ok
DELETE FROM wf_source WHERE k=3;

statement ok
UPDATE wf_source SET k=5 WHERE k=2 AND d=1;

statement ok
INSERT INTO wf_source VALUES (4,1,9);

statement ok
PRAGMA refresh('wf_avg');

query I
SELECT COUNT(*) FROM ((SELECT * FROM wf_avg EXCEPT ALL SELECT * FROM wf_avg_expected) UNION ALL (SELECT * FROM wf_avg_expected EXCEPT ALL SELECT * FROM wf_avg));
----
0

statement ok
PRAGMA refresh('wf_order');

query I
SELECT COUNT(*) FROM ((SELECT * FROM wf_order EXCEPT ALL SELECT * FROM wf_order_expected) UNION ALL (SELECT * FROM wf_order_expected EXCEPT ALL SELECT * FROM wf_order));
----
0

statement ok
PRAGMA refresh('wf_range');

query I
SELECT COUNT(*) FROM ((SELECT * FROM wf_range EXCEPT ALL SELECT * FROM wf_range_expected) UNION ALL (SELECT * FROM wf_range_expected EXCEPT ALL SELECT * FROM wf_range));
----
0

statement ok
PRAGMA refresh('wf_alias');

query I
SELECT COUNT(*) FROM ((SELECT * FROM wf_alias EXCEPT ALL SELECT * FROM wf_alias_expected) UNION ALL (SELECT * FROM wf_alias_expected EXCEPT ALL SELECT * FROM wf_alias));
----
0

query I
SELECT COUNT(*) FROM ((SELECT * FROM wf_child EXCEPT ALL SELECT * FROM wf_child_expected) UNION ALL (SELECT * FROM wf_child_expected EXCEPT ALL SELECT * FROM wf_child));
----
0

statement ok
CREATE MATERIALIZED VIEW wf_top AS SELECT *,SUM(x) OVER (PARTITION BY k ORDER BY d ROWS BETWEEN UNBOUNDED PRECEDING AND CURRENT ROW) s FROM wf_source ORDER BY s DESC,k,d LIMIT 2;

statement ok
CREATE VIEW wf_top_expected AS SELECT *,SUM(x) OVER (PARTITION BY k ORDER BY d ROWS BETWEEN UNBOUNDED PRECEDING AND CURRENT ROW) s FROM wf_source ORDER BY s DESC,k,d LIMIT 2;

query I
SELECT CAST(sql NOT LIKE '%WHERE EXISTS (SELECT 1 FROM openivm_delta_wf_top d WHERE%' AS INTEGER) FROM openivm_compile_with_facts('wf_top','{"target_dialect":"duckdb","compile_only":true,"assume_insert_only":true,"running_window_incremental":true}') WHERE sql LIKE 'CREATE TEMP TABLE openivm_publish_next_wf_top AS%';
----
1

statement ok
INSERT INTO wf_source VALUES (6,1,18014398509481984);

statement ok
PRAGMA refresh('wf_top');

query I
SELECT COUNT(*) FROM ((SELECT * FROM wf_top EXCEPT ALL SELECT * FROM wf_top_expected) UNION ALL (SELECT * FROM wf_top_expected EXCEPT ALL SELECT * FROM wf_top));
----
0

statement ok
DELETE FROM wf_source WHERE k=6;

statement ok
UPDATE wf_source SET x=7 WHERE k=1 AND d=1;

statement ok
PRAGMA refresh('wf_top');

query I
SELECT COUNT(*) FROM ((SELECT * FROM wf_top EXCEPT ALL SELECT * FROM wf_top_expected) UNION ALL (SELECT * FROM wf_top_expected EXCEPT ALL SELECT * FROM wf_top));
----
0


# Shared partition metadata helpers must preserve literal dots in column names.
statement ok
CREATE TABLE wf_quoted("partition.key" INT,"event.day" INT,x BIGINT);

statement ok
INSERT INTO wf_quoted VALUES (1,1,9007199254740993);

statement ok
CREATE MATERIALIZED VIEW wf_quoted_mv AS SELECT "partition.key",AVG(x) OVER (PARTITION BY "partition.key" ORDER BY "event.day" ROWS BETWEEN UNBOUNDED PRECEDING AND CURRENT ROW) a FROM wf_quoted;

statement ok
INSERT INTO wf_quoted VALUES (1,2,-9007199254740992);

statement ok
PRAGMA refresh('wf_quoted_mv');

query I
WITH expected AS (SELECT "partition.key",AVG(x) OVER (PARTITION BY "partition.key" ORDER BY "event.day" ROWS BETWEEN UNBOUNDED PRECEDING AND CURRENT ROW) a FROM wf_quoted)
SELECT COUNT(*) FROM ((SELECT * FROM wf_quoted_mv EXCEPT ALL SELECT * FROM expected) UNION ALL (SELECT * FROM expected EXCEPT ALL SELECT * FROM wf_quoted_mv));
----
0

# User aliases must not collide with the merged bounds/seed relation.
statement ok
CREATE TABLE wf_alias_names(k INT,d INT,x INT);

statement ok
INSERT INTO wf_alias_names VALUES(1,1,4);

statement ok
CREATE MATERIALIZED VIEW wf_alias_names_mv AS SELECT *,SUM(x) OVER (PARTITION BY k ORDER BY d ROWS BETWEEN UNBOUNDED PRECEDING AND CURRENT ROW) new_count FROM wf_alias_names;

statement ok
INSERT INTO wf_alias_names VALUES(1,2,3);

statement ok
PRAGMA refresh('wf_alias_names_mv');

query I
WITH expected AS (SELECT *,SUM(x) OVER (PARTITION BY k ORDER BY d ROWS BETWEEN UNBOUNDED PRECEDING AND CURRENT ROW) new_count FROM wf_alias_names)
SELECT COUNT(*) FROM ((SELECT * FROM wf_alias_names_mv EXCEPT ALL SELECT * FROM expected) UNION ALL (SELECT * FROM expected EXCEPT ALL SELECT * FROM wf_alias_names_mv));
----
0
